product_id,product_url,name,price,shop_name
27815631,https://www.sendo.vn/chieu-truc-dat-noi-xe-day-cho-be-may-thang-tuoi-kt-30-x-75cm-27815631.html,chiếu trúc đặt nôi - xe đẩy cho bé mấy tháng tuổi kt 30 x 75cm,120000,Đồ dùng văn phòng 104
28153887,https://www.sendo.vn/dem-nam-chong-trao-nguoc-cao-cap-monmon-tang-kem-vong-dau-tam-28153887.html,Đệm nằm chống trào ngược cao cấp MonMon Tặng kèm vòng dâu tằm,250000,ShopMonMon
28170328,https://www.sendo.vn/thanh-chan-giuong-baby-gift-dang-truot-cao-90cm-28170328.html,Thanh chắn giường Baby Gift dạng trượt cao 90cm,350000,baby68
29086652,https://www.sendo.vn/tham-nam-choi-co-nhac-cho-be-29086652.html,Thảm nằm chơi có nhạc cho bé,275000,shop Mẹ Gôn
26629454,https://www.sendo.vn/giuong-nhua-mam-non-cho-be-26629454.html,Giường nhựa mầm non cho bé ,395000,dochoi123
29324681,https://www.sendo.vn/giuong-luoi-cho-be-29324681.html,GIƯỜNG LƯỚI CHO BÉ,289000,HÀNGTIỆNÍCH
29307651,https://www.sendo.vn/thanh-chan-giuong-1m4-mau-kem-29307651.html,Thanh chắn giường 1m4 màu kem,299000,Nguyenty16
29307609,https://www.sendo.vn/thanh-chan-giuong-1m8-xanh-29307609.html,Thanh chắn giường 1m8 xanh,299000,Nguyenty16
28567885,https://www.sendo.vn/thanh-chan-giuong-28567885.html,Thanh Chắn Giường,400000,Ngocphat212
28483778,https://www.sendo.vn/noi-go-cho-be-0-2-tuoi-87x45x25cm-home-and-garden-28483778.html,Nôi gỗ cho bé 0-2 tuổi 87x45x25cm- Home and Garden,1450000,Home and Garden
28478138,https://www.sendo.vn/giuong-ngu-kiem-ghe-sofa-cho-be-0-3-tuoi-baby-bed-sofa-5in1-home-and-garden-28478138.html, Giường ngủ kiêm ghế Sofa cho bé 0-3 tuổi Baby Bed Sofa 5in1- Home and Garden,920000,Home and Garden
28419185,https://www.sendo.vn/mau-treo-noi-vuong-do-kich-thich-thi-giac-cho-be-28419185.html,Mẫu treo nôi vuông đỏ kích thích thị giác cho bé,99000,Thiết bị vệ sinh LIFMOD
6781287,https://www.sendo.vn/giuong-sat-nghe-thuat-giuong-sat-dep-giuong-sat-ha-noi-6781287.html,"Giường sắt nghệ thuật, giường sắt đẹp, giường sắt hà nội",2200000,sắt nghệ thuật
20712142,https://www.sendo.vn/may-dua-vong-tu-dong-cho-be-lvr01-20712142.html,Máy Đưa Võng Tự Động  Cho Bé - LVR01 ,305000,ShopLG
23248218,https://www.sendo.vn/xich-du-kiem-ghe-nam-danh-cho-tre-em-co-khung-bang-sat-boc-dem-6579-hieu-mastela-23248218.html,Xích đu kiêm ghế nằm dành cho trẻ em có khung bằng sắt bọc đệm 6579 hiệu Mastela,1329000,BabyKingdom
20619754,https://www.sendo.vn/tham-xop-phu-silicon-xpe-cao-cap-2-mat-cho-be-nhieu-kich-co-mau-ngau-nhien-20619754.html,Thảm xốp phủ silicon XPE cao cấp 2 mặt cho bé nhiều kích cỡ màu ngẫu nhiên,165000,Bỉm Tã Thảm Xốp
28271594,https://www.sendo.vn/xich-du-kiem-ghe-nam-danh-cho-tre-em-co-khung-bang-sat-boc-dem-chinh-hang-mastela-28271594.html,Xích đu kiêm ghế nằm dành cho trẻ em có khung bằng sắt bọc đệm chính hãng Mastela,1329000,BabyKingdom
19447904,https://www.sendo.vn/chieu-lua-dieu-hoa-kem-goi-thao-duoc-cho-be-19447904.html,Chiếu lụa điều hòa kèm gối thảo dược cho bé,69000,Cubon Shop
11443139,https://www.sendo.vn/ghe-rung-cho-be-mau-hong-co-nhac-11443139.html,GHẾ RUNG CHO BÉ MÀU HỒNG CÓ NHẠC,480000,sieuthidochoi
23756866,https://www.sendo.vn/goi-chong-trao-nguoc-babystar-tang-goi-chong-lom-dau-2-mieng-lot-chong-tham-cotton-va-5-khan-sua-nhat-23756866.html,Gối chống trào ngược BABYSTAR-Tặng gối chống lõm đầu-2 miếng lót chống thấm cotton và 5 khăn sữa Nhật,369000,shop Muns
28107725,https://www.sendo.vn/giuong-ngu-xinh-xan-cho-be-28107725.html,GIƯỜNG NGỦ XINH XẮN CHO BÉ ,370000,GiadungDinhVinh
19804223,https://www.sendo.vn/den-ngu-ngo-nghinh-chieu-cau-vong-den-ngu-cho-be-den-ngu-cau-vong-19804223.html,Đèn ngủ ngộ nghĩnh chiếu cầu vồng - Đèn ngủ cho bé - Đèn ngủ cầu vòng,156000,TOTTOT99
17383603,https://www.sendo.vn/ghe-rung-cho-be-an-dam-mau-hong-17383603.html,Ghế rung cho bé ăn dặm màu hồng,550000,Đồ gia dụng Liên Anh
19824578,https://www.sendo.vn/may-dua-vong-tai-100-kg-hang-viet-nam-chat-luong-cao-19824578.html,MÁY ĐƯA VÕNG - TẢI 100 KG - HÀNG VIỆT NAM CHẤT LƯỢNG CAO,599000,AMENSHOP
24081496,https://www.sendo.vn/giuong-luoi-cho-be-yeu-chat-luong-cao-gia-tot-24081496.html,Giường lưới cho bé yêu- Chất lượng cao- Giá tốt,240000,Kimthoan
23251231,https://www.sendo.vn/chieu-coi-cho-be-so-sinh-23251231.html,Chiếu cói cho bé sơ sinh,35000,SHOP MẸ VỊT 
30382777,https://www.sendo.vn/cuc-nguon-may-dua-vong-30382777.html,cục nguồn máy đưa võng,189000,SA MẠC
10852893,https://www.sendo.vn/dem-ngu-dung-tu-the-jjovce-xam-10852893.html,Đệm ngủ đúng tư thế JJOVCE - Xám,200000,iKids
30698837,https://www.sendo.vn/cuc-nguon-may-dua-vong-30698837.html,cục nguồn máy đưa võng,189000,SHOP RẺ ĐỘC QUYỀN
22146590,https://www.sendo.vn/bo-cap-nguon-noi-dien-dai-vi-tang-kem-2day-curoa-22146590.html,Bộ cấp nguồn nôi điện Đại Vĩ tặng kèm 2dây curoa,145000,Shop_Trâmxinh
12470516,https://www.sendo.vn/noi-rung-dien-graco-co-nhac-tu-ru-ngu-12470516.html,Nôi rung điện GRACO có nhạc  tự ru ngủ,5900000,Siêu Thị Happy
11717963,https://www.sendo.vn/dem-van-phong-dem-gap-da-nang-1-5-x-2m-11717963.html,"Đệm văn phòng - đệm gấp đa năng 1,5 x 2m",530000,Siêu Thị Happy
19267906,https://www.sendo.vn/ban-le-luoi-vong-noi-dien-cac-loai-nguyen-luoi-vong-19267906.html,Bán lẻ lưới võng nôi điện các loại - Nguyên lưới võng,49000,Shop Siêu Thị 24H
18556826,https://www.sendo.vn/noi-dien-2-tang-loai-to-tang-kem-vong-man-chong-muoi-18556826.html,"Nôi Điện 2 Tầng Loại To - Tặng Kèm Võng, Màn Chống Muỗi",99000,Shop Siêu Thị 24H
18557157,https://www.sendo.vn/combo-sac-cu-rung-noi-dien-khanh-ngoc-18557157.html,Combo sạc + củ rung nôi điện Khánh Ngọc,33000,Shop Siêu Thị 24H
18557111,https://www.sendo.vn/cui-go-tu-nhien-cao-cap-co-dem-banh-xe-18557111.html,Cũi gỗ tự nhiên Cao cấp - Có đệm Bánh xe,99000,Shop Siêu Thị 24H
18556660,https://www.sendo.vn/quay-bong-quay-cui-khung-inox-cho-be-co-cua-chui-18556660.html,Quây Bóng Quây Cũi Khung Inox Cho Bé - Có Cửa Chui,28500,Shop Siêu Thị 24H
18556256,https://www.sendo.vn/noi-dien-vong-xep-2-trong-1-dai-vi-tang-kem-vong-man-chong-muoi-tam-lot-lung-18556256.html,"Nôi điện Võng xếp 2 Trong 1 Đại Vĩ - Tặng kèm võng, màn chống muỗi, tấm lót lưng",66000,Shop Siêu Thị 24H
18556291,https://www.sendo.vn/cu-rung-noi-dien-dai-vi-tang-2-day-curoa-du-phong-18556291.html,Củ rung nôi điện Đại Vĩ - Tặng 2 dây Curoa dự phòng,49000,Shop Siêu Thị 24H
18556262,https://www.sendo.vn/day-curoa-noi-dien-dai-vi-loai-1-tang-1-bo-2-day-18556262.html,Dây curoa Nôi điện Đại Vĩ loại 1 tầng - 1 bộ 2 dây,35000,Shop Siêu Thị 24H
30154401,https://www.sendo.vn/noi-tre-nam-vong-size-12mx70-be-tu-0-36-thang-tang-vong-dau-tam-30154401.html,Nôi tre nằm võng size 1.2mx70 bé từ 0-36 tháng ( tặng vòng dâu tằm),300000,Noitrenamvong
30014338,https://www.sendo.vn/bo-10-mieng-tham-cao-su-phuoc-thanh-hinh-vu-tru-30-x-30-cm-30014338.html,Bộ 10 Miếng Thảm Cao Su Phước Thành Hình Vũ Trụ (30 x 30 cm),103900,Tiki Trading Platinum Mall
28560761,https://www.sendo.vn/tham-nam-choi-co-nhac-cho-be-a01-28560761.html,Thảm nằm chơi có nhạc  cho bé A01,199000,Miu Kids
30014367,https://www.sendo.vn/bo-4-mieng-tham-cao-su-phuoc-thanh-60-x-60-cm-4-mau-30014367.html,Bộ 4 Miếng Thảm Cao Su Phước Thành (60 x 60 cm) - 4 Màu,124000,Tiki Trading Platinum Mall
18556921,https://www.sendo.vn/noi-dien-vong-xep-2-trong-1-dai-vi-tang-vong-man-chong-muoi-tam-lot-lung-18556921.html,"Nôi điện võng xếp 2 trong 1 Đại Vĩ - tặng võng, màn chống muỗi, tấm lót lưng",68000,Shop Siêu Thị 24H
30014327,https://www.sendo.vn/bo-4-mieng-tham-cao-su-phuoc-thanh-50-x-50-cm-4-mau-30014327.html,Bộ 4 Miếng Thảm Cao Su Phước Thành (50 x 50 cm) - 4 Màu,124000,Tiki Trading Platinum Mall
29851384,https://www.sendo.vn/noi-ngu-chung-giuong-summer-infant-sm91310-29851384.html,Nôi Ngủ Chung Giường Summer Infant SM91310,1703000,Tiki Trading Platinum Mall
20498856,https://www.sendo.vn/ghe-rung-nhun-cho-be-20498856.html,Ghế rung nhún cho bé,639000,MuaSắm247
16442219,https://www.sendo.vn/cui-quay-cho-be-khung-inox-16442219.html,cũi quây cho bé khung inox,298000,Bestbuy TV
30120967,https://www.sendo.vn/noi-tre-na-m-vong-cho-be-cho-ng-gu-lung-tre-nho-noinho-30120967.html,Nôi tre nằm võng cho bé chống gù lưng trẻ nhỏ - NOINHO,130000,VINH THIEN
18604963,https://www.sendo.vn/mung-man-ngu-chong-muoi-co-nhac-cho-be-18604963.html,"Mùng, màn ngủ chống muỗi có nhạc cho bé",269000,Vodka Store
11673951,https://www.sendo.vn/ghe-dung-nhun-loai-dep-cho-be-11673951.html,Ghế Dung Nhún Loại Đẹp Cho Bé,350000,chuyên đồ gia dụng hương
12676211,https://www.sendo.vn/giuong-luoi-cho-be-12676211.html,giường lưới cho bé,340000,chuyên đồ gia dụng hương
11284786,https://www.sendo.vn/ghe-dung-cho-be-hang-dep-11284786.html,Ghế Dung Cho Bé Hàng Đẹp,350000,chuyên đồ gia dụng hương
11464129,https://www.sendo.vn/giuong-luoi-cho-be-11464129.html,Giường Lưới Cho Bé,330000,chuyên đồ gia dụng hương
23565382,https://www.sendo.vn/quay-bong-luc-giac-cho-be-23565382.html,QUÂY BÓNG LỤC GIÁC CHO BÉ ,350000,chuyên đồ gia dụng hương
17425662,https://www.sendo.vn/cui-quay-cho-be-17425662.html,CŨI QUÂY CHO BÉ ,420000,chuyên đồ gia dụng hương
12394055,https://www.sendo.vn/tham-nhac-baby-12394055.html,Thảm Nhạc Baby,380000,chuyên đồ gia dụng hương
11234555,https://www.sendo.vn/quay-bong-cui-luoi-kem-100-bong-11234555.html,Quây Bóng Cũi Lưới Kèm 100 Bóng,530000,chuyên đồ gia dụng hương
11855122,https://www.sendo.vn/quay-bong-lam-cui-luoi-kem-150-bong-11855122.html,Quây Bóng  Làm Cũi Lưới Kèm 150 bóng,530000,chuyên đồ gia dụng hương
12793091,https://www.sendo.vn/quay-bong-cho-be-12793091.html,Quây Bóng Cho Bé,480000,chuyên đồ gia dụng hương
12762757,https://www.sendo.vn/cui-quay-bong-khung-inox-12762757.html,Cũi quây bóng khung inox,475000,chuyên đồ gia dụng hương
17519611,https://www.sendo.vn/cui-quay-kem-100-bong-cho-be-17519611.html,cũi quây kèm 100 bóng cho bé,510000,Shop Tiện Ích Gia Vinh
17608536,https://www.sendo.vn/cui-quay-cho-be-17608536.html,CŨI QUÂY CHO BÉ,480000,Shop Tiện Ích Gia Vinh
28180165,https://www.sendo.vn/giuong-luoi-cho-be-28180165.html,giường lưới cho bé,350000,SIÊU THỊ GIA ĐÌNH 1
28570221,https://www.sendo.vn/quay-cui-kiem-nha-bong-tang-kem-bong-cho-be-28570221.html,Quây cũi kiêm nhà bóng tặng kèm bóng cho bé,444000,MapleStore
1466339,https://www.sendo.vn/thanh-chan-giuong-tre-em-brevi-bre312-1466339.html,Thanh chắn giường trẻ em Brevi BRE312,1390000,Chăm sóc bé sơ sinh
22097261,https://www.sendo.vn/dem-cho-be-22097261.html,Đệm cho bé,215000,Đầm bầu SuMom
30122752,https://www.sendo.vn/noi-tre-na-m-vong-cho-be-yeu-cho-ng-gu-lung-tre-size-lo-n-100x65-cm-co-ke-m-de-m-bo-c-30122752.html,Nôi tre nằm võng cho bé yêu chống gù lưng trẻ Size Lớn 100x65 cm CÓ KÈM ĐỆM BỌC,320000,VINH THIEN
24634296,https://www.sendo.vn/noi-dien-dai-vi-2-trong-1-vua-la-noi-dien-vua-la-vong-xep-hang-vn-chat-luong-cao-24634296.html,NÔI ĐIỆN ĐẠI VĨ 2 TRONG 1 VỪA LÀ NÔI ĐIỆN VỪA LÀ VÕNG XẾP - HÀNG VN CHẤT LƯỢNG CAO,650000,Babykids
20830084,https://www.sendo.vn/giuong-be-quy-phuc-60-120cm-20830084.html,Giường bé Quy Phúc 60*120cm,218000,ĐỒ GIA DỤNG HOÀ
23761164,https://www.sendo.vn/quay-cui-cho-be-kem-1-ga-cotton-lua-han-quoc-23761164.html,Quây cũi cho bé kèm 1 ga cotton lụa Hàn Quốc,390000,shop Muns
10282928,https://www.sendo.vn/com-bo-2-chieu-nam-noi-cho-be-chieu-coi-tu-nhien-10282928.html,COM BO 2 chiếu nằm nôi cho bé - chiếu cói tự nhiên,79000,duchangshop
12965479,https://www.sendo.vn/may-dua-vong-duy-phuong-12965479.html,Máy Đưa Võng Duy Phương,460000,tuanminh
12556709,https://www.sendo.vn/combo-sac-cu-rung-noi-dien-dai-vi-tang-2-day-curoa-du-phong-12556709.html,Combo sạc + củ rung nôi điện Đại Vĩ + Tặng 2 dây curoa dự phòng,330000,Siêu Thị 24h Online
12119426,https://www.sendo.vn/noi-dien-vong-xep-tu-dong-thanh-hung-2-trong-1-co-vong-man-chong-muoi-12119426.html,Nôi điện Võng xếp tự động Thành Hưng 2 Trong 1- Có võng màn chống muỗi,680000,Siêu Thị 24h Online
18926003,https://www.sendo.vn/cui-go-cho-be-co-banh-xe-tam-lot-18926003.html,Cũi gỗ cho bé có bánh xe tấm lót,1950000,Siêu Thị 24h Online
22948027,https://www.sendo.vn/noi-dien-vong-xep-tu-dong-thanh-hung-2-trong-1-tang-vong-man-chong-muoi-22948027.html,Nôi điện Võng xếp tự động Thành Hưng 2 Trong 1- Tặng võng màn chống muỗi ,660000,Siêu Thị 24h Online
18680862,https://www.sendo.vn/bo-doi-nguon-cu-rung-may-rung-noi-dien-nguyen-cu-rung-18680862.html,"BỘ ĐỔI NGUỒN CỦ RUNG, MÁY RUNG NÔI ĐIỆN - NGUYÊN CỦ RUNG",220000,Siêu Thị 24h Online
23080298,https://www.sendo.vn/noi-rung-dien-dai-vi-2-trong-1-tang-kem-luoi-vong-vua-la-noi-dien-vua-la-vong-xep-23080298.html,NÔI RUNG ĐIỆN ĐẠI VĨ 2 TRONG 1 TẶNG KÈM LƯỚI VÕNG - VỪA LÀ NÔI ĐIỆN VỪA LÀ VÕNG XẾP,680000,Siêu Thị 24h Online
12863068,https://www.sendo.vn/noi-tre-chu-nhat-size-95x60cm-12863068.html,nôi tre chữ nhật size 95x60cm,180000,hai hip's house
19376778,https://www.sendo.vn/noi-kiem-vong-dien-cho-be-2-in-1-hang-viet-nam-19376778.html,NÔI KIÊM VÕNG ĐIỆN CHO BÉ 2 IN 1 HÀNG VIỆT NAM,1200000,cốm tinh nghịch
14132300,https://www.sendo.vn/combo-noi-chu-nhat-lon-va-chieu-co-14132300.html,combo nôi chữ nhật lớn và chiếu cỏ,230000,hai hip's house
22909002,https://www.sendo.vn/ghe-rung-nhun-cho-be-co-gau-22909002.html,Ghế rung nhún cho bé có gấu,199000,THANHTHAO14
19637997,https://www.sendo.vn/noi-xach-tay-farlin-bang-vai-bf-843-thiet-ke-don-gian-tinh-te-19637997.html,Nôi xách tay Farlin bằng vải BF-843 thiết kế đơn giản tinh tế,1350000,YoYoShop99
26611259,https://www.sendo.vn/cui-tre-em-cui-go-thong-cho-be-kt-70x105cm-26611259.html,Cũi Trẻ Em - Cũi Gỗ Thông cho bé KT 70X105cm,1350000,YoYoShop99
26633859,https://www.sendo.vn/noi-cui-2-tang-da-nang-autoru-26633859.html,Nôi cũi 2 tầng đa năng AUTORU,2590000,YoYoShop99
30154078,https://www.sendo.vn/noi-dat-vong-chong-cong-lung-size-90x60-boc-noi-tang-vong-dau-tam-30154078.html,Nôi đặt võng chóng còng lưng size 90x60 + bọc nôi  (tặng vòng dâu tằm),265000,SHOP BÁN NÔI TRE NGỌC YẾN
13940885,https://www.sendo.vn/man-nhac-cho-be-yeu-13940885.html,Màn nhạc cho bé yêu,230000,GIA DỤNG TỔNG HỢP VIAN
29046380,https://www.sendo.vn/tham-silicon-2-mat-xpe-han-quoc-chong-va-dap-cho-be-1m8x2m-29046380.html,Thảm Silicon 2 Mặt Xpe Hàn Quốc Chống Va Đập  Cho Bé 1M8X2M,189000,tongkhodadungmienbac
22935419,https://www.sendo.vn/quay-cui-kiem-nha-bong-khung-inox-tang-kem-15-bong-da-sac-cho-be-vui-choi-22935419.html,Quây Cũi Kiêm Nhà Bóng Khung Inox - Tặng Kèm 15 Bóng Đa Sắc Cho Bé Vui Chơi,290000,Siêu Thị 24h Online
13883349,https://www.sendo.vn/cui-quay-cho-be-13883349.html,CŨI QUÂY CHO BÉ,450000,GIA DỤNG TỔNG HỢP VIAN
29325862,https://www.sendo.vn/giuong-luoi-cho-be-29325862.html,GIƯỜNG LƯỚI CHO BÉ,289000,GIA DỤNG TỔNG HỢP VIAN
13994911,https://www.sendo.vn/giuong-luoi-cho-be-13994911.html,GIƯỜNG LƯỚI CHO BÉ,340000,GIA DỤNG TỔNG HỢP VIAN
22166442,https://www.sendo.vn/noi-rung-cho-be-22166442.html,NÔI RUNG CHO BÉ,590000,GIA DỤNG TỔNG HỢP VIAN
29502648,https://www.sendo.vn/bo-doi-nguon-sac-noi-dien-khong-kem-may-dua-noi-29502648.html,"BỘ ĐỔI NGUỒN, SẠC NÔI ĐIỆN (Không kèm máy đưa nôi)",160000,Siêu Thị 24h Online
28178339,https://www.sendo.vn/cui-quay-bong-28178339.html,CŨI QUÂY BÓNG,430000,GIA DỤNG TỔNG HỢP VIAN
12537109,https://www.sendo.vn/noi-dien-vong-xep-2in1-khanh-ngoc-tang-kem-vong-man-chong-muoi-12537109.html,"Nôi điện võng xếp 2in1 Khánh Ngọc - Tặng kèm võng, màn chống muỗi",720000,Siêu Thị 24h Online
22748717,https://www.sendo.vn/giuong-phat-nhac-vui-nhon-cho-be-22748717.html,Giường phát nhạc vui nhộn cho bé ,245000,Bà Xã Yêu
12706392,https://www.sendo.vn/cui-quay-cho-be-kem-100-bong-12706392.html,CŨI QUÂY CHO BÉ kèm 100 bóng,480000,GIA DỤNG TỔNG HỢP VIAN
30192841,https://www.sendo.vn/noi-tre-cho-be-size-85x55-boc-noi-30192841.html,Nôi tre cho bé size 85x55 + bọc nôi,240000,SHOP BÁN NÔI TRE NGỌC YẾN
17389941,https://www.sendo.vn/quay-bong-cho-be-17389941.html,QUÂY BÓNG CHO BÉ,350000,gia dụng binbo
23305186,https://www.sendo.vn/noi-rung-kiem-ghe-bap-benh-5-trong-1-mastela-6037-mau-ghi-xanh-23305186.html,Nôi rung kiêm ghế bập bênh 5 trong 1 Mastela 6037 - Màu ghi xanh,1330000,Chăm sóc bé sơ sinh
3096065,https://www.sendo.vn/ghe-noi-da-nang-dreamy-mau-tim-114495-3096065.html,Ghế nôi đa năng Dreamy màu tím 114495,8990000,Chăm sóc bé sơ sinh
3095902,https://www.sendo.vn/ghe-noi-da-nang-roanju-111815-3095902.html,Ghế nôi đa năng Roanju 111815,13900000,Chăm sóc bé sơ sinh
12231814,https://www.sendo.vn/noi-cui-du-zaracos-jenni-5046-blue-12231814.html,NÔI CŨI DÙ ZARACOS JENNI 5046 - BLUE,2150000,Chăm sóc bé sơ sinh
17351382,https://www.sendo.vn/giuong-cui-graco-on-the-go-rumor-17351382.html,GIƯỜNG CŨI GRACO ON THE GO RUMOR,2399000,Chăm sóc bé sơ sinh
19280200,https://www.sendo.vn/noi-vong-tu-dong-cho-be-2-trong-1-vinanoi-nv20x-19280200.html,Nôi Võng tự động cho bé 2 trong 1 VINANOI - NV20X,950000,Chăm sóc bé sơ sinh
9449364,https://www.sendo.vn/giuong-cui-tre-em-joie-excursion-change-bounce-in-the-rain-9449364.html,GIƯỜNG CŨI TRẺ EM JOIE EXCURSION CHANGE BOUNCE IN THE RAIN,4999000,Chăm sóc bé sơ sinh
22678261,https://www.sendo.vn/noi-rung-kiem-ghe-bap-benh-5-trong-1-mastela-6033-22678261.html,Nôi rung kiêm ghế bập bênh 5 trong 1 Mastela 6033,1330000,Chăm sóc bé sơ sinh
25018735,https://www.sendo.vn/noi-vong-tu-dong-cho-be-2-trong-1-vinanoi-nv25h-mau-hong-25018735.html,Nôi Võng tự động cho bé 2 trong 1 VINANOI - NV25H màu hồng,1299000,Chăm sóc bé sơ sinh
25017953,https://www.sendo.vn/giuong-cui-cho-be-go-thong-cao-cap-vinanoi-vnc107-25017953.html,Giường cũi cho bé gỗ thông cao cấp VINANOI - VNC107,1751000,Chăm sóc bé sơ sinh
6279425,https://www.sendo.vn/giuong-cui-graco-portable-napper-changer-studio-1925939-6279425.html,Giường cũi Graco Portable Napper Changer Studio 1925939,4200000,Chăm sóc bé sơ sinh
3096174,https://www.sendo.vn/noi-3-chuc-nang-aprica-nemyu-dx-589-bl-88362-3096174.html,Nôi 3 Chức Năng Aprica Nemyu DX 589 BL 88362,5000000,Chăm sóc bé sơ sinh
3096144,https://www.sendo.vn/ghe-noi-da-nang-reminis-mau-xanh-114579-3096144.html,Ghế nôi đa năng Reminis màu xanh 114579,7300000,Chăm sóc bé sơ sinh
24792211,https://www.sendo.vn/noi-tu-dong-cao-cap-mastela-sg239-mau-be-24792211.html,Nôi tự động cao cấp Mastela SG239 - Màu Be,2060000,Chăm sóc bé sơ sinh
3536908,https://www.sendo.vn/vinanoi-vnc-g301-giuong-cui-gap-xep-cao-cap-cho-be-2-tang-go-thong-3536908.html,VINANOI VNC-G301 - Giường cũi gấp xếp cao cấp cho bé 2 tầng gỗ thông,1800000,Chăm sóc bé sơ sinh
26125318,https://www.sendo.vn/noi-xach-tay-cho-be-farlin-bf843-cho-be-moi-sinh-cho-den-8-thang-tuoi-26125318.html,Nôi xách tay cho bé Farlin BF843 cho bé mới sinh cho đến 8 tháng tuổi,1150000,Chăm sóc bé sơ sinh
20986222,https://www.sendo.vn/noi-dien-thanh-hung-2-trong-1-vua-la-noi-dien-vua-la-vong-xep-20986222.html,NÔI ĐIỆN THÀNH HƯNG 2 TRONG 1 VỪA LÀ NÔI ĐIỆN VỪA LÀ VÕNG XẾP,650000,Shop Mẹ Bé Nhímm
7537807,https://www.sendo.vn/ghe-rung-luoi-7537807.html,ghế rung lưới,180000,shop-phuongbeo
24175738,https://www.sendo.vn/treo-noi-den-trang-kich-thich-thi-giac-hinh-khoi-24175738.html,TReo nôi đen trắng kích thích thị giác hình khối,109000,Thiết bị vệ sinh LIFMOD
11859686,https://www.sendo.vn/quay-cui-goc-tron-size-m-11859686.html,QUÂY CŨI GÓC TRÒN SIZE M,2300000,shop thaothy16
24640569,https://www.sendo.vn/quay-cui-ruot-matxa-24640569.html,QUÂY CŨI RUỘT MATXA,290000,shop Muns
22351837,https://www.sendo.vn/vong-tu-dua-cho-be-noi-tu-dua-noi-vong-tu-dua-mau-hong-22351837.html,võng tự đưa cho bé- nôi tự đưa- nôi võng tự đưa màu hồng,450000,Màn Khung Võng Xếp
22149391,https://www.sendo.vn/noi-cho-be-hoang-thanh-22149391.html,Nôi cho bé Hoàng Thành,450000,baby68
20764126,https://www.sendo.vn/thanh-chan-giuong-thong-minh-cho-be-20764126.html,Thanh chắn giường thông minh cho bé,335000,Chíp Family
18629786,https://www.sendo.vn/banh-xe-cho-cui-goldcat-18629786.html,Bánh xe cho cũi GOLDCAT,150000,Goldcat shop
12021996,https://www.sendo.vn/bo-36-mieng-tham-xop-lot-san-chu-va-so-loai-lon-30x30cm-12021996.html,Bộ 36 miếng thảm xốp lót sàn chữ và số loại lớn 30x30cm,285000,September Cosmetics
17564184,https://www.sendo.vn/may-dua-vong-cho-be-sbaby-cao-cap-17564184.html,Máy đưa võng cho bé Sbaby cao cấp ,590000,CÔNG TY ĐỒ GIA DỤNG ĐĂNG KHOA
22351061,https://www.sendo.vn/day-coloa-noi-dien-dai-vi-2-day-22351061.html,dây coloa nôi điện đại vĩ 2 dây,25000,Màn Khung Võng Xếp
7016223,https://www.sendo.vn/may-dua-vong-cho-be-livorno-bao-hanh-12-thang-7016223.html,MÁY ĐƯA VÕNG CHO BÉ LIVORNO BẢO HÀNH 12 THÁNG,370000,SIÊU MUA RẺ
23203493,https://www.sendo.vn/sach-vai-cho-be-23203493.html,Sách vải cho bé,19000,Thiết bị vệ sinh LIFMOD
17345382,https://www.sendo.vn/may-dua-vong-hieu-sbaby-ah01-17345382.html,Máy đưa võng hiệu Sbaby AH01,280000,gaunhoibong
9875002,https://www.sendo.vn/ghe-hoi-tap-ngoi-cho-be-9875002.html,Ghế hơi tập ngồi cho bé,119000,HoaMai9999
18731978,https://www.sendo.vn/giuong-luoi-cho-be-18731978.html,giường lưới cho bé,340000,Dogiadung99
26236711,https://www.sendo.vn/giuong-luoi-dieu-hoa-rainbow-90cmx50cm-26236711.html,Giường lưới điều hoà Rainbow 90cmx50cm,190000,Giường lưới Vuông Tròn 8
26131653,https://www.sendo.vn/cuc-nguon-may-dua-vong-a79-26131653.html,Cục nguồn máy đưa võng - A79,147000,TƯ MÃ Ý 2560
21581543,https://www.sendo.vn/bo-doi-nguon-may-dua-noi-dien-thanh-hung-21581543.html,"Bộ đổi nguồn, máy đưa nôi điện Thành Hưng",325000,Võng Xếp Nôi Điện
22909417,https://www.sendo.vn/01-thanh-chan-giuong-giu-an-toan-cho-be-22909417.html,01 THANH CHẮN GIƯỜNG GIỮ AN TOÀN CHO BÉ,259000,Xinh
20845791,https://www.sendo.vn/cu-rung-noi-dien-hang-viet-nam-20845791.html,CỦ RUNG NÔI ĐIỆN HÀNG VIỆT NAM,240000,GIÀY XINH QUẢNG CHÂU
22640021,https://www.sendo.vn/quay-cui-kiem-nha-bong-tang-kem-bong-cho-be-22640021.html,Quây cũi kiêm nhà bóng tặng kèm bóng cho bé,299000,Shop_Trâmxinh
11303926,https://www.sendo.vn/man-ngu-kem-goi-chong-muoi-co-nhac-danh-cho-be-11303926.html,Màn ngủ kèm Gối chống muỗi có nhạc dành cho bé,150000,Bellra
17414761,https://www.sendo.vn/may-dua-vong-khong-kem-bo-nguon-17414761.html,Máy đưa võng KHÔNG KÈM BỘ NGUỒN,299000,SHOP MINH SAN
19277044,https://www.sendo.vn/noi-dien-dai-vi-2-trong-1-vua-la-noi-dien-vua-la-vong-xep-hang-vn-chat-luong-cao-19277044.html,NÔI ĐIỆN ĐẠI VĨ 2 TRONG 1  VỪA LÀ NÔI ĐIỆN VỪA LÀ VÕNG XẾP - HÀNG VN CHẤT LƯỢNG CAO,650000,Shop Mẹ Bé Nhímm
10874253,https://www.sendo.vn/bo-goi-nem-cho-em-be-di-mau-giao-vai-cara-kim-home-100x60cm-10874253.html,Bộ gối nệm cho em bé đi mẫu giáo vải cara kim home 100x60cm,175000,Babies Vn
16298339,https://www.sendo.vn/1-thanh-chan-giuong-2m-kem-qua-tang-16298339.html,1 THANH CHẮN GIƯỜNG 2M KÈM QUÀ TẶNG,319000,GIADUNGGIAGOC1
24634510,https://www.sendo.vn/noi-dien-vong-xep-thanh-hung-2in1-tang-vong-man-chong-muoi-tam-lot-lung-24634510.html,Nôi điện Võng Xếp Thành Hưng 2in1 - Tặng Võng Màn Chống Muỗi Tấm Lót Lưng,650000,Babykids
29384593,https://www.sendo.vn/noi-tre-dan-cho-be-29384593.html,Nôi tre đan cho bé,135000,NÔI MÂY TRE ĐAN CHO BÉ
17486504,https://www.sendo.vn/chieu-truc-tre-em-bambo-60x120cm-17486504.html,Chiếu trúc trẻ em Bambo 60x120cm,199000,Babiesland
24634174,https://www.sendo.vn/giuong-luoi-cao-cap-cho-be-1m2-24634174.html,Giường Lưới Cao Cấp Cho Bé 1m2,300000,Babykids
24634343,https://www.sendo.vn/giuong-luoi-tre-em-1m2-24634343.html,Giường Lưới Trẻ Em 1M2,300000,Babykids
24634406,https://www.sendo.vn/noi-dien-vong-xep-2-tang-co-dai-2-trong-1-co-man-chong-muoi-tang-vong-24634406.html,Nôi điện Võng xếp 2 tầng cỡ đại 2 Trong 1 Có màn chống muỗi tặng võng ,1280000,Babykids
24634057,https://www.sendo.vn/day-curoa-noi-dien-dai-vi-loai-1-tang-1-bo-gom-2-day-24634057.html,Dây Curoa Nôi điện Đại Vĩ loại 1 tầng - 1 bộ gồm 2 dây,40000,Babykids
26146755,https://www.sendo.vn/noi-dien-vong-xep-2-trong-1-dai-vi-tang-kem-vong-man-chong-muoi-cho-be-26146755.html,Nôi Điện Võng Xếp 2 Trong 1 Đại Vĩ Tặng Kèm Võng + Màn Chống Muỗi Cho Bé,680000,Babykids
