product_id,product_url,name,price,shop_name
18998602,https://www.sendo.vn/dem-ngu-dung-tu-the-coza-baby-bed-premium-18998602.html,Đệm ngủ đúng tư thế Coza Baby Bed – Premium,2999000,MTP Store
19833820,https://www.sendo.vn/noi-tre-va-chieu-lot-cho-be-19833820.html,Nôi tre và chiếu lót cho bé,165000,Quần chục
12537888,https://www.sendo.vn/mau-moi-nhat-2018-thanh-chan-giuong-m6-cao-82cm-cua-aachamann-12537888.html,Mẫu mới nhất 2018- Thanh chăn giường m6 cao 82cm của Aachamann,449000,ShopDuongMinh
11914527,https://www.sendo.vn/quay-cui-nhua-3d-loai-16-mieng-cho-be-tang-tham-va-bong-hang-cao-cap-11914527.html,QUÂY CŨI NHỰA 3D LOẠI 16 MIẾNG CHO BÉ TẶNG THẢM VÀ BÓNG HÀNG CAO CẤP,1850000,Cái Gì Chẳng Có 1
12546802,https://www.sendo.vn/cui-quay-cho-be-12546802.html,cũi quây cho bé,410000,GiadungDinhVinh
12547183,https://www.sendo.vn/giuong-luoi-cho-be-12547183.html,giường lưới cho bé,340000,GiadungDinhVinh
13118886,https://www.sendo.vn/cui-quay-bong-13118886.html,Cũi quây bóng,480000,giadunganan
13372765,https://www.sendo.vn/giuong-luoi-tre-em-13372765.html,giường lưới trẻ em,340000,GiadungDinhVinh
13118890,https://www.sendo.vn/cui-quay-cho-be-kem-100-qua-bong-13118890.html,CŨI QUÂY CHO BÉ kèm 100 quả bóng,520000,giadunganan
13118880,https://www.sendo.vn/cui-quay-cho-be-13118880.html,Cũi quây cho bé,480000,ĐỒ GIA DỤNG VIAN
17772536,https://www.sendo.vn/cui-quay-cho-be-17772536.html,CŨI QUÂY CHO BÉ,420000,HÀNG TIỆN ÍCH 01
17772603,https://www.sendo.vn/cui-quay-cho-be-17772603.html,CŨI QUÂY CHO BÉ,420000,SHOP HÀNG TỔNG HỢP
13094399,https://www.sendo.vn/cui-quay-cho-be-13094399.html,CŨI QUÂY CHO BÉ,350000,ĐỒ GIA DỤNG VIAN
13118872,https://www.sendo.vn/cui-quay-cho-be-kem-100-bong-13118872.html,CŨI QUÂY CHO BÉ kèm 100 bóng,520000,ĐỒ GIA DỤNG VIAN
14137121,https://www.sendo.vn/bo-quay-va-ga-huou-xanh-cho-cui-kich-thuoc-70x110-14137121.html,Bộ quây và ga Hươu xanh cho cũi kích thước 70x110,500000,Goldcat shop
14017008,https://www.sendo.vn/cui-quay-cho-be-kem-100-bong-14017008.html,CŨI QUÂY CHO BÉ kèm 100 bóng,520000,GIA DỤNG TỔNG HỢP VIAN
17219844,https://www.sendo.vn/dem-ngu-chong-bet-dau-cho-tre-17219844.html,Đệm Ngủ Chống Bẹt Đầu Cho Trẻ,235000,Winmart
13469328,https://www.sendo.vn/bo-doi-dien-ac-dc-cho-may-dua-vong-autoru-13469328.html,Bộ đổi điện AC-DC cho máy đưa võng Autoru,230000,Babymart
27524044,https://www.sendo.vn/quan-nhong-chun-coc-cao-cap-vai-giong-cocoon-giup-be-ngu-ngon-27524044.html,QUẤN NHỘNG CHŨN CỘC CAO CẤP - VẢI GIỐNG COCOON - GIÚP BÉ NGỦ NGON,235000,Túi Ngủ Thiện Tâm
11516442,https://www.sendo.vn/cui-quay-cho-be-kem-100-bong-11516442.html,CŨI QUÂY CHO BÉ kèm 100 bóng,520000,giadunganan
12212154,https://www.sendo.vn/quay-cui-nhua-3d-loai-16-mieng-cho-be-kem-tham-va-bong-hang-cao-cap-12212154.html,QUÂY CŨI NHỰA 3D LOẠI 16 MIẾNG CHO BÉ KÈM THẢM VÀ BÓNG HÀNG CAO CẤP,1850000,Cái Gì Chẳng Có 68
12135402,https://www.sendo.vn/khung-vong-xep-tre-em-vong-xep-em-be-thuyen-rong-12135402.html,Khung Võng Xếp Trẻ Em – Võng Xếp Em Bé Thuyền Rồng,539000,Nhật Trường Store
12131444,https://www.sendo.vn/cui-quay-cho-be-12131444.html,Cũi Quây Cho Bé,480000,GiadungDinhVinh
12266985,https://www.sendo.vn/quay-bong-vai-du-khung-thep-inox-cho-be-hang-cao-cap-tang-200-bong-12266985.html,QUÂY BÓNG VẢI DÙ KHUNG THÉP INOX CHO BÉ HÀNG CAO CẤP TẶNG 200 BÓNG,460000,Cái Gì Chẳng Có 68
11503742,https://www.sendo.vn/noi-may-dat-vong-giup-be-khong-bi-cong-lung-11503742.html,Nôi mây đặt võng giúp bé không bị cong lưng,450000,baby68
11530232,https://www.sendo.vn/cui-quay-bong-11530232.html,Cũi quây bóng,480000,ĐỒ GIA DỤNG VIAN
12111026,https://www.sendo.vn/cui-quay-cho-be-kem-100-bong-12111026.html,CŨI QUÂY CHO BÉ kèm 100 bóng,520000,giadunganan
11234258,https://www.sendo.vn/tham-nhac-baby-11234258.html,Thảm Nhạc Baby,380000,GiadungDinhVinh
12365080,https://www.sendo.vn/cui-quay-cho-be-kem-100-qua-bong-12365080.html,CŨI QUÂY CHO BÉ kèm 100 quả bóng,550000,GiadungDinhVinh
11679242,https://www.sendo.vn/ghe-nhun-cho-be-11679242.html,GHẾ NHÚN CHO BÉ,279000,MẠNH KHA
12375839,https://www.sendo.vn/giuong-luoi-cao-cap-tre-em-12375839.html,Giường lưới cao cấp trẻ em,189000,trunghương
13912267,https://www.sendo.vn/giuong-luoi-tre-em-13912267.html,GIƯỜNG LƯỚI TRẺ EM,340000,GiadungDinhVinh
10857271,https://www.sendo.vn/ghe-rung-an-bot-cho-be-co-bao-hiem-mai-che-goi-do-choi-dang-ke-chu-a-10857271.html,"Ghế rung ăn bột cho bé có bảo hiểm, mái che, gối, đồ chơi dạng kệ chữ A",360000,Siêu Thị 24h Online
14045805,https://www.sendo.vn/qua-dinh-0-dong-chieu-truc-lot-cui-noi-va-vong-cho-be-80-x-120cm-tang-4-vien-pin-con-tho-size-aaa-14045805.html,[ QUÀ ĐỈNH 0 ĐỒNG ] chiếu trúc lót cũi nôi và võng cho bé 80 x 120cm - Tặng 4 viên pin con thỏ size aaa,290000,dangtuyen0909
10283430,https://www.sendo.vn/quay-cui-nhua-3d-cho-be-loai-18-mieng-co-bong-ro-10283430.html,QUÂY CŨI NHỰA 3D CHO BÉ LOẠI 18 MIẾNG CÓ BÓNG RỔ,2050000,Cái Gì Chẳng Có
10283571,https://www.sendo.vn/quay-cui-nhua-3d-cho-be-loai-16-mieng-co-bong-ro-10283571.html,QUÂY CŨI NHỰA 3D CHO BÉ LOẠI 16 MIẾNG CÓ BÓNG RỔ,1750000,Cái Gì Chẳng Có 1
10283539,https://www.sendo.vn/quay-cui-nhua-3d-cho-be-loai-14-mieng-co-bong-ro-10283539.html,QUÂY CŨI NHỰA 3D CHO BÉ LOẠI 14 MIẾNG CÓ BÓNG RỔ,1650000,Cái Gì Chẳng Có 1
11097859,https://www.sendo.vn/thanh-chan-giuong-1m8-cho-be-11097859.html,THANH CHẮN GIƯỜNG 1M8 CHO BÉ,309000,tongkhodobuon
10212256,https://www.sendo.vn/xich-du-mastela-6519-dung-dua-tu-dong-mau-hong-10212256.html,Xích đu Mastela  6519 đung đưa tự động  màu hồng,1399000,Diệp Anh Japan
11102348,https://www.sendo.vn/nem-cara-kim-home-60x120cm-cho-em-be-so-sinh-tu-1-5-tuoi-11102348.html,Nệm cara kim home 60x120cm cho em bé sơ sinh từ 1-5 tuổi,155000,Babies Vn
10196767,https://www.sendo.vn/noi-rung-kiem-bap-benh-3-in-1-kiza-crown-rockker-napper-co-nhac-10196767.html,Nôi rung kiêm bập bênh 3 in 1 Kiza Crown Rockker-Napper có nhạc,1890000,Diệp Anh Japan
11401611,https://www.sendo.vn/cui-quay-cho-be-kem-100-bong-11401611.html,CŨI QUÂY CHO BÉ kèm 100 bóng,520000,giadunganan
11079244,https://www.sendo.vn/bo-10-mieng-tham-lot-san-mau-giao-thong-loai-lon-30x30x1cm-11079244.html,Bộ 10 miếng thảm lót sàn mẫu giao thông loại lớn 30x30x1cm,89000,September Cosmetics
10936088,https://www.sendo.vn/noi-2-tang-3-sao-autoru-da-nang-10936088.html,NÔI 2 TẦNG 3 SAO AUTORU ĐÀ NẴNG,2090000,ONG VANG
11185588,https://www.sendo.vn/cui-quay-cho-be-kem-100-qua-bong-11185588.html,CŨI QUÂY CHO BÉ kèm 100 quả bóng,520000,ĐỒ GIA DỤNG VIAN
11213607,https://www.sendo.vn/1-thanh-chan-giuong-1m8-cho-be-11213607.html,1 THANH CHẮN GIƯỜNG 1M8 CHO BÉ,360000,shopdogiadung1207
23305253,https://www.sendo.vn/noi-tu-dong-cao-cap-mastela-sg239-23305253.html,Nôi tự động cao cấp Mastela SG239,2058000,Chăm sóc bé sơ sinh
22080523,https://www.sendo.vn/chieucao-su-kareal-chong-tham-cho-be-22080523.html,CHIẾUCAO SU KAREAL CHỐNG THẤM CHO BÉ,250000,GIA DỤNG GIÁ RẺ HC
6546220,https://www.sendo.vn/noi-rung-cho-be-6546220.html,nôi rung cho bé,490000,shop-phuongbeo
29307651,https://www.sendo.vn/thanh-chan-giuong-1m4-mau-kem-29307651.html,Thanh chắn giường 1m4 màu kem,329000,Nguyenty16
19448158,https://www.sendo.vn/tui-ngu-qua-dau-co-keo-khoa-19448158.html,Túi ngủ quả đậu có kéo khóa,135000,Cubon Shop
19447837,https://www.sendo.vn/chan-bang-long-carter-thu-19447837.html,Chăn băng lông Carter thú,89000,Cubon Shop
19447820,https://www.sendo.vn/tui-ngu-cho-be-co-keo-khoa-cai-cuc-19447820.html,Túi ngủ cho bé có kéo khóa- cài cúc,99000,Cubon Shop
19447834,https://www.sendo.vn/chieu-dieu-hoa-kem-goi-thao-duoc-cho-be-19447834.html,Chiếu điều hòa kèm gối thảo dược cho bé,159000,Cubon Shop
19449530,https://www.sendo.vn/chieu-coi-loai-be-to-hinh-thu-19449530.html,Chiếu cói loại bé- to hình thú,24000,Cubon Shop
14101948,https://www.sendo.vn/giuong-thay-ta-xep-gon-chong-dau-lung-cho-me-c1-st3849-14101948.html,"Giường thay tã xếp gọn, chống đau lưng cho mẹ C1-ST3849",980000,Phụ Kiện Thuận Lợi
10313986,https://www.sendo.vn/ghe-nhun-cho-be-ghe-rung-cho-be-10313986.html,Ghế nhún cho bé-GHẾ RUNG CHO BÉ,199000,khogiadungsieure
5346490,https://www.sendo.vn/noi-tre-em-mem-hai-tang-autoru-3-sao-auac3s-5346490.html,Nôi trẻ em mềm hai tầng Autoru 3 sao AUAC3S,2090000,baby68
5409273,https://www.sendo.vn/noi-nhun-cho-be-loai-moi-kem-do-choi-5409273.html,NÔI NHÚN CHO BÉ LOẠI MỚI KÈM ĐỒ CHƠI,380000,Cái Gì Chẳng Có
3326311,https://www.sendo.vn/may-dua-vong-duy-phuong-3326311.html,Máy đưa võng Duy Phương,479000,Vietcare Solutions
29533252,https://www.sendo.vn/day-noi-dai-vi-1-day-lon-1-nho-29533252.html,dây nôi Đại vĩ 1 dây lớn 1 nhỏ,26000,hoa giay
28367754,https://www.sendo.vn/may-dua-vong-uwa-cup-dien-van-dung-duoc-28367754.html,MÁY ĐƯA VÕNG UWA-CÚP ĐIỆN VẪN DÙNG ĐƯỢC ,449000,Nội thất Khánh Thịnh
29508042,https://www.sendo.vn/noi-dien-vong-xep-2-trong-1-khanh-ngoc-tang-kem-vong-man-chong-muoi-cho-be-29508042.html,Nôi Điện Võng Xếp 2 Trong 1 Khánh Ngọc  Tặng Kèm Võng   Màn Chống Muỗi Cho Bé,729000,màn chụp tự bung
28169638,https://www.sendo.vn/cui-quay-bong-cho-be-28169638.html,Cũi quây bóng cho bé,480000,GiadungDinhVinh
28161270,https://www.sendo.vn/cui-quay-cho-be-28161270.html,CŨI QUÂY CHO BÉ,399000,giadunganan
28335877,https://www.sendo.vn/ghe-nam-danh-cho-tre-em-co-khung-bang-sat-boc-dem-chinh-hang-mastela-28335877.html,Ghế nằm dành cho trẻ em có khung bằng sắt bọc đệm CHÍNH HÃNG Mastela,939000,BabyKingdom
27510631,https://www.sendo.vn/nem-lot-boc-noi-tre-cho-be-27510631.html,Nệm lót bọc nôi tre cho bé,100000,noitrenoitre
29748056,https://www.sendo.vn/bo-nguon-adapter-may-dua-vong-tu-dong-fujishi-va017-adapter-29748056.html,Bộ nguồn adapter Máy đưa võng tự động Fujishi VA017 - adapter,170000,dacsanmien
28966241,https://www.sendo.vn/noi-ru-ngu-dieu-khien-tu-xa-28966241.html,nôi ru ngủ điều khiển từ xa,1680000,SuSu Kids kube
30379674,https://www.sendo.vn/cuc-nguon-may-dua-vong-30379674.html,cục nguồn máy đưa võng,189000,ĐÀ LẠT 7979
29849034,https://www.sendo.vn/day-curoa-noi-dien-long-hung-29849034.html,Dây curoa nôi điện Long Hưng,15000,baby68
29849068,https://www.sendo.vn/day-curoa-noi-dien-dai-vi-29849068.html,Dây curoa nôi điện Đại Vĩ    ,13000,baby68
27986761,https://www.sendo.vn/day-curoa-noi-dien-long-hung-combo-3-soi-ban-day-dan-27986761.html,Dây curoa nôi điện Long Hưng combo 3 sợi bản dày dặn,85000,hoa giay
28838045,https://www.sendo.vn/day-cu-roa-noi-dien-dai-vi-loai-1-tang-bo-2-chiec-28838045.html,DÂY CU ROA NÔI ĐIỆN ĐẠI VĨ LOẠI 1 TẦNG BỘ 2 CHIẾC,45000,SHOP MINH KHÔI BABY
28773036,https://www.sendo.vn/giuong-luoi-cho-be-28773036.html,giường lưới cho bé,350000,SIÊU THỊ GIA ĐÌNH 1
28171854,https://www.sendo.vn/cui-quay-bong-28171854.html,cũi quây bóng,430000,CÂY ĂN QUẢ 4
28137925,https://www.sendo.vn/day-curoa-cui-cho-em-be-2-day-lon-va-nho-28137925.html,Dây curoa cũi cho em bé 2 dây lớn và nhỏ,53000,hoa giay
28420135,https://www.sendo.vn/noi-go-cho-be-0-2-tuoi-87x45x25cm-28420135.html,Nôi gỗ cho bé 0-2 tuổi 87x45x25cm,1462000,EuroHome Siêu Thị Nhập Khẩu
28221801,https://www.sendo.vn/quay-nhua-an-toan-cho-be-cui-14-28221801.html, Quây nhựa an toàn cho bé - cũi-14,1490000,shopluandung
25052923,https://www.sendo.vn/nem-mung-ngu-chong-muoi-cho-be-happy-baby-25052923.html,Nệm mùng ngủ chống muỗi cho bé Happy Baby,380000,đồ lót chất
25368977,https://www.sendo.vn/tham-xop-cho-be-yeu-2020-du-kich-co-25368977.html,Thảm xốp cho bé yêu 2020 đủ kích cỡ,95000,Siêu Thị 24h Online
25002424,https://www.sendo.vn/giuong-luoi-cho-be-ngu-ngon-co-qua-tang-25002424.html,Giường lười cho bé ngủ ngon [Có Quà Tặng],3688000,La ca
25125630,https://www.sendo.vn/may-dua-vong-tu-dong-em-be-fujishi-va017-kem-adapter-25125630.html,Máy Đưa Võng Tự Động em bé Fujishi VA017 kèm adapter,350000,Shop Mounts
26234909,https://www.sendo.vn/ghe-rung-ghe-rung-26234909.html,ghế rung ghế rung,345000,Đồ Tiện ích
26156222,https://www.sendo.vn/leu-bong-hinh-huou-va-kitty-tang-kem-tui-bong-100-qua-26156222.html,Lều bóng hình hươu và kitty tặng kèm Túi bóng 100 quả,199000,Kho Gia Dụng Ánh Thư
25368496,https://www.sendo.vn/noi-dien-dai-vinh-2-trong-1-vua-la-noi-lai-la-vong-xep-25368496.html,Nôi điện Đại vĩnh 2 trong 1 vừa là nôi lại là võng xếp,680000,Siêu Thị 24h Online
26217588,https://www.sendo.vn/giuong-nem-ngu-em-ai-cho-be-giuong-nem-cho-be-super-market-26217588.html,Giường Nệm Ngủ Êm Ái Cho Bé - giường nệm cho bé - Super Market ,859000,Dominate The Market
26060195,https://www.sendo.vn/giuong-cui-tre-em-xinh-xan-loi-tre-em-26060195.html,Giường cũi trẻ em xinh xắn - lôi trẻ em,299200,Hệ Thống Bán Lẻ Amina
26216527,https://www.sendo.vn/noi-dien-dua-tu-dong-co-nhac-cho-be-co-mung-chong-muoi-boss-baby-noi-bossbaby-super-market-26216527.html,Nôi điện đưa tự động có nhạc cho bé có mùng chống muỗi Boss Baby - nôi bossbaby - Super Market ,1490000,Dominate The Market
26109730,https://www.sendo.vn/cuc-nguon-may-dua-vong-cuc-nguon-may-dua-vong-26109730.html,cục nguồn máy đưa võng - cục nguồn máy đưa võng,189000,TƯ MÃ Ý 2459
26040429,https://www.sendo.vn/tham-choi-cho-be-don-mau-pastel-xam-tro-10-mieng-dien-tich-1m2-smile-puzzle-khong-mui-26040429.html,"Thảm chơi cho bé đơn màu Pastel Xám Tro 10 miếng, diện tích 1m2 Smile Puzzle Không mùi",72000,SmilePuzzleVN
26610432,https://www.sendo.vn/cui-3d-linh-hoat-4-canh-26610432.html,Cũi 3D linh hoạt - 4 cánh,850000,YoYoShop99
26732639,https://www.sendo.vn/online-mall-vn-noi-go-tre-em-phong-cach-nhat-ban-tu-0-2-tuoi-87x45x25cm-26732639.html,Online Mall VN - Nôi gỗ trẻ em phong cách Nhật Bản từ 0-2 tuổi 87x45x25cm,1450000,Online Mall VN
26730131,https://www.sendo.vn/online-mall-vn-giuong-nem-ngu-em-ai-cho-be-26730131.html,Online Mall VN -  Giường Nệm Ngủ Êm Ái Cho Bé,849000,Online Mall VN
26732952,https://www.sendo.vn/cuc-nguon-may-dua-vong-cuc-nguon-may-dua-vong-26732952.html,cục nguồn máy đưa võng - cục nguồn máy đưa võng,189000,jb4736
26255328,https://www.sendo.vn/noi-may-cho-be-26255328.html,Nôi mây cho bé ,650000,Giường tre sài gòn
26272360,https://www.sendo.vn/bo-quay-cui-cho-be-cao-cap-26272360.html,Bộ quây cũi cho bé cao cấp ,720000,MamaKids Gold Việt Nam
26066853,https://www.sendo.vn/noi-dua-tre-em-joie-serina-2in1-in-the-rain-cho-be-tu-so-sinh-6-toc-do-dua-noi-3-goc-do-nga-lung-ghe-2-che-do-rung-nhe-ket-hop-5-am-thanh-tu-nhien-26066853.html,"Nôi đưa trẻ em Joie Serina 2in1 In the Rain cho bé từ sơ sinh, 6 tốc độ đưa nôi, 3 góc độ ngả lưng ghế, 2 chế độ rung nhẹ kết hợp 5 âm thanh tự nhiên",4700000,Chăm sóc bé sơ sinh
22410514,https://www.sendo.vn/noi-bap-benh-cho-be-22410514.html,Nôi Bập Bênh Cho Bé,1310000,Nam Thành Shop
23214855,https://www.sendo.vn/quay-cui-cho-be-23214855.html,QUÂY CŨI CHO BÉ,390000,GIA DỤNG TỔNG HỢP VIAN
22553831,https://www.sendo.vn/bo-quay-cui-4-tam-nhieu-mau-sac-cho-be-goldcat-22553831.html,Bộ quây cũi 4 tấm nhiều màu sắc cho bé GoldCat,480000,Goldcat shop
22761366,https://www.sendo.vn/quay-cui-kiem-nha-bong-khung-inox-tang-kem-bong-da-sac-cho-be-vui-choi-22761366.html,Quây Cũi Kiêm Nhà Bóng Khung Inox - Tặng Kèm Bóng Đa Sắc Cho Bé Vui Chơi,400000,Miu Miu Shop PT
23066777,https://www.sendo.vn/cui-quay-bong-cho-be-23066777.html,CŨI QUÂY BÓNG CHO BÉ,390000,GIA DỤNG TỔNG HỢP VIAN
23003769,https://www.sendo.vn/noi-ru-ngu-tu-dong-co-phat-nhac-cho-be-nghe-ad-23003769.html,Nôi ru ngủ tự động có phát nhạc cho bé nghe - AD,1900000,AudiSport Shop
24053640,https://www.sendo.vn/vong-noi-cho-be-thanh-hung-khong-dien-tang-man-chong-muoi-tam-lot-lung-24053640.html,"Võng Nôi Cho Bé Thành Hưng Không Điện - Tặng Màn Chống Muỗi, Tấm Lót Lưng",629000,Đồ Gia Dụng VN
24221428,https://www.sendo.vn/noi-cho-be-noi-cho-be-24221428.html,Nôi cho bé-Nôi cho bé,1320000,CLICK BUY SHOP
23643388,https://www.sendo.vn/noi-dien-dai-vi-2-trong-1-vua-la-noi-dien-vua-la-vong-xep-hang-vn-chat-luong-cao-23643388.html,NÔI ĐIỆN ĐẠI VĨ 2 TRONG 1 VỪA LÀ NÔI ĐIỆN VỪA LÀ VÕNG XẾP - HÀNG VN CHẤT LƯỢNG CAO,900000,Tổng Kho Sơ Sinh Giá Sỉ
24301323,https://www.sendo.vn/combo-set-ga-chun-cottong-me-va-be-nhan-tin-chon-mau-va-kich-thuoc-24301323.html,Combo Sét ga chun cottong mẹ và bé-nhăn tin chọn màu và kích thước,249000,CỬA TIỆM BỐN MÙA
24270549,https://www.sendo.vn/giuong-luoi-cho-be-mam-non-24270549.html,Giường lưới cho bé mầm non,240000,Kimthoan
23772096,https://www.sendo.vn/cu-rung-noi-dien-dai-vi-cuc-rung-noi-dai-vi-23772096.html,Củ Rung Nôi Điện Đại Vĩ - Cục rung nôi Đại Vĩ,249000,Shop Con Cưngg
24343762,https://www.sendo.vn/cui-tre-em-giuong-cui-tre-em-cui-cho-be-cui-go-tu-nhien-cui-da-nang-24343762.html,"Cũi trẻ em, giường cũi trẻ em, cũi cho bé, cũi gỗ tự nhiên, cũi đa năng",2500000,Leon_Decor
23517454,https://www.sendo.vn/noi-dien-2in1-dai-vi-co-tang-vong-man-cho-be-23517454.html,NÔI ĐIỆN 2IN1 ĐẠI VĨ CÓ TẶNG VÕNG MÀN CHO BÉ,680000,Siêu Thị 24h Online
23799886,https://www.sendo.vn/giuong-cui-tre-em-graco-pnp-qc-prt-npr-asher-23799886.html,Giường cũi trẻ em Graco PNP QC PRT NPR Asher,5670000,SIÊUTHỊHÀNGNHẬT
23643368,https://www.sendo.vn/noi-dien-vong-xep-2-tang-co-dai-2-trong-1-co-man-chong-muoi-tang-vong-23643368.html,"Nôi điện Võng xếp 2 tầng cỡ đại 2 Trong 1 Có màn chống muỗi ,tặng võng ",1280000,Tổng Kho Sơ Sinh Giá Sỉ
23565375,https://www.sendo.vn/quay-bong-luc-giac-cho-be-23565375.html,QUÂY BÓNG LỤC GIÁC CHO BÉ,350000,chuyên đồ gia dụng hương
24346936,https://www.sendo.vn/cui-2-tang-cho-be-size-120cm-24346936.html,Cũi 2 tầng cho bé size 120cm,2869000,HONA BEAT
23838270,https://www.sendo.vn/giuong-cui-tre-em-joie-commuter-change-logan-23838270.html,Giường cũi trẻ em Joie Commuter Change Logan,2250000,SIÊUTHỊHÀNGNHẬT
24802433,https://www.sendo.vn/bo-dem-2-ga-quay-cui-24802433.html,BỘ ĐỆM -2 GA-QUÂY CŨI,680000,shop Muns
23854028,https://www.sendo.vn/combo-cui-quay-cui-dem-cho-be-0-36-thang-23854028.html,Combo cũi - quây cũi - đệm cho bé 0 - 36 tháng,2679000,HONA BEAT
24369041,https://www.sendo.vn/cui-cho-be-cui-cho-be-cao-cap-24369041.html,Cũi cho bé - cũi cho bé cao câp,2059000,HONA HOME
24365806,https://www.sendo.vn/giuong-cui-noi-cui-cui-luoi-hona64-24365806.html,Giường cũi - Nôi cũi - Cũi lưới - HONA64,1990000,HONA BOSS
22681753,https://www.sendo.vn/noi-em-be-22681753.html,NÔI EM BÉ,1299000,AllSale
24330476,https://www.sendo.vn/noi-vai-goi-lom-goi-chan-cho-be-24330476.html,Nôi vải. Gối lõm. Gối chặn cho bé,520000,LôiLôi90
23288403,https://www.sendo.vn/noi-ngu-co-man-chong-muoi-cho-be-kich-thuoc-106x60x51cm-23288403.html,Nôi ngủ có màn chống muỗi cho bé kích thước 106x60x51cm,330000,Siêu Thị 24h Online
24573836,https://www.sendo.vn/ke-thay-ta-loft-kem-nem-24573836.html,Kệ thay tã Loft kèm nệm,1000000,baby68
24346637,https://www.sendo.vn/cui-tre-em-cui-2-tang-cho-be-size-dai-24346637.html,Cũi trẻ em - Cũi 2 tầng cho bé size đại,2869000,HONA BEAT
23428628,https://www.sendo.vn/giuong-giuong-quay-3-mat-cao-cap-23428628.html,Giường - Giường quây 3 mặt cao cấp,1389000,HONA BEAT
24175808,https://www.sendo.vn/treo-noi-den-trang-hinh-khoi-kich-thich-thi-giac-cho-be-24175808.html,Treo nôi đen trắng hình khối kích thích thị giác cho bé,109000,LIF MOD
22458537,https://www.sendo.vn/cui-quay-cho-be-22458537.html,cũi quây cho bé,480000,Shop Tiện Ích Gia Vinh
21913258,https://www.sendo.vn/sp-chinh-hang-chan-u-thu-bong-day-dan-cho-be-mua-dong-21913258.html,SP Chính Hãng  Chăn ủ thú bông dày dặn cho bé mùa đông,60000,hân khánh 2016
23392536,https://www.sendo.vn/binh-rua-mui-kha-ng-khua-n-giam-cuc-khung-23392536.html,BÌNH RỬA MŨI KHÁNG KHUẨN giảm cực khủng,91000,shop rẻ 9k
22347906,https://www.sendo.vn/giuong-vai-cho-be-22347906.html,giường vải cho bé,550000,LôiLôi90
22306373,https://www.sendo.vn/giuong-tang-bb-225-cau-thang-treo-nhieu-mau-kem-2-hoc-keo-22306373.html,Giường tầng BB 225 cầu thang treo nhiều màu kèm 2 hộc kéo,4200000,baby68
22322489,https://www.sendo.vn/giuong-ba-tang-1m4-bella-bb-228-hoc-nam-nhieu-mau-22322489.html,Giường ba tầng 1m4 Bella BB 228 hộc nằm nhiều màu,5000000,baby68
21578584,https://www.sendo.vn/noi-dien-2in1-dai-vi-co-tang-vong-cho-be-yeu-21578584.html,NÔI ĐIỆN 2IN1 ĐẠI VĨ CÓ TẶNG VÕNG CHO BÉ YÊU,850000,Võng Xếp Nôi Điện
22829269,https://www.sendo.vn/dung-cu-ve-sinh-mui-cho-be-litte-may-hut-mui-cho-be-22829269.html,Dụng cụ vệ sinh mũi cho bé Litte Máy hút mũi cho bé,412200,Minstore079
20204927,https://www.sendo.vn/1-thanh-chan-giuong-mau-moi-truot-len-xuong-1m8-1-thanh-20204927.html,1 thanh chắn giường mẫu mới trượt lên xuống 1M8 - 1 THANH,339000,TongKhoGiaDụngMiềnBắc
14137575,https://www.sendo.vn/bo-quay-va-ga-vuong-mien-ghi-goldcat-14137575.html,Bộ quây và ga Vương miện ghi GoldCat,500000,Goldcat shop
17193947,https://www.sendo.vn/bo-02-goi-om-chan-hinh-meo-cho-be-baby-qt-10-x-50cm-xanh-ngoc-17193947.html,Bộ 02 Gối Ôm Chặn Hình Mèo Cho Bé Baby QT 10 x 50cm Xanh Ngọc,200000,Cộng Đồng Xanh
13436170,https://www.sendo.vn/noi-tre-hun-khoi-chu-nhat-s4-95x60cm-13436170.html,Nôi tre hun khói chữ nhật S4 95x60cm,110000,Babies Vn
13936226,https://www.sendo.vn/cui-quay-cho-be-nhua-ket-hop-vai-luoi-13936226.html,Cũi quây cho bé nhựa kết hợp vải lưới,480000,baby68
16153165,https://www.sendo.vn/quay-bong-cho-be-16153165.html,QUÂY BÓNG CHO BÉ ,420000,Dogiadung99
16153034,https://www.sendo.vn/cui-quay-cho-be-16153034.html,CŨI QUÂY CHO BÉ ,420000,GiadungDinhVinh
14135061,https://www.sendo.vn/bo-quay-va-ga-cho-xanh-goldcat-14135061.html,Bộ quây và ga Chó xanh GoldCat,500000,Goldcat shop
13948864,https://www.sendo.vn/quay-cui-nhua-pe-cao-cap-play-happy-12-mieng-ghep-12x155m-13948864.html,Quây cũi nhựa PE cao cấp Play&Happy 12 miếng ghép 1.2x1.55m,2380000,HanRui Shop
16298036,https://www.sendo.vn/1-thanh-chan-giuong-1m8-cho-be-16298036.html,1 THANH CHẮN GIƯỜNG 1M8 CHO BÉ,450000,GIADUNGGIAGOC1
16335951,https://www.sendo.vn/chieu-dieu-hoa-kem-goi-16335951.html,chiếu điều hòa kèm gối,89000,quan 2015
13940738,https://www.sendo.vn/man-nhac-cho-be-yeu-13940738.html,Màn nhạc cho bé yêu,230000,giadunganan
14063897,https://www.sendo.vn/cui-3d-playpen-cho-be-14063897.html,Cũi 3d Playpen cho bé,905000,Cui 3d
16267415,https://www.sendo.vn/ke-vet-chu-a-16267415.html,kệ vẹt chữ a,139000,huykhoi171017
13507932,https://www.sendo.vn/chieu-coi-cho-be-13507932.html,Chiếu cói cho bé,45000,shopchuyensosinh
14036749,https://www.sendo.vn/giuong-luoi-tre-em-14036749.html,giường lưới trẻ em,340000,Dogiadung99
14036586,https://www.sendo.vn/giuong-luoi-tre-em-14036586.html,giường lưới trẻ em,340000,chuyên đồ gia dụng hương
20831907,https://www.sendo.vn/bo-10-mieng-tham-xop-lot-san-30x30cm-mau-con-vat-20831907.html,Bộ 10 miếng thảm xốp lót sàn 30x30cm mẫu con vật,89000,September Cosmetics
20271147,https://www.sendo.vn/cui-quay-cho-be-20271147.html,cũi quây cho bé,480000,Shop Tiện Ích Gia Vinh
20846021,https://www.sendo.vn/cu-hop-so-noi-dien-hang-viet-nam-20846021.html,CỦ HỘP SỐ  NÔI ĐIỆN HÀNG VIỆT NAM ,199000,ĐỒ CHƠI HỮU ÍCH
20542072,https://www.sendo.vn/giuong-noi-xep-gon-cho-be-seebaby-p2-20542072.html,Giường nôi xếp gọn cho bé Seebaby P2,1250000,V BABY
20224426,https://www.sendo.vn/ke-chu-a-hinh-chu-vet-ngo-nghinh-20224426.html,Kệ chữ A hình chú vẹt ngộ nghĩnh,189000,Vua Bán Hàng 2020
19438975,https://www.sendo.vn/man-mungchong-muoi-phat-nhac-19438975.html,MÀN [MÙNG]CHỐNG MUỖI PHÁT NHẠC,250000,giàythểthaođồnggiá
19972490,https://www.sendo.vn/noi-cui-cao-cap-19972490.html,Nôi cũi cao cấp,1990000,thietbidonoithat
20364132,https://www.sendo.vn/noi-ngu-chung-giuong-bo-me-kiem-tui-dung-do-cho-be-yeu-hang-vnxk-thuong-hieu-phu-dat-20364132.html,"Nôi ngủ chung giường bố mẹ,kiêm túi đựng đồ cho bé yêu hàng VNXK thương hiệu Phú Đạt. ",209000,Phú Đạt Sport
17713743,https://www.sendo.vn/quay-cui-nhua-pe-cao-cap-tortoise-and-hare-playpen-109x147cm-17713743.html,Quây cũi nhựa PE cao cấp Tortoise and Hare PLAYPEN 109x147cm,2380000,SmartShop1688
17474332,https://www.sendo.vn/cui-quay-cho-be-kem-100-qua-bong-17474332.html,CŨI QUÂY CHO BÉ kèm 100 quả bóng,450000,giadunganan
17594573,https://www.sendo.vn/giuong-luoi-cho-be-17594573.html,Giường lưới cho bé,350000,Shop Gia Dụng Nova
17474430,https://www.sendo.vn/cui-quay-cho-be-kem-100-qua-bong-17474430.html,CŨI QUÂY CHO BÉ kèm 100 quả bóng,450000,HÀNG TIỆN ÍCH 02
