product_id,product_url,name,price,shop_name
11133087,https://www.sendo.vn/noi-dien-dua-tu-dong-co-nhac-cho-be-co-mung-chong-muoi-boss-baby-11133087.html,Nôi điện đưa tự động có nhạc cho bé có mùng chống muỗi Boss Baby,1480000,HanRui Shop
11826096,https://www.sendo.vn/noi-cu-i-du-zaracos-jelly-6064-yellow-11826096.html,nôi cũi dù Zaracos Jelly 6064 yellow,4385000,BabyCar
11618399,https://www.sendo.vn/cui-quay-bong-khung-inox-chac-chan-an-toan-cho-be-tang-kem-bong-11618399.html,Cũi quây bóng khung inox chắc chắn an toàn cho bé + Tặng kèm bóng,480000,ĐỒ GIA DỤNG VIAN
11137551,https://www.sendo.vn/noi-dua-tu-dong-cho-be-co-nhac-boss-baby-home-and-garden-11137551.html,Nôi đưa tự động cho bé có nhạc Boss Baby - Home and Garden,1490000,Home and Garden
11079244,https://www.sendo.vn/bo-10-mieng-tham-lot-san-mau-giao-thong-loai-lon-30x30x1cm-11079244.html,Bộ 10 miếng thảm lót sàn mẫu giao thông loại lớn 30x30x1cm,89000,September Cosmetics
11213607,https://www.sendo.vn/1-thanh-chan-giuong-1m8-cho-be-11213607.html,1 THANH CHẮN GIƯỜNG 1M8 CHO BÉ,360000,shopdogiadung1207
11097859,https://www.sendo.vn/thanh-chan-giuong-1m8-cho-be-11097859.html,THANH CHẮN GIƯỜNG 1M8 CHO BÉ,309000,tongkhodobuon
11618394,https://www.sendo.vn/cui-quay-cho-be-kem-100-qua-bong-11618394.html,CŨI QUÂY CHO BÉ kèm 100 quả bóng,550000,ĐỒ GIA DỤNG VIAN
16942849,https://www.sendo.vn/cui-quay-bong-khung-sat-16942849.html,cũi quây bóng khung sắt ,480000,GiadungDinhVinh
17931085,https://www.sendo.vn/chieu-cao-su-hoi-cho-be-17931085.html,chiếu cao su hơi cho bé,140000,chuyên sơ sinh Quân Hợp
13646670,https://www.sendo.vn/quay-bong-khung-sat-kem-100-bong-cho-be-13646670.html,quây bóng khung sắt kèm 100 bóng cho bé,510000,chuyên đồ gia dụng hương
11679242,https://www.sendo.vn/ghe-nhun-cho-be-11679242.html,GHẾ NHÚN CHO BÉ,279000,MẠNH KHA
13847517,https://www.sendo.vn/giuong-cui-go-thong-hai-tang-13847517.html,Giường cũi gổ thông hai tầng,1199000,Cui 3d
13486520,https://www.sendo.vn/giuong-luoi-tre-em-13486520.html,giường lưới trẻ em,340000,Dogiadung99
13728091,https://www.sendo.vn/noi-dien-dai-vi-2-trong-1-vua-la-noi-dien-vua-la-vong-xep-hang-vn-chat-luong-cao-13728091.html,NÔI ĐIỆN ĐẠI VĨ 2 TRONG 1 VỪA LÀ NÔI ĐIỆN VỪA LÀ VÕNG XẾP - HÀNG VN CHẤT LƯỢNG CAO,850000,BabyChip
13848123,https://www.sendo.vn/cui-5d-quickflex-6-canh-13848123.html, Cũi 5D Quickflex 6 cánh,1250000,Cui 3d
12589075,https://www.sendo.vn/giuong-luoi-cho-be-12589075.html,giường lưới cho bé,340000,GiadungDinhVinh
12558539,https://www.sendo.vn/xich-du-noi-rung-noi-dua-tu-dong-co-man-cater-sboo-mau-be-tang-mu-tam-12558539.html,Xích đu nôi rung nôi đưa tự động CÓ MÀN Cater sboo-Màu be. Tặng mũ tắm,1199000,SHOP BÉ CHƠI
12547809,https://www.sendo.vn/quay-bong-dong-thoi-lam-cui-luoi-cho-be-12547809.html,Quây Bóng Đồng Thời Làm Cũi Lưới Cho Bé,480000,chuyên đồ gia dụng hương
12547847,https://www.sendo.vn/cui-bong-cho-be-12547847.html,Cũi Bóng Cho Bé,410000,chuyên đồ gia dụng hương
12109317,https://www.sendo.vn/bo-tham-choi-winfun-cho-be-12109317.html,Bộ Thảm Chơi WINFUN Cho Bé,120000,chuyenbim
12537888,https://www.sendo.vn/mau-moi-nhat-2018-thanh-chan-giuong-m6-cao-82cm-cua-aachamann-12537888.html,Mẫu mới nhất 2018- Thanh chăn giường m6 cao 82cm của Aachamann,449000,ShopDuongMinh
12169746,https://www.sendo.vn/noi-dien-sbaby-nd16-12169746.html,NÔI ĐIỆN SBABY ND16,1090000,Nhật Trường Store
12169694,https://www.sendo.vn/noi-vong-dien-sbaby-3-trong-1-nv14-12169694.html,NÔI VÕNG ĐIỆN SBABY 3 TRONG 1 NV14,1550000,Nhật Trường Store
12111026,https://www.sendo.vn/cui-quay-cho-be-kem-100-bong-12111026.html,CŨI QUÂY CHO BÉ kèm 100 bóng,520000,giadunganan
12824998,https://www.sendo.vn/giuong-luoi-cho-be-12824998.html,Giường Lưới Cho Bé,360000,GIA DỤNG TỔNG HỢP VIAN
12756645,https://www.sendo.vn/cui-quay-cho-be-kem-100-bong-12756645.html,CŨI QUÂY CHO BÉ KÈM 100 BÓNG,520000,GIA DỤNG TỔNG HỢP VIAN
12606530,https://www.sendo.vn/thanh-chan-giuong-1-4m-baby-smiles-12606530.html,"Thanh chắn giường 1,4m Baby Smiles",400000,Ngocphat212
12135402,https://www.sendo.vn/khung-vong-xep-tre-em-vong-xep-em-be-thuyen-rong-12135402.html,Khung Võng Xếp Trẻ Em – Võng Xếp Em Bé Thuyền Rồng,539000,Nhật Trường Store
12027232,https://www.sendo.vn/giuong-luoi-cho-be-12027232.html,Giường Lưới Cho Bé,340000,chuyên đồ gia dụng hương
12013163,https://www.sendo.vn/giuong-luoi-cho-be-12013163.html,GIƯỜNG LƯỚI CHO BÉ,340000,GiadungDinhVinh
11969618,https://www.sendo.vn/cui-quay-cho-be-khung-inox-quay-cui-leu-nha-banh-11969618.html,cũi quây cho bé khung inox-quây cũi-lều nhà banh,298000,LÊ NGUYỄN 88
11961845,https://www.sendo.vn/cui-quay-cho-be-kem-100-bong-11961845.html,CŨI QUÂY CHO BÉ kèm 100 bóng,520000,giadunganan
12080812,https://www.sendo.vn/quay-cui-nhua-3d-loai-14-mieng-cho-be-tang-tham-va-bong-hang-cao-cap-12080812.html,QUÂY CŨI NHỰA 3D LOẠI 14 MIẾNG CHO BÉ TẶNG THẢM VÀ BÓNG HÀNG CAO CẤP,1850000,Cái Gì Chẳng Có
12065453,https://www.sendo.vn/ghe-rung-phat-nhac-cho-be-12065453.html,Ghế rung phát nhạc cho bé,409000,tongkhodobuon
11914527,https://www.sendo.vn/quay-cui-nhua-3d-loai-16-mieng-cho-be-tang-tham-va-bong-hang-cao-cap-11914527.html,QUÂY CŨI NHỰA 3D LOẠI 16 MIẾNG CHO BÉ TẶNG THẢM VÀ BÓNG HÀNG CAO CẤP,1850000,Cái Gì Chẳng Có 1
12706282,https://www.sendo.vn/cui-quay-cho-be-kem-100-bong-12706282.html,CŨI QUÂY CHO BÉ KÈM 100 BÓNG,520000,ĐỒ GIA DỤNG VIAN
12836325,https://www.sendo.vn/quay-cui-nhua-pe-cao-cap-tortoise-and-hare-playpen-109x147cm-12836325.html,Quây cũi nhựa PE cao cấp Tortoise and Hare PLAYPEN 109x147cm,2380000,Home and Garden
11914234,https://www.sendo.vn/quay-cui-nhua-3d-loai-12-mieng-cho-be-tang-tham-va-bong-hang-cao-cap-11914234.html,QUÂY CŨI NHỰA 3D LOẠI 12 MIẾNG CHO BÉ TẶNG THẢM VÀ BÓNG HÀNG CAO CẤP,1650000,Cái Gì Chẳng Có 1
11921069,https://www.sendo.vn/may-dua-vong-ah01-sbaby-11921069.html,Máy Đưa Võng AH01 Sbaby,590000,Shop Diệu My
13118890,https://www.sendo.vn/cui-quay-cho-be-kem-100-qua-bong-13118890.html,CŨI QUÂY CHO BÉ kèm 100 quả bóng,520000,giadunganan
13118886,https://www.sendo.vn/cui-quay-bong-13118886.html,Cũi quây bóng,480000,giadunganan
13118872,https://www.sendo.vn/cui-quay-cho-be-kem-100-bong-13118872.html,CŨI QUÂY CHO BÉ kèm 100 bóng,520000,ĐỒ GIA DỤNG VIAN
12571894,https://www.sendo.vn/xich-du-noi-dien-noi-dua-tu-dong-co-hen-gio-va-nhac-mastela-6558-12571894.html,Xích đu nôi điện nôi đưa tự động có hẹn giờ và nhạc Mastela 6558,1399000,SHOP BÉ CHƠI
12571799,https://www.sendo.vn/xich-du-noi-rung-noi-dua-tu-dong-cater-sboo-mau-hong-12571799.html,Xích đu nôi rung nôi đưa tự động Cater sboo - Màu hồng,999000,SHOP BÉ CHƠI
12365080,https://www.sendo.vn/cui-quay-cho-be-kem-100-qua-bong-12365080.html,CŨI QUÂY CHO BÉ kèm 100 quả bóng,550000,GiadungDinhVinh
13167392,https://www.sendo.vn/giuong-luoi-tre-em-13167392.html,GIƯỜNG LƯỚI TRẺ EM,340000,GiadungDinhVinh
12375839,https://www.sendo.vn/giuong-luoi-cao-cap-tre-em-12375839.html,Giường lưới cao cấp trẻ em,189000,trunghương
13693977,https://www.sendo.vn/giuong-luoi-tre-em-13693977.html,giường lưới trẻ em,300000,Shop Tiện Ích Gia Vinh
13137683,https://www.sendo.vn/giuong-luoi-cho-be-13137683.html,Giường Lưới Cho Bé,330000,chuyên đồ gia dụng hương
13176715,https://www.sendo.vn/xe-an-bot-k4-nhua-cho-lon-13176715.html,XE ĂN BỘT K4 NHỰA CHỢ LỚN,500000,TuấnThanh1189
26236664,https://www.sendo.vn/giuong-luoi-dieu-hoa-90cmx50cm-26236664.html,Giường lưới điều hoà 90cmx50cm,180000,Giường lưới Vuông Tròn 8
26146916,https://www.sendo.vn/cu-rung-cua-noi-dien-26146916.html,Củ rung của nôi điện,270000,Babykids
26146753,https://www.sendo.vn/noi-dien-vong-xep-2-trong-1-thanh-hung-tang-kem-vong-man-chong-muoi-cho-be-26146753.html,Nôi Điện Võng Xếp 2 Trong 1 Thành Hưng Tặng Kèm Võng + Màn Chống Muỗi Cho Bé,729000,Babykids
26144661,https://www.sendo.vn/giuong-luoi-cao-cap-cho-be-1m2-26144661.html,Giường Lưới Cao Cấp Cho Bé 1m2,220000,Shop Con Cưngg
26144652,https://www.sendo.vn/quay-bong-khung-inox-26144652.html,Quây bóng khung inox,299000,Shop Con Cưngg
26251770,https://www.sendo.vn/ghe-rung-ghe-rung-26251770.html,ghế rung ghế rung,345000,Topvn
26216542,https://www.sendo.vn/noi-dien-dua-tu-dong-cho-be-co-nhac-boss-baby-boss-baby-super-market-26216542.html,Nôi điện đưa tự động cho bé có nhạc Boss Baby - boss baby - Super Market ,1490000,Dominate The Market
25438322,https://www.sendo.vn/quay-bong-vai-khung-inox-25438322.html,Quầy Bóng Vải Khung Inox,455000,ShopTrungHieu CS3
25433528,https://www.sendo.vn/cuc-nguon-may-dua-vong-2500-25433528.html,cục nguồn máy đưa võng - 2500,179000,TỶ PHÚ ĐÔ LA 1352
25894618,https://www.sendo.vn/cui-quay-cho-be-choi-25894618.html,Cũi quây cho bé chơi,350000,SHOP MẸ VÀ BÉ 89
26088251,https://www.sendo.vn/noi-cui-zaracosjelly-6046-cho-be-xanh-la-ma-26088251.html,Nôi cũi ZaracosJelly 6046 cho bé Xanh lá mạ,4385000,Chăm sóc bé sơ sinh
25556224,https://www.sendo.vn/cuc-nguon-may-dua-vong-25556224.html,Cục nguồn máy đưa võng,160000,Rẻ Bất Ngờ
25556211,https://www.sendo.vn/cuc-nguon-may-dua-vong-25556211.html,Cục nguồn máy đưa võng,152000,SHOP SHIN
25537429,https://www.sendo.vn/ti-gia-avent-ultra-air-chinh-hang-cho-be-6-18-thang-chinh-nha-25537429.html,Ti Giả Avent Ultra air Chính hãng cho bé 6 -18 tháng chỉnh nha,110000,Bột Bình Tinh Nguyên Chất
29458334,https://www.sendo.vn/noi-kem-vong-dien-cho-be-2-trong-1-made-in-viet-nam-29458334.html,Nôi Kèm Võng Điện Cho Bé 2 Trong 1  Made In Viet Nam,670000,màn chụp tự bung
28087333,https://www.sendo.vn/cui-tre-em-marlow-tu-nhien-me-vi-be-28087333.html,Cũi trẻ em Marlow tự nhiên - Mẹ Vì Bé,2550000,Cty Mẹ Vì Bé
28121036,https://www.sendo.vn/giuong-ngu-cho-be-28121036.html,GIƯỜNG NGỦ CHO BÉ,345000,Kho buôn phố Phủ
25551218,https://www.sendo.vn/cuc-nguon-may-dua-vong-25551218.html,cục nguồn máy đưa võng,189000,TỶ PHÚ ĐÔ LA 0945
28153887,https://www.sendo.vn/dem-nam-chong-trao-nguoc-cao-cap-monmon-tang-kem-vong-dau-tam-28153887.html,Đệm nằm chống trào ngược cao cấp MonMon Tặng kèm vòng dâu tằm,250000,ShopMonMon
30724750,https://www.sendo.vn/noi-tre-dat-vong-chong-cong-lung-cho-be-size-11mx70-tang-kem-vong-dau-tam-30724750.html,NÔI TRE ĐẶT VÕNG CHÓNG CÒNG LƯNG CHO BÉ SIZE 1.1MX70 (TẶNG KÈM VÒNG DÂU TẰM),200000,SHOP  BÁN NÔI TRE  YẾN NGỌC
30299652,https://www.sendo.vn/noi-dien-tu-dong-2in1-dai-vi-30299652.html,Nôi điện tự động 2in1 Đại Vĩ,979000,E U SHOP
30154544,https://www.sendo.vn/noi-tre-nam-vong-size-85x55-be-tu-0-12-thang-tang-vong-dau-tam-30154544.html,Nôi tre nằm võng size 85x55 bé từ 0-12 tháng ( tặng vòng dâu tằm),120000,Noitrenamvong
13273950,https://www.sendo.vn/noi-ru-em-be-nuna-leaf-bouncer-wind-bundle-13273950.html,Nôi ru em bé Nuna Leaf Bouncer Wind Bundle,8870000,shopbabyborn
12756529,https://www.sendo.vn/cui-quay-cho-be-kem-100-qua-bong-12756529.html,CŨI QUÂY CHO BÉ kèm 100 quả bóng,510000,ĐỒ GIA DỤNG VIAN
26220294,https://www.sendo.vn/giuong-noi-xep-gon-cho-be-travel-home-giuong-noi-xep-gon-super-market-26220294.html,Giường nôi xếp gọn cho bé Travel Home - giường nôi xếp gọn - Super Market ,1689000,Dominate The Market
13280885,https://www.sendo.vn/mau-moi-nhat-2018-thanh-chan-giuong-2m-cao-82cm-cua-aachamann-13280885.html,Mẫu mới nhất 2018- Thanh chăn giường 2m cao 82cm của Aachamann,316000,tongkhodobuon
29916037,https://www.sendo.vn/free-ship-1-cap-chieu-truc-thoang-mat-tay-bac-cho-em-be-2-chiec-29916037.html, [FREE SHIP]  1 CĂP Chiếu trúc  THOÁNG MÁT Tây Bắc CHO EM BÉ [ 2 CHIẾC],126591,dothidiem
30036226,https://www.sendo.vn/noi-nam-vong-chong-cong-lung-xuc-xac-trong-tang-kem-vong-dau-tam-30036226.html,Nôi nằm võng chóng còng lưng + xúc xắc trống tặng kèm vòng dâu tằm,220000,NÔI MÂY TRE ĐAN CHO BÉ
30025100,https://www.sendo.vn/day-noi-dai-vi-long-hung-thanh-hung-30025100.html,"dây nôi Đại Vĩ, Long Hưng, Thành Hưng",10000,hoa giay
30014303,https://www.sendo.vn/bo-40-mieng-tham-cao-su-phuoc-thanh-hinh-chu-cai-va-so-15-x-15-cm-30014303.html,Bộ 40 Miếng Thảm Cao Su Phước Thành Hình Chữ Cái Và Số (15 x 15 cm),79900,Tiki Trading Platinum Mall
29926882,https://www.sendo.vn/noi-tre-nam-vong-du-6-size-da-ho-sach-dam-29926882.html,Nôi tre nằm võng đủ 6 size đã hơ sạch dằm,120000,baongocsuri
29375532,https://www.sendo.vn/it-smart-giuong-xep-gon-cho-be-29375532.html,It Smart - Giường xếp gọn cho bé,1679000,Tiệm Đồ Gia Dụng 168
26144518,https://www.sendo.vn/tham-xop-hai-mat-maboshi-hang-viet-nam-cao-cap-cho-be-vua-hoc-vua-choi-26144518.html,THẢM XỐP HAI MẶT MABOSHI HÀNG VIỆT NAM CAO CẤP CHO BÉ VỪA HỌC VỪA CHƠI,75000,Shop Con Cưngg
13118880,https://www.sendo.vn/cui-quay-cho-be-13118880.html,Cũi quây cho bé,480000,ĐỒ GIA DỤNG VIAN
29981607,https://www.sendo.vn/giuong-luoi-cho-be-29981607.html,GIƯỜNG LƯỚI CHO BÉ,290000,GIA DỤNG TỔNG HỢP VIAN
30245434,https://www.sendo.vn/noi-vong-cho-be-30245434.html,NÔI VÕNG CHO BÉ,979000,GIA DỤNG TỔNG HỢP VIAN
29943568,https://www.sendo.vn/quay-cui-bong-cho-be-khung-inox-29943568.html,QUÂY CŨI BÓNG CHO BÉ KHUNG INOX ,249000,Siêu thị xe trẻ em
29945605,https://www.sendo.vn/noi-dien-dai-vi-2-trong-1-vua-la-noi-vua-la-vong-29945605.html,NÔI ĐIỆN ĐẠI VĨ 2 TRONG 1 - VỪA LÀ NÔI VỪA LÀ VÕNG,655000,CỬA HÀNG TUYẾN THƠ
29972668,https://www.sendo.vn/giuong-luoi-cho-be-mam-non-29972668.html,Giường Lưới Cho Bé Mầm Non,259000,SHOP MINH KHÔI BABY
30730196,https://www.sendo.vn/noi-tre-cho-be-size-85x55-cheu-lot-noi-tang-kem-vong-dau-tam-30730196.html,NÔI TRE CHO BÉ SIZE 85X55 + CHẾU LÓT NÔI (TẶNG KÈM VÒNG DÂU TẰM),170000,SHOP  BÁN NÔI TRE  YẾN NGỌC
30836815,https://www.sendo.vn/combo-noi-dat-vong-boc-noi-120mmx70mm-30836815.html,Combo Nôi đặt võng + bọc nôi 120mmX70mm,479000,Shop Tiện Ích Ánh Dương
30806201,https://www.sendo.vn/bo-khung-kep-6-bai-hat-khong-loi-30806201.html,BỘ KHUNG KẸP 6 BÀI HÁT KHÔNG LỜI,145000,Nanatuti 0963371612
30806076,https://www.sendo.vn/bo-khung-kep-phu-kien-treo-noi-cho-be-30806076.html,BỘ KHUNG KẸP - PHỤ KIỆN TREO NÔI CHO BÉ,95000,Nanatuti 0963371612
30819141,https://www.sendo.vn/cuc-nguon-may-dua-vong-30819141.html,cục nguồn máy đưa võng,189000,QUAN THẮNG
30816793,https://www.sendo.vn/noi-tre-nam-vong-cho-be-combo-3sp-size-85x55-boc-noi-chieu-lot-noi-tang-vong-dau-tam-30816793.html,Nôi tre nằm võng cho bé COMBO 3SP SIZE 85X55 + BỌC NÔI + CHIẾU LÓT NÔI ( TẶNG VÒNG DÂU TẰM),300000,SHOP NÔI TRE  ĐẠI NAM
30816017,https://www.sendo.vn/noi-tre-cho-be-combo-size-85x55-chieu-lot-noi-tang-vong-dau-tam-30816017.html,Nôi tre cho bé combo size 85x55 + chiếu lót nôi ( tặng vòng dâu tằm ),170000,SHOP NÔI TRE  ĐẠI NAM
30809048,https://www.sendo.vn/bo-den-trang-khung-kep-hop-nhac-35-bai-hat-khong-luoi-chay-bang-pin-30809048.html,BỘ ĐEN TRẮNG - KHUNG KẸP HỘP NHẠC 35 BÀI HÁT KHÔNG LƯỜI CHẠY BẰNG PIN,298000,Nanatuti 0963371612
30808845,https://www.sendo.vn/treo-noi-den-trang-bo-khung-kep-30808845.html,TREO NÔI ĐEN TRẮNG - BỘ KHUNG KẸP,162000,Nanatuti 0963371612
29842623,https://www.sendo.vn/nhong-chun-29842623.html,Nhộng chũn,199000,KELLY BABY SHOP
29882984,https://www.sendo.vn/noi-dien-dai-vi-tang-kem-vong-2-trong-1-29882984.html,Nôi điện Đại Vĩ - tặng kèm võng - 2 trong 1,679000,Siêu thị xe trẻ em
30812036,https://www.sendo.vn/treo-noi-mau-khung-kep-hop-nhac-35-bai-hat-khong-loi-chay-bang-pin-30812036.html,TREO NÔI MÀU - KHUNG KẸP HỘP NHẠC 35 BÀI HÁT KHÔNG LỜI CHẠY BẰNG PIN,298000,Nanatuti 0963371612
30815720,https://www.sendo.vn/noi-tre-nam-vong-size-110x70-tang-kem-vong-dau-tam-30815720.html,Nôi tre nằm võng size 110x70 ( tặng kèm vòng dâu tằm),200000,SHOP NÔI TRE  ĐẠI NAM
30109035,https://www.sendo.vn/do-choi-treo-cui-cho-be-30109035.html,ĐỒ CHƠI TREO CŨI CHO BÉ,59000,Dososinhgiagoc
28874830,https://www.sendo.vn/noi-dua-tu-dong-cho-be-co-nhac-boss-baby-c3-st3882-28874830.html,Nôi đưa tự động cho bé có nhạc Boss Baby C3-ST3882,1480000,13th October
28870225,https://www.sendo.vn/noi-ru-ngu-tu-dong-co-chuc-nang-phat-nhac-28870225.html,Nôi ru ngủ tự động có chức năng phát nhạc,1890000,13th October
30338359,https://www.sendo.vn/noi-dien-tu-dong-30338359.html,nôi điện tự động,979000,CÁI GÌ CŨNG CÓ 01
29740112,https://www.sendo.vn/noi-giuong-da-nang-seebaby-p2-tang-kem-tham-2-mat-mabashi-18-x-2m-29740112.html,"Nôi, giường đa năng - SEEBABY P2 - Tặng kèm thảm 2 mặt Mabashi 1.8 x 2m",1349000,Mua Nhanh Bán Tốt
29417878,https://www.sendo.vn/noi-bap-benh-29417878.html,Nôi bập bênh,890000,DITA SHOP
30154112,https://www.sendo.vn/noi-tre-nam-vong-size-100x65-be-tu-0-24-thang-tang-vong-dau-tam-30154112.html,Nôi tre nằm võng size 100x65 bé từ 0-24 tháng ( tặng vòng dâu tằm),170000,Noitrenamvong
30158758,https://www.sendo.vn/giuong-luoi-cho-be-95x65cm-giuong-luoi-cho-be-95x65cm-30158758.html,Giường lưới cho bé 95x65cm - Giường lưới cho bé 95x65cm,159000,giadunghamy20
30230443,https://www.sendo.vn/giuong-luoi-mam-non-2-nan-cho-be-30230443.html,GIƯỜNG LƯỚI MẦM NON 2 NAN CHO BÉ,259000,Họa mi tóc nâu
30176170,https://www.sendo.vn/noi-tre-nam-vong-size-100x65-be-tu-0-24thang-30176170.html,Nôi tre nằm võng size 100x65 bé từ 0-24tháng,170000,Noitredatvong
29592624,https://www.sendo.vn/combo-noi-tre-nam-vong-chieu-lot-boc-noi-tang-kem-vong-dau-29592624.html,Combo Nôi tre nằm võng + chiếu lót + bọc nôi ( tặng kèm vòng dâu ),360000,NÔI MÂY TRE ĐAN CHO BÉ
29619684,https://www.sendo.vn/noi-dien-cao-cap-dai-vithanh-hung-noi-cho-be-tu-dong-2-in1-tang-vong-man-chong-muoi-29619684.html,Nôi điện Cao cấp Đại Vĩ/Thành Hưng (Nôi cho bé tự động 2 in1) - Tặng võng màn chống muỗi,680000,Siêu Thị 24h Online
30252151,https://www.sendo.vn/may-dua-vong-tu-dong-cao-cap-vinanoi-asanta-100-30252151.html,Máy Đưa Võng Tự Động Cao Cấp VINANOI ASANTA 100,535000,PHỤ KIỆN THÁI HUY
29458365,https://www.sendo.vn/luoi-vong-noi-tu-dua-thanh-hung-khong-bao-gom-khung-29458365.html,Lưới Võng Nôi Tự Đưa Thành Hưng Không Bao Gồm Khung,80000,màn chụp tự bung
29420414,https://www.sendo.vn/noi-dien-vong-xep-2-trong-1-khanh-ngoc-tang-kem-vong-man-chong-muoi-cho-be-29420414.html,Nôi Điện Võng Xếp 2 Trong 1 Khánh Ngọc  Tặng Kèm Võng   Màn Chống Muỗi Cho Bé,729000,shopman
29457931,https://www.sendo.vn/noi-kem-vong-dien-cho-be-2-trong-1-made-in-viet-nam-29457931.html,Nôi Kèm Võng Điện Cho Bé 2 Trong 1  Made In Viet Nam,845000,shopman
9450626,https://www.sendo.vn/noi-dua-tre-em-joie-sansa-2in1-in-the-rain-9450626.html,NÔI ĐƯA TRẺ EM JOIE SANSA 2IN1 IN THE RAIN,5300000,Chăm sóc bé sơ sinh
16442219,https://www.sendo.vn/cui-quay-cho-be-khung-inox-16442219.html,cũi quây cho bé khung inox,298000,Bestbuy TV
29996993,https://www.sendo.vn/giuong-luoi-tien-ich-cho-be-khung-innox-hang-viet-nam-29996993.html,Giường lưới tiện ích cho bé khung innox hàng việt Nam,225000,Tổng kho đồ sơ sinh
30866753,https://www.sendo.vn/giuong-em-be-go-moc-da-chuc-nang-nhieu-tang-noi-em-be-khong-phun-son-co-the-di-dong-30866753.html,giường em bé gỗ mộc đa chức năng nhiều tầng nôi em bé không phun sơn có thể di động,1732500,vinhthuanshop
28271594,https://www.sendo.vn/xich-du-kiem-ghe-nam-danh-cho-tre-em-co-khung-bang-sat-boc-dem-chinh-hang-mastela-28271594.html,Xích đu kiêm ghế nằm dành cho trẻ em có khung bằng sắt bọc đệm chính hãng Mastela,1399000,BabyKingdom
29363611,https://www.sendo.vn/noi-rung-tu-dong-29363611.html,Nôi rung tự động,920000,DITA SHOP
29457998,https://www.sendo.vn/cu-rung-noi-dien-thanh-hung-tang-2-day-curoa-du-phong-co-anh-that-29457998.html,Củ Rung Nôi Điện Thành Hưng   Tặng 2 Dây Curoa Dự Phòng  Có Ảnh Thật,250000,shopman
23248218,https://www.sendo.vn/xich-du-kiem-ghe-nam-danh-cho-tre-em-co-khung-bang-sat-boc-dem-6579-hieu-mastela-23248218.html,Xích đu kiêm ghế nằm dành cho trẻ em có khung bằng sắt bọc đệm 6579 hiệu Mastela,1329000,BabyKingdom
30246687,https://www.sendo.vn/noi-vong-cho-be-30246687.html,NÔI VÕNG CHO BÉ,969000,HÀNG TIỆN ÍCH 02
28543312,https://www.sendo.vn/noi-tre-dat-vong-cho-be-yeu-cho-ng-gu-lung-tre-nho-28543312.html,Nôi tre đặt võng cho bé yêu chống gù lưng trẻ nhỏ,130000,Vĩnh Thuyên
12063442,https://www.sendo.vn/cui-3d-4-canh-xuat-khau-me-vi-be-12063442.html,Cũi 3d 4 cánh xuất khẩu - Mẹ Vì Bé,880000,Mẹ Vì Bé
10233869,https://www.sendo.vn/tham-nhac-fisher-pirce-chinh-hang-0973809698-10233869.html,THẢM NHẠC FISHER PIRCE CHÍNH HÃNG 0973809698,451000,Đồ gia dụng chất lượng cao
10189077,https://www.sendo.vn/cui-quay-cho-be-10189077.html,CŨI QUÂY CHO BÉ,480000,giadunganan
9937715,https://www.sendo.vn/chieu-dat-noi-cui-cho-be-60-x1m-9937715.html,chiếu đặt nôi cũi cho bé 60 x1m,220000,ChieuTrucVietNam
7952875,https://www.sendo.vn/cui-nhua-cho-be-20-mieng-tang-tham-bong-7952875.html,CŨI NHỰA CHO BÉ 20 MIẾNG TẶNG THẢM BÓNG,2100000,Cái Gì Chẳng Có
9751023,https://www.sendo.vn/chieu-noi-cho-tre-tuy-chon-kich-thuoc-9751023.html,chiếu nôi cho trẻ tùy chọn kích thước,210000,Chiếu trúc Việt Nam
11198058,https://www.sendo.vn/cui-quay-cho-be-kem-100-bong-11198058.html,CŨI QUÂY CHO BÉ kèm 100 bóng,520000,giadunganan
11284786,https://www.sendo.vn/ghe-dung-cho-be-hang-dep-11284786.html,Ghế Dung Cho Bé Hàng Đẹp,350000,chuyên đồ gia dụng hương
11308111,https://www.sendo.vn/cui-quay-cho-be-kem-100-qua-bong-11308111.html,CŨI QUÂY CHO BÉ kèm 100 quả bóng,520000,giadunganan
3096174,https://www.sendo.vn/noi-3-chuc-nang-aprica-nemyu-dx-589-bl-88362-3096174.html,Nôi 3 Chức Năng Aprica Nemyu DX 589 BL 88362,5000000,Chăm sóc bé sơ sinh
11717963,https://www.sendo.vn/dem-van-phong-dem-gap-da-nang-1-5-x-2m-11717963.html,"Đệm văn phòng - đệm gấp đa năng 1,5 x 2m",530000,Siêu Thị Happy
3096144,https://www.sendo.vn/ghe-noi-da-nang-reminis-mau-xanh-114579-3096144.html,Ghế nôi đa năng Reminis màu xanh 114579,7300000,Chăm sóc bé sơ sinh
30376013,https://www.sendo.vn/cuc-nguon-may-dua-vong-30376013.html,cục nguồn máy đưa võng,189000,SHOP MỘC 668
29457905,https://www.sendo.vn/noi-dien-cho-be-2in1-dai-vi-29457905.html,Nôi Điện Cho Bé 2In1 Đại Vĩ,870000,shopman
3095902,https://www.sendo.vn/ghe-noi-da-nang-roanju-111815-3095902.html,Ghế nôi đa năng Roanju 111815,13900000,Chăm sóc bé sơ sinh
30812654,https://www.sendo.vn/combo-tron-khung-kep-hop-nhac-6-bai-hat-khong-loi-chay-bang-cot-30812654.html,COMBO TRÒN - KHUNG KẸP HỘP NHẠC 6 BÀI HÁT KHÔNG LỜI CHẠY BẰNG CÓT,229000,Nanatuti 0963371612
9964457,https://www.sendo.vn/nem-cho-be-nem-cao-cap-cho-be-9964457.html,Nệm cho bé - Nệm cao cấp cho bé,375000,Chi shopping
9961731,https://www.sendo.vn/nem-cho-be-nem-cao-cap-cho-be-9961731.html,Nệm cho bé - Nệm cao cấp cho bé,349000,giadinh cungmua
7790663,https://www.sendo.vn/rao-chan-quickflex-3d-7790663.html,Rào chắn Quickflex 3D,880000,baby68
1466339,https://www.sendo.vn/thanh-chan-giuong-tre-em-brevi-bre312-1466339.html,Thanh chắn giường trẻ em Brevi BRE312,1390000,Chăm sóc bé sơ sinh
10170494,https://www.sendo.vn/noi-tu-dong-mastela-sg239-co-dieu-khien-tu-xa-co-nhac-10170494.html,Nôi tự động Mastela SG239 có điều khiển từ xa có nhạc,2250000,Diệp Anh Japan
9875002,https://www.sendo.vn/ghe-hoi-tap-ngoi-cho-be-9875002.html,Ghế hơi tập ngồi cho bé,119000,HoaMai9999
7363442,https://www.sendo.vn/bo-do-choi-ghep-go-cho-be-7363442.html,BỘ ĐỒ CHƠI GHÉP GỖ CHO BÉ,60000,Babies Vn
7979361,https://www.sendo.vn/giuong-tang-1m4-bb014-nhieu-mau-kem-hoc-keo-7979361.html,Giường tầng 1m4 BB014 nhiều màu kèm hộc kéo,4750000,baby68
11375617,https://www.sendo.vn/day-curoa-noi-dien-dai-vi-loai-1-tang-1-bo-2-day-11375617.html,Dây curoa Nôi điện Đại Vĩ loại 1 tầng - 1 bộ 2 dây,35000,Siêu Thị 24h Online
12355915,https://www.sendo.vn/tui-ngu-cho-be-cung-la-ao-hoa-trang-sang-tao-cho-be-v436-12355915.html,túi ngủ cho bé cũng là áo hóa trang sáng tạo cho bé. V436,68000,yennhi
7967550,https://www.sendo.vn/may-dua-vong-tu-dong-cao-cap-livorno-lvr01-7967550.html,Máy đưa võng tự động cao cấp Livorno LVR01,310000,Muasam3mien
12266413,https://www.sendo.vn/quay-bong-cho-be-vai-du-khung-thep-inox-loai-dep-12266413.html,QUÂY BÓNG CHO BÉ VẢI DÙ KHUNG THÉP INOX LOẠI ĐẸP,450000,Cái Gì Chẳng Có
11464129,https://www.sendo.vn/giuong-luoi-cho-be-11464129.html,Giường Lưới Cho Bé,330000,chuyên đồ gia dụng hương
12254996,https://www.sendo.vn/cui-quay-cho-be-kem-100-bong-12254996.html,CŨI QUÂY CHO BÉ KÈM 100 BÓNG,520000,ĐỒ GIA DỤNG VIAN
12220564,https://www.sendo.vn/may-dua-vong-12220564.html,Máy Đưa Võng,398000,TOÀN GIA PHÁT
