product_id,product_url,name,price,shop_name
10521908,https://www.sendo.vn/voi-xanh-phat-nhac-10521908.html,Voi xanh phát nhạc,75000,ChiOngNau
10595322,https://www.sendo.vn/cui-quay-bong-khung-inox-chac-chan-an-toan-cho-be-tang-kem-10-bong-10595322.html,Cũi quây bóng khung inox chắc chắn an toàn cho bé -Tặng kèm 10 bóng,399000,BachHoaTongHopVN
13847517,https://www.sendo.vn/giuong-cui-go-thong-hai-tang-13847517.html,Giường cũi gổ thông hai tầng,1199000,Cui 3d
13999754,https://www.sendo.vn/quay-cui-nhua-pe-cao-cap-play-happy-12-mieng-ghep-12x155m-home-and-garden-13999754.html,Quây cũi nhựa PE cao cấp Play&Happy 12 miếng ghép 1.2x1.55m - Home and Garden,2380000,Home and Garden
17194141,https://www.sendo.vn/bo-02-goi-om-chan-hinh-meo-cho-be-baby-qt-10-x-50cm-hong-17194141.html,Bộ 02 Gối Ôm Chặn Hình Mèo Cho Bé Baby QT 10 x 50cm Hồng,200000,Cộng Đồng Xanh
13421945,https://www.sendo.vn/noi-dien-2-trong-1-dai-vi-tang-vong-man-chong-muoi-13421945.html,"Nôi Điện 2 trong 1 Đại Vĩ - Tặng Võng, Màn Chống Muỗi",680000,Siêu Thị 24h Online
17130459,https://www.sendo.vn/cui-quay-cho-be-17130459.html,CŨI QUÂY CHO BÉ,490000,HÀNGTIỆNÍCH
13507860,https://www.sendo.vn/chieu-coi-nho-cho-be-13507860.html,Chiếu cói nhỏ cho bé,25000,shopchuyensosinh
17250361,https://www.sendo.vn/cui-go-soi-c61-70-110-cm-17250361.html,Cũi gỗ sồi C61 70*110 cm,2200000,NOLULU SHOP
13176715,https://www.sendo.vn/xe-an-bot-k4-nhua-cho-lon-13176715.html,XE ĂN BỘT K4 NHỰA CHỢ LỚN,500000,TuấnThanh1189
13728091,https://www.sendo.vn/noi-dien-dai-vi-2-trong-1-vua-la-noi-dien-vua-la-vong-xep-hang-vn-chat-luong-cao-13728091.html,NÔI ĐIỆN ĐẠI VĨ 2 TRONG 1 VỪA LÀ NÔI ĐIỆN VỪA LÀ VÕNG XẾP - HÀNG VN CHẤT LƯỢNG CAO,850000,BabyChip
13848123,https://www.sendo.vn/cui-5d-quickflex-6-canh-13848123.html, Cũi 5D Quickflex 6 cánh,1250000,Cui 3d
13273950,https://www.sendo.vn/noi-ru-em-be-nuna-leaf-bouncer-wind-bundle-13273950.html,Nôi ru em bé Nuna Leaf Bouncer Wind Bundle,8870000,shopbabyborn
16800006,https://www.sendo.vn/may-dua-vong-em-be-vinanoi-vn365-suc-dua-70kg-sieu-em-16800006.html,Máy đưa võng em bé VINANOI - Vn365 sức đưa 70kg siêu êm,495000,MeBeOnline
13525084,https://www.sendo.vn/giuong-luoi-tre-em-13525084.html,giường lưới trẻ em,340000,chuyên đồ gia dụng hương
12487977,https://www.sendo.vn/quay-cui-go-thong-3d-loai-5-mieng-cho-be-hang-viet-nam-12487977.html,QUÂY CŨI GỖ THÔNG 3D LOẠI 5 MIẾNG CHO BÉ HÀNG VIỆT NAM,2150000,Cái Gì Chẳng Có
12487622,https://www.sendo.vn/quay-cui-go-thong-3d-loai-4-mieng-cho-be-hang-viet-nam-12487622.html,QUÂY CŨI GỖ THÔNG 3D LOẠI 4 MIẾNG CHO BÉ HÀNG VIỆT NAM,1650000,Cái Gì Chẳng Có
13486520,https://www.sendo.vn/giuong-luoi-tre-em-13486520.html,giường lưới trẻ em,340000,Dogiadung99
16326270,https://www.sendo.vn/quay-bong-cho-be-16326270.html,QUÂY BÓNG CHO BÉ ,420000,Dogiadung99
13078361,https://www.sendo.vn/cui-quay-cho-be-13078361.html,CŨI QUÂY CHO BÉ,450000,giadunganan
16365988,https://www.sendo.vn/may-dua-vong-nguyen-bo-tang-them-1-bo-nguon-se-cua-16365988.html,Máy đưa võng nguyên bộ  tặng thêm 1 BỘ NGUỒN SE CUA,699000,SHOP MINH SAN
13078431,https://www.sendo.vn/cui-quay-cho-be-13078431.html,CŨI QUÂY CHO BÉ,450000,GIA DỤNG TỔNG HỢP VIAN
12540229,https://www.sendo.vn/xe-tap-di-mastela-w2002tp7-12540229.html,Xe tập đi Mastela W2002TP7,580000,Bình Minh Baby
16152511,https://www.sendo.vn/cui-quay-cho-be-16152511.html,Cũi Quây Cho Bé ,420000,chuyên đồ gia dụng hương
14036912,https://www.sendo.vn/giuong-luoi-tre-em-14036912.html,giường lưới trẻ em,340000,Shop Tiện Ích Gia Vinh
14040981,https://www.sendo.vn/quay-bong-khung-sat-cho-be-14040981.html,quây bóng khung sắt cho bé,450000,Shop Tiện Ích Gia Vinh
16386797,https://www.sendo.vn/cui-quay-cho-be-16386797.html,CŨI QUÂY CHO BÉ,490000,ĐỒ GIA DỤNG VIAN
13556508,https://www.sendo.vn/giuong-luoi-tre-em-13556508.html,giường lưới trẻ em,340000,GiadungDinhVinh
14016944,https://www.sendo.vn/cui-quay-cho-be-kem-100-bong-14016944.html,cũi quây cho bé kèm 100 bóng,490000,giadunganan
11618399,https://www.sendo.vn/cui-quay-bong-khung-inox-chac-chan-an-toan-cho-be-tang-kem-bong-11618399.html,Cũi quây bóng khung inox chắc chắn an toàn cho bé + Tặng kèm bóng,480000,ĐỒ GIA DỤNG VIAN
11618394,https://www.sendo.vn/cui-quay-cho-be-kem-100-qua-bong-11618394.html,CŨI QUÂY CHO BÉ kèm 100 quả bóng,550000,ĐỒ GIA DỤNG VIAN
12606530,https://www.sendo.vn/thanh-chan-giuong-1-4m-baby-smiles-12606530.html,"Thanh chắn giường 1,4m Baby Smiles",400000,Ngocphat212
11914234,https://www.sendo.vn/quay-cui-nhua-3d-loai-12-mieng-cho-be-tang-tham-va-bong-hang-cao-cap-11914234.html,QUÂY CŨI NHỰA 3D LOẠI 12 MIẾNG CHO BÉ TẶNG THẢM VÀ BÓNG HÀNG CAO CẤP,1650000,Cái Gì Chẳng Có 1
12706282,https://www.sendo.vn/cui-quay-cho-be-kem-100-bong-12706282.html,CŨI QUÂY CHO BÉ KÈM 100 BÓNG,520000,ĐỒ GIA DỤNG VIAN
12870761,https://www.sendo.vn/cui-quay-cho-be-kem-100-bong-12870761.html,CŨI QUÂY CHO BÉ kèm 100 bóng,480000,giadunganan
12558539,https://www.sendo.vn/xich-du-noi-rung-noi-dua-tu-dong-co-man-cater-sboo-mau-be-tang-mu-tam-12558539.html,Xích đu nôi rung nôi đưa tự động CÓ MÀN Cater sboo-Màu be. Tặng mũ tắm,1199000,SHOP BÉ CHƠI
11921069,https://www.sendo.vn/may-dua-vong-ah01-sbaby-11921069.html,Máy Đưa Võng AH01 Sbaby,590000,Shop Diệu My
11969618,https://www.sendo.vn/cui-quay-cho-be-khung-inox-quay-cui-leu-nha-banh-11969618.html,cũi quây cho bé khung inox-quây cũi-lều nhà banh,298000,LÊ NGUYỄN 88
11961845,https://www.sendo.vn/cui-quay-cho-be-kem-100-bong-11961845.html,CŨI QUÂY CHO BÉ kèm 100 bóng,520000,giadunganan
12065453,https://www.sendo.vn/ghe-rung-phat-nhac-cho-be-12065453.html,Ghế rung phát nhạc cho bé,409000,tongkhodobuon
12169746,https://www.sendo.vn/noi-dien-sbaby-nd16-12169746.html,NÔI ĐIỆN SBABY ND16,1090000,Nhật Trường Store
12169694,https://www.sendo.vn/noi-vong-dien-sbaby-3-trong-1-nv14-12169694.html,NÔI VÕNG ĐIỆN SBABY 3 TRONG 1 NV14,1550000,Nhật Trường Store
11826292,https://www.sendo.vn/noi-cui-du-zaracos-jenni-5046-pink-11826292.html,NÔI CŨI DÙ ZARACOS JENNI 5046 - PINK,2885000,BabyCar
11826096,https://www.sendo.vn/noi-cu-i-du-zaracos-jelly-6064-yellow-11826096.html,nôi cũi dù Zaracos Jelly 6064 yellow,4385000,BabyCar
12824998,https://www.sendo.vn/giuong-luoi-cho-be-12824998.html,Giường Lưới Cho Bé,360000,GIA DỤNG TỔNG HỢP VIAN
12109317,https://www.sendo.vn/bo-tham-choi-winfun-cho-be-12109317.html,Bộ Thảm Chơi WINFUN Cho Bé,120000,chuyenbim
12547847,https://www.sendo.vn/cui-bong-cho-be-12547847.html,Cũi Bóng Cho Bé,410000,chuyên đồ gia dụng hương
12547809,https://www.sendo.vn/quay-bong-dong-thoi-lam-cui-luoi-cho-be-12547809.html,Quây Bóng Đồng Thời Làm Cũi Lưới Cho Bé,480000,chuyên đồ gia dụng hương
12836325,https://www.sendo.vn/quay-cui-nhua-pe-cao-cap-tortoise-and-hare-playpen-109x147cm-12836325.html,Quây cũi nhựa PE cao cấp Tortoise and Hare PLAYPEN 109x147cm,2380000,Home and Garden
13873141,https://www.sendo.vn/giuong-luoi-cho-be-i-giuong-ngu-cho-be-cao-cap-i-giuong-luoi-13873141.html,Giường lưới cho bé I Giường ngủ cho bé cao cấp I Giường lưới,179000,SBB Group
13137683,https://www.sendo.vn/giuong-luoi-cho-be-13137683.html,Giường Lưới Cho Bé,330000,chuyên đồ gia dụng hương
12874124,https://www.sendo.vn/giuong-luoi-cho-be-12874124.html,Giường Lưới Cho Bé,360000,chuyên đồ gia dụng hương
13035662,https://www.sendo.vn/giuong-luoi-cho-be-13035662.html,giường lưới cho bé,340000,chuyên đồ gia dụng hương
13280885,https://www.sendo.vn/mau-moi-nhat-2018-thanh-chan-giuong-2m-cao-82cm-cua-aachamann-13280885.html,Mẫu mới nhất 2018- Thanh chăn giường 2m cao 82cm của Aachamann,316000,tongkhodobuon
12013163,https://www.sendo.vn/giuong-luoi-cho-be-12013163.html,GIƯỜNG LƯỚI CHO BÉ,340000,GiadungDinhVinh
12863158,https://www.sendo.vn/noi-tre-chu-nhat-size-85x50cm-12863158.html,nôi tre chữ nhật size 85x50cm,150000,hai hip's house
13167392,https://www.sendo.vn/giuong-luoi-tre-em-13167392.html,GIƯỜNG LƯỚI TRẺ EM,340000,GiadungDinhVinh
12080812,https://www.sendo.vn/quay-cui-nhua-3d-loai-14-mieng-cho-be-tang-tham-va-bong-hang-cao-cap-12080812.html,QUÂY CŨI NHỰA 3D LOẠI 14 MIẾNG CHO BÉ TẶNG THẢM VÀ BÓNG HÀNG CAO CẤP,1850000,Cái Gì Chẳng Có
13367773,https://www.sendo.vn/quay-bong-cho-be-13367773.html,quây bóng cho bé,480000,GiadungDinhVinh
13646670,https://www.sendo.vn/quay-bong-khung-sat-kem-100-bong-cho-be-13646670.html,quây bóng khung sắt kèm 100 bóng cho bé,510000,chuyên đồ gia dụng hương
13646682,https://www.sendo.vn/cui-quay-cho-be-13646682.html,cũi quây cho bé,480000,chuyên đồ gia dụng hương
13693977,https://www.sendo.vn/giuong-luoi-tre-em-13693977.html,giường lưới trẻ em,300000,Shop Tiện Ích Gia Vinh
12027232,https://www.sendo.vn/giuong-luoi-cho-be-12027232.html,Giường Lưới Cho Bé,340000,chuyên đồ gia dụng hương
12589075,https://www.sendo.vn/giuong-luoi-cho-be-12589075.html,giường lưới cho bé,340000,GiadungDinhVinh
12571894,https://www.sendo.vn/xich-du-noi-dien-noi-dua-tu-dong-co-hen-gio-va-nhac-mastela-6558-12571894.html,Xích đu nôi điện nôi đưa tự động có hẹn giờ và nhạc Mastela 6558,1399000,SHOP BÉ CHƠI
12756645,https://www.sendo.vn/cui-quay-cho-be-kem-100-bong-12756645.html,CŨI QUÂY CHO BÉ KÈM 100 BÓNG,520000,GIA DỤNG TỔNG HỢP VIAN
12756529,https://www.sendo.vn/cui-quay-cho-be-kem-100-qua-bong-12756529.html,CŨI QUÂY CHO BÉ kèm 100 quả bóng,510000,ĐỒ GIA DỤNG VIAN
17043916,https://www.sendo.vn/giuong-luoi-tre-em-17043916.html,giường lưới trẻ em,340000,chuyên đồ gia dụng hương
17303256,https://www.sendo.vn/quay-bong-12-2-cho-be-17303256.html,Quây bóng 12+2 cho bé,1450000,MiloCocashop
12571799,https://www.sendo.vn/xich-du-noi-rung-noi-dua-tu-dong-cater-sboo-mau-hong-12571799.html,Xích đu nôi rung nôi đưa tự động Cater sboo - Màu hồng,999000,SHOP BÉ CHƠI
17325173,https://www.sendo.vn/quay-bong-khung-sat-cho-be-17325173.html,quây bóng khung sắt cho bé,450000,Shop Tiện Ích Gia Vinh
17324498,https://www.sendo.vn/combo-may-dua-vong-em-be-vinanoi-vn365-suc-dua-70kg-va-diu-em-be-17324498.html,COMBO Máy đưa võng em bé VINANOI - VN365 sức đưa 70kg và Địu em bé,645000,MeBeOnline
16849951,https://www.sendo.vn/noi-tu-dong-cao-cap-dieu-khien-tu-xa-mastela-sg239-mau-hong-16849951.html,Nôi tự động cao cấp điều khiển từ xa Mastela SG239 MÀU HỒNG,2399000,Gấu Babi Shop
16608189,https://www.sendo.vn/cui-quay-cho-be-16608189.html,cũi quây cho bé,480000,Dogiadung99
16153549,https://www.sendo.vn/cui-quay-cho-be-16153549.html,CŨI QUÂY CHO BÉ ,420000,Shop Tiện Ích Gia Vinh
27524115,https://www.sendo.vn/quan-nhong-chun-coc-he-giup-be-so-sinh-ngu-ngon-27524115.html,QUẤN NHỘNG CHŨN CỘC HÈ GIÚP BÉ SƠ SINH NGỦ NGON,235000,Túi Ngủ Thiện Tâm
16849714,https://www.sendo.vn/noi-rung-kiem-ghe-bap-benh-5-trong-1-mastela-chinh-hang-mau-hong-xam-16849714.html,Nôi rung kiêm ghế bập bênh 5 trong 1 Mastela chính hãng MÀU HỒNG XÁM,1699000,Gấu Babi Shop
16849689,https://www.sendo.vn/xich-du-kiem-noi-rung-mastela-2-trong-1-mastela-sg301-chinh-hang-16849689.html,Xích đu kiêm Nôi rung Mastela 2 trong 1 Mastela SG301 chính hãng,3699000,Gấu Babi Shop
16298350,https://www.sendo.vn/1-thanh-chan-giuong-1m8-kem-qua-tang-16298350.html,1 THANH CHẮN GIƯỜNG 1M8 KÈM QUÀ TẶNG,319000,GIADUNGGIAGOC1
16099508,https://www.sendo.vn/noi-ngu-chung-giuong-gap-gon-thuan-tien-khi-cho-be-di-choi-di-du-lich-summer-cua-my-16099508.html,"Nôi ngủ chung giường Gập gọn thuận tiện khi cho bé đi chơi, đi du lịch- SUMMER của Mỹ",1485000,Enbay24h.com
16099827,https://www.sendo.vn/cui-quay-bong-khung-sat-cho-be-16099827.html,cũi quây bóng khung sắt cho bé,480000,GiadungDinhVinh
16928602,https://www.sendo.vn/giuong-luoi-cho-be-16928602.html,Giường lưới cho bé,340000,GIA DỤNG PICO
17127890,https://www.sendo.vn/quay-bong-cho-be-17127890.html,QUÂY BÓNG CHO BÉ,350000,chuyên đồ gia dụng hương
17510252,https://www.sendo.vn/quay-cui-kiem-nha-bong-khung-inox-cho-be-tang-kem-bong-da-sac-17510252.html,Quây Cũi Kiêm Nhà Bóng Khung Inox Cho Bé Tặng Kèm Bóng Đa Sắc,295000,Siêu Thị 24h Online
17809362,https://www.sendo.vn/cui-quay-cho-be-17809362.html,cũi quây cho bé,480000,Shop Tiện Ích Gia Vinh
19818786,https://www.sendo.vn/combo-may-dua-vong-em-be-vinanoi-vn365-suc-dua-30kg-sieu-em-va-xe-tap-di-cho-be-19818786.html,COMBO Máy đưa võng em bé VINANOI - VN365 sức đưa 30kg siêu êm và xe tập đi cho bé,945000,VINANOI
19570693,https://www.sendo.vn/giuong-hoi-19570693.html,GIƯỜNG HƠI,990000,GIA DỤNG TỔNG HỢP VIAN
18932563,https://www.sendo.vn/noi-rung-tu-dong-autoru-aue-ac85-18932563.html,NÔI RUNG TỰ ĐỘNG AUTORU AUE-AC85,1290000,siêu thị TELO
19771277,https://www.sendo.vn/chieu-truc-trai-noi-cui-cho-be-70-x-13m-19771277.html,chiếu trúc trải nôi cũi cho bé 70 x 1.3m,275000,Đồ dùng văn phòng 104
18921194,https://www.sendo.vn/cu-rung-sac-noi-dien-khanh-ngoc-dai-vi-thanh-hung-18921194.html,"Củ rung + sạc nôi điện Khánh Ngọc, Đại Vĩ, Thành Hưng",320000,Siêu Thị 24h Online
19345487,https://www.sendo.vn/cui-soi-tron-mau-moc-cho-be-goldcat-mua-cui-tang-man-ho-tro-phi-ship-19345487.html,"Cũi Sồi Tròn Màu Mộc cho bé GoldCat - MUA CŨI TẶNG MÀN, HỖ TRỢ PHÍ SHIP",2250000,Goldcat shop
16940378,https://www.sendo.vn/chieu-luc-binh-hien-trang-cho-be-16940378.html,chiếu lục bình Hiền trang cho bé,60000,thanhtuyen2012
17858922,https://www.sendo.vn/noi-rung-tu-dong-17858922.html,NÔI RUNG TỰ ĐỘNG,899000,GIA DỤNG TỔNG HỢP VIAN
16942849,https://www.sendo.vn/cui-quay-bong-khung-sat-16942849.html,cũi quây bóng khung sắt ,480000,GiadungDinhVinh
17474486,https://www.sendo.vn/cui-quay-cho-be-kem-100-qua-bong-17474486.html,CŨI QUÂY CHO BÉ kèm 100 quả bóng,450000,GIA DỤNG TỔNG HỢP VIAN
17474338,https://www.sendo.vn/cui-quay-cho-be-kem-100-qua-bong-17474338.html,CŨI QUÂY CHO BÉ kèm 100 quả bóng,450000,SHOP HÀNG TỔNG HỢP
17892739,https://www.sendo.vn/cui-quay-cho-be-17892739.html,CŨI QUÂY CHO BÉ,420000,giadunganan
17241660,https://www.sendo.vn/cui-tre-em-c71ha-hong-70-x-110-cm-17241660.html,Cũi Trẻ Em C71HA-Hồng 70 x 110 cm ,1750000,NOLULU SHOP
17018367,https://www.sendo.vn/cui-quay-cho-be-kem-100-bong-17018367.html,cũi quây cho bé kèm 100 bóng,510000,Dogiadung99
19758345,https://www.sendo.vn/bo-nem-noi-vai-cotton-nhieu-mau-lua-chon-19758345.html,Bộ nệm nôi vải COTTON nhiều mẫu lựa chọn,600000,Amooy Store
20370640,https://www.sendo.vn/cui-quay-cho-be-20370640.html,CŨI QUÂY CHO BÉ,390000,giadunganan
19437526,https://www.sendo.vn/noi-dien-cho-be-2-tang-co-tang-bo-vong-19437526.html,NÔI ĐIỆN CHO BÉ 2 TẦNG CÓ TẶNG BỘ VÕNG,960000,ĐỒ CHƠI CHO BÉ
19552617,https://www.sendo.vn/thanh-chan-giuong-umo-han-quoc-19552617.html,THANH CHẮN GIƯỜNG UMO HÀN QUỐC,500000,BẢO NHI BABY SHOP
19440689,https://www.sendo.vn/luoi-vong-cao-cap-vinanoi-v01-danh-cho-khung-vong-em-be-mau-xanh-la-19440689.html,Lưới võng cao cấp VINANOI V01 dành cho khung võng em bé màu xanh lá,140000,MeBeOnline
20368464,https://www.sendo.vn/nguon-may-dua-vong-bien-ap-may-dua-vong-20368464.html,NGUỒN MÁY ĐƯA VÕNG - BIẾN ÁP MÁY ĐƯA VÕNG,250000,Anh Bo
20078271,https://www.sendo.vn/ghe-rung-lac-cho-baby-20078271.html,Ghế rung lắc cho baby,1050000,MuaSắm247
19577198,https://www.sendo.vn/giuong-hoi-19577198.html,GIƯỜNG HƠI,990000,HÀNGTIỆNÍCH
19676672,https://www.sendo.vn/chieu-truc-bambo-hang-loai-dep-cho-be-19676672.html,Chiếu trúc bambo hàng loại đẹp cho bé,180000,shop me gau8217
19768877,https://www.sendo.vn/combo-may-dua-vong-em-be-vinanoi-a100-suc-dua-100kg-va-diu-cho-be-19768877.html,COMBO Máy đưa võng em bé VINANOI - A100 sức đưa 100kg và địu cho bé,700000,VINANOI
19767014,https://www.sendo.vn/vong-xep-tu-dong-cho-nguoi-lon-vinanoi-a100-kvt-khung-thep-kem-luoi-dai-mau-xanh-la-19767014.html,Võng xếp tự động cho người lớn VINANOI A100-KVT khung thép kèm lưới đại màu xanh lá,1200000,VINANOI
19565603,https://www.sendo.vn/nem-cho-be-nem-lot-ka-te-thang-loi-cho-be-72-105cm-19565603.html,Nem cho be_Nệm lót Ka tê Thắng Lợi cho bé 72*105cm,105000,Mẹ và bé bobo
20398712,https://www.sendo.vn/giuong-luoi-cho-be-20398712.html,GIƯỜNG LƯỚI CHO BÉ ,189000,shopdogiadung1207
19811104,https://www.sendo.vn/combo-may-dua-vong-em-be-vinanoi-vn365n-suc-dua-100kg-sieu-em-va-diu-cho-be-19811104.html,COMBO Máy đưa võng em bé VINANOI - Vn365N sức đưa 100kg siêu êm và địu cho bé,770000,VINANOI
18793850,https://www.sendo.vn/noi-may-chong-may-cho-be-chat-hoac-goi-cho-shop-truoc-khi-dat-hang-18793850.html,Nôi mây Chõng mây cho bé - Chat hoặc gọi cho shop trước khi đặt hàng,499000,Siêu Thị 24h Online
18668152,https://www.sendo.vn/quay-cui-nhua-loai-18-mieng-cho-be-tang-tham-va-bong-hang-cao-cap-18668152.html,QUÂY CŨI NHỰA LOẠI 18 MIẾNG CHO BÉ TẶNG THẢM VÀ BÓNG HÀNG CAO CẤP,2150000,Cái Gì Chẳng Có
18899078,https://www.sendo.vn/noi-dien-dai-vi-2-trong-1-vua-la-noi-dien-vua-la-vong-xep-hang-vn-chat-luong-cao-18899078.html,NÔI ĐIỆN ĐẠI VĨ 2 TRONG 1  VỪA LÀ NÔI ĐIỆN VỪA LÀ VÕNG XẾP - HÀNG VN CHẤT LƯỢNG CAO ,650000,Shop Mẹ Bé Nhímm
18705314,https://www.sendo.vn/quay-bong-nhua-2m4-12-canh-nho-2-canh-lon-50-bong-1-tham-18705314.html,quay bóng nhựa 2m4 12 cánh nhỏ 2 cánh lớn 50 bóng 1 thảm,1900000,Gia dụng SIÊU RẺ Bà Rịa
18872825,https://www.sendo.vn/cui-quay-cho-be-18872825.html,cũi quây cho bé,480000,Shop Tiện Ích Gia Vinh
18557207,https://www.sendo.vn/noi-dien-2-trong-1-dai-vi-tang-vong-man-chong-muoi-18557207.html,"Nôi Điện 2 trong 1 Đại Vĩ - Tặng Võng, Màn Chống Muỗi",68000,Shop Siêu Thị 24H
19489310,https://www.sendo.vn/bo-nguon-adapter-chinh-toc-do-dung-cho-may-dua-vong-19489310.html,Bộ Nguồn Adapter Chỉnh Tốc Độ Dùng Cho Máy Đưa Võng,155000,lazabay
18728096,https://www.sendo.vn/noi-vong-tu-dong-2in1-18728096.html,nôi võng tự động 2in1 ,990000,trúc quỳnh shop
18557186,https://www.sendo.vn/quay-cui-kiem-nha-bong-cho-be-hang-loai-1-18557186.html,Quây cũi kiêm nhà bóng cho bé - hàng loại 1,29000,Shop Siêu Thị 24H
18720288,https://www.sendo.vn/giuong-luoi-cho-be-18720288.html,Giường lưới cho bé,340000,chuyên đồ gia dụng hương
18668573,https://www.sendo.vn/quay-cui-nhua-loai-10-mieng-cho-be-tang-tham-va-bong-hang-cao-cap-18668573.html,QUÂY CŨI NHỰA LOẠI 10 MIẾNG CHO BÉ  TẶNG THẢM VÀ BÓNG HÀNG CAO CẤP,1380000,Cái Gì Chẳng Có 68
18868951,https://www.sendo.vn/quay-cui-nhua-loai-12-mieng-cho-be-tang-tham-va-bong-hang-cao-cap-18868951.html,QUÂY CŨI NHỰA LOẠI 12 MIẾNG CHO BÉ  TẶNG THẢM VÀ BÓNG HÀNG CAO CẤP,1480000,Cái Gì Chẳng Có 1
17921626,https://www.sendo.vn/noi-cho-be-nam-vong-tang-vong-dau-tam-17921626.html,nôi cho bé nằm võng tặng vòng dâu tằm,109000,shop mẹ vịt con
18556279,https://www.sendo.vn/cu-rung-noi-dien-khanh-ngoc-18556279.html,Củ rung Nôi điện Khánh Ngọc,49000,Shop Siêu Thị 24H
18556254,https://www.sendo.vn/noi-dien-tu-dong-2-in-1-khanh-ngoc-tang-man-chong-muoi-vong-tam-lot-lung-18556254.html,"Nôi điện tự động 2 in 1 Khánh Ngọc - Tặng màn chống muỗi, võng, tấm lót lưng",69000,Shop Siêu Thị 24H
18556099,https://www.sendo.vn/noi-dien-vong-xep-2in1-khanh-ngoc-tang-kem-vong-man-chong-muoi-18556099.html,"Nôi điện võng xếp 2in1 Khánh Ngọc - Tặng kèm võng, màn chống muỗi",72000,Shop Siêu Thị 24H
20499618,https://www.sendo.vn/thanh-chan-giuong-cua-achmann-cao90cm-mau-moi-20499618.html,thanh chắn giường của Âchmann cao90cm mẫu mới,400000,dungcuchobe
21335157,https://www.sendo.vn/day-curoa-noi-dien-thanh-hung-loai-1-tang-1-bo-2-day-21335157.html,Dây curoa Nôi điện Thành Hưng loại 1 tầng - 1 bộ 2 dây,38000,VongxepMantubung
20423440,https://www.sendo.vn/chieu-nhua-thay-bim-so-sinh-loai-to-20423440.html,Chiếu nhựa thay bỉm sơ sinh loại to,18000,shopchuyensosinh
21183508,https://www.sendo.vn/giuong-luoi-tre-em-21183508.html,GIƯỜNG LƯỚI TRẺ EM ,350000,ĐỒ DÙNG GIA ĐÌNH 09
21757095,https://www.sendo.vn/day-coloa-noi-dien-cho-be-21757095.html,Dây coloa nôi điện cho bé,28000,Võng Xếp Màn Khung
21325700,https://www.sendo.vn/quay-cui-2-in-1-cho-be-vua-la-cui-vua-la-nha-bong-21325700.html,Quây Cũi 2 in 1 Cho Bé - Vừa Là Cũi Vừa Là Nhà Bóng,450000,Sukem Bé Bỏng
21754192,https://www.sendo.vn/noi-tu-duatre-em-2-trong-1-dai-vi-vua-la-noi-vua-la-vong-21754192.html,Nôi Tự ĐưaTrẻ Em 2 Trong 1 Đại Vĩ - Vừa Là Nôi Vừa Là Võng,850000,VongxepMantubung
21858168,https://www.sendo.vn/noi-em-be-tang-kem-dai-diu-4-tu-the-21858168.html,Nôi em bé tặng kèm đai địu 4 tư thế,1680000,ssssky shop
21836491,https://www.sendo.vn/tham-xop-cho-be-chu-so-pastel-10-mieng-dien-tich-1m2-smile-puzzle-21836491.html,"Thảm xốp cho bé chữ số pastel 10 miếng, diện tích 1m2 Smile Puzzle",189000,SmilePuzzleVN
21768004,https://www.sendo.vn/tu-sac-mau-21768004.html,tủ sắc màu,350000,maingocanhduong
21835477,https://www.sendo.vn/tham-choi-cho-be-don-mau-4-mieng-60x60x1-2cm-smile-puzzle-khong-mui-21835477.html,"Thảm chơi cho bé đơn màu 4 miếng 60x60x1,2cm Smile Puzzle không mùi",220000,SmilePuzzleVN
21623198,https://www.sendo.vn/noi-bap-benh-cho-be-co-man-chong-muoi-21623198.html,Nôi bập bênh cho bé có màn chống muỗi,1600000,ssssky shop
21615555,https://www.sendo.vn/ghe-rung-cho-tre-0-3-tuoi-21615555.html,Ghế rung cho trẻ 0-3 tuổi,649000,Tít Tít Sing
21784080,https://www.sendo.vn/ban-le-cac-loai-luoi-vong-noi-dien-cho-be-nguyen-luoi-vong-21784080.html,Bán lẻ các loại lưới võng nôi điện cho bé-Nguyên lưới võng ,180000,ThoanKim
21846172,https://www.sendo.vn/day-curoa-noi-dien-loai-1-tang-2-tang-duong-kinh-7cm-1-bo-2-day-21846172.html,"Dây curoa nôi điện loại 1 tầng, 2 tầng - đường kính 7cm, 1 bộ 2 dây",35000,Siêu Thị 24h Online
21657711,https://www.sendo.vn/cui-quay-bong-cho-be-21657711.html,Cũi quây bóng cho bé,430000,SHOP MẸ VÀ BÉ 89
21835956,https://www.sendo.vn/tham-choi-cho-be-chu-cai-26-mieng-dien-tich-24m2-smile-puzzle-khong-mui-21835956.html,"Thảm chơi cho bé chữ cái 26 miếng, diện tích 2.4m2 Smile Puzzle Không mùi",350000,SmilePuzzleVN
22403337,https://www.sendo.vn/ghe-bap-benh-cho-be-3-che-do-22403337.html,Ghế bập bênh cho bé 3 chế độ,329000,Kho hàng gia dụng uy tín
21183333,https://www.sendo.vn/giuong-hoi-hinh-thu-21183333.html,GIƯỜNG HƠI HÌNH THÚ,990000,ĐỒ DÙNG GIA ĐÌNH 09
22375537,https://www.sendo.vn/treo-noi-den-trang-hinh-vuong-tron-kich-thich-thi-giac-cho-be-22375537.html,TReo nôi đen trắng hình vuông tròn kích thích thi giác cho bé,109000,LIF MOD
22775238,https://www.sendo.vn/noi-ru-ngu-tu-dong-co-chuc-nang-phat-nhac-best-seller-tony-22775238.html,Nôi ru ngủ tự động có chức năng phát nhạc - Best Seller Tony,1890000,Shop P T L
22774394,https://www.sendo.vn/giuong-nem-ngu-em-ai-cho-be-best-seller-tony-22774394.html,Giường Nệm Ngủ Êm Ái Cho Bé - Best Seller Tony,849000,Shop P T L
21501458,https://www.sendo.vn/giuong-nem-ngu-em-ai-cho-be-21501458.html,Giường Nệm Ngủ Êm Ái Cho Bé,849000,HanRui Shop
22311159,https://www.sendo.vn/giuong-tang-bb-025-cau-thang-cheo-nhieu-mau-kem-2-hoc-keo-22311159.html,Giường tầng BB 025 cầu thang chéo nhiều màu kèm 2 hộc kéo,4200000,baby68
22076321,https://www.sendo.vn/thanh-chan-giuong-22076321.html,thanh chắn giường,430000,goldshop231115
22253369,https://www.sendo.vn/noi-cho-be-co-man-chong-muoi-22253369.html,Nôi cho bé có màn chống muỗi,1290000,Big Mall
22357766,https://www.sendo.vn/quay-cui-kiem-nha-bong-cho-be-khung-inox-tang-kem-20-qua-bong-da-sac-22357766.html,QUÂY CŨI KIÊM NHÀ BÓNG CHO BÉ KHUNG INOX - TẶNG KÈM 20 QUẢ BÓNG ĐA SẮC,399000,Shop Con Cưngg
22068099,https://www.sendo.vn/noi-dai-vi-cho-be-yeu-22068099.html,Nôi đại vĩ Cho bé yêu ,730000,Kimthoan
22744922,https://www.sendo.vn/cui-cho-be-cui-cho-be-22744922.html,Cũi cho bé - cũi cho bé,1509000,HONA HOME
22685878,https://www.sendo.vn/noi-cui-giuong-cui-go-tre-em-22685878.html,Nôi cũi - giường cũi gỗ trẻ em,1509000,HONA BEAT
22842036,https://www.sendo.vn/hot-goi-la-dinh-lang-cho-be-chong-mo-hoi-trom-ngan-giat-minh-re-22842036.html,HOT Gối lá đinh lăng cho bé chống mồ hôi trộm ngăn giật mình RE,95700,THANH THANH 01
22688925,https://www.sendo.vn/noi-go-noi-cui-noi-tu-dong-22688925.html,Nôi gỗ - Nôi cũi - Nôi tự động,1199000,HONA BEAT
22819199,https://www.sendo.vn/dung-cu-ve-sinh-mui-cho-be-litte-may-hut-mui-cho-be-22819199.html,Dụng cụ vệ sinh mũi cho bé Litte Máy hút mũi cho bé,366500,Bebe store 247
22688776,https://www.sendo.vn/cui-go-giuong-cui-noi-go-cao-cap-22688776.html,Cũi gỗ - giường cũi - Nôi gỗ cao cấp ,1509000,HONA BEAT
