product_id,product_url,name,price,shop_name
9245471,https://www.sendo.vn/noi-dien-noi-ru-cho-be-va-tang-kem-chan-u-cho-be-hinh-meo-9245471.html,"Nôi điện, nôi ru cho bé và tặng kèm chăn ủ cho bé hình mèo",1029000,Home and Garden
8764366,https://www.sendo.vn/quay-cui-12-mieng-bang-nhua-an-toan-cho-be-8764366.html,QUÂY CŨI 12 MIẾNG BẰNG NHỰA AN TOÀN CHO BÉ,1650000,Cái Gì Chẳng Có 1
7650785,https://www.sendo.vn/ghe-rung-cho-be-co-gau-mau-ngau-nhien-7650785.html,Ghế rung cho bé có gấu màu ngẫu nhiên,279000,ngocngochuyenshop2012
9588766,https://www.sendo.vn/quay-cui-nhua-cho-be-16-mieng-kem-tham-va-bong-9588766.html,QUÂY CŨI NHỰA CHO BÉ 16 MIẾNG KÈM THẢM VÀ BÓNG,2100000,Cái Gì Chẳng Có 68
6985631,https://www.sendo.vn/ghe-nhun-cho-be-6985631.html,Ghế nhún cho bé,309000,gia dụng binbo
7089072,https://www.sendo.vn/giuong-tang-3-trong-1-hello-kitty-gt10-7089072.html,Giường tầng 3 trong 1 Hello Kitty GT10,13013000,baby68
7088245,https://www.sendo.vn/giuong-tang-tre-em-hello-kitty-gt04-7088245.html,Giường tầng trẻ em Hello Kitty GT04,9097000,baby68
9492536,https://www.sendo.vn/set5mon-chan-goi-kem-ruot-goi-cotton-han-quoc-cao-cap-cho-be0den-8tuoi-lh-zalo-0899673032-9492536.html,SET5món chăn gối KÈM RUỘT GỐI cotton hàn quốc cao cấp cho bé0đến 8tuổi LH ZALO: 0899673032,249000,CHUYÊN SỈ VÀ LẺ
7087529,https://www.sendo.vn/giuong-tang-lau-dai-gt02-7087529.html,Giường tầng lâu đài GT02,9097000,baby68
5314775,https://www.sendo.vn/chieu-lua-kem-goi-mem-mai-thoang-mat-cho-be-5314775.html,Chiếu lụa kèm gối mềm mại thoáng mát cho bé,150000,Hà Hà Shop HN
5735528,https://www.sendo.vn/combo-cui-man-quay-5735528.html,COMBO CŨI MÀN QUÂY,3650000,Cái Gì Chẳng Có
11672086,https://www.sendo.vn/giuong-luoi-cho-be-11672086.html,Giường Lưới Cho Bé,330000,GiadungDinhVinh
6545869,https://www.sendo.vn/ghe-rung-cho-be-happy-hang-loai-1-6545869.html,Ghế Rung cho bé Happy hàng loại 1,259000,CỰC RẺ 86
9613717,https://www.sendo.vn/thanh-chan-giuong-baby-smiles-9613717.html,Thanh chắn giường Baby Smiles ,350000,Ngocphat212
7641680,https://www.sendo.vn/noi-cui-du-zaracos-jelly-6046-yellow-jelly-6046-yellow-7641680.html,NÔI CŨI DÙ ZARACOS JELLY 6046 - YELLOW - JELLY 6046 - YELLOW,3899000,Chăm sóc bé sơ sinh
5723086,https://www.sendo.vn/cui-va-noi-cho-be-hang-viet-nam-5723086.html,CŨI VÀ NÔI CHO BÉ HÀNG VIỆT NAM,2800000,Cái Gì Chẳng Có
11444672,https://www.sendo.vn/cui-quay-cho-be-kem-100-bong-11444672.html,CŨI QUÂY CHO BÉ kèm 100 bóng,520000,ĐỒ GIA DỤNG VIAN
12364988,https://www.sendo.vn/giuong-luoi-cho-be-12364988.html,GIƯỜNG LƯỚI CHO BÉ,340000,GiadungDinhVinh
11284922,https://www.sendo.vn/giuong-luoi-cho-be-11284922.html,GIƯỜNG LƯỚI CHO BÉ,340000,chuyên đồ gia dụng hương
11284759,https://www.sendo.vn/ghe-dung-cho-be-11284759.html,Ghế Dung Cho Bé,290000,chuyên đồ gia dụng hương
12060959,https://www.sendo.vn/giuong-luoi-cho-be-12060959.html,GIƯỜNG LƯỚI CHO BÉ,440000,GiadungDinhVinh
11722619,https://www.sendo.vn/cui-quay-bong-khung-inox-chac-chan-an-toan-cho-be-tang-kem-bong-11722619.html,Cũi quây bóng khung inox chắc chắn an toàn cho bé + Tặng kèm bóng,480000,chuyên đồ gia dụng hương
11440656,https://www.sendo.vn/may-dua-vong-tu-dong-cao-cap-cho-em-be-autoru-85kg-11440656.html,Máy đưa võng  tự động cao cấp cho em bé autoru 85kg,590000,Babies Vn
12870738,https://www.sendo.vn/cui-quay-cho-be-kem-100-bong-12870738.html,CŨI QUÂY CHO BÉ kèm 100 bóng,520000,GIA DỤNG TỔNG HỢP VIAN
11533626,https://www.sendo.vn/thiet-bi-mam-non-toan-quoc-ghe-nhua-duc-nhap-khau-mam-non-ma-xdv-11533626.html,THIẾT BỊ MẦM NON TOÀN QUỐC- Ghế nhựa đúc nhập khẩu mầm non. Mã XĐV,115000,Thietbimamnontoanquoc
12870736,https://www.sendo.vn/cui-quay-cho-be-12870736.html,Cũi Quây  Cho Bé,480000,GIA DỤNG TỔNG HỢP VIAN
12870618,https://www.sendo.vn/cui-quay-cho-be-12870618.html,CŨI QUÂY CHO BÉ,480000,ĐỒ GIA DỤNG VIAN
11618402,https://www.sendo.vn/cui-quay-cho-be-kem-100-bong-11618402.html,CŨI QUÂY CHO BÉ kèm 100 bóng,520000,giadunganan
12136751,https://www.sendo.vn/noi-tre-chu-nhat-size-85x50cm-12136751.html,nôi tre chữ nhật size 85x50cm,150000,abcbabies
12136791,https://www.sendo.vn/noi-tre-chu-nhat-size-95x60cm-12136791.html,nôi tre chữ nhật size 95x60cm,180000,abcbabies
12138226,https://www.sendo.vn/thanh-chan-giuong-bao-ve-tre-12138226.html,thanh chắn giường bảo vệ trẻ,330000,ShopDuongMinh
11907592,https://www.sendo.vn/quay-cui-nhua-3d-loai-18-mieng-cho-be-hang-cao-cap-tang-tham-va-bong-11907592.html,QUÂY CŨI NHỰA 3D LOẠI 18 MIẾNG CHO BÉ HÀNG CAO CẤP TẶNG THẢM VÀ BÓNG,2150000,Cái Gì Chẳng Có
11420006,https://www.sendo.vn/nem-lot-cho-noi-dat-vong-vietkids-cho-noi-duoi-90cm-11420006.html,Nệm lót cho nôi đặt võng Vietkids cho nôi dưới 90cm,110000,Babies Vn
11944558,https://www.sendo.vn/giuong-luoi-cho-be-11944558.html,GIƯỜNG LƯỚI CHO BÉ,340000,ĐỒ GIA DỤNG VIAN
11961819,https://www.sendo.vn/cui-quay-cho-be-kem-100-bong-11961819.html,CŨI QUÂY CHO BÉ kèm 100 bóng,520000,ĐỒ GIA DỤNG VIAN
11464356,https://www.sendo.vn/giuong-luoi-tam-cho-be-11464356.html,Giường lưới tắm cho bé,63000,ShopQuyenLinh
12052119,https://www.sendo.vn/giuong-luoi-cho-be-12052119.html,Giường Lưới Cho Bé,350000,chuyên đồ gia dụng hương
11432413,https://www.sendo.vn/cui-quay-cho-be-kem-100-bong-11432413.html,CŨI QUÂY CHO BÉ kèm 100 bóng,520000,ĐỒ GIA DỤNG VIAN
11953058,https://www.sendo.vn/cui-quay-bong-khung-inox-chac-chan-an-toan-cho-be-tang-150-bong-11953058.html,Cũi quây bóng khung inox chắc chắn an toàn cho bé + Tặng 150 bóng,530000,chuyên đồ gia dụng hương
12793186,https://www.sendo.vn/thanh-chan-giuong-baby-gift-m5-12793186.html,thanh chắn giường baby gift m5,310000,tongkholinhdam
12212098,https://www.sendo.vn/quay-cui-nhua-3d-loai-12-mieng-cho-be-kem-tham-va-bong-hang-cao-cap-12212098.html,QUÂY CŨI NHỰA 3D LOẠI 12 MIẾNG CHO BÉ KÈM THẢM VÀ BÓNG HÀNG CAO CẤP,1650000,Cái Gì Chẳng Có 68
11732746,https://www.sendo.vn/ghe-dung-cho-be-11732746.html,Ghế Dung Cho Bé,290000,chuyên đồ gia dụng hương
12065432,https://www.sendo.vn/ghe-rung-phat-nhac-ghe-rung-phat-nhac-12065432.html,Ghế Rung Phát Nhạc - Ghế Rung Phát Nhạc,419000,tongkhodobuon
12213016,https://www.sendo.vn/quay-cui-nhua-3d-loai-16-mieng-cho-be-kem-tham-va-bong-hang-cao-cap-12213016.html,QUÂY CŨI NHỰA 3D LOẠI 16 MIẾNG CHO BÉ KÈM THẢM VÀ BÓNG HÀNG CAO CẤP,1850000,Cái Gì Chẳng Có 68
13610023,https://www.sendo.vn/giuong-luoi-tre-em-13610023.html,giường lưới trẻ em,340000,chuyên đồ gia dụng hương
12688309,https://www.sendo.vn/ghe-rung-ghe-nhun-da-nang-cho-be-tang-kem-thu-treo-ghe-rung-cho-be-12688309.html,Ghế Rung Ghế Nhún Đa Năng Cho Bé Tặng Kèm Thú Treo - ghế rung cho bé,290000,Hàng hót theo mùa
12662381,https://www.sendo.vn/noi-rung-kiem-ghe-bap-benh-5-trong-1-mastela-xanh-hoa-tiet-12662381.html,Nôi rung kiêm ghế bập bênh 5 trong 1 Mastela - Xanh hoạ tiết,1697000,Nam Thành baby
13002659,https://www.sendo.vn/thanh-chan-giuong-viet-nam-baby-smiles-cho-be-do-cao-68-90cm-13002659.html,Thanh Chắn Giường Việt Nam Baby Smiles Cho Bé độ cao 68-90cm,400000,Baby and dear
13929679,https://www.sendo.vn/noi-dien-vong-xep-2-trong-1-tang-vong-man-chong-muoi-13929679.html,"Nôi Điện Võng Xếp 2 Trong 1 - Tặng Võng, Màn Chống Muỗi",660000,Siêu Thị 24h Online
14020327,https://www.sendo.vn/ghe-noi-rung-cao-cap-co-nhac-music-rocking-chair-14020327.html,Ghế nôi Rung cao cấp có Nhạc Music rocking chair,1500000,hanhbeo
13473495,https://www.sendo.vn/bo-nem-lot-va-noi-chu-nhat-85x50cm-13473495.html,bộ nệm lót và nôi chữ nhật 85x50cm,225000,hai hip's house
13473425,https://www.sendo.vn/bo-nem-lot-va-noi-chu-nhat-95x60cm-13473425.html,bộ nệm lót và nôi chữ nhật 95x60cm,250000,hai hip's house
9479029,https://www.sendo.vn/ghe-nhun-co-hinh-thu-treo-cho-be-t408-9479029.html,Ghế nhún có hình thú treo cho bé T408,310000,Shopsonlinh
11286547,https://www.sendo.vn/cui-quay-cho-be-kem-100-bong-11286547.html,CŨI QUÂY CHO BÉ kèm 100 bóng,520000,ĐỒ GIA DỤNG VIAN
10851777,https://www.sendo.vn/ke-chu-a-con-vet-cho-be-01674776662-10851777.html,KỆ CHỮ A CON VẸT CHO BÉ 01674776662,200000,Gia Dụng Ngọc Lan
10450098,https://www.sendo.vn/quay-cui-nhua-3d-loai-18-mieng-cho-be-kem-tham-va-bong-10450098.html,QUÂY CŨI NHỰA 3D LOẠI 18 MIẾNG CHO BÉ KÈM THẢM VÀ BÓNG,1950000,Cái Gì Chẳng Có 68
10199180,https://www.sendo.vn/ghe-rung-mastela-chinh-hang-6910-mau-nau-10199180.html,Ghế rung Mastela chính hãng 6910 màu nâu,999000,Diệp Anh Japan
10896031,https://www.sendo.vn/ghe-rung-ghe-nhun-cho-be-10896031.html,Ghế Rung Ghế Nhún Cho Bé,290000,GiadungDinhVinh
11787037,https://www.sendo.vn/noi-cui-du-zaracos-jenni-5046-pink-11787037.html,NÔI CŨI DÙ ZARACOS JENNI 5046 - PINK,2600000,đồ dùng cho bé zaracos coozy
11846287,https://www.sendo.vn/giuong-luoi-cho-be-11846287.html,GIƯỜNG LƯỚI CHO BÉ,340000,chuyên đồ gia dụng hương
11846226,https://www.sendo.vn/giuong-luoi-cho-be-11846226.html,GIƯỜNG LƯỚI CHO BÉ,340000,chuyên đồ gia dụng hương
10026800,https://www.sendo.vn/quay-cui-nhua-3d-loai-14-mieng-cho-be-phong-cach-hoang-gia-kem-tham-va-bong-10026800.html,QUÂY CŨI NHỰA 3D LOẠI 14 MIẾNG CHO BÉ PHONG CÁCH HOÀNG GIA KÈM THẢM VÀ BÓNG,1750000,Cái Gì Chẳng Có 1
10182322,https://www.sendo.vn/giuong-cui-2-tang-joie-commuter-change-travel-cot-petite-city-10182322.html,Giường cũi 2 tầng Joie Commuter Change Travel Cot  Petite City,2500000,Diệp Anh Japan
10685974,https://www.sendo.vn/day-cu-roa-noi-dien-10685974.html,DÂY CU ROA NÔI ĐIỆN,20000,TuấnThanh1189
10026139,https://www.sendo.vn/quay-cui-nhua-12-mieng-cho-be-phong-cach-hoang-gia-kem-tham-va-bong-10026139.html,QUÂY CŨI NHỰA 12 MIẾNG CHO BÉ PHONG CÁCH HOÀNG GIA KÈM THẢM VÀ BÓNG,1750000,Cái Gì Chẳng Có 68
9975518,https://www.sendo.vn/nem-cho-be-nem-cao-cap-cho-be-9975518.html,Nệm cho bé - Nệm cao cấp cho bé,299000,Ty shopping
9450492,https://www.sendo.vn/giuong-cui-tre-em-joie-commuter-change-petite-city-9450492.html,GIƯỜNG CŨI TRẺ EM JOIE COMMUTER CHANGE PETITE CITY,2199000,Chăm sóc bé sơ sinh
9975466,https://www.sendo.vn/ghe-rung-cho-be-9975466.html,Ghế rung cho bé,180000,Shopsonlinh
9964822,https://www.sendo.vn/nem-cao-cap-cho-be-jjovce-9964822.html,Nệm cao cấp cho bé JJOVCE,399000,NAMSUBI
25067827,https://www.sendo.vn/quay-bong-cho-be-choi-25067827.html,Quây bóng cho bé chơi,480000,Dogiadung99
12741065,https://www.sendo.vn/noi-dien-tu-dong-cho-be-k2-12741065.html,Nôi điện TỰ ĐỘNG cho bé K2,750000,dohayshop
9990514,https://www.sendo.vn/10-chieu-luc-binh-chong-tham-9990514.html,10  chiếu lục bình chống thấm,480000,Pipbokids
24985188,https://www.sendo.vn/cui-tre-em-cui-go-thong-xuat-khau-cao-cap-24985188.html,Cũi Trẻ Em - Cũi Gỗ Thông Xuất Khẩu Cao Cấp,1500000,Baby Kid
24984028,https://www.sendo.vn/cui-tre-em-canh-gian-cao-cap-24984028.html,Cũi Trẻ Em - Cánh Gián Cao Cấp,1300000,Baby Kid
25624553,https://www.sendo.vn/noi-rung-5-trong-1-mastela-6038-25624553.html,Nôi rung 5 trong 1 Mastela 6038,1299000,Chăm sóc bé sơ sinh
26031623,https://www.sendo.vn/goi-nem-chong-trao-nguoc-cho-be-26031623.html,gối nệm chống trào ngược cho bé ,449000,thuyhome
26054319,https://www.sendo.vn/day-curoa-noi-dien-2-soi-26054319.html,Dây curoa nôi điện 2 sợi,20000,IT360
26624752,https://www.sendo.vn/cui-quay-bang-go-tu-nhien-cho-be-loai-5-mieng-hang-viet-nam-26624752.html,CŨI QUÂY BẰNG GỖ TỰ NHIÊN CHO BÉ LOẠI 5 MIẾNG HÀNG VIỆT NAM,2150000,Cái Gì Chẳng Có 68
26624847,https://www.sendo.vn/cui-quay-bang-go-tu-nhien-cho-be-loai-6-mieng-hang-viet-nam-26624847.html,CŨI QUÂY BẰNG GỖ TỰ NHIÊN CHO BÉ LOẠI 6 MIẾNG HÀNG VIỆT NAM,2350000,Cái Gì Chẳng Có 68
26624716,https://www.sendo.vn/quay-cui-bang-go-tu-nhien-cho-be-loai-4-mieng-hang-viet-nam-26624716.html,QUÂY CŨI BẰNG GỖ TỰ NHIÊN CHO BÉ LOẠI 4 MIẾNG HÀNG VIỆT NAM,1650000,Cái Gì Chẳng Có 68
25879238,https://www.sendo.vn/thanh-chan-giuong-umo-dang-truot-cao-90cm-25879238.html,Thanh chắn giường Umo dạng trượt cao 90cm,420000,baby68
26377626,https://www.sendo.vn/vong-noi-2in1-26377626.html,võng nôi 2in1,990000,CÂY ĂN QUẢ 1
26059099,https://www.sendo.vn/noi-rung-khanh-ngoc-cho-be-tang-kem-vong-26059099.html,Nôi rung Khánh Ngọc cho Bé tặng kèm võng,689000,Babykids
26242481,https://www.sendo.vn/cuc-nguon-may-dua-vong-cuc-nguon-may-dua-vong-26242481.html,cục nguồn máy đưa võng - cục nguồn máy đưa võng,189000,TƯ MÃ Ý 2359
28054190,https://www.sendo.vn/day-curoa-noi-dien-thanh-hung-combo-4-soi-28054190.html,Dây curoa nôi điện Thành Hưng combo 4 sợi,50000,hoa giay
16386540,https://www.sendo.vn/quay-cui-quay-bong-cho-be-16386540.html,QUÂY CŨI QUÂY BÓNG cho bé,450000,ĐỒ GIA DỤNG VIAN
16386539,https://www.sendo.vn/quay-cui-quay-bong-16386539.html,QUÂY CŨI QUÂY BÓNG,490000,ĐỒ GIA DỤNG VIAN
21770454,https://www.sendo.vn/noi-dien-vong-xep-tu-dong-thanh-hung-2-trong-1-tang-vong-man-chong-muoi-co-anh-that-21770454.html,Nôi Điện Võng Xếp Tự Động Thành Hưng 2 Trong 1 Tặng Võng Màn Chống Muỗi Có ảnh thật,885000,VongxepMantubung
21770877,https://www.sendo.vn/noi-dien-vong-xep-2-trong-1-tang-kem-vong-man-chong-muoi-cho-be-21770877.html,Nôi điện Võng xếp 2 Trong 1 Tặng kèm võng màn chống muỗi cho bé,705000,VongxepMantubung
21770869,https://www.sendo.vn/noi-dien-vong-xep-2-trong-1-dai-vi-tang-kem-2-day-curoa-vong-man-chong-muoi-cho-be-21770869.html,Nôi điện Võng xếp 2 Trong 1 Đại Vĩ Tặng kèm 2 dây curoa võng màn chống muỗi cho bé,850000,VongxepMantubung
21770754,https://www.sendo.vn/noi-go-di-dong-cho-be-yeu-co-banh-xe-21770754.html,NÔI GỖ DI ĐỘNG CHO BÉ YÊU CÓ BÁNH XE,929000,VongxepMantubung
21495619,https://www.sendo.vn/quay-cui-12-mieng-cho-be-21495619.html,QUÂY CŨI 12 MIẾNG CHO BÉ ,1650000,CỬA HÀNG XE ĐIỆN
21756994,https://www.sendo.vn/noi-dien-vong-xep-tu-dong-thanh-hung-2-trong-1-tang-vong-man-chong-muoi-co-anh-that-21756994.html,Nôi Điện Võng Xếp Tự Động Thành Hưng 2 Trong 1 Tặng Võng Màn Chống Muỗi Có ảnh thật,880000,Võng Xếp Màn Khung
21756986,https://www.sendo.vn/noi-dien-dai-vi-tang-2-day-coroa-san-pham-gom-1-vong-va-1-noi-dien-cho-be-21756986.html,nôi điện đại vĩ tặng 2 dây coroa sản phẩm gồm 1 võng và 1 nôi điện cho bé,887000,Võng Xếp Màn Khung
25186625,https://www.sendo.vn/noi-vong-tu-dong-25186625.html,nôi võng tự động,990000,CÁI GÌ CŨNG CÓ 02
28875054,https://www.sendo.vn/quay-cui-nhua-hinh-sao-cho-be-28875054.html,Quây cũi nhựa hình sao cho bé,1600000,Shop Mẹ Mít Quây cũi nhựa
22775034,https://www.sendo.vn/noi-dien-dua-tu-dong-cho-be-co-nhac-boss-baby-best-seller-tony-22775034.html,Nôi điện đưa tự động cho bé có nhạc Boss Baby - Best Seller Tony,1480000,Shop P T L
28236794,https://www.sendo.vn/double-it-noi-ru-ngu-tu-dong-co-chuc-nang-phat-nhac-28236794.html,Double It Nôi ru ngủ tự động có chức năng phát nhạc,1900000,Double IT
28874914,https://www.sendo.vn/quay-cui-nhua-cho-be-hinh-sao-28874914.html,Quây cũi nhựa cho bé hình sao,1600000,Shop Mẹ Mít Quây cũi nhựa
26937071,https://www.sendo.vn/bo-dem-quay-cui-mau-moi-2020-quay-cui-khinh-khi-cau-cho-be-vai-cotton-khicauhongs3003-26937071.html,Bộ Đệm Quây Cũi MẪU MỚI 2020 - QUÂY CŨI KHINH KHÍ CẦU CHO BÉ VẢI COTTON - KHICAUHONGS3003,469000,Shop Mẹ Đô Đậu
28591295,https://www.sendo.vn/noi-ngu-rung-tu-dong-cho-be-co-man-chong-muoi-babykey-5-che-do-rung-hen-gio-remote-phat-nhac-tren-dien-thoai-bang-bluetooth-xam-28591295.html,"Nôi ngủ Rung Tự Động cho bé có màn chống muỗi BaByKey 5 Chế Độ Rung, Hẹn Giờ, Remote, Phát Nhạc Trên Điện Thoại bằng Bluetooth (Xám)",2290000,HaruShop168
28428546,https://www.sendo.vn/noi-giuong-cho-be-kem-chan-u-long-cuu-nhat-ban-28428546.html,Nôi giường cho bé kèm chăn ủ lông cừu Nhật Bản,1992000,EuroHome Siêu Thị Nhập Khẩu
28567545,https://www.sendo.vn/thanh-chan-giuong-baby-smilies-28567545.html,Thanh Chắn Giường Baby Smilies ,400000,Ngocphat212
28426451,https://www.sendo.vn/quay-cui-nhua-nguyen-sinh-an-toan-cho-be-2m4-2m4-tang-kem-tham-xop-bong-sot-dung-bong-28426451.html,QUÂY CŨI NHỰA NGUYÊN SINH AN TOÀN CHO BÉ 2M4-2M4 - TẶNG KÈM THẢM XỐP + BÓNG + SỌT ĐỰNG BÓNG,2220000,Khoailang Shop
29274118,https://www.sendo.vn/giuong-luoi-cho-be-29274118.html,giường lưới cho bé,350000,SIÊU THỊ GIA ĐÌNH 2
28566840,https://www.sendo.vn/ghe-hoi-tap-ngoi-hinh-vit-28566840.html,Ghế hơi tập ngồi hình vịt,95000,cơm sạch online
28422149,https://www.sendo.vn/giuong-luoi-cho-be-28422149.html,giường lưới cho bé,350000,SIÊU THỊ GIA ĐÌNH 2
28426819,https://www.sendo.vn/giuong-noi-xep-gon-cho-be-travel-home-28426819.html,Giường nôi xếp gọn cho bé Travel Home,1691000,EuroHome Siêu Thị Nhập Khẩu
28425893,https://www.sendo.vn/quay-cui-nhua-nguyen-sinh-an-toan-cho-be-1m6-1m6-tang-kem-tham-xop-bong-sot-dung-bong-28425893.html,QUÂY CŨI NHỰA NGUYÊN SINH AN TOÀN CHO BÉ 1M6-1M6 - TẶNG KÈM THẢM XỐP + BÓNG + SỌT ĐỰNG BÓNG,1580000,Khoailang Shop
28450000,https://www.sendo.vn/man-noi-cho-be-28450000.html,màn nôi cho bé,330000,ĐỒ GIA DỤNG CHO MỌI NHÀ
29307598,https://www.sendo.vn/thanh-chan-giuong-1m6-mau-xanh-29307598.html,Thanh chắn giường 1m6 màu xanh,299000,Nguyenty16
17417523,https://www.sendo.vn/noi-dien-autoru-cho-be-18kg-tro-xuong-17417523.html,nôi điện  autoru cho bé 18kg trở xuống,1300000,mua sam cung spring
28517403,https://www.sendo.vn/ghe-rung-nhun-cao-cap-28517403.html,ghế rung nhún cao cấp,630000,Shop Tiện Ích Gia Vinh
17154481,https://www.sendo.vn/combo-may-dua-vong-em-be-vinanoi-a100-suc-dua-100kg-va-diu-cho-be-17154481.html,COMBO Máy đưa võng em bé VINANOI - A100 sức đưa 100kg và Địu cho bé,700000,MeBeOnline
17177699,https://www.sendo.vn/1-thanh-chan-giuong-chan-dep-1m8-17177699.html,1 THANH CHẮN GIƯỜNG CHÂN DẸP 1M8  ,399000,shopdogiadung1207
17697880,https://www.sendo.vn/chieu-lua-dieu-hoa-cho-be-gia-dung-gia-re-amina-17697880.html,Chiều Lụa Điều Hòa Cho Bé - Gia Dụng Giá Rẻ Amina,119000,Siêu Thị Amina
16962035,https://www.sendo.vn/ghe-rung-nam-choi-bap-benh-co-nhac-mastela-6903-hong-hoa-tiet-16962035.html,Ghế rung nằm chơi bập bênh có nhạc Mastela-6903: HỒNG HOẠ TIẾT,939000,Vnkids Fashion
17858896,https://www.sendo.vn/noi-rung-tu-dong-17858896.html,NÔI RUNG TỰ ĐỘNG,899000,ĐỒ GIA DỤNG VIAN
18588102,https://www.sendo.vn/adapter-bo-chuyen-doi-dien-noi-autoru-18588102.html,Adapter Bộ chuyển đổi điện nôi Autoru,190000,YoYoShop99
18912217,https://www.sendo.vn/ban-le-luoi-vong-noi-dien-cac-loai-nguyen-luoi-vong-18912217.html,Bán lẻ lưới võng nôi điện các loại - Nguyên lưới võng,159000,Siêu Thị 24h Online
18752769,https://www.sendo.vn/tron-bo-vong-noi-dien-tang-kem-vong-nhu-hinh-18752769.html,Trọn bộ võng nôi điện tặng kèm võng như hình,870000,gaunhoibong
19053985,https://www.sendo.vn/tham-nam-choi-co-nhac-cho-be-0-24m-19053985.html,Thảm nằm chơi có nhạc cho bé 0-24m,164900,Rioshop888
18783137,https://www.sendo.vn/quay-cui-quay-bong-cho-be-hang-cao-cap-tang-kem-15-bong-global-18783137.html,Quây cũi quây bóng cho bé hàng Cao cấp - Tặng kèm 15 bóng Global,290000,Siêu Thị 24h Online
19275418,https://www.sendo.vn/combo-cui-giuong-go-soi-goldcat-mua-combo-nhan-qua-hap-han-ho-tro-phi-ship-19275418.html,"Combo cũi giường gỗ Sồi GoldCat - MUA COMBO NHẬN QUÀ HẤP HẪN, HỖ TRỢ PHÍ SHIP",3460000,Goldcat shop
19236507,https://www.sendo.vn/quay-bong-cho-be-hang-xuat-eu-19236507.html,Quây bóng cho bé hàng xuất EU,1899000,Công cụ Tinh Anh
19376609,https://www.sendo.vn/man-chup-tu-bung-du-kich-thuoc-19376609.html,Màn Chụp Tự Bung đủ kích thước,145000,cốm tinh nghịch
18851878,https://www.sendo.vn/vong-tu-dong-cho-be-vinanoi-vtd25-luoi-vong-mau-xanh-la-18851878.html,Võng tự động cho bé VINANOI - VTD25 Lưới võng màu xanh lá,990000,MeBeOnline
19267908,https://www.sendo.vn/cu-rung-sac-noi-dien-cho-be-2-in-1-dung-cho-dai-vi-thanh-hung-khanh-ngoc-19267908.html,"Củ rung, sạc nôi điện cho bé 2 in 1 - Dùng cho đại vĩ, thành hưng, khánh ngọc",33000,Shop Siêu Thị 24H
19376625,https://www.sendo.vn/giuong-luoi-cho-be-19376625.html,Giường lưới cho bé,249000,cốm tinh nghịch
19376443,https://www.sendo.vn/noi-kiem-vong-dien-cho-be-2-in-1-hang-viet-nam-19376443.html,NÔI KIÊM VÕNG ĐIỆN CHO BÉ 2 IN 1 HÀNG VIỆT NAM,1200000,Gia Dụng Bảo Hân
18531971,https://www.sendo.vn/noi-dien-vong-xep-2-trong-1-dai-vi-tang-kem-vong-18531971.html,Nôi điện Võng xếp 2 Trong 1 Đại Vĩ -Tặng kèm võng ,610000,ShopGau_trantham
19267259,https://www.sendo.vn/noi-dien-tu-dong-2-in-1-khanh-ngoc-tang-man-chong-muoi-vong-19267259.html,Nôi điện tự động 2 in 1 Khánh Ngọc - Tặng màn chống muỗi + võng,69000,Shop Siêu Thị 24H
19266885,https://www.sendo.vn/cu-rung-sac-noi-dien-khanh-ngoc-dai-vi-thanh-hung-19266885.html,"Củ rung + sạc nôi điện Khánh Ngọc, Đại Vĩ, Thành Hưng",35000,Shop Siêu Thị 24H
19269104,https://www.sendo.vn/bo-doi-nguon-sac-noi-dien-19269104.html,"BỘ ĐỔI NGUỒN, SẠC NÔI ĐIỆN",99000,Shop Siêu Thị 24H
19762054,https://www.sendo.vn/vong-xep-tu-dong-nguoi-lon-vinanoi-vn365-kvt-khung-thep-kem-luoi-dai-mau-xanh-la-19762054.html,Võng xếp tự động người lớn VINANOI VN365-KVT khung thép kèm lưới đại màu xanh lá,1145000,VINANOI
19376307,https://www.sendo.vn/giuong-luoi-cho-be-19376307.html,Giường lưới cho bé,335000,Gia Dụng Bảo Hân
19871273,https://www.sendo.vn/thanh-cha-n-giuo-ng-2m-cao-ca-p-19871273.html,THANH CHẮN GIƯỜNG 2M CAO CẤP,339000,GiaDụngBaMiền
19269179,https://www.sendo.vn/noi-may-chong-may-cho-be-chat-hoac-goi-cho-shop-truoc-khi-dat-hang-19269179.html,Nôi mây Chõng mây cho bé - Chat hoặc gọi cho shop trước khi đặt hàng,49000,Shop Siêu Thị 24H
19760592,https://www.sendo.vn/may-dua-vong-em-be-vinanoi-vn365-sieu-em-suc-dua-70kg-19760592.html,Máy đưa võng em bé VINANOI VN365 siêu êm sức đưa 70kg,495000,VINANOI
19222383,https://www.sendo.vn/noi-dien-dai-vi-2-trong-1-vua-la-noi-dien-vua-la-vong-xep-hang-vn-chat-luong-cao-19222383.html,NÔI ĐIỆN ĐẠI VĨ 2 TRONG 1 VỪA LÀ NÔI ĐIỆN VỪA LÀ VÕNG XẾP - HÀNG VN CHẤT LƯỢNG CAO,800000,Shop Mẹ Bé Nhímm
19709646,https://www.sendo.vn/1-thanh-chan-giuong-m8-mau-truot-khong-kenh-dem-thay-doi-7-nac-do-cao-19709646.html, 1 THANH CHẮN GIƯỜNG M8 MẪU TRƯỢT KHÔNG KÊNH ĐỆM THAY ĐỔI 7 NẤC ĐỘ CAO,339000,GIA DỤNG ĐĂNG MINH
18979567,https://www.sendo.vn/chieu-cao-su-chong-tham-cho-be-18979567.html,Chiếu cao su chống thấm Cho Bé,200000,THIÊN ĐƯỜNG MẸ VÀ BÉ
19817935,https://www.sendo.vn/combo-may-dua-vong-em-be-vinanoi-vn365-suc-dua-30kg-sieu-em-va-diu-em-be-19817935.html,COMBO Máy đưa võng em bé VINANOI - VN365 sức đưa 30kg siêu êm và Địu em bé,645000,VINANOI
19813861,https://www.sendo.vn/combo-may-dua-vong-em-be-vinanoi-vn365n-suc-dua-100kg-sieu-em-va-may-massage-mat-5in1-19813861.html,COMBO Máy đưa võng em bé VINANOI - Vn365N sức đưa 100kg siêu êm và Máy massage mặt 5in1,770000,VINANOI
19609279,https://www.sendo.vn/noi-ngu-chung-giuong-cho-be-19609279.html,Nôi ngủ chung giường cho bé,329000,timimart
18623573,https://www.sendo.vn/noi-dien-vong-xep-tu-dong-thanh-hung-2-trong-1-co-vong-man-chong-muoi-18623573.html,Nôi điện Võng xếp tự động Thành Hưng 2 Trong 1- Có võng màn chống muỗi,900000,BabyChip
19818549,https://www.sendo.vn/combo-may-dua-vong-em-be-vinanoi-vn365-suc-dua-30kg-sieu-em-va-may-massage-mat-5in1-19818549.html,COMBO Máy đưa võng em bé VINANOI - VN365 sức đưa 30kg siêu êm và  máy massage mặt 5in1,645000,VINANOI
19322617,https://www.sendo.vn/cui-giuong-go-que-moc-goldcat-mua-cui-tang-man-ho-tro-phi-ship-19322617.html,"Cũi giường gỗ Quế Mộc GoldCat - MUA CŨI TẶNG MÀN, HỖ TRỢ PHÍ SHIP",1900000,Goldcat shop
18680817,https://www.sendo.vn/bo-doi-sac-noi-dien-nguyen-sac-18680817.html,BỘ ĐỔI SẠC NÔI ĐIỆN - NGUYÊN SẠC,160000,Siêu Thị 24h Online
20096111,https://www.sendo.vn/chieu-dieu-hoa-soi-lua-kem-goi-ngu-thao-moc-cho-be-20096111.html,Chiếu điều hòa sợi lụa kèm gối ngủ thảo mộc cho bé,235000,Vinakara
19441047,https://www.sendo.vn/cui-3d-linh-hoat-19441047.html,Cũi 3d Linh Hoạt,850000,Cui 3d
19632812,https://www.sendo.vn/ghe-rung-phat-nhac-cho-be-19632812.html,Ghế rung phát nhạc cho bé,429000,GIA DỤNG ĐĂNG MINH
19466861,https://www.sendo.vn/chie-u-lu-a-die-u-ho-a-ta-ng-ke-m-go-i-tha-o-duo-c-cho-be-19466861.html,Chiếu Lụa Điều Hòa Tặng Kèm Gối Thảo Dược Cho Bé,79000,Mẹ Ben
