product_id,product_url,name,price,shop_name
28450000,https://www.sendo.vn/man-noi-cho-be-28450000.html,màn nôi cho bé,330000,ĐỒ GIA DỤNG CHO MỌI NHÀ
26624716,https://www.sendo.vn/quay-cui-bang-go-tu-nhien-cho-be-loai-4-mieng-hang-viet-nam-26624716.html,QUÂY CŨI BẰNG GỖ TỰ NHIÊN CHO BÉ LOẠI 4 MIẾNG HÀNG VIỆT NAM,1650000,Cái Gì Chẳng Có 68
26624847,https://www.sendo.vn/cui-quay-bang-go-tu-nhien-cho-be-loai-6-mieng-hang-viet-nam-26624847.html,CŨI QUÂY BẰNG GỖ TỰ NHIÊN CHO BÉ LOẠI 6 MIẾNG HÀNG VIỆT NAM,2350000,Cái Gì Chẳng Có 68
26626162,https://www.sendo.vn/cui-quay-bang-go-tu-nhien-cho-be-loai-4-mieng-hang-viet-nam-26626162.html,CŨI QUÂY BẰNG GỖ TỰ NHIÊN CHO BÉ LOẠI 4 MIẾNG HÀNG VIỆT NAM,1650000,Cái Gì Chẳng Có 1
29378586,https://www.sendo.vn/giuong-luoi-cho-be-29378586.html,GIƯỜNG LƯỚI CHO BÉ,295000,HÀNGTIỆNÍCH
26937071,https://www.sendo.vn/bo-dem-quay-cui-mau-moi-2020-quay-cui-khinh-khi-cau-cho-be-vai-cotton-khicauhongs3003-26937071.html,Bộ Đệm Quây Cũi MẪU MỚI 2020 - QUÂY CŨI KHINH KHÍ CẦU CHO BÉ VẢI COTTON - KHICAUHONGS3003,469000,Shop Mẹ Đô Đậu
28567545,https://www.sendo.vn/thanh-chan-giuong-baby-smilies-28567545.html,Thanh Chắn Giường Baby Smilies ,400000,Ngocphat212
28566840,https://www.sendo.vn/ghe-hoi-tap-ngoi-hinh-vit-28566840.html,Ghế hơi tập ngồi hình vịt,95000,cơm sạch online
28466728,https://www.sendo.vn/noi-ngu-cho-be-28466728.html,Nôi ngủ cho bé,239000,QuyenHa
5359934,https://www.sendo.vn/noi-dien-tu-dong-vinanoi-vnn201m-5359934.html,Nôi điện tự động VinaNoi VNN201M,3400000,baby68
4104487,https://www.sendo.vn/vinanoi-vnn201-noi-dien-em-be-bang-go-thong-2-tang-3-trong-1-4104487.html,VINANOI VNN201 - Nôi điện em bé bằng gỗ thông 2 tầng 3 trong 1,3400000,MeBeOnline
28232863,https://www.sendo.vn/giuong-luoi-cho-be-28232863.html,giường lưới cho bé,340000,GiadungDinhVinh
5312472,https://www.sendo.vn/giuong-cui-xk-80x127-5312472.html,Giường cũi XK 80x127,1750000,baby68
5282109,https://www.sendo.vn/ghe-rung-x7033-cho-be-ghe-rung-0973809698-5282109.html,GHẾ RUNG X7033 CHO BÉ-  GHẾ RUNG - -0973809698,407000,Hàng gia dụng giá sốc
5277667,https://www.sendo.vn/giuong-tang-1m4-bella-bb-228-nhieu-mau-kem-hoc-keo-5277667.html,Giường tầng 1m4 Bella BB 228 nhiều màu kèm hộc kéo,4550000,baby68
19466114,https://www.sendo.vn/giuo-ng-noi-rung-cao-ca-p-ke-t-ho-p-do-choi-xu-c-xa-c-cho-be-19466114.html,Giường Nôi Rung Cao Cấp Kết Hợp Đồ Chơi Xúc Xắc Cho Bé,699000,Đồ Chơi Giáo Dục Benrikids
18960467,https://www.sendo.vn/ghe-bong-tap-ngoi-18960467.html,Ghế Bông Tập Ngồi,250000,muasamgiare
7457806,https://www.sendo.vn/ghe-rung-cho-be-7457806.html,ghế rung cho bé,480000,Ninh Thinh
29948461,https://www.sendo.vn/free-ship-1-cap-chieu-truc-viet-nam-thoang-mat-cho-em-be-2-chiec-29948461.html,[FREE SHIP]  1 CĂP Chiếu trúc   việt nam THOÁNG MÁT  CHO EM BÉ [ 2 CHIẾC],126591,dothidiem
30014395,https://www.sendo.vn/bo-10-mieng-tham-cao-su-phuoc-thanh-10-mau-30-x-30-cm-30014395.html,Bộ 10 Miếng Thảm Cao Su Phước Thành 10 màu (30 x 30 cm),77900,Tiki Trading Platinum Mall
28344223,https://www.sendo.vn/noi-tu-dong-cao-cap-danh-cho-be-sg239-hieu-mastela-mau-xam-nhat-28344223.html,Nôi tự động cao cấp dành cho bé SG239 hiệu Mastela màu xám nhạt,2279000,BabyKingdom
19449350,https://www.sendo.vn/bo-10-ta-cheo-so-sinh-yen-trang-19449350.html,Bộ 10 tã chéo sơ sinh Yến Trang,23000,Cubon Shop
10655942,https://www.sendo.vn/noi-kiem-vong-dien-cho-be-2-trong-1-made-in-viet-nam-10655942.html,NÔI KIÊM VÕNG ĐIỆN CHO BÉ 2 TRONG 1 -MADE IN VIET NAM,629000,sieuthidochoi
22878780,https://www.sendo.vn/cui-quay-luc-giac-be-choi-22878780.html,Cũi quây lục giác bé chơi,430000,SHOP MẸ VÀ BÉ 89
19447821,https://www.sendo.vn/chan-u-carter-cotton-2-lop-19447821.html,Chăn ủ carter Cotton 2 lớp,89000,Cubon Shop
28517646,https://www.sendo.vn/ghe-rung-nhun-cao-cap-28517646.html,ghế rung nhún cao cấp,630000,SHOP MẸ VÀ BÉ 89
28769392,https://www.sendo.vn/giuong-luoi-cho-be-28769392.html,giường lưới cho bé,350000,SHOP MẸ VÀ BÉ 89
23598498,https://www.sendo.vn/noi-rung-noi-nhun-cho-be-23598498.html,NÔI RUNG NÔI NHÚN CHO BÉ ,630000,SHOP MẸ VÀ BÉ 89
28405609,https://www.sendo.vn/giuong-thay-ta-xep-gon-chong-dau-lung-cho-me-c1-st3849-28405609.html,"Giường thay tã xếp gọn, chống đau lưng cho mẹ C1-ST3849",990000,Phụ kiện HnL
11843538,https://www.sendo.vn/ke-ech-chu-a-con-vet-11843538.html,Kệ ếch chữ A con vẹt,150000,giadinhshop
17241242,https://www.sendo.vn/cui-tre-em-c71a-xanh-70-x-110-cm-17241242.html,Cũi Trẻ Em C71A-Xanh 70 x 110 cm ,1750000,NOLULU SHOP
17249520,https://www.sendo.vn/cui-tre-em-go-que-c21-80-x-120-cm-17249520.html,Cũi Trẻ Em Gỗ Quế C21 80 x 120 cm,1950000,NOLULU SHOP
17299412,https://www.sendo.vn/noi-go-cho-be-0-2-tuoi-87x45x25cm-17299412.html,Nôi gỗ cho bé 0-2 tuổi 87x45x25cm,1450000,HanRui Shop
25002097,https://www.sendo.vn/cui-quay-3d-quay-bong-25002097.html,Cũi Quây 3D - Quây Bóng,1600000,Baby Kid
29307620,https://www.sendo.vn/thanh-chan-giuong-aachman-7-cap-do-mau-hong-29307620.html,Thanh chắn giường Aachman 7 cấp độ màu hồng,299000,Nguyenty16
11132943,https://www.sendo.vn/noi-dien-dua-tu-dong-cho-be-co-nhac-boss-baby-11132943.html,Nôi điện đưa tự động cho bé có nhạc Boss Baby,1480000,HanRui Shop
29307572,https://www.sendo.vn/thanh-chan-giuong-2m-mau-xanh-29307572.html,Thanh chắn giường 2m màu xanh,299000,Nguyenty16
21487809,https://www.sendo.vn/quay-cui-kiem-nha-bong-khung-inox-tang-kem-bong-da-sac-21487809.html,Quây Cũi Kiêm Nhà Bóng Khung Inox Tặng Kèm Bóng Đa Sắc,100000,Miu Miu Shop PT
21704401,https://www.sendo.vn/tham-xop-2-mat-maboshi-mau-ngau-nhien-nhieu-kich-thuoc-21704401.html,THẢM XỐP 2 MẶT MABOSHI  MÀU NGẪU NHIÊN NHIỀU KÍCH THƯỚC,59000,Thảm xốp bỉm tã
18556484,https://www.sendo.vn/nha-bong-kiem-cui-hang-cao-cap-loai-1-quay-bong-quay-cui-cho-be-18556484.html,Nhà Bóng Kiêm Cũi Hàng Cao Cấp Loại 1 Quây Bóng Quây Cũi Cho Bé,49000,Shop Siêu Thị 24H
18556512,https://www.sendo.vn/quay-cui-kiem-nha-bong-khung-inox-cho-be-tang-kem-bong-da-sac-18556512.html,Quây Cũi Kiêm Nhà Bóng Khung Inox Cho Bé Tặng Kèm Bóng Đa Sắc,29000,Shop Siêu Thị 24H
26677539,https://www.sendo.vn/noi-tre-dat-vong-size-90-chong-cong-lung-tai-ha-noi-26677539.html,nôi tre đặt võng size 90 chống còng lưng tại Hà Nội,155000,B2B
18557053,https://www.sendo.vn/noi-dien-vong-xep-2-trong-1-tang-vong-man-chong-muoi-18557053.html,"Nôi Điện Võng Xếp 2 Trong 1 - Tặng Võng, Màn Chống Muỗi",66000,Shop Siêu Thị 24H
19269103,https://www.sendo.vn/bo-doi-nguon-cu-rung-may-rung-noi-dien-nguyen-cu-rung-19269103.html,"BỘ ĐỔI NGUỒN, CỦ RUNG, MÁY RUNG NÔI ĐIỆN - Nguyên củ rung",49000,Shop Siêu Thị 24H
19269781,https://www.sendo.vn/cu-rung-noi-dien-sac-noi-dien-dai-vi-19269781.html,Củ rung nôi điện + sạc nôi điện Đại Vĩ,30000,Shop Siêu Thị 24H
19268955,https://www.sendo.vn/noi-dien-tu-dong-long-hung-dai-vi-thanh-hung-khanh-ngoc-lay-mau-nao-chat-voi-shop-hoac-ghi-chu-o-don-hang-19268955.html,"Nôi điện tự động Long Hưng, Đại vĩ, Thành Hưng, Khánh Ngọc - lấy mẫu nào chat với shop hoặc ghi chú ở đơn hàng",69000,Shop Siêu Thị 24H
19267920,https://www.sendo.vn/noi-dien-vong-xep-2-tang-co-dai-2-trong-1-co-man-chong-muoi-tang-vong-19267920.html,Nôi điện Võng xếp 2 tầng cỡ đại 2 Trong 1 - Có màn chống muỗi  + tặng võng ,99000,Shop Siêu Thị 24H
19267151,https://www.sendo.vn/noi-dien-vong-xep-tu-dong-thanh-hung-2-trong-1-co-man-chong-muoi-tang-vong-19267151.html,Nôi điện Võng xếp tự động Thành Hưng 2 Trong 1 - Có màn chống muỗi + tặng võng,65000,Shop Siêu Thị 24H
18556524,https://www.sendo.vn/day-curoa-cho-noi-dien-2-tang-1-bo-2-day-18556524.html,Dây Curoa Cho Nôi Điện 2 tầng - 1 Bộ 2 dây,35000,Shop Siêu Thị 24H
18556069,https://www.sendo.vn/noi-dien-vong-xep-2-tang-co-dai-2-trong-1-tang-vong-man-chong-muoi-giuong-tang-18556069.html,"Nôi điện Võng xếp 2 tầng cỡ đại 2 Trong 1 - Tặng võng, màn chống muỗi, giường tầng",150000,Shop Siêu Thị 24H
25847532,https://www.sendo.vn/cuc-nguon-may-dua-vong-25847532.html,Cục nguồn máy đưa võng,169000,BẢO ĐẠT
18556668,https://www.sendo.vn/day-curoa-cho-noi-dien-1-tang-1-bo-2-day-18556668.html,Dây Curoa Cho Nôi Điện 1 Tầng - 1 Bộ 2 Dây,35000,Shop Siêu Thị 24H
19376555,https://www.sendo.vn/combo-bo-2-day-curoa-noi-dai-vi-19376555.html,combo bộ 2 dây curoa nôi đại vĩ,49000,cốm tinh nghịch
18556267,https://www.sendo.vn/ghe-rung-cao-cap-cho-be-co-bao-hiem-do-choi-mai-che-goi-dau-18556267.html,"Ghế rung Cao cấp cho bé - Có bảo hiểm, đồ chơi, mái che, gối đầu",38000,Shop Siêu Thị 24H
18556063,https://www.sendo.vn/noi-dien-vong-xep-2-trong-1-tang-vong-man-chong-muoi-18556063.html,Nôi điện Võng Xếp 2 trong 1 - Tặng võng màn chống muỗi,90000,Shop Siêu Thị 24H
30014329,https://www.sendo.vn/bo-26-mieng-tham-cao-su-phuoc-thanh-hinh-chu-cai-30-x-30-cm-30014329.html,Bộ 26 Miếng Thảm Cao Su Phước Thành Hình Chữ Cái (30 x 30 cm),194000,Tiki Trading Platinum Mall
30014359,https://www.sendo.vn/bo-10-mieng-tham-cao-su-phuoc-thanh-hinh-phuong-tien-giao-thong-30-x-30-cm-30014359.html,Bộ 10 Miếng Thảm Cao Su Phước Thành Hình Phương Tiện Giao Thông (30 x 30 cm),103900,Tiki Trading Platinum Mall
24934201,https://www.sendo.vn/noi-dien-tu-dong-khanh-ngoc-vua-la-noi-vua-la-vong-xep-24934201.html,Nôi điện tự động Khánh Ngọc vừa là nôi vừa là võng xếp,695000,Kimthoan
30567909,https://www.sendo.vn/quay-cui-kiem-nha-bong-cho-be-30567909.html,QUÂY CŨI KIÊM NHÀ BÓNG CHO BÉ,298000,Họa mi tóc nâu
24934068,https://www.sendo.vn/noi-dien-tu-dong-khanh-ngoc-24934068.html,Nôi điện tự động Khánh Ngọc❤,685000,Kimthoan
16313070,https://www.sendo.vn/vong-noi-cho-be-dai-vi-khong-dien-tang-man-chong-muoi-tam-lot-lung-16313070.html,"Võng Nôi Cho Bé Đại Vĩ Không Điện - Tặng Màn Chống Muỗi, Tấm Lót Lưng",599000,shopluandung
12323178,https://www.sendo.vn/nha-bong-khung-inox-cui-inox-tre-em-12323178.html,nhà bóng khung inox - cũi inox trẻ em,298000,HÀNG LOẠI I
27970331,https://www.sendo.vn/giuong-luoi-cho-be-chong-ra-mo-hoi-27970331.html,GIƯỜNG LƯỚI CHO BÉ CHỐNG RA MỒ HÔI,230000,Thế giới tạp hóa
25037340,https://www.sendo.vn/goi-chong-trao-nguoc-babystar-25037340.html,GỐI CHỐNG TRÀO NGƯỢC BABYSTAR,359000,shop Muns
28852515,https://www.sendo.vn/noi-rung-2-tang-quang-hung-qh02-28852515.html,Nôi rung 2 tầng Quang Hưng QH02,1150000,siêu thị TELO
24881700,https://www.sendo.vn/goi-chong-trao-nguoc-babystar-tang-2-mieng-lot-chong-tham-cotton-va-goi-chong-lom-dau-24881700.html,GỐI CHỐNG TRÀO NGƯỢC BABYSTAR-Tặng 2 miếng lót chống thấm cotton và gối chống lõm đầu!,398000,shop Muns
23876431,https://www.sendo.vn/bo-man-khung-treo-cui-23876431.html,Bộ màn khung treo cũi,189000,shop Muns
13350062,https://www.sendo.vn/1-thanh-chan-giuong-babyqiner-mau-moi-2018-truot-len-xuong-1m8-13350062.html,1 Thanh chắn giường babyqiner mẫu mới 2018 trượt lên xuống 1M8,420000,GIADUNGLINHDAM
13350251,https://www.sendo.vn/1-thanh-chan-giuong-mau-moi-truot-len-xuong-2018-1m8-13350251.html,1 thanh chắn giường mẫu mới trượt lên xuống 2018 1M8,399000,GIADUNGLINHDAM
20936379,https://www.sendo.vn/noi-tu-dong-autoru-2-tang-3-sao-20936379.html,Nôi tự động Autoru 2 tầng 3 sao,2090000,YoYoShop99
26661263,https://www.sendo.vn/noi-cui-go-cho-be-playpen-6-canh-26661263.html,Nôi cũi gỗ cho bé Playpen 6 cánh,1200000,YoYoShop99
10155573,https://www.sendo.vn/nem-cho-be-nem-cao-cap-cho-be-10155573.html,Nệm cho bé - Nệm cao cấp cho bé,399000,Đại Tâm online
28070061,https://www.sendo.vn/quay-cui-bang-sat-cho-be-3d-28070061.html,Quây cũi bằng sắt cho bé 3d,880000,YoYoShop99
19293827,https://www.sendo.vn/noi-tu-dong-autoru-eco18-19293827.html,Nôi tự động Autoru ECO18,1090000,YoYoShop99
13205477,https://www.sendo.vn/man-nhac-cho-be-yeu-13205477.html,Màn nhạc cho bé yêu,199000,SHOPTRUCTUYEN
14103222,https://www.sendo.vn/day-curoa-cho-noi-dien-1-tang-1-bo-2-day-14103222.html,Dây Curoa Cho Nôi Điện 1 tầng - 1 Bộ 2 dây,35000,Siêu Thị 24h Online
12553612,https://www.sendo.vn/ghe-rung-ghe-nhun-3-tu-the-kem-goi-co-do-choi-treo-dang-ke-chu-a-12553612.html,Ghế rung ghế nhún 3 tư thế kèm gối - Có đồ chơi treo dạng kệ chữ A,259000,Siêu Thị 24h Online
12796087,https://www.sendo.vn/noi-dien-2-in-1-cho-be-tang-vong-man-chong-muoi-12796087.html,Nôi điện 2 in 1 cho bé - Tặng võng màn chống muỗi,720000,Siêu Thị 24h Online
12578889,https://www.sendo.vn/noi-dien-vong-xep-2-tang-co-dai-2-trong-1-tang-vong-man-chong-muoi-giuong-tang-12578889.html,"Nôi điện Võng xếp 2 tầng cỡ đại 2 Trong 1 - Tặng võng, màn chống muỗi, giường tầng",1150000,Siêu Thị 24h Online
19000567,https://www.sendo.vn/noi-dien-vong-xep-2-trong-1-dai-vi-tang-2-day-curoa-vong-man-chong-muoi-19000567.html,Nôi điện Võng xếp 2 Trong 1 Đại Vĩ -Tặng 2 dây Curoa + võng +  màn chống muỗi,680000,Siêu Thị 24h Online
16035156,https://www.sendo.vn/ghe-rung-cao-cap-cho-be-co-bao-hiem-do-choi-mai-che-dieu-chinh-nam-ngoi-16035156.html,"Ghế Rung Cao Cấp Cho Bé - Có Bảo Hiểm, Đồ Chơi, Mái Che, Điều Chỉnh Nằm Ngồi",370000,Siêu Thị 24h Online
18747318,https://www.sendo.vn/noi-dien-tu-dong-long-hung-dai-vi-thanh-hung-khanh-ngoc-lay-mau-nao-chat-voi-shop-hoac-ghi-chu-o-don-hang-18747318.html,"Nôi điện tự động Long Hưng, Đại vĩ, Thành Hưng, Khánh Ngọc - lấy mẫu nào chat với shop hoặc ghi chú ở đơn hàng",720000,Siêu Thị 24h Online
17510657,https://www.sendo.vn/quay-cui-kiem-nha-bong-cho-be-hang-loai-1-tang-bong-di-kem-17510657.html,Quây cũi kiêm nhà bóng cho bé - hàng loại 1 tặng bóng đi kèm,290000,Siêu Thị 24h Online
11390564,https://www.sendo.vn/noi-dien-vong-xep-2-trong-1-dai-vi-tang-kem-vong-man-chong-muoi-tam-lot-lung-11390564.html,"Nôi điện Võng xếp 2 Trong 1 Đại Vĩ - Tặng kèm võng, màn chống muỗi, tấm lót lưng",680000,Siêu Thị 24h Online
25367451,https://www.sendo.vn/quay-cui-kiem-nha-bong-khung-inox-tang-kem-bong-da-sac-2021-25367451.html,Quây Cũi Kiêm Nhà Bóng Khung Inox Tặng Kèm Bóng Đa Sắc 2021,290000,Siêu Thị 24h Online
25366668,https://www.sendo.vn/tham-xop-hai-mat-maboshi-hang-viet-nam-cao-cap-cho-be-vua-hoc-vua-choi-2020-25366668.html,THẢM XỐP HAI MẶT MABOSHI HÀNG VIỆT NAM CAO CẤP - CHO BÉ VỪA HỌC VỪA CHƠI 2020,95000,Siêu Thị 24h Online
21891974,https://www.sendo.vn/noi-dien-dai-vi-2-trong-1-vua-la-noi-dien-vua-la-vong-xep-hang-vn-chat-luong-cao-21891974.html,NÔI ĐIỆN ĐẠI VĨ 2 TRONG 1 VỪA LÀ NÔI ĐIỆN VỪA LÀ VÕNG XẾP - HÀNG VN CHẤT LƯỢNG CAO,680000,Siêu Thị 24h Online
21745083,https://www.sendo.vn/giuong-noi-xach-tay-da-nang-cho-be-giuong-noi-di-dong-giuong-noi-ngu-chung-bo-me-tu-0-1-tuoi-xam-tang-kem-goi-chong-bep-dau-21745083.html,"Giường Nôi xách tay đa năng cho bé, giường nôi di động, giường nôi ngủ chung bố mẹ từ 0 1 tuổi xám Tặng kèm gối chống bẹp đầu",849000,dautram_ngoctuyet
22766255,https://www.sendo.vn/bo-doi-nguon-cap-nguon-noi-dien-nguyen-sac-22766255.html,Bộ đổi nguồn cấp nguồn nôi điện - Nguyên sạc,159000,Siêu Thị 24h Online
23527155,https://www.sendo.vn/noi-dien-2-tang-kiem-vong-2in1-co-man-chong-muoi-23527155.html,NÔI ĐIỆN 2 TẦNG KIÊM VÕNG 2IN1 CÓ MÀN CHỐNG MUỖI,1150000,Siêu Thị 24h Online
23711454,https://www.sendo.vn/noi-kiem-vong-dien-cho-be-2-trong-1-made-in-viet-nam-23711454.html,NÔI KIÊM VÕNG ĐIỆN CHO BÉ 2 TRONG 1 MADE IN VIET NAM ,660000,Siêu Thị 24h Online
20393379,https://www.sendo.vn/ghe-rung-phat-nhac-cho-be-ghe-rung-phat-nhac-cho-be-20393379.html,Ghế rung phát nhạc cho bé - Ghế rung phát nhạc cho bé,429000,GIA DỤNG ĐĂNG MINH
26454121,https://www.sendo.vn/tam-lot-chong-tham-4-lop-cho-be-yeu-26454121.html,Tấm lót chống thấm 4 lớp cho bé yêu,42000,SHOP MẸ VỊT 
19632830,https://www.sendo.vn/1-thanh-chan-giuong-2018-mau-truot-len-xuong-1m6-19632830.html,1 thanh chắn giường 2018 mẫu trượt lên xuống 1m6,339000,GIA DỤNG ĐĂNG MINH
19074294,https://www.sendo.vn/dem-ngu-dung-tu-the-chong-trao-nguoc-babymoov-bm14836-19074294.html,ĐỆM NGỦ ĐÚNG TƯ THẾ & CHỐNG TRÀO NGƯỢC BABYMOOV BM14836,1439000,SHOP MẸ VỊT 
24296257,https://www.sendo.vn/quay-bong-vai-du-cho-be-24296257.html,Quây bóng vải dù cho bé,480000,Shop Tiện Ích Gia Vinh
23312396,https://www.sendo.vn/quay-bong-cho-be-23312396.html,QUÂY BÓNG CHO BÉ ,350000,chuyên đồ gia dụng hương
10460200,https://www.sendo.vn/giuong-luoi-cho-be-10460200.html,Giường lưới Cho Bé,350000,chuyên đồ gia dụng hương
23044785,https://www.sendo.vn/noi-dien-thanh-hung-2-trong-1-vua-la-noi-dien-vua-la-vong-xep-noi-dien-2in1-23044785.html,NÔI ĐIỆN THÀNH HƯNG 2 TRONG 1 VỪA LÀ NÔI ĐIỆN VỪA LÀ VÕNG XẾP - Nôi điện 2in1,660000,Siêu Thị 24h Online
10672102,https://www.sendo.vn/ghe-dung-cho-be-10672102.html,Ghế Dung Cho Bé,290000,chuyên đồ gia dụng hương
12052123,https://www.sendo.vn/giuong-luoi-cho-be-12052123.html,Giường Lưới Cho Bé,340000,chuyên đồ gia dụng hương
17075689,https://www.sendo.vn/cui-quay-cho-be-17075689.html,CŨI QUÂY CHO BÉ,420000,chuyên đồ gia dụng hương
12052097,https://www.sendo.vn/giuong-luoi-cho-be-12052097.html,Giường Lưới Cho Bé,330000,chuyên đồ gia dụng hương
11265625,https://www.sendo.vn/giuong-luoi-cho-be-11265625.html,Giường Lưới Cho Bé,340000,chuyên đồ gia dụng hương
11467484,https://www.sendo.vn/giuong-luoi-cho-be-11467484.html,Giường Lưới Cho Bé,350000,chuyên đồ gia dụng hương
11722714,https://www.sendo.vn/quay-bong-lam-cui-luoi-kem-100-bong-11722714.html,Quây Bóng  Làm Cũi Lưới Kèm 100 bóng,530000,chuyên đồ gia dụng hương
12992562,https://www.sendo.vn/giuong-luoi-cho-be-12992562.html,Giường Lưới Cho Bé,340000,chuyên đồ gia dụng hương
13466164,https://www.sendo.vn/cui-quay-cho-be-13466164.html,cũi quây cho bé,480000,chuyên đồ gia dụng hương
11492695,https://www.sendo.vn/ghe-dung-cho-be-hang-chuan-11492695.html,Ghế Dung Cho Bé Hàng Chuẩn,620000,chuyên đồ gia dụng hương
14041391,https://www.sendo.vn/cui-quay-kem-100-bong-cho-be-14041391.html,cũi quây kèm 100 bóng cho bé,510000,chuyên đồ gia dụng hương
11722749,https://www.sendo.vn/quay-bong-cui-luoi-11722749.html,Quây Bóng Cũi Lưới,480000,chuyên đồ gia dụng hương
30246643,https://www.sendo.vn/noi-vong-cho-be-30246643.html,NÔI VÕNG CHO BÉ,969000,HÀNGTIỆNÍCH
17025631,https://www.sendo.vn/cui-quay-cho-be-17025631.html,CŨI QUÂY CHO BÉ ,420000,chuyên đồ gia dụng hương
10460163,https://www.sendo.vn/giuong-luoi-cho-be-10460163.html,Giường Lưới Cho Bé,350000,chuyên đồ gia dụng hương
12897510,https://www.sendo.vn/cui-quay-cho-be-12897510.html,cũi quây cho bé,480000,chuyên đồ gia dụng hương
18869036,https://www.sendo.vn/quay-cui-nhua-loai-16-mieng-cho-be-tang-tham-va-bong-hang-cao-cap-18869036.html,QUÂY CŨI NHỰA LOẠI 16 MIẾNG CHO BÉ  TẶNG THẢM VÀ BÓNG HÀNG CAO CẤP,1720000,Cái Gì Chẳng Có 1
22688881,https://www.sendo.vn/noi-go-cui-go-giuong-cho-be-22688881.html,Nôi gỗ - Cũi gỗ - Giường cho bé,1509000,HONA BEAT
23650386,https://www.sendo.vn/qua-dinh-0d-noi-cho-be-tang-dai-diu-4-tu-the-23650386.html,[QUÀ ĐỈNH 0Đ] Nôi Cho Bé - Tặng Đai Địu 4 Tư Thế,1900000,ssssky shop
21770643,https://www.sendo.vn/bo-doi-nguon-may-dua-noi-dien-noi-dai-vi-21770643.html,Bộ đổi nguồn máy đưa nôi điện Nôi Đại Vĩ,185000,VongxepMantubung
29963976,https://www.sendo.vn/may-nghe-tieng-on-trang-may-nghe-tieng-on-trang-white-noise-may-ru-ngu-may-tao-tieng-ru-cho-be-ngu-ngon-29963976.html,Máy Nghe Tiếng Ồn Trắng - Máy Nghe Tiếng Ồn Trắng White Noise - Máy Ru Ngủ - Máy tạo tiếng ru cho bé ngủ ngon.,165000,TARANTO SHOES
16121569,https://www.sendo.vn/cui-quay-cho-be-16121569.html,CŨI QUÂY CHO BÉ ,350000,GiadungDinhVinh
22745017,https://www.sendo.vn/cui-cui-cui-giuong-go-thong-cao-cap-22745017.html,Cũi - cũi - cũi giường gỗ thông cao cấp,1509000,HONA HOME
28137669,https://www.sendo.vn/day-curoa-noi-hoang-thanh-2-day-28137669.html,Dây curoa nôi Hoàng Thành (2 dây),29000,hoa giay
20438640,https://www.sendo.vn/may-dua-vong-bao-hanh-6-thang-chinh-hang-20438640.html,MÁY ĐƯA VÕNG BẢO HÀNH 6 THÁNG CHÍNH HÃNG,380000,Anh Bo
17099037,https://www.sendo.vn/cui-quay-cho-be-17099037.html,CŨI QUÂY CHO BÉ ,350000,Dogiadung99
21836395,https://www.sendo.vn/tham-choi-cho-be-don-mau-pastel-10-mieng-dien-tich-1m2-smile-puzzle-khong-mui-21836395.html,"Thảm chơi cho bé đơn màu Pastel 10 miếng, diện tích 1m2 Smile Puzzle Không mùi",114000,SmilePuzzleVN
29508045,https://www.sendo.vn/cuc-dua-cua-noi-dien-29508045.html,Cục Đưa Của Nôi Điện,250000,màn chụp tự bung
19795183,https://www.sendo.vn/noi-dien-tu-dong-cho-be-vinanoi-vnn201t-go-thong-mau-trang-19795183.html,Nôi điện tự động cho bé VINANOI VNN201T - Gỗ thông màu trắng,2999000,"Engineering Services Co., Ltd"
19795721,https://www.sendo.vn/noi-dien-tu-dong-cho-be-vinanoi-vnn201-go-thong-mau-tu-nhien-19795721.html,Nôi điện tự động cho bé VINANOI VNN201 - Gỗ thông màu tự nhiên,2900000,"Engineering Services Co., Ltd"
19892434,https://www.sendo.vn/noi-vong-tu-dong-cho-be-hai-trong-mot-vinanoi-nv25-19892434.html,Nôi võng tự động cho bé hai trong một Vinanoi - NV25,1149000,"Engineering Services Co., Ltd"
20943783,https://www.sendo.vn/giuong-luoi-tre-em-20943783.html,GIƯỜNG LƯỚI TRẺ EM,340000,GIA DỤNG TỔNG HỢP VIAN
24527155,https://www.sendo.vn/quay-bong-luc-giac-cho-be-24527155.html,QUÂY BÓNG LỤC GIÁC CHO BÉ,390000,GIA DỤNG TỔNG HỢP VIAN
3583443,https://www.sendo.vn/giuong-cui-graco-pnp-reversible-napper-changer-nyssa-1893760-3583443.html,Giường cũi Graco PNP Reversible Napper Changer Nyssa 1893760,3600000,Chăm sóc bé sơ sinh
4704895,https://www.sendo.vn/ghe-noi-da-nang-prumea-s-4704895.html,Ghế nôi đa năng Prumea S,3600000,Chăm sóc bé sơ sinh
5488132,https://www.sendo.vn/noi-dua-graco-lovin-hug-counting-sheep-1953167-5488132.html,Nôi đưa Graco Lovin Hug Counting Sheep 1953167,3200000,Chăm sóc bé sơ sinh
9450509,https://www.sendo.vn/giuong-cui-tre-em-joie-commuter-change-snooze-linen-gray-9450509.html,GIƯỜNG CŨI TRẺ EM JOIE COMMUTER CHANGE SNOOZE LINEN GRAY,2750000,Chăm sóc bé sơ sinh
3096186,https://www.sendo.vn/aprica-noi-3-chuc-nang-nemyu-std-569-be-88366-3096186.html,Aprica - Nôi 3 chức năng Nemyu STD 569 BE 88366,5000000,Chăm sóc bé sơ sinh
3129039,https://www.sendo.vn/giuong-cui-graco-pnp-reversible-napper-changer-soho-square-1812041-3129039.html,Giường cũi Graco PNP Reversible Napper Changer Soho Square 1812041,3600000,Chăm sóc bé sơ sinh
19280144,https://www.sendo.vn/noi-vong-tu-dong-da-nang-nv35x-19280144.html,Nôi Võng Tự Động Đa Năng NV35X,1450000,Chăm sóc bé sơ sinh
10577409,https://www.sendo.vn/chan-luoi-cho-be-10577409.html,chăn lưới cho bé,85000,Gia dụng giá rẻ Đà Nẵng
3511340,https://www.sendo.vn/giuong-cui-graco-pnp-on-the-go-signal-1895915-3511340.html,Giường cũi Graco PNP On The Go Signal 1895915,2399000,Chăm sóc bé sơ sinh
28172984,https://www.sendo.vn/set-noi-dem-cho-be-28172984.html,Set nôi đệm cho bé,429000,QuyenHa
11859701,https://www.sendo.vn/quay-cui-goc-tron-size-s-11859701.html,QUÂY CŨI GÓC TRÒN SIZE S,1800000,shop thaothy16
19533974,https://www.sendo.vn/trong-do-choi-tre-em-19533974.html,TRỐNG ĐỒ CHƠI TRẺ EM,25000,Dososinhgiagoc
13401862,https://www.sendo.vn/ghe-rung-nhun-cho-be-ghe-nhun-cho-be-ghe-rung-cho-be-giuong-nam-cho-be-13401862.html,Ghế rung nhún cho bé - Ghế nhún cho bé - GHẾ RUNG CHO BÉ - giường năm cho bé,148000,Shopchuyensyquanaotreem
16372482,https://www.sendo.vn/adapter-bo-nguon-may-dua-vong-livorno-16372482.html,Adapter - bộ nguồn máy đưa võng Livorno,189000,SHOP MINH SAN
11078237,https://www.sendo.vn/bo-10-mieng-tham-xop-lot-san-ghep-so-loai-lon-30x30x1cm-11078237.html,Bộ 10 miếng thảm xốp lót sàn ghép số loại lớn 30x30x1cm,89000,September Cosmetics
7790718,https://www.sendo.vn/cui-luc-giac-quickflex-5d-7790718.html,Cũi lục giác Quickflex 5D,1320000,baby68
29080573,https://www.sendo.vn/noi-tre-dat-vong-chong-cong-lung-cho-beda-ho-ramkt-29080573.html,Nôi tre đặt võng chống còng lưng cho bé(đã hơ rằm)kt:,300000,nôi tre đặt võng cho bé
30033576,https://www.sendo.vn/noi-tre-nam-vong-cho-be-tang-kem-dau-tam-size-11mx70-30033576.html,Nôi tre Nằm võng cho bé tặng kèm dâu tằm size 1.1mX70,200000,SHOP BÁN NÔI TRE NGỌC YẾN
9786130,https://www.sendo.vn/ghe-rung-cho-be-mau-do-a52-9786130.html,GHẾ RUNG  CHO BÉ MÀU ĐỎ A52,220000,sieuthidochoi
