product_id,product_url,name,price,shop_name
29080995,https://www.sendo.vn/ghe-bap-benh-co-gau-cho-be-29080995.html,GHẾ BẬP BỀNH CÓ GẤU CHO BÉ,199000,GIA DỤNG ĐẠI PHÁT
23078055,https://www.sendo.vn/treo-noi-kep-giuong-35-bai-chay-pin-23078055.html,Treo nôi kẹp giường 35 bài chạy pin,210000,Thiết bị vệ sinh LIFMOD
29087802,https://www.sendo.vn/noi-dien-cao-cap-29087802.html,Nôi điện cao cấp ,720000,Nghĩa Phượng Shop
28426819,https://www.sendo.vn/giuong-noi-xep-gon-cho-be-travel-home-28426819.html,Giường nôi xếp gọn cho bé Travel Home,1691000,EuroHome Siêu Thị Nhập Khẩu
22050903,https://www.sendo.vn/mua-ngay-nhan-qua-lien-tay-tinh-dau-xong-mui-hong-100-thao-duoc-thien-nhien-dong-y-phuc-loc-xong-cung-may-xong-mui-hong-22050903.html,Mua ngay nhận quà liền tay TINH DẦU XÔNG MŨI HỌNG 100 THẢO DƯỢC THIÊN NHIÊN ĐÔNG Y PHÚC LỘC XÔNG CÙNG MÁY XÔNG MŨI HỌNG,10000,Phúc Lộc Cao
28098432,https://www.sendo.vn/u-quan-tay-anna-cho-be-so-sinh-28098432.html,Ủ quấn tay Anna cho bé sơ sinh,130000,Tổng kho đồ sơ sinh
28054190,https://www.sendo.vn/day-curoa-noi-dien-thanh-hung-combo-4-soi-28054190.html,Dây curoa nôi điện Thành Hưng combo 4 sợi,50000,hoa giay
28466728,https://www.sendo.vn/noi-ngu-cho-be-28466728.html,Nôi ngủ cho bé,239000,QuyenHa
28522740,https://www.sendo.vn/thanh-chan-giuong-cho-be-28522740.html,Thanh chắn giường cho bé,360000,shoptaigia
28435197,https://www.sendo.vn/noi-may-tre-cho-be-28435197.html,Nôi mây tre cho bé,180000,FVNSTORE
28426451,https://www.sendo.vn/quay-cui-nhua-nguyen-sinh-an-toan-cho-be-2m4-2m4-tang-kem-tham-xop-bong-sot-dung-bong-28426451.html,QUÂY CŨI NHỰA NGUYÊN SINH AN TOÀN CHO BÉ 2M4-2M4 - TẶNG KÈM THẢM XỐP + BÓNG + SỌT ĐỰNG BÓNG,2220000,Khoailang Shop
29492624,https://www.sendo.vn/nem-phao-cho-be-29492624.html,nệm phao cho bé,600000,ken shop 668
29458000,https://www.sendo.vn/luoi-vong-noi-tu-dua-thanh-hung-khong-bao-gom-khung-29458000.html,Lưới Võng Nôi Tự Đưa Thành Hưng Không Bao Gồm Khung,89000,shopman
29274118,https://www.sendo.vn/giuong-luoi-cho-be-29274118.html,giường lưới cho bé,350000,SIÊU THỊ GIA ĐÌNH 2
29524252,https://www.sendo.vn/giuong-cui-tre-em-joie-commuter-change-snooze-linen-gray-29524252.html,GIƯỜNG CŨI TRẺ EM JOIE COMMUTER CHANGE & SNOOZE LINEN GRAY,2850000,azobabyvn
28405673,https://www.sendo.vn/noi-dua-tu-dong-cho-be-co-nhac-boss-baby-c3-st3882-28405673.html,Nôi đưa tự động cho bé có nhạc Boss Baby C3-ST3882,1490000,Phụ kiện HnL
28371859,https://www.sendo.vn/ghe-rung-cho-be-28371859.html,Ghế rung cho bé,160000,Shopvuongquyen
28425893,https://www.sendo.vn/quay-cui-nhua-nguyen-sinh-an-toan-cho-be-1m6-1m6-tang-kem-tham-xop-bong-sot-dung-bong-28425893.html,QUÂY CŨI NHỰA NGUYÊN SINH AN TOÀN CHO BÉ 1M6-1M6 - TẶNG KÈM THẢM XỐP + BÓNG + SỌT ĐỰNG BÓNG,1580000,Khoailang Shop
28361108,https://www.sendo.vn/noi-vong-2in-1-28361108.html,nôi võng 2in 1,990000,VIAN GIA DỤNG TIỆN ÍCH
28422149,https://www.sendo.vn/giuong-luoi-cho-be-28422149.html,giường lưới cho bé,350000,SIÊU THỊ GIA ĐÌNH 2
28419420,https://www.sendo.vn/noi-dien-dua-tu-dong-cho-be-co-nhac-boss-baby-28419420.html,Nôi điện đưa tự động cho bé có nhạc Boss Baby,1492000,EuroHome Siêu Thị Nhập Khẩu
28517403,https://www.sendo.vn/ghe-rung-nhun-cao-cap-28517403.html,ghế rung nhún cao cấp,630000,Shop Tiện Ích Gia Vinh
28566840,https://www.sendo.vn/ghe-hoi-tap-ngoi-hinh-vit-28566840.html,Ghế hơi tập ngồi hình vịt,95000,cơm sạch online
28591295,https://www.sendo.vn/noi-ngu-rung-tu-dong-cho-be-co-man-chong-muoi-babykey-5-che-do-rung-hen-gio-remote-phat-nhac-tren-dien-thoai-bang-bluetooth-xam-28591295.html,"Nôi ngủ Rung Tự Động cho bé có màn chống muỗi BaByKey 5 Chế Độ Rung, Hẹn Giờ, Remote, Phát Nhạc Trên Điện Thoại bằng Bluetooth (Xám)",2290000,HaruShop168
28556579,https://www.sendo.vn/bo-c-de-m-lo-t-na-m-cho-noi-tre-na-m-vo-ng-cho-em-be-28556579.html,BỌC ĐỆM LÓT NẰM CHO NÔI TRE NẰM VÕNG CHO EM BÉ,120000,Vĩnh Thuyên
29733572,https://www.sendo.vn/noi-vai-cho-be-0-2-tuoi-thanh-ly-moi-100-29733572.html,NÔI VẢI CHO BÉ 0-2 TUỔI THANH LÝ MỚI 100%,299000,TrumPhuKien
29373151,https://www.sendo.vn/it-smart-quay-cui-nhua-pe-cao-cap-play-happy-12-mieng-ghep-12x155m-29373151.html,It Smart - Quây cũi nhựa PE cao cấp Play&Happy 12 miếng ghép 1.2x1.55m,2380000,Tiệm Đồ Gia Dụng 168
28428546,https://www.sendo.vn/noi-giuong-cho-be-kem-chan-u-long-cuu-nhat-ban-28428546.html,Nôi giường cho bé kèm chăn ủ lông cừu Nhật Bản,1992000,EuroHome Siêu Thị Nhập Khẩu
28552450,https://www.sendo.vn/noi-tre-dat-vong-cho-be-yeu-cho-ng-gu-lung-tre-size-vu-a-28552450.html,Nôi tre đặt võng cho bé yêu chống gù lưng trẻ Size Vừa,180000,Vĩnh Thuyên
30299443,https://www.sendo.vn/noi-dien-tu-dong-2in1-dai-vi-30299443.html,Nôi điện tự động 2in1 Đại Vĩ,979000,HANGTIENICH04
29533678,https://www.sendo.vn/day-curoa-noi-dien-thanh-hung-day-zin-theo-may-29533678.html,Dây curoa nôi điện Thành Hưng- dây zin theo máy,48000,hoa giay
29533766,https://www.sendo.vn/day-da-nang-cho-noi-dien-em-be-29533766.html,Dây đa năng cho nôi điện em bé,38000,hoa giay
30154262,https://www.sendo.vn/noi-tre-nam-vong-size-90x60-be-tu-0-15-thang-tang-vong-dau-tam-30154262.html,Nôi tre nằm võng size 90x60 bé từ 0-15 tháng (tặng vòng dâu tằm),140000,Noitrenamvong
29583584,https://www.sendo.vn/day-cuaroa-noi-hoang-thanh-1-soi-lon-va-1-soi-nho-ban-day-dan-29583584.html,Dây cuaroa nôi Hoàng Thành 1 sợi lớn và 1 sợi nhỏ (bản dày dặn),57000,hoa giay
29594130,https://www.sendo.vn/day-cuaroa-noi-dien-dai-vi-1-soi-lon-va-1-soi-nho-29594130.html,Dây cuaroa nôi điện Đại vĩ 1 sợi lớn và 1 sợi nhỏ ,28000,hoa giay
29584469,https://www.sendo.vn/giuong-luoi-cho-be-co-lon-29584469.html,Giường lưới cho bé cỡ lớn ,230000,đồ chơi mầm non chất lượng cao
29594128,https://www.sendo.vn/day-cuaroa-noi-dien-autoru-29594128.html,Dây cuaroa nôi điện Autoru ,28000,hoa giay
29508059,https://www.sendo.vn/cuc-dua-cua-noi-dien-29508059.html,Cục Đưa Của Nôi Điện,250000,shopman
29622135,https://www.sendo.vn/noi-may-chong-may-cho-be-tu-0-12-thang-tuoi-29622135.html,Nôi mây chõng mây cho bé từ 0-12 tháng tuổi ,515000,Nghĩa Phượng Shop
29621972,https://www.sendo.vn/noi-may-chong-may-cho-be-tu-0-10-thang-tuoi-29621972.html,Nôi mây chõng mây cho bé từ 0-10 tháng tuổi ,499000,Nghĩa Phượng Shop
29601677,https://www.sendo.vn/giuong-ngu-cho-be-holla-tang-dem-xin-kem-theo-giuong-cho-tre-em-chiu-luc-100kg-hang-chinh-hang-1-doi-1-29601677.html,"Giường ngủ cho bé Holla , Tặng Đệm Xịn kèm theo giường cho trẻ em, chịu lực 100kg, hàng chính hãng 1 đổi 1.",2190000,Zimba Baby Shop
18960467,https://www.sendo.vn/ghe-bong-tap-ngoi-18960467.html,Ghế Bông Tập Ngồi,250000,muasamgiare
3129039,https://www.sendo.vn/giuong-cui-graco-pnp-reversible-napper-changer-soho-square-1812041-3129039.html,Giường cũi Graco PNP Reversible Napper Changer Soho Square 1812041,3600000,Chăm sóc bé sơ sinh
5365104,https://www.sendo.vn/noi-vong-dien-tu-dong-vinanoi-vnn301-5365104.html,Nôi võng điện tự động Vinanoi VNN301,4250000,baby68
3511340,https://www.sendo.vn/giuong-cui-graco-pnp-on-the-go-signal-1895915-3511340.html,Giường cũi Graco PNP On The Go Signal 1895915,2399000,Chăm sóc bé sơ sinh
3583443,https://www.sendo.vn/giuong-cui-graco-pnp-reversible-napper-changer-nyssa-1893760-3583443.html,Giường cũi Graco PNP Reversible Napper Changer Nyssa 1893760,3600000,Chăm sóc bé sơ sinh
3096186,https://www.sendo.vn/aprica-noi-3-chuc-nang-nemyu-std-569-be-88366-3096186.html,Aprica - Nôi 3 chức năng Nemyu STD 569 BE 88366,5000000,Chăm sóc bé sơ sinh
7336329,https://www.sendo.vn/giuong-gau-pooh-in-doremon-1m2-gd23-7336329.html,Giường gấu pooh in Doremon 1m2 GD23,3800000,baby68
9514574,https://www.sendo.vn/giuong-nam-cho-be-sozzy-cao-su-non-cao-cap-chong-lat-chong-trao-9514574.html,"Giường nằm cho bé Sozzy cao su non cao cấp chống lật, chống trào",185000,Home and Garden
5972972,https://www.sendo.vn/ghe-rung-zaracos-1106-5972972.html,Ghế rung Zaracos 1106,1985000,baby68
5488132,https://www.sendo.vn/noi-dua-graco-lovin-hug-counting-sheep-1953167-5488132.html,Nôi đưa Graco Lovin Hug Counting Sheep 1953167,3200000,Chăm sóc bé sơ sinh
5488128,https://www.sendo.vn/noi-dua-graco-lovin-hug-ted-and-coco-1987439-5488128.html,Nôi đưa Graco Lovin Hug Ted And Coco 1987439,3200000,Chăm sóc bé sơ sinh
4729081,https://www.sendo.vn/may-dua-vong-tu-dong-livorno-dsa627-4729081.html,Máy đưa võng tự động Livorno DSA627,330000,ShopLG
5112019,https://www.sendo.vn/cui-noi-80-1m2-cho-be-giuong-cui-cho-be-80-1m2-5112019.html,Cũi nôi 80*1m2 cho bé - giường cũi cho bé 80*1m2,1700000,Cty Nội Thất Trung Tín
5111970,https://www.sendo.vn/noi-cui-go-giuong-cui-cho-be-cho-be-70-1m1-5111970.html,Nôi cũi gỗ - giường cũi cho bé cho bé 70*1m1,1500000,Cty Nội Thất Trung Tín
5110408,https://www.sendo.vn/cui-go-70-115-5110408.html,CŨI GỖ 70*115,1500000,Cty Nội Thất Trung Tín
4740827,https://www.sendo.vn/noi-vai-xep-4740827.html,NÔI VẢI XẾP,345000,Upick
6839237,https://www.sendo.vn/giuong-cui-go-cao-cap-vinanoi-s201-6839237.html,Giường cũi gỗ cao cấp VINANOI - S201,2200000,MeBeOnline
5277591,https://www.sendo.vn/giuong-hop-2-tang-co-ngan-keo-acme-bb092-nhieu-mau-5277591.html,Giường hộp 2 tầng có ngăn kéo Acme BB092 nhiều màu,4300000,baby68
6279456,https://www.sendo.vn/noi-ngu-chung-giuong-summer-sm91310-6279456.html,Nôi Ngủ Chung Giường Summer SM91310,1799000,Chăm sóc bé sơ sinh
5364627,https://www.sendo.vn/rao-chan-playpen-5d-6-canh-5364627.html,Rào chắn Playpen 5D 6 cánh,1250000,baby68
4704895,https://www.sendo.vn/ghe-noi-da-nang-prumea-s-4704895.html,Ghế nôi đa năng Prumea S,3600000,Chăm sóc bé sơ sinh
7167371,https://www.sendo.vn/giuong-o-to-so-9-mau-vang-gd01-y-1m4-7167371.html,Giường ô tô số 9 màu vàng GD01-Y 1m4,4000000,baby68
17334616,https://www.sendo.vn/noi-tu-dong-cho-be-khung-thep-vinanoi-n25-x-long-noi-mau-xanh-17334616.html,Nôi tự động cho bé khung thép Vinanoi N25-X lồng nôi màu xanh,1200000,MeBeOnline
17334435,https://www.sendo.vn/combo-noi-cho-be-gia-re-vinanoi-n20-va-may-massage-mat-5in1-17334435.html,COMBO Nôi cho bé giá rẻ Vinanoi N20 và Máy massage mặt 5in1,1140000,MeBeOnline
12237107,https://www.sendo.vn/combo-nem-lot-va-noi-tre-85x55cm-12237107.html,combo nệm lót và nôi tre 85x55cm,240000,abcbabies
17334511,https://www.sendo.vn/combo-noi-cho-be-gia-re-vinanoi-n20-va-dai-diu-cho-be-17334511.html,COMBO Nôi cho bé giá rẻ Vinanoi N20 và Đai Địu cho bé,1140000,MeBeOnline
12255144,https://www.sendo.vn/cui-quay-kem-bong-12255144.html,CŨI QUÂY KÈM BÓNG,490000,giadunganan
12578889,https://www.sendo.vn/noi-dien-vong-xep-2-tang-co-dai-2-trong-1-tang-vong-man-chong-muoi-giuong-tang-12578889.html,"Nôi điện Võng xếp 2 tầng cỡ đại 2 Trong 1 - Tặng võng, màn chống muỗi, giường tầng",1150000,Siêu Thị 24h Online
12706400,https://www.sendo.vn/cui-quay-cho-be-12706400.html,CŨI QUÂY CHO BÉ,450000,GIA DỤNG TỔNG HỢP VIAN
9540238,https://www.sendo.vn/goi-cao-su-non-cho-be-9540238.html,Gối cao su non cho bé,85000,Hoa Tư Dẫn
10227191,https://www.sendo.vn/noi-vong-tu-dong-k3-2-trong-1-10227191.html,NÔI VÕNG TỰ ĐỘNG K3 2 TRONG 1,950000,Hiền Tuấn
10056844,https://www.sendo.vn/noi-dua-tre-em-joie-sansa-in-the-rain-10056844.html,Nôi đưa trẻ em Joie Sansa In the Rain,5300000,MTP Store
9450614,https://www.sendo.vn/noi-dua-tre-em-joie-serina-2in1-in-the-rain-9450614.html,NÔI ĐƯA TRẺ EM JOIE SERINA 2IN1 IN THE RAIN,3890000,Chăm sóc bé sơ sinh
9473381,https://www.sendo.vn/tham-nhac-cho-be-01216123264-9473381.html,THẢM NHẠC CHO BÉ 01216123264,249000,KHO GIA DỤNG TOÀN QUỐC
8945182,https://www.sendo.vn/ghe-goi-dau-cho-be-8945182.html,ghế gội đầu cho bé,155000,susutmilk
10071953,https://www.sendo.vn/nem-cho-be-nem-cao-cap-cho-be-10071953.html,Nệm cho bé - Nệm cao cấp cho bé,349000,CHÂU THUẬN PHÁT
9808765,https://www.sendo.vn/giuong-noi-2-tang-co-banh-xe-cho-be-tu-0-den12-thang-9808765.html,Giường Nôi 2 tầng có bánh xe cho bé từ 0 đến12 tháng,730000,Thế giới đồ chơi Thu Trang
9786130,https://www.sendo.vn/ghe-rung-cho-be-mau-do-a52-9786130.html,GHẾ RUNG  CHO BÉ MÀU ĐỎ A52,220000,sieuthidochoi
8743759,https://www.sendo.vn/may-dua-vong-tu-dong-fujishi-8743759.html,MÁY ĐƯA VÕNG TỰ ĐỘNG FUJISHI,480000,BINHMON
8819073,https://www.sendo.vn/cui-5d-playpen-6-canh-giam-gia-8819073.html,Cũi 5d Playpen 6 cánh giảm giá,1250000,Cui 3d
10212333,https://www.sendo.vn/xich-du-mastela-6579-dung-dua-tu-dong-mau-xanh-co-nhac-10212333.html,Xích đu Mastela  6579 đung đưa tự động  màu xanh có nhạc,1399000,Diệp Anh Japan
10560004,https://www.sendo.vn/may-dua-vong-cho-be-10560004.html,MÁY ĐƯA VÕNG CHO BÉ,399000,TOÀN THỊNH PHÁT
10739533,https://www.sendo.vn/ghe-rung-nhun-cho-be-10739533.html,Ghế rung nhún cho bé,150000,Bepviet16122017
11265625,https://www.sendo.vn/giuong-luoi-cho-be-11265625.html,Giường Lưới Cho Bé,340000,chuyên đồ gia dụng hương
10672102,https://www.sendo.vn/ghe-dung-cho-be-10672102.html,Ghế Dung Cho Bé,290000,chuyên đồ gia dụng hương
11277089,https://www.sendo.vn/cui-quay-cho-be-kem-100-bong-11277089.html,CŨI QUÂY CHO BÉ kèm 100 bóng,520000,ĐỒ GIA DỤNG VIAN
11308120,https://www.sendo.vn/cui-quay-cho-be-kem-100-qua-bong-11308120.html,CŨI QUÂY CHO BÉ kèm 100 quả bóng,520000,ĐỒ GIA DỤNG VIAN
11284878,https://www.sendo.vn/giuong-luoi-cho-be-11284878.html,Giường Lưới Cho Bé,330000,chuyên đồ gia dụng hương
11552311,https://www.sendo.vn/cui-quay-bong-11552311.html,Cũi quây bóng,480000,giadunganan
11552298,https://www.sendo.vn/cui-quay-cho-be-kem-100-bong-11552298.html,CŨI QUÂY CHO BÉ kèm 100 bóng,520000,giadunganan
11606706,https://www.sendo.vn/noi-ngu-chinh-hang-summer-cua-my-an-toan-cho-be-11606706.html,Nôi ngủ Chính hãng Summer của Mỹ An toàn cho Bé,1789000,Enbay24h.com
11467484,https://www.sendo.vn/giuong-luoi-cho-be-11467484.html,Giường Lưới Cho Bé,350000,chuyên đồ gia dụng hương
11843538,https://www.sendo.vn/ke-ech-chu-a-con-vet-11843538.html,Kệ ếch chữ A con vẹt,150000,giadinhshop
11390803,https://www.sendo.vn/tham-nam-chan-bong-cho-be-11390803.html,Thảm nằm chần bông cho bé,90000,dokhuyenmai.info
8824401,https://www.sendo.vn/tham-nhac-cho-be-0973809698-8824401.html,Thảm nhạc CHO BÉ   0973809698,174000,Hàng gia dụng giá sốc
11420032,https://www.sendo.vn/nem-lot-cho-noi-dat-vong-hinh-big-size-cho-noi-95-100cm-11420032.html,Nệm lót cho nôi đặt võng hình big size cho nôi 95-100cm,130000,Babies Vn
11419828,https://www.sendo.vn/ghe-rung-cho-be-11419828.html,Ghế rung cho bé,500000,Tổng kho Bảo Linh
11722749,https://www.sendo.vn/quay-bong-cui-luoi-11722749.html,Quây Bóng Cũi Lưới,480000,chuyên đồ gia dụng hương
8251065,https://www.sendo.vn/giuong-tang-bb265-8251065.html,Giường tầng BB265,3650000,baby68
7592574,https://www.sendo.vn/tham-maboshi-2-mat-cao-cap-1-8m-x-2m-nx1354-7592574.html,"Thảm Maboshi 2 Mặt Cao Cấp 1,8m X 2m NX1354",165000,nhadepxinh
6386329,https://www.sendo.vn/cui-da-nang-hang-viet-nam-6386329.html,CŨI ĐA NĂNG HÀNG VIỆT NAM,3500000,Cái Gì Chẳng Có
11859701,https://www.sendo.vn/quay-cui-goc-tron-size-s-11859701.html,QUÂY CŨI GÓC TRÒN SIZE S,1800000,shop thaothy16
11915108,https://www.sendo.vn/quay-cui-nhua-3d-loai-18-mieng-cho-be-tang-tham-va-bong-hang-cao-cap-11915108.html,QUÂY CŨI NHỰA 3D LOẠI 18 MIẾNG CHO BÉ TẶNG THẢM VÀ BÓNG HÀNG CAO CẤP,1950000,Cái Gì Chẳng Có 1
11916022,https://www.sendo.vn/nem-nuoc-em-be-cao-cap-nam-noi-11916022.html,"Nệm nước em bé cao cấp ,nằm nôi",158000,Bubushop3010
12061879,https://www.sendo.vn/cui-quay-cho-be-kem-100-bong-12061879.html,CŨI QUÂY CHO BÉ kèm 100 bóng,520000,GiadungDinhVinh
12013031,https://www.sendo.vn/giuong-luoi-cho-be-12013031.html,Giường Lưới Cho Bé,340000,GiadungDinhVinh
12652213,https://www.sendo.vn/noi-dien-vong-xep-hang-viet-nam-2-trong-1-12652213.html,Nôi điện võng xếp hàng Việt Nam 2 trong 1,769000,cốm tinh nghịch
12094060,https://www.sendo.vn/giuong-luoi-12094060.html,Giường lưới,350000,GiadungDinhVinh
12094038,https://www.sendo.vn/thanh-chan-giuong-babyqiner-mau-moi-2018-truot-len-xuong-12094038.html,thanh chắn giường babyqiner mẫu mới 2018 trượt lên xuống,445000,shop sóc thỏ
12093888,https://www.sendo.vn/thanh-chan-giuong-babyqiner-mau-moi-2018-truot-len-xuong-12093888.html,thanh chắn giường babyqiner mẫu mới 2018 trượt lên xuống,420000,shop sóc thỏ
12093752,https://www.sendo.vn/thanh-chan-giuong-mau-moi-truot-len-xuong-12093752.html,thanh chắn giường mẫu mới trượt lên xuống,450000,shop sóc thỏ
12773887,https://www.sendo.vn/thanh-chan-giuong-an-toan-mastela-xanh-la-1m5-12773887.html,Thanh chắn giường an toàn Mastela - Xanh lá 1m5,798000,Nam Thành baby
11877076,https://www.sendo.vn/ghe-rung-ghe-rung-11877076.html,ghế rung - ghế rung,345000,tonador
12080850,https://www.sendo.vn/quay-cui-nhua-3d-loai-16-mieng-cho-be-tang-tham-va-bong-hang-cao-cap-12080850.html,QUÂY CŨI NHỰA 3D LOẠI 16 MIẾNG CHO BÉ TẶNG THẢM VÀ BÓNG HÀNG CAO CẤP,1950000,Cái Gì Chẳng Có
11722714,https://www.sendo.vn/quay-bong-lam-cui-luoi-kem-100-bong-11722714.html,Quây Bóng  Làm Cũi Lưới Kèm 100 bóng,530000,chuyên đồ gia dụng hương
10440764,https://www.sendo.vn/quay-cui-nhua-3d-loai-20-mieng-cho-be-kem-tham-va-bong-10440764.html,QUÂY CŨI NHỰA 3D LOẠI 20 MIẾNG CHO BÉ KÈM THẢM VÀ BÓNG,2200000,Cái Gì Chẳng Có 1
12089220,https://www.sendo.vn/ghe-rung-fisher-price-x7033-12089220.html,Ghế rung Fisher-Price X7033,680000,ShopDuongMinh
9450509,https://www.sendo.vn/giuong-cui-tre-em-joie-commuter-change-snooze-linen-gray-9450509.html,GIƯỜNG CŨI TRẺ EM JOIE COMMUTER CHANGE SNOOZE LINEN GRAY,2750000,Chăm sóc bé sơ sinh
11492695,https://www.sendo.vn/ghe-dung-cho-be-hang-chuan-11492695.html,Ghế Dung Cho Bé Hàng Chuẩn,620000,chuyên đồ gia dụng hương
11215344,https://www.sendo.vn/noi-ghe-rung-bap-benh-5-in-1-mastela-chinh-hang-mau-xanh-hoa-tiet-11215344.html,Nôi ghế rung bập bênh 5 in 1 Mastela chính hãng màu xanh họa tiết,1699000,Diệp Anh Japan
10577409,https://www.sendo.vn/chan-luoi-cho-be-10577409.html,chăn lưới cho bé,85000,Gia dụng giá rẻ Đà Nẵng
12052123,https://www.sendo.vn/giuong-luoi-cho-be-12052123.html,Giường Lưới Cho Bé,340000,chuyên đồ gia dụng hương
13325164,https://www.sendo.vn/giuong-luoi-tre-em-13325164.html,giường lưới trẻ em,340000,GiadungDinhVinh
12052097,https://www.sendo.vn/giuong-luoi-cho-be-12052097.html,Giường Lưới Cho Bé,330000,chuyên đồ gia dụng hương
12163621,https://www.sendo.vn/chieu-co-cho-be-co-to-60x120cm-12163621.html,Chiếu cỏ cho bé cỡ to 60x120cm,40000,bikidsvn2 Cơ sở 19 Xa La
11088373,https://www.sendo.vn/cui-quay-bong-khung-inox-chac-chan-an-toan-cho-be-tang-kem-bong-11088373.html,Cũi quây bóng khung inox chắc chắn an toàn cho bé + Tặng kèm bóng,480000,giadunganan
11132943,https://www.sendo.vn/noi-dien-dua-tu-dong-cho-be-co-nhac-boss-baby-11132943.html,Nôi điện đưa tự động cho bé có nhạc Boss Baby,1480000,HanRui Shop
11213619,https://www.sendo.vn/1-thanh-cha-n-giuo-ng-2m-cao-ca-p-11213619.html,1 THANH CHẮN GIƯỜNG 2M CAO CẤP,350000,shopdogiadung1207
12823652,https://www.sendo.vn/giuong-luoi-cho-be-12823652.html,giường lưới cho bé,340000,GiadungDinhVinh
17099037,https://www.sendo.vn/cui-quay-cho-be-17099037.html,CŨI QUÂY CHO BÉ ,350000,Dogiadung99
11604398,https://www.sendo.vn/cui-quay-cho-be-kem-100-bong-11604398.html,CŨI QUÂY CHO BÉ kèm 100 bóng,520000,giadunganan
11401617,https://www.sendo.vn/cui-quay-cho-be-kem-100-bong-11401617.html,CŨI QUÂY CHO BÉ kèm 100 bóng,520000,giadunganan
16850019,https://www.sendo.vn/noi-tu-dong-cao-cap-dieu-khien-tu-xa-mastela-sg239-mau-kem-16850019.html,Nôi tự động cao cấp điều khiển từ xa Mastela SG239 MÀU KEM,2399000,Gấu Babi Shop
16102930,https://www.sendo.vn/noi-dien-dai-vi-2-in-1-hang-viet-nam-16102930.html,NÔI ĐIỆN ĐẠI VĨ 2 IN 1 HÀNG VIỆT NAM,918000,Gia Dụng Bảo Hân
11213589,https://www.sendo.vn/1-thanh-chan-giuong-1m6-cho-be-11213589.html,1 THANH CHẮN GIƯỜNG 1M6 CHO BÉ,325000,shopdogiadung1207
16849805,https://www.sendo.vn/noi-rung-kiem-ghe-bap-benh-5-trong-1-mastela-chinh-hang-mau-xanh-vien-xam-16849805.html,Nôi rung kiêm ghế bập bênh 5 trong 1 Mastela chính hãng MÀU XANH VIỀN XÁM,1699000,Gấu Babi Shop
13850246,https://www.sendo.vn/ghe-tam-giuong-luoi-tam-cho-be-13850246.html,Ghế tắm – Giường lưới tắm cho bé,90000,Shop Cún Khoai
16140121,https://www.sendo.vn/xe-an-bot-cho-be-co-man-che-16140121.html,XE ĂN BỘT CHO BÉ CÓ MÀN CHE,350000,Xe Đạp Hưng Thịnh
16121569,https://www.sendo.vn/cui-quay-cho-be-16121569.html,CŨI QUÂY CHO BÉ ,350000,GiadungDinhVinh
13571695,https://www.sendo.vn/bo-noi-tre-chu-nhat-s2-82x53cm-kem-nem-lot-cara-tron-vietkids-dat-vong-xep-cho-be-13571695.html,Bộ nôi tre chữ nhật S2  82x53cm  kèm nệm lót cara trơn Vietkids đặt võng xếp cho bé,210000,Babies Vn
13571491,https://www.sendo.vn/noi-tre-chu-nhat-s4-95x60cm-dat-vong-xep-vong-luoi-cho-be-13571491.html,"Nôi tre chữ nhật S4  95x60cm đặt võng xếp, võng lưỡi cho bé",110000,Babies Vn
13372601,https://www.sendo.vn/giuong-luoi-cho-be-13372601.html,giường lưới cho bé,340000,Dogiadung99
20297006,https://www.sendo.vn/giuong-luoi-tre-em-20297006.html,giường lưới trẻ em,340000,GiadungDinhVinh
19800480,https://www.sendo.vn/thanh-chan-giuong-thong-minh-loai-2m-19800480.html,Thanh chắn giường thông minh - Loại 2m,335000,Chíp Family
13466164,https://www.sendo.vn/cui-quay-cho-be-13466164.html,cũi quây cho bé,480000,chuyên đồ gia dụng hương
20087981,https://www.sendo.vn/cui-quay-cho-be-20087981.html,Cũi Quây cho bé,480000,Dogiadung99
18556267,https://www.sendo.vn/ghe-rung-cao-cap-cho-be-co-bao-hiem-do-choi-mai-che-goi-dau-18556267.html,"Ghế rung Cao cấp cho bé - Có bảo hiểm, đồ chơi, mái che, gối đầu",38000,Shop Siêu Thị 24H
18556668,https://www.sendo.vn/day-curoa-cho-noi-dien-1-tang-1-bo-2-day-18556668.html,Dây Curoa Cho Nôi Điện 1 Tầng - 1 Bộ 2 Dây,35000,Shop Siêu Thị 24H
19074294,https://www.sendo.vn/dem-ngu-dung-tu-the-chong-trao-nguoc-babymoov-bm14836-19074294.html,ĐỆM NGỦ ĐÚNG TƯ THẾ & CHỐNG TRÀO NGƯỢC BABYMOOV BM14836,1699000,SHOP MẸ VỊT 
18556524,https://www.sendo.vn/day-curoa-cho-noi-dien-2-tang-1-bo-2-day-18556524.html,Dây Curoa Cho Nôi Điện 2 tầng - 1 Bộ 2 dây,35000,Shop Siêu Thị 24H
18556512,https://www.sendo.vn/quay-cui-kiem-nha-bong-khung-inox-cho-be-tang-kem-bong-da-sac-18556512.html,Quây Cũi Kiêm Nhà Bóng Khung Inox Cho Bé Tặng Kèm Bóng Đa Sắc,29000,Shop Siêu Thị 24H
19172194,https://www.sendo.vn/noi-ingenuity-moonlight-rocking-sleeper-noi-rung-tu-dong-cho-be-co-nhac-va-anh-sang-19172194.html,Nôi Ingenuity Moonlight Rocking Sleeper nôi rung tự đông cho bé có nhạc và ánh sáng,3500000,dautram_ngoctuyet
18556484,https://www.sendo.vn/nha-bong-kiem-cui-hang-cao-cap-loai-1-quay-bong-quay-cui-cho-be-18556484.html,Nhà Bóng Kiêm Cũi Hàng Cao Cấp Loại 1 Quây Bóng Quây Cũi Cho Bé,49000,Shop Siêu Thị 24H
17075689,https://www.sendo.vn/cui-quay-cho-be-17075689.html,CŨI QUÂY CHO BÉ,420000,chuyên đồ gia dụng hương
29929350,https://www.sendo.vn/noi-tre-90x60-da-ho-sach-dam-29929350.html,Nôi tre 90x60 đã hơ sạch dằm,120000,baongocsuri
17028775,https://www.sendo.vn/adaptor-cao-cap-prota-dung-cho-may-dua-vong-17028775.html,Adaptor cao cấp  Prota dùng cho máy đưa võng,195000,Taphoagannha
16516211,https://www.sendo.vn/thanh-chan-giuong-m6-chan-det-khong-kenh-dem-thay-doi-7-nac-do-cao-16516211.html,THANH CHẮN GIƯỜNG M6 CHÂN DẸT KHÔNG KÊNH ĐỆM THAY ĐỔI 7 NẤC ĐỘ CAO,450000,tongkholinhdam
16476595,https://www.sendo.vn/combo-3-thanh-chan-giuong-2-thanh-2m-va-1-thanh-1m8-mau-2019-16476595.html,"combo 3 thanh chắn giường 2 thanh 2m và 1 thanh 1m8, mẫu 2019",1800000,shop sóc thỏ
13994874,https://www.sendo.vn/giuong-luoi-cho-be-13994874.html,GIƯỜNG LƯỚI CHO BÉ,340000,giadunganan
16153038,https://www.sendo.vn/cui-quay-cho-be-16153038.html,CŨI QUÂY CHO BÉ ,420000,GiadungDinhVinh
16795176,https://www.sendo.vn/thanh-chan-giuong-m8-mau-moi-chan-det-khong-kenh-dem-16795176.html,THANH CHẮN GIƯỜNG M8 MẪU MỚI CHÂN DẸT KHÔNG KÊNH ĐỆM,450000,DUONGMINH01
17697703,https://www.sendo.vn/chieu-lua-cho-be-gia-dung-gia-re-amina-17697703.html,Chiếu Lụa Cho Bé - Gia Dụng Giá Rẻ Amina,99000,Siêu Thị Amina
17629959,https://www.sendo.vn/combo-chieu-luc-binh-17629959.html,combo chiếu lục bình ,1080000,Pipbokids
17481043,https://www.sendo.vn/dem-ngu-dung-tu-the-cho-be-jjovce-17481043.html,Đệm ngủ đúng tư thế cho bé JJovce,498000,Babiesland
