product_id,product_url,name,price,shop_name
24175490,https://www.sendo.vn/ghe-rung-nhun-cho-be-24175490.html,Ghế rung nhún cho bé,199000,GIA DỤNG ĐẠI PHÁT
12796087,https://www.sendo.vn/noi-dien-2-in-1-cho-be-tang-vong-man-chong-muoi-12796087.html,Nôi điện 2 in 1 cho bé - Tặng võng màn chống muỗi,720000,Siêu Thị 24h Online
20347469,https://www.sendo.vn/chieu-coi-cho-be-20347469.html,CHIẾU CÓI CHO BÉ,25000,SIEUTHI_ME_VA_BE
12167375,https://www.sendo.vn/nem-lot-noi-tre-size-lon-12167375.html,nệm lót nôi tre size lớn,130000,abcbabies
28240065,https://www.sendo.vn/quay-bong-khung-inox-tang-kem-100-bong-28240065.html,QUÂY BÓNG KHUNG INOX-tặng kèm 100 bóng,310000,shopmebon208
12119426,https://www.sendo.vn/noi-dien-vong-xep-tu-dong-thanh-hung-2-trong-1-co-vong-man-chong-muoi-12119426.html,Nôi điện Võng xếp tự động Thành Hưng 2 Trong 1- Có võng màn chống muỗi,680000,Siêu Thị 24h Online
13414951,https://www.sendo.vn/quay-bong-quay-cui-khung-inox-cho-be-co-cua-chui-tang-kem-bong-13414951.html,Quây Bóng Quây Cũi Khung Inox Cho Bé - Có Cửa Chui Tặng Kèm Bóng,290000,Siêu Thị 24h Online
11909573,https://www.sendo.vn/vong-noi-cho-be-loai-khong-dien-tang-man-chong-muoi-tam-lot-lung-11909573.html,"Võng Nôi cho bé loại không điện - Tặng màn chống muỗi, tấm lót lưng",630000,Siêu Thị 24h Online
24241713,https://www.sendo.vn/ghe-nhun-kem-do-choi-cho-be-24241713.html,Ghế nhún KÈM đồ chơi cho bé,199000,GIA DỤNG ĐẠI PHÁT
13047194,https://www.sendo.vn/cui-quay-cho-be-vui-choi-13047194.html,Cũi quây cho bé vui chơi,269000,Tạp hóa toàn quốc
19709559,https://www.sendo.vn/1-thanh-chan-giuong-2m-chinh-cao-7-nac-khong-kenh-dem-1-thanh-19709559.html,1 THANH CHẮN GIƯỜNG 2M CHỈNH CAO 7 NẤC KHÔNG KÊNH ĐỆM - 1 thanh,339000,GIA DỤNG ĐĂNG MINH
23253063,https://www.sendo.vn/vong-noi-cho-be-khanh-ngoc-khong-dien-tang-man-chong-muoi-tam-lot-lung-23253063.html,"Võng Nôi Cho Bé Khánh Ngọc Không Điện - Tặng Màn Chống Muỗi, Tấm Lót Lưng",628000,shopluandung
26234697,https://www.sendo.vn/chieu-cao-su-hoi-cho-be-26234697.html,CHIẾU CAO SU HƠI CHO BÉ,125000,SIEUTHI_ME_VA_BE
18799512,https://www.sendo.vn/quay-cui-kiem-nha-bong-khung-inox-cho-be-tang-kem-12-15-bong-da-sac-mau-18799512.html,Quây Cũi Kiêm Nhà Bóng Khung Inox Cho Bé Tặng Kèm 12-15 Bóng Đa Sắc Màu,290000,Siêu Thị 24h Online
22843739,https://www.sendo.vn/dem-ngu-thong-minh-chong-giat-minh-22843739.html,Đệm Ngủ Thông Minh chống giật mình,199000,hangsosinh 46115
23004609,https://www.sendo.vn/noi-dien-vong-xep-thanh-hung-2-trong-1-tang-vong-man-chong-muoi-tam-lot-lung-23004609.html,"Nôi điện Võng Xếp Thành Hưng 2 trong 1 - Tặng Võng, Màn Chống Muỗi, Tấm Lót Lưng ",680000,Siêu Thị 24h Online
12537109,https://www.sendo.vn/noi-dien-vong-xep-2in1-khanh-ngoc-tang-kem-vong-man-chong-muoi-12537109.html,"Nôi điện võng xếp 2in1 Khánh Ngọc - Tặng kèm võng, màn chống muỗi",720000,Siêu Thị 24h Online
24577984,https://www.sendo.vn/vong-noi-dai-vy-24577984.html,võng nôi đại vỹ,999000,CÁI GÌ CŨNG CÓ 02
24594810,https://www.sendo.vn/noi-xach-tay-chicco-24594810.html,Nôi xách tay Chicco,690000,baby68
25125599,https://www.sendo.vn/may-dua-vong-tu-dong-fujishi-va017-co-may-va-adapter-hang-viet-nam-cong-nghe-nhat-ban-25125599.html,Máy đưa võng tự động Fujishi VA017 có máy và adapter hàng Việt Nam công nghệ Nhật bản,365000,Shop Mounts
25267842,https://www.sendo.vn/goi-ngu-dung-tu-the-chong-trao-nguoc-cho-be-25267842.html,GỐI NGỦ ĐÚNG TƯ THẾ CHỐNG TRÀO NGƯỢC CHO BÉ,299000,Best Store Việt Nam
24577941,https://www.sendo.vn/vong-noi-dai-vy-24577941.html,võng nôi đại vỹ,999000,CÁI GÌ CŨNG CÓ 01
25368412,https://www.sendo.vn/giuong-luoi-cho-be-mam-non-th01-25368412.html,Giường lưới cho bé mầm non TH01,270000,Siêu Thị 24h Online
25455649,https://www.sendo.vn/bong-vai-luyen-chan-cho-be-me-ken-25455649.html,Bóng vải luyện chân cho bé - Mẹ Ken,150000,Bột Bình Tinh Nguyên Chất
25036312,https://www.sendo.vn/vong-noi-dai-vi-2-trong-1-25036312.html,võng nôi đại vĩ 2 trong 1,880000,minh son dieu anh
23440040,https://www.sendo.vn/dem-luoi-cho-be-tang-tam-dem-4-mua-23440040.html,Đệm lưới cho bé-tặng tấm đệm 4 mùa,299000,shop Muns
24085787,https://www.sendo.vn/combo-quay-cui-va-dem-cho-be-24085787.html,Combo quây cũi và đệm cho bé,1139000,HONA BEAT
24487229,https://www.sendo.vn/xe-day-5-banh-kieu-moi-24487229.html,XE ĐẨY 5 BÁNH KIỂU MỚI,380000,shopsieure911
24149390,https://www.sendo.vn/noi-tu-dong-cao-cap-cho-be-mastela-sg239-be-24149390.html,"Nôi Tự Động Cao Cấp Cho Bé Mastela SG239, Be",2060000,Chăm sóc bé sơ sinh
23598499,https://www.sendo.vn/ghe-rung-ghe-nhun-cho-be-23598499.html,GHẾ RUNG GHẾ NHÚN CHO BÉ ,630000,SHOP MẸ VÀ BÉ 89
24346405,https://www.sendo.vn/bo-nem-cho-be-so-sinh-60x80cm-24346405.html,bộ nệm cho bé sơ sinh 60x80cm,255000,tattantatndshop
22999285,https://www.sendo.vn/de-m-na-m-cao-ca-p-da-chu-c-nang-coza-baby-bed-lite-mau-hong-22999285.html,Đệm Nằm Cao Cấp Đa Chức Năng Coza Baby Bed – Lite Màu Hồng,2299000,Mom Baby Care
24094279,https://www.sendo.vn/giuong-luoi-th01-cho-cac-be-hoc-mam-non-24094279.html,Giường lưới TH01 cho các bé học mầm non 💕💕💕💕,229000,ThoanKim
23757926,https://www.sendo.vn/noi-dien-dai-vi-2-trong-1-vua-la-noi-dien-vua-la-vong-xep-hang-vn-chat-luong-cao-23757926.html,NÔI ĐIỆN ĐẠI VĨ 2 TRONG 1   VỪA LÀ NÔI ĐIỆN VỪA LÀ VÕNG XẾP - HÀNG VN CHẤT LƯỢNG CAO,650000,Shop Con Cưngg
23642764,https://www.sendo.vn/noi-dien-dai-vi-2-trong-1-vua-la-noi-dien-vua-la-vong-xep-hang-vn-chat-luong-cao-23642764.html,NÔI ĐIỆN ĐẠI VĨ 2 TRONG 1 VỪA LÀ NÔI ĐIỆN VỪA LÀ VÕNG XẾP - HÀNG VN CHẤT LƯỢNG CAO,800000,Tổng Kho Sơ Sinh Giá Sỉ
23754899,https://www.sendo.vn/treo-noi-kich-thich-thi-giac-hinh-cuu-den-trang-23754899.html,Treo nôi kích thích thị giác hình cừu đen trắng,109000,Thiết bị vệ sinh LIFMOD
23207331,https://www.sendo.vn/giuong-luoi-kim-loai-full-box-viet-kids-cho-be-nhieu-size-23207331.html,Giường lưới kim loại full box Viet kids cho bé nhiều size,230000,Babies Vn
23797584,https://www.sendo.vn/bo-dem-luc-lac-co-phat-nhac-cho-be-23797584.html,Bộ đệm lục lặc có phát nhạc cho bé,350000,94 HOST STORE
23746288,https://www.sendo.vn/bo-may-dua-vong-da-nang-23746288.html,BỘ MÁY ĐƯA VÕNG ĐA NĂNG,680000,công nghệ độc quyền
23642128,https://www.sendo.vn/quay-bong-khung-inox-23642128.html,Quây bóng khung inox,400000,Tổng Kho Sơ Sinh Giá Sỉ
23729678,https://www.sendo.vn/quay-cui-ga-chun-goi-va-tho-om-23729678.html,quây cũi. ga chun. gối và thỏ ôm,650000,LôiLôi90
27556253,https://www.sendo.vn/noi-dua-tre-em-joie-serina-2in1-petite-city-cho-be-tu-so-sinh-den-13kg-27556253.html,Nôi Đưa Trẻ Em Joie Serina 2in1 Petite City cho bé từ sơ sinh đến 13kg,4199000,Chăm sóc bé sơ sinh
28400824,https://www.sendo.vn/giuong-nem-ngu-em-ai-cho-be-28400824.html,Giường Nệm Ngủ Êm Ái Cho Bé,859000,Phụ kiện HnL
28271060,https://www.sendo.vn/giuong-cui-tre-em-joie-kubbie-sleep-foggy-gray-28271060.html,Giường Cũi Trẻ Em Joie Kubbie Sleep Foggy Gray,2799000,Chăm sóc bé sơ sinh
27869868,https://www.sendo.vn/noi-cui-ke-giuong-da-nang-giuong-cui-gap-gon-co-6-banh-xe-di-chuyen-cho-be-one-kem-xanh-27869868.html,"Nôi, cũi kề giường đa năng, giường cũi gấp gọn có 6 bánh xe di chuyển cho bé ONE kem (xanh)",2499000,dautram_ngoctuyet
28087018,https://www.sendo.vn/giuong-ngu-xinh-yeu-cho-be-28087018.html,GIƯỜNG NGỦ XINH YÊU CHO BÉ,330000,Bách hóa tổng hợp 03
27813218,https://www.sendo.vn/cui-quay-cho-be-27813218.html,CŨI QUÂY CHO BÉ,450000,giadunganan
27174169,https://www.sendo.vn/bo-dem-quay-cui-quay-cui-kitty-hong-cho-be-vai-cotton-kittys1006-27174169.html,Bộ Đệm Quây Cũi QUÂY CŨI KITTY HỒNG CHO BÉ-  VẢI COTTON KITTYS1006,389000,Shop Mẹ Đô Đậu
28053851,https://www.sendo.vn/day-noi-dien-em-be-combo-5-soi-ban-day-28053851.html,Dây nôi điện em bé combo 5 sợi bản dày,145000,hoa giay
27969678,https://www.sendo.vn/day-curoa-noi-dien-cho-lon-ban-day-dan-27969678.html,Dây curoa nôi điện Chợ Lớn - bản dày dặn,30000,hoa giay
28106422,https://www.sendo.vn/cui-3d-4-canh-me-vi-be-28106422.html,Cũi 3d 4 cánh - Mẹ Vì Bé,880000,Cty Mẹ Vì Bé
28167041,https://www.sendo.vn/day-curoa-cho-noi-autoru-long-lung-hoang-thanh-nhua-cho-lon-dai-vi-28167041.html,"Dây curoa cho nôi Autoru, Long Lưng, Hoàng Thành, Nhựa Chợ Lớn, Đại Vĩ  .....",13000,baby68
28137316,https://www.sendo.vn/day-curoa-noi-dien-dai-vi-28137316.html,Dây curoa nôi điện Đai Vĩ,10000,hoa giay
28232857,https://www.sendo.vn/giuong-ngu-cho-be-28232857.html,giường ngủ cho bé,370000,GiadungDinhVinh
28567226,https://www.sendo.vn/chieu-muslin-chieu-dieu-hoa-cho-be-28567226.html,"Chiếu muslin, chiếu điều hòa cho bé",188000,tongkhososinh
28199110,https://www.sendo.vn/giuong-tang-28199110.html,giường tầng,10900000,Nội thất Lê Trường
28537647,https://www.sendo.vn/thanh-chan-giuong-babysmiles-28537647.html,Thanh Chắn Giường BabySmiles,400000,Ngocphat212
18868909,https://www.sendo.vn/quay-cui-nhua-loai-10-mieng-cho-be-tang-tham-va-bong-hang-cao-cap-18868909.html,QUÂY CŨI NHỰA LOẠI 10 MIẾNG CHO BÉ  TẶNG THẢM VÀ BÓNG HÀNG CAO CẤP,1380000,Cái Gì Chẳng Có 1
19208619,https://www.sendo.vn/giuong-luoi-cho-be-19208619.html,Giường lưới cho bé,249000,Kho hàng gia dụng uy tín
18850587,https://www.sendo.vn/combo-noi-vong-tu-dong-cho-be-2-trong-1-vinanoi-nv20-va-diu-em-be-18850587.html,COMBO Nôi Võng tự động cho bé 2 trong 1 VINANOI - NV20 Và Địu em bé,1250000,MeBeOnline
18736105,https://www.sendo.vn/noi-dien-vong-xep-2-tang-co-dai-2-trong-1-co-man-chong-muoi-tang-vong-18736105.html,"Nôi điện Võng xếp 2 tầng cỡ đại 2 Trong 1 Có màn chống muỗi ,tặng võng ",1280000,BabyChip
19352566,https://www.sendo.vn/treo-cui-hinh-dong-vat-co-nhac-winfun-19352566.html,Treo cũi hình động vật có nhạc Winfun,359000,TILO MART OFFICIAL STORE
19293511,https://www.sendo.vn/noi-tu-dong-autoru-eco22-19293511.html,Nôi tự động Autoru ECO22,1390000,YoYoShop99
19330600,https://www.sendo.vn/cui-giuong-2-giat-goldcat-mua-cui-tang-man-ho-tro-phi-ship-19330600.html,"Cũi giường 2 giát GoldCat - MUA CŨI TẶNG MÀN, HỖ TRỢ PHÍ SHIP",2400000,Goldcat shop
19377649,https://www.sendo.vn/noi-dien-noi-dien-vong-xep-2-trong-1-19377649.html,Nôi điện Nôi điện võng xếp 2 trong 1,1000000,Gia Dụng Bảo Hân
18850723,https://www.sendo.vn/combo-noi-vong-tu-dong-cho-be-2-trong-1-vinanoi-nv20-va-goi-ke-chuyen-cho-be-18850723.html,COMBO Nôi Võng tự động cho bé 2 trong 1 VINANOI - NV20 Và Gối kể chuyện cho bé,1300000,MeBeOnline
18869166,https://www.sendo.vn/quay-cui-nhua-loai-18-mieng-cho-be-tang-tham-va-bong-hang-cao-cap-18869166.html,QUÂY CŨI NHỰA LOẠI 18 MIẾNG CHO BÉ  TẶNG THẢM VÀ BÓNG HÀNG CAO CẤP,1890000,Cái Gì Chẳng Có 1
20250137,https://www.sendo.vn/vong-xep-khung-vuong-inox-co-tang-kem-vong-cao-cap-20250137.html,VÕNG XẾP KHUNG VUÔNG INOX CÓ TẶNG KÈM VÕNG CAO CẤP,560000,ĐỒ CHƠI CHO BÉ
20743052,https://www.sendo.vn/tham-nam-choi-nhac-baby-gym-music-20743052.html,THẢM NẰM CHƠI NHẠC BABY GYM MUSIC,165000,SIEUTHI_ME_VA_BE
20177907,https://www.sendo.vn/dem-ngu-dung-tu-the-chong-trao-nguoc-babymoov-bm14836-20177907.html,ĐỆM NGỦ ĐÚNG TƯ THẾ & CHỐNG TRÀO NGƯỢC BABYMOOV BM14836,1550000,siêu thị TELO
19000782,https://www.sendo.vn/noi-dien-vong-xep-2-tang-co-dai-2-trong-1-co-man-chong-muoi-tang-vong-19000782.html,Nôi điện Võng xếp 2 tầng cỡ đại 2 Trong 1 - Có màn chống muỗi  + tặng võng ,1150000,Siêu Thị 24h Online
18779157,https://www.sendo.vn/gia-treo-6-ngan-de-quan-ao-giay-dep-trong-tu-18779157.html,"Giá treo 6 ngăn để quần áo, giầy dép trong tủ",285000,HONG DO MINIMART
17988252,https://www.sendo.vn/giuong-luoi-mua-he-cho-be-120x55x10cm-17988252.html,Giường lưới mùa hè cho bé 120x55x10cm,179000,Hàng Chất Lượng
29377812,https://www.sendo.vn/it-smart-giuong-nam-cho-be-sozzy-cao-su-non-cao-cap-chong-lat-chong-trao-29377812.html,"It Smart - Giường nằm cho bé Sozzy cao su non cao cấp chống lật, chống trào",185000,Tiệm Đồ Gia Dụng 168
28591220,https://www.sendo.vn/noi-ngu-cho-be-rung-tu-dong-babykey-5-che-do-rung-hen-gio-remote-phat-nhac-tren-dien-thoai-bang-bluetooth-xam-28591220.html,"Nôi ngủ cho bé Rung Tự Động BaByKey 5 Chế Độ Rung, Hẹn Giờ, Remote, Phát Nhạc Trên Điện Thoại bằng Bluetooth (Xám)",2290000,HanRui Shop
28890327,https://www.sendo.vn/quay-cui-kiem-nha-bong-khung-inox-hang-cao-cap-dung-cho-be-yeu-28890327.html, Quây cũi kiêm nhà bóng khung inox - Hàng cao cấp dùng cho bé yêu,299000,SHOP MINH KHÔI BABY
20349682,https://www.sendo.vn/giuong-gap-son-tinh-dien-van-phong-cao-cap-20349682.html,giường gấp sơn tĩnh điện văn phòng cao cấp,370000,màn chụp tự bung
20000434,https://www.sendo.vn/cu-quay-luc-giac-20000434.html,CŨ QUÂY LỤC GIÁC,520000,tổng kho gia dụng huong
20687589,https://www.sendo.vn/giuong-luoi-cho-be-yeu-kem-qua-tang-20687589.html,GIƯỜNG LƯỚI CHO BÉ YÊU KÈM QUÀ TẶNG ,169000,GiaDụngThăngLong
20687579,https://www.sendo.vn/giuong-luoi-cho-be-yeu-kem-qua-tang-20687579.html,GIƯỜNG LƯỚI CHO BÉ YÊU KÈM QUÀ TẶNG ,169000,GiaDụngBaMiền
19996860,https://www.sendo.vn/bo-nem-cho-be-so-sinh-60x80cm-19996860.html,bộ nệm cho bé sơ sinh 60x80cm,120000,ngocbich94
20687561,https://www.sendo.vn/giuong-luoi-cho-be-20687561.html,GIƯỜNG LƯỚI CHO BÉ,169000,GiaDụngBaMiền
20687550,https://www.sendo.vn/giuong-luoi-cho-be-20687550.html,GIƯỜNG LƯỚI CHO BÉ,169000,GiaDụngThăngLong
20555721,https://www.sendo.vn/giuong-luoi-cho-be-20555721.html,GIƯỜNG LƯỚI CHO BÉ ,175000,GIA DỤNG ĐĂNG MINH
20878508,https://www.sendo.vn/noi-ngu-chung-giuong-summer-20878508.html,Nôi ngủ chung giường Summer,1799000,azobabyvn
20637844,https://www.sendo.vn/giuong-luoi-tre-em-20637844.html,giường lưới trẻ em,340000,GiadungDinhVinh
20419789,https://www.sendo.vn/dem-ngu-dung-tu-the-babymoov-bm15322-20419789.html,ĐỆM NGỦ ĐÚNG TƯ THẾ BABYMOOV BM15322,1260000,siêu thị TELO
20204340,https://www.sendo.vn/si-noi-dien-tang-them-vong-cho-be-20204340.html,SỈ NÔI ĐIỆN TẶNG THÊM VÕNG CHO BÉ,629000,ĐỒ CHƠI HỮU ÍCH
22387722,https://www.sendo.vn/giuong-tang-bella-45192-kem-hoc-nam-nhieu-mau-22387722.html,Giường tầng Bella 45192 kèm hộc nằm nhiều màu,7150000,baby68
21852891,https://www.sendo.vn/dem-chong-trao-nguoc-cho-be-21852891.html,Đệm chống trào ngược cho bé,310000,Cactus
21822057,https://www.sendo.vn/nem-mung-cho-be-nem-mung-cho-be-nemmungchobe-21822057.html,nệm mùng cho bé - nệm mùng cho bé - nemmungchobe,149000,tiện ích vũng tàu 24h
22313196,https://www.sendo.vn/quay-cui-ga-chun-chan-tran-bong-goi-va-thu-om-22313196.html,Quây cũi. ga chun. chăn trần bông. gối và thú ôm,800000,LôiLôi90
22328699,https://www.sendo.vn/treo-noi-cui-xe-day-tho-mama-gau-papa-co-nhac-22328699.html,"TREO NÔI, CŨI, XE ĐẨY THỎ MAMA GẤU PAPA CÓ NHẠC",79000,Babies Vn
19376563,https://www.sendo.vn/sac-noi-dien-cu-rung-noi-dien-dai-vi-tang-kem-2-day-curoa-19376563.html,"Sạc Nôi Điện, Củ Rung Nôi Điện Đại Vĩ - Tặng Kèm 2 Dây Curoa",350000,cốm tinh nghịch
17390040,https://www.sendo.vn/quay-bong-luc-giac-cho-be-17390040.html,QUÂY BÓNG LỤC GIÁC CHO BÉ,350000,gia dụng binbo
19206384,https://www.sendo.vn/drap-chong-tham-19206384.html,drap chống thấm,250000,tranxuannui
16860557,https://www.sendo.vn/may-dua-vong-tu-dong-co-radio-fm-va-may-nghe-nhac-usb-cao-cap-prota-ke-16860557.html,Máy đưa võng tự động có radio FM và máy nghe nhạc USB cao cấp Prota kè,750000,Taphoagannha
21835610,https://www.sendo.vn/tham-choi-cho-be-con-trung-10-mieng-dien-tich-1m2-smile-puzzle-khong-mui-21835610.html,"Thảm chơi cho bé côn trùng 10 miếng, diện tích 1m2 Smile Puzzle Không mùi",179000,SmilePuzzleVN
16840488,https://www.sendo.vn/combo-vong-xep-inox-cao-cap-va-may-dua-tu-dong-vinanoi-16840488.html,Combo Võng xếp inox cao cấp và Máy Đưa tự động VINANOI,1299000,Chăm sóc bé sơ sinh
16860500,https://www.sendo.vn/may-dua-vong-tu-dong-cao-cap-prota-kem-qua-tang-bo-lam-kem-16860500.html,Máy đưa võng tự động cao cấp Prota kèm quà tặng bộ làm kem,650000,Taphoagannha
16002292,https://www.sendo.vn/cui-quay-cho-be-16002292.html,CŨI QUÂY CHO BÉ ,480000,GiadungDinhVinh
16152283,https://www.sendo.vn/cui-quay-cho-be-16152283.html,CŨI QUÂY CHO BÉ ,420000,chuyên đồ gia dụng hương
16153546,https://www.sendo.vn/cui-quay-cho-be-16153546.html,CŨI QUÂY CHO BÉ ,420000,Shop Tiện Ích Gia Vinh
16689653,https://www.sendo.vn/quay-bong-cho-be-16689653.html,quây bóng cho bé,480000,Shop Tiện Ích Gia Vinh
23212506,https://www.sendo.vn/may-nghe-tieng-on-trang-white-noise-may-tao-tieng-ru-cho-be-ngu-ngon-23212506.html,Máy nghe tiếng ồn trắng white noise - Máy tạo tiếng ru cho bé ngủ ngon,185000,Túi Ngủ Thiện Tâm
16820236,https://www.sendo.vn/quay-bong-cho-be-16820236.html,quây bóng cho bé,480000,Shop Tiện Ích Gia Vinh
16099543,https://www.sendo.vn/quay-bong-khung-sat-cho-be-16099543.html,quây bóng khung sắt cho bé,480000,Dogiadung99
17189060,https://www.sendo.vn/cui-quay-cho-be-17189060.html,CŨI QUÂY CHO BÉ ,420000,chuyên đồ gia dụng hương
12935110,https://www.sendo.vn/cui-quay-cho-be-12935110.html,cũi quây cho bé,480000,Dogiadung99
17201509,https://www.sendo.vn/giuong-cui-noi-4-in1-thong-minh-cho-tre-so-sinh-alfor-baby-17201509.html,"Giường cũi, nôi 4 in1 thông minh cho trẻ sơ sinh  Alfor Baby",5890000,dautram_ngoctuyet
13060533,https://www.sendo.vn/giuong-luoi-cho-be-13060533.html,Giường Lưới Cho Bé,340000,chuyên đồ gia dụng hương
13035181,https://www.sendo.vn/giuong-luoi-cho-be-13035181.html,giường lưới cho bé,340000,Dogiadung99
13841345,https://www.sendo.vn/giuong-luoi-tre-em-13841345.html,giường lưới trẻ em,340000,GiadungDinhVinh
13841263,https://www.sendo.vn/giuong-luoi-tre-em-13841263.html,giường lưới trẻ em,340000,Shop Tiện Ích Gia Vinh
13078413,https://www.sendo.vn/cui-quay-cho-be-kem-100-bong-13078413.html,CŨI QUÂY CHO BÉ kèm 100 bóng,520000,GIA DỤNG TỔNG HỢP VIAN
14041251,https://www.sendo.vn/cui-quay-bong-khung-sat-cho-be-14041251.html,cũi quây bóng khung sắt cho bé,480000,Dogiadung99
14040978,https://www.sendo.vn/cui-quay-kem-100-bong-cho-be-14040978.html,cũi quây kèm 100 bóng cho bé,510000,Shop Tiện Ích Gia Vinh
13078327,https://www.sendo.vn/cui-quay-cho-be-kem-100-bong-13078327.html,CŨI QUÂY CHO BÉ kèm 100 bóng,520000,giadunganan
13255632,https://www.sendo.vn/giuong-luoi-cho-be-13255632.html,giường lưới cho bé,340000,chuyên đồ gia dụng hương
13643377,https://www.sendo.vn/dokma-bo-chan-so-sinh-cho-be-13643377.html,dokma  bộ chặn sơ sinh cho bé,85000,dokma
13036120,https://www.sendo.vn/giuong-luoi-cho-be-13036120.html,giường lưới cho bé,340000,GiadungDinhVinh
13554817,https://www.sendo.vn/giuong-luoi-tre-em-13554817.html,giường lưới trẻ em,340000,chuyên đồ gia dụng hương
13094389,https://www.sendo.vn/cui-quay-cho-be-kem-100-bong-13094389.html,CŨI QUÂY CHO BÉ kèm 100 bóng,520000,ĐỒ GIA DỤNG VIAN
13525161,https://www.sendo.vn/giuong-luoi-tre-em-13525161.html,giường lưới trẻ em,340000,Dogiadung99
12131485,https://www.sendo.vn/cui-quay-bong-cho-be-12131485.html,Cũi Quây Bóng Cho Bé,480000,GiadungDinhVinh
12553341,https://www.sendo.vn/thanh-chan-giuong-mau-moi-2018-truot-len-xuong-2-2m-12553341.html,"thanh chắn giường mẫu mới 2018 trượt lên xuống 2,2m",420000,ShopDuongMinh
12084909,https://www.sendo.vn/ghe-hoi-tap-ngoi-cho-be-12084909.html,Ghế hơi tập ngồi cho bé,145000,shop gia dụng hàng chuẩn
12133962,https://www.sendo.vn/noi-tre-oval-size-85x55cm-12133962.html,nôi tre oval size 85x55cm,130000,abcbabies
12465575,https://www.sendo.vn/cui-quay-cho-be-kem-100-bong-12465575.html,CŨI QUÂY CHO BÉ kèm 100 bóng,520000,ĐỒ GIA DỤNG VIAN
12470479,https://www.sendo.vn/noi-rung-dien-graco-cao-cap-12470479.html,nôi rung điện GRACO cao cấp,6900000,Siêu Thị Happy
12470326,https://www.sendo.vn/noi-rung-dien-co-nhac-ru-ngu-12470326.html,Nôi rung điện có nhạc ru ngủ,5900000,Siêu Thị Happy
12465564,https://www.sendo.vn/cui-quay-cho-be-12465564.html,CŨI QUÂY CHO BÉ,480000,ĐỒ GIA DỤNG VIAN
11450570,https://www.sendo.vn/ghe-rung-cao-cap-cho-be-co-bao-hiem-do-choi-mai-che-goi-dau-11450570.html,"Ghế rung Cao cấp cho bé - Có bảo hiểm, đồ chơi, mái che, gối đầu",370000,Siêu Thị 24h Online
12897429,https://www.sendo.vn/giuong-luoi-cho-be-12897429.html,giường lưới cho bé,340000,chuyên đồ gia dụng hương
12063050,https://www.sendo.vn/cui-tre-em-3-trong-1-marlow-mau-go-tu-nhien-me-vi-be-12063050.html,Cũi trẻ em 3 trong 1 Marlow màu gỗ tự nhiên - Mẹ Vì Bé,2550000,Mẹ Vì Bé
12063218,https://www.sendo.vn/ke-03-tang-kiem-ban-thay-ta-mau-go-tu-nhien-me-vi-be-12063218.html,Kệ 03 tầng kiêm bàn thay tã màu gỗ tự nhiên - Mẹ Vì Bé,1150000,Mẹ Vì Bé
11907389,https://www.sendo.vn/quay-cui-nhua-3d-loai-16-mieng-cho-be-hang-cao-cap-tang-tham-va-bong-11907389.html,QUÂY CŨI NHỰA 3D LOẠI 16 MIẾNG CHO BÉ HÀNG CAO CẤP TẶNG THẢM VÀ BÓNG,2050000,Cái Gì Chẳng Có
12234381,https://www.sendo.vn/noi-dua-graco-sweetpeace-faux-fur-12234381.html,Nôi đưa Graco Sweetpeace Faux Fur,5799000,Chăm sóc bé sơ sinh
11835830,https://www.sendo.vn/thiet-bi-mam-non-toan-quoc-cc-si-le-giuong-mn-ma-2xst-11835830.html,"THIẾT BỊ MẦM NON TOÀN QUỐC. CC sỉ, lẻ giường MN. Mã 2XST",200000,Thietbimamnontoanquoc
13096643,https://www.sendo.vn/cui-quay-cho-be-kem-100-bong-13096643.html,Cũi Quây Cho Bé kèm 100 Bóng,510000,chuyên đồ gia dụng hương
12844854,https://www.sendo.vn/quay-bong-khung-sat-cho-be-12844854.html,quây bóng khung sắt cho bé,480000,GiadungDinhVinh
12965507,https://www.sendo.vn/may-dua-vong-duy-phuong-12965507.html,Máy Đưa Võng Duy Phương,460000,giadungminhminh
10026825,https://www.sendo.vn/quay-cui-nhua-3d-hoang-gia-16-mieng-cho-be-kem-tham-va-bong-10026825.html,QUÂY CŨI NHỰA 3D HOÀNG GIA 16 MIẾNG CHO BÉ KÈM THẢM VÀ BÓNG,1850000,Cái Gì Chẳng Có 1
9450546,https://www.sendo.vn/noi-dua-tre-em-joie-serina-swivel-hip-hop-9450546.html,NÔI ĐƯA TRẺ EM JOIE SERINA SWIVEL HIP HOP,3900000,Chăm sóc bé sơ sinh
10026647,https://www.sendo.vn/quay-cui-nhua-3d-hoang-gia-12-mieng-cho-be-kem-tham-va-bong-10026647.html,QUÂY CŨI NHỰA 3D HOÀNG GIA 12 MIẾNG CHO BÉ KÈM THẢM VÀ BÓNG,1750000,Cái Gì Chẳng Có 1
10026753,https://www.sendo.vn/quay-cui-nhua-3d-loai-14-mieng-cho-be-phong-cach-hoang-gia-kem-tham-va-bong-10026753.html,QUÂY CŨI NHỰA  3D LOẠI 14 MIẾNG CHO BÉ PHONG CÁCH HOÀNG GIA KÈM THẢM VÀ BÓNG,1950000,Cái Gì Chẳng Có 1
23769068,https://www.sendo.vn/khan-quan-chun-giup-be-so-sinh-ngu-ngon-23769068.html,KHĂN QUẤN CHŨN GIÚP BÉ SƠ SINH NGỦ NGON,150000,Túi Ngủ Thiện Tâm
10139939,https://www.sendo.vn/ghe-rung-ghe-nhun-kem-gau-cho-be-10139939.html,Ghế Rung - Ghế Nhún Kèm Gấu Cho Bé,300000,Banbuonhanggiadung91
9587089,https://www.sendo.vn/quay-cui-nhua-16-mieng-cho-be-kem-tham-va-bong-9587089.html,QUÂY CŨI NHỰA 16 MIẾNG CHO BÉ KÈM THẢM VÀ BÓNG,2100000,Cái Gì Chẳng Có
10283169,https://www.sendo.vn/quay-cui-nhua-3d-loai-12-mieng-cho-be-co-bong-ro-tang-tham-va-bong-10283169.html,QUÂY CŨI NHỰA 3D LOẠI 12 MIẾNG CHO BÉ CÓ BÓNG RỔ TẶNG THẢM VÀ BÓNG,1750000,Cái Gì Chẳng Có
8626975,https://www.sendo.vn/dem-cho-be-dinh-hinh-chong-bep-dau-cao-cap-tang-kem-bo-10-khan-yem-8626975.html,Đệm cho bé định hình chống bẹp đầu cao cấp Tặng kèm bộ 10 khăn yếm,289000,sweet boutique86
8453081,https://www.sendo.vn/giuong-luoi-mam-non-khung-inox-8453081.html,Giường lưới mầm non khung inox,300000,Carol
11396551,https://www.sendo.vn/cui-tre-em-3-trong-1-henley-trang-me-vi-be-11396551.html,Cũi trẻ em 3 trong 1 Henley trắng - Mẹ Vì Bé,3850000,Mẹ Vì Bé
11390330,https://www.sendo.vn/noi-dien-tu-dong-2-in-1-khanh-ngoc-tang-man-chong-muoi-vong-tam-lot-lung-11390330.html,"Nôi điện tự động 2 in 1 Khánh Ngọc - Tặng màn chống muỗi, võng, tấm lót lưng",749000,Siêu Thị 24h Online
9975797,https://www.sendo.vn/nem-cho-be-nem-cao-cap-cho-be-9975797.html,Nệm cho bé - Nệm cao cấp cho bé,499000,giadinhcungmuavn
11354743,https://www.sendo.vn/cui-quay-cho-be-kem-100-bong-11354743.html,CŨI QUÂY CHO BÉ kèm 100 bóng,520000,giadunganan
11311320,https://www.sendo.vn/ghe-rung-cho-be-yeu-11311320.html,GHẾ RUNG CHO BÉ YÊU,159000,sieuthidochoi
10211788,https://www.sendo.vn/xich-du-mastela-6558-dung-dua-tu-dong-mau-nau-10211788.html,Xích đu Mastela  6558 đung đưa tự động  màu nâu,1499000,Diệp Anh Japan
11279637,https://www.sendo.vn/drap-chong-tham-hoang-thien-ha-11279637.html,Drap chống thấm Hoàng Thiên Hà,230000,tranxuannui
