product_id,product_url,name,price,shop_name
28240065,https://www.sendo.vn/quay-bong-khung-inox-tang-kem-100-bong-28240065.html,QUÂY BÓNG KHUNG INOX-tặng kèm 100 bóng,310000,shopmebon208
24054241,https://www.sendo.vn/noi-may-chong-may-cho-be-24054241.html,Nôi mây -Chõng mây cho bé,530000,Đồ Gia Dụng VN
23253063,https://www.sendo.vn/vong-noi-cho-be-khanh-ngoc-khong-dien-tang-man-chong-muoi-tam-lot-lung-23253063.html,"Võng Nôi Cho Bé Khánh Ngọc Không Điện - Tặng Màn Chống Muỗi, Tấm Lót Lưng",628000,shopluandung
11562760,https://www.sendo.vn/bo-vong-xep-danh-cho-be-vong-xep-cao-cap-11562760.html,bộ võng xếp dành cho bé võng xếp cao cấp,315000,Võng Xếp Các Loại
10549065,https://www.sendo.vn/ghe-nhun-rung-an-toan-cho-be-10549065.html,"Ghế nhún, rung an toàn cho bé",179000,duchangshop
11969618,https://www.sendo.vn/cui-quay-cho-be-khung-inox-quay-cui-leu-nha-banh-11969618.html,cũi quây cho bé khung inox-quây cũi-lều nhà banh,298000,LÊ NGUYỄN 88
13355288,https://www.sendo.vn/noi-kiem-vong-dien-cho-be-2-in-1-hang-viet-nam-13355288.html,NÔI KIÊM VÕNG ĐIỆN CHO BÉ 2 IN 1 HÀNG VIỆT NAM,699000,Kho hàng gia dụng uy tín
14189694,https://www.sendo.vn/noi-ngu-chung-giuong-noi-kiem-tui-dung-do-da-nang-cho-be-den-24-thang-nhieu-mau-sac-hang-vnxk-thuong-hieu-phu-dat-tang-qua-cho-be-14189694.html,"Nôi ngủ chung giường , nôi kiêm túi đựng đồ đa năng cho bé đến 24 tháng nhiều màu sắc hàng VNXK thương hiệu Phú Đạt tặng quà cho bé",199000,Chợ Giá Rẻ
25479844,https://www.sendo.vn/man-chup-tu-bung-cao-ca-p-m6x2m-m8x2m-2mx2m2-25479844.html,"Màn chụp tự bung cao cấp m6x2m,m8x2m,2mx2m2",130000,Kimthoan
24728650,https://www.sendo.vn/noi-kiem-vong-dien-cho-be-2-in-1-hang-viet-nam-24728650.html,NÔI KIÊM VÕNG ĐIỆN CHO BÉ 2 IN 1 HÀNG VIỆT NAM,649000,BabyOnlineHN
27513985,https://www.sendo.vn/noi-dien-tu-dong-2-in-1-khanh-ngoc-tang-man-chong-muoi-vong-tam-lot-lung-kn01-27513985.html,"Nôi điện tự động 2 in 1 Khánh Ngọc - Tặng màn chống muỗi, võng, tấm lót lưng - kn01",680000,Thế giới tạp hóa
28891299,https://www.sendo.vn/tron-bo-khung-va-vong-xep-cho-be-iu-28891299.html,trọn bộ khung và võng xếp cho bé iu,220000,Shop Đu Đưa Relax
10685974,https://www.sendo.vn/day-cu-roa-noi-dien-10685974.html,DÂY CU ROA NÔI ĐIỆN,20000,TuấnThanh1189
16333433,https://www.sendo.vn/noi-dien-vong-xep-tu-dong-thanh-hung-2-trong-1-tang-vong-man-chong-muoi-16333433.html,Nôi Điện Võng xếp tự động Thành Hưng 2 trong 1 tặng võng - màn chống muỗi,650000,Thế giới tạp hóa
23465313,https://www.sendo.vn/giuong-luoi-mam-non-cao-cap-cho-be-yeu-23465313.html,Giường lưới mầm non cao cấp cho bé yêu,290000,Thế giới tạp hóa
16233622,https://www.sendo.vn/man-chup-tu-bung-16233622.html,Màn Chụp Tự Bung,199000,Kho hàng gia dụng uy tín
26915809,https://www.sendo.vn/giuong-luoi-cho-be-100x55cm-26915809.html,Giường lưới cho bé 100x55cm,165000,đồ chơi mầm non chất lượng cao
25555855,https://www.sendo.vn/giuong-luoi-2-nan-cho-be-25555855.html,GIƯỜNG LƯỚI 2 NAN CHO BÉ,219000,Kho hàng gia dụng uy tín
1466337,https://www.sendo.vn/thanh-chan-giuong-tre-em-kuku-ku-6009-1466337.html,Thanh chắn giường trẻ em kuku ku-6009,1199000,Chăm sóc bé sơ sinh
11732746,https://www.sendo.vn/ghe-dung-cho-be-11732746.html,Ghế Dung Cho Bé,290000,chuyên đồ gia dụng hương
23760429,https://www.sendo.vn/quay-bong-khung-inox-tang-kem-bong-23760429.html,QUÂY BÓNG KHUNG INOX TẶNG KÈM BÓNG,289000,Kho hàng gia dụng uy tín
19205766,https://www.sendo.vn/giuong-luoi-cho-be-19205766.html,Giường lưới cho bé,249000,Kho hàng gia dụng uy tín
23187913,https://www.sendo.vn/vong-noi-cho-be-thanh-hung-khong-dien-tang-man-chong-muoi-tam-lot-lung-23187913.html,"Võng Nôi Cho Bé Thành Hưng Không Điện - Tặng Màn Chống Muỗi, Tấm Lót Lưng",629000,shopluandung
29080995,https://www.sendo.vn/ghe-bap-benh-co-gau-cho-be-29080995.html,GHẾ BẬP BỀNH CÓ GẤU CHO BÉ,199000,GIA DỤNG ĐẠI PHÁT
16602268,https://www.sendo.vn/combo-bo-2-day-curoa-noi-dai-vi-16602268.html,combo bộ 2 dây curoa nôi đại vĩ,35000,Kho hàng gia dụng uy tín
9355841,https://www.sendo.vn/cui-kiem-nha-bong-khung-inox-kem-110-bong-nhua-9355841.html,Cũi kiêm nhà bóng khung inox kèm 110 bóng nhựa,369000,Thế giới đồ chơi Thu Trang
19226843,https://www.sendo.vn/thanh-chan-giuong-thong-minh-cho-be-1-tam-19226843.html,Thanh chắn giường thông minh cho bé - 1 TẤM,345000,HAT Shop
25620318,https://www.sendo.vn/noi-tre-cho-be-1-15-thang-tang-vong-dau-tam-25620318.html,nôi tre cho bé 1_15 tháng tặng vòng dâu tằm,95000,chợ quê 76
16190760,https://www.sendo.vn/noi-dien-viet-nam-16190760.html,Nôi điện Việt Nam,699000,Kho hàng gia dụng uy tín
13454435,https://www.sendo.vn/noi-ngu-chung-giuong-noi-kiem-tui-dung-do-da-nang-cho-be-den-24-thang-nhieu-mau-sac-hang-vnxk-thuong-hieu-phu-dat-tang-qua-cho-be-13454435.html,"Nôi ngủ chung giường , nôi kiêm túi đựng đồ đa năng cho bé đến 24 tháng nhiều màu sắc hàng VNXK thương hiệu Phú Đạt tặng quà cho bé",199000,Chợ Giá Rẻ
11921069,https://www.sendo.vn/may-dua-vong-ah01-sbaby-11921069.html,Máy Đưa Võng AH01 Sbaby,590000,Shop Diệu My
19226827,https://www.sendo.vn/thanh-chan-giuong-thong-minh-cho-be-1-tam-19226827.html,Thanh chắn giường thông minh cho bé - 1 TẤM,345000,HAT Shop
13940932,https://www.sendo.vn/man-nhac-cho-be-yeu-13940932.html,Màn nhạc cho bé yêu,230000,HÀNGTIỆNÍCH
12111660,https://www.sendo.vn/thanh-chan-giuong-mau-moi-truot-len-xuong-2018-12111660.html,thanh chắn giường mẫu mới trượt lên xuống 2018,440000,shop sóc thỏ
26632375,https://www.sendo.vn/noi-cui-go-cho-be-playpen-4-canh-26632375.html,Nôi cũi gỗ cho bé Playpen 4 cánh,920000,YoYoShop99
12793170,https://www.sendo.vn/thanh-chan-giuong-baby-gift-m8-12793170.html,thanh chắn giường baby gift m8,310000,tongkholinhdam
17900321,https://www.sendo.vn/quay-bong-luoi-17900321.html,QUÂY BÓNG LƯỚI,420000,SHOP HÀNG TỔNG HỢP
29849113,https://www.sendo.vn/day-cu-roa-cho-cac-dong-noi-dien-29849113.html,Dây cu roa cho các dòng nôi điện,13000,baby68
12063218,https://www.sendo.vn/ke-03-tang-kiem-ban-thay-ta-mau-go-tu-nhien-me-vi-be-12063218.html,Kệ 03 tầng kiêm bàn thay tã màu gỗ tự nhiên - Mẹ Vì Bé,1150000,Mẹ Vì Bé
12367897,https://www.sendo.vn/quay-bong-cui-luoi-12367897.html,Quây Bóng Cũi Lưới,480000,GiadungDinhVinh
13643377,https://www.sendo.vn/dokma-bo-chan-so-sinh-cho-be-13643377.html,dokma  bộ chặn sơ sinh cho bé,85000,dokma
12776637,https://www.sendo.vn/vong-noi-tu-dong-dai-vi-12776637.html,võng nôi tự động đại vĩ,918000,dochoibacninh
13078327,https://www.sendo.vn/cui-quay-cho-be-kem-100-bong-13078327.html,CŨI QUÂY CHO BÉ kèm 100 bóng,520000,giadunganan
17130142,https://www.sendo.vn/cui-quay-cho-be-17130142.html,CŨI QUÂY CHO BÉ,480000,giadunganan
12706302,https://www.sendo.vn/cui-quay-kem-bong-12706302.html,CŨI QUÂY KÈM BÓNG,490000,giadunganan
12756565,https://www.sendo.vn/cui-quay-kem-bong-12756565.html,CŨI QUÂY KÈM BÓNG,490000,giadunganan
11354743,https://www.sendo.vn/cui-quay-cho-be-kem-100-bong-11354743.html,CŨI QUÂY CHO BÉ kèm 100 bóng,520000,giadunganan
11570532,https://www.sendo.vn/cui-quay-cho-be-kem-100-bong-11570532.html,CŨI QUÂY CHO BÉ kèm 100 bóng,520000,giadunganan
28063571,https://www.sendo.vn/giuong-ngu-xinh-xan-cho-be-28063571.html,Giường ngủ xinh xắn cho bé,370000,giadunganan
27813218,https://www.sendo.vn/cui-quay-cho-be-27813218.html,CŨI QUÂY CHO BÉ,450000,giadunganan
28167041,https://www.sendo.vn/day-curoa-cho-noi-autoru-long-lung-hoang-thanh-nhua-cho-lon-dai-vi-28167041.html,"Dây curoa cho nôi Autoru, Long Lưng, Hoàng Thành, Nhựa Chợ Lớn, Đại Vĩ  .....",13000,baby68
16413377,https://www.sendo.vn/cui-cho-be-16413377.html,CŨI CHO BÉ ,480000,giadunganan
22976313,https://www.sendo.vn/dem-ngu-dung-tu-the-baby-22976313.html,ĐỆM NGỦ ĐÚNG TƯ THẾ BABY,210000,Gia Dụng Gia Đình Việt
22657890,https://www.sendo.vn/tui-ngu-cho-be-22657890.html,Túi ngủ cho bé,230000,MUANGAY247
17732781,https://www.sendo.vn/giuong-tang-tre-em-angry-bird-gt06-17732781.html,Giường tầng trẻ em  Angry Bird GT06,9097000,baby68
17734361,https://www.sendo.vn/chieu-lua-dieu-hoa-kem-goi-cho-be-60x120cm-17734361.html,Chiếu Lụa Điều Hòa Kém Gối Cho Bé 60x120cm,125000,Zin Baby
17194190,https://www.sendo.vn/bo-02-goi-om-chan-hinh-meo-cho-be-baby-qt-10-x-50cm-cam-17194190.html,Bộ 02 Gối Ôm Chặn Hình Mèo Cho Bé Baby QT 10 x 50cm Cam,200000,Cộng Đồng Xanh
18869166,https://www.sendo.vn/quay-cui-nhua-loai-18-mieng-cho-be-tang-tham-va-bong-hang-cao-cap-18869166.html,QUÂY CŨI NHỰA LOẠI 18 MIẾNG CHO BÉ  TẶNG THẢM VÀ BÓNG HÀNG CAO CẤP,1890000,Cái Gì Chẳng Có 1
17154436,https://www.sendo.vn/combo-noi-vong-tu-dong-cho-be-2-trong-1-vinanoi-nv25-va-xe-tap-di-cho-be-17154436.html,COMBO Nôi Võng tự động cho bé 2 trong 1 VINANOI - NV25 Và Xe tập đi cho bé,1750000,MeBeOnline
18868909,https://www.sendo.vn/quay-cui-nhua-loai-10-mieng-cho-be-tang-tham-va-bong-hang-cao-cap-18868909.html,QUÂY CŨI NHỰA LOẠI 10 MIẾNG CHO BÉ  TẶNG THẢM VÀ BÓNG HÀNG CAO CẤP,1380000,Cái Gì Chẳng Có 1
10388352,https://www.sendo.vn/quay-cui-nhua-3d-loai-18-mieng-cho-be-kem-tham-va-bong-10388352.html,QUÂY CŨI NHỰA 3D LOẠI 18 MIẾNG CHO BÉ KÈM THẢM VÀ BÓNG,2150000,Cái Gì Chẳng Có
9587089,https://www.sendo.vn/quay-cui-nhua-16-mieng-cho-be-kem-tham-va-bong-9587089.html,QUÂY CŨI NHỰA 16 MIẾNG CHO BÉ KÈM THẢM VÀ BÓNG,2100000,Cái Gì Chẳng Có
10283169,https://www.sendo.vn/quay-cui-nhua-3d-loai-12-mieng-cho-be-co-bong-ro-tang-tham-va-bong-10283169.html,QUÂY CŨI NHỰA 3D LOẠI 12 MIẾNG CHO BÉ CÓ BÓNG RỔ TẶNG THẢM VÀ BÓNG,1750000,Cái Gì Chẳng Có
29751487,https://www.sendo.vn/bo-quay-cui-an-toan-cho-be-16-tam-1m6x2m-tang-bong-va-tham-29751487.html,Bộ quây cũi an toàn cho bé 16 tấm 1m6x2m tặng bóng và thảm,1490000,Thiên Quang Company
6711764,https://www.sendo.vn/cui-da-nang-3in1-hang-viet-nam-6711764.html,CŨI ĐA NĂNG 3IN1 HÀNG VIỆT NAM,2800000,Cái Gì Chẳng Có
11907389,https://www.sendo.vn/quay-cui-nhua-3d-loai-16-mieng-cho-be-hang-cao-cap-tang-tham-va-bong-11907389.html,QUÂY CŨI NHỰA 3D LOẠI 16 MIẾNG CHO BÉ HÀNG CAO CẤP TẶNG THẢM VÀ BÓNG,2050000,Cái Gì Chẳng Có
27869868,https://www.sendo.vn/noi-cui-ke-giuong-da-nang-giuong-cui-gap-gon-co-6-banh-xe-di-chuyen-cho-be-one-kem-xanh-27869868.html,"Nôi, cũi kề giường đa năng, giường cũi gấp gọn có 6 bánh xe di chuyển cho bé ONE kem (xanh)",2499000,dautram_ngoctuyet
24346405,https://www.sendo.vn/bo-nem-cho-be-so-sinh-60x80cm-24346405.html,bộ nệm cho bé sơ sinh 60x80cm,255000,tattantatndshop
24119593,https://www.sendo.vn/ga-chun-boc-dem-cui-cho-be-vai-cottong-han-dong-gia-kich-thuoc-24119593.html,Ga chun bọc đệm cũi cho bé vải cottong hàn đồng giá kích thước,135000,CỬA TIỆM BỐN MÙA
24487229,https://www.sendo.vn/xe-day-5-banh-kieu-moi-24487229.html,XE ĐẨY 5 BÁNH KIỂU MỚI,380000,shopsieure911
25480569,https://www.sendo.vn/cuc-nguon-may-dua-vong-2500-25480569.html,cục nguồn máy đưa võng - 2500,179000,TỶ PHÚ ĐÔ LA 2028
23642440,https://www.sendo.vn/noi-rung-dien-dai-vi-2-trong-1-tang-kem-luoi-vong-vua-la-noi-dien-vua-la-vong-xep-23642440.html,NÔI RUNG ĐIỆN ĐẠI VĨ 2 TRONG 1 TẶNG KÈM LƯỚI VÕNG - VỪA LÀ NÔI ĐIỆN VỪA LÀ VÕNG XẾP,918000,Tổng Kho Sơ Sinh Giá Sỉ
23642764,https://www.sendo.vn/noi-dien-dai-vi-2-trong-1-vua-la-noi-dien-vua-la-vong-xep-hang-vn-chat-luong-cao-23642764.html,NÔI ĐIỆN ĐẠI VĨ 2 TRONG 1 VỪA LÀ NÔI ĐIỆN VỪA LÀ VÕNG XẾP - HÀNG VN CHẤT LƯỢNG CAO,800000,Tổng Kho Sơ Sinh Giá Sỉ
23642128,https://www.sendo.vn/quay-bong-khung-inox-23642128.html,Quây bóng khung inox,400000,Tổng Kho Sơ Sinh Giá Sỉ
26216936,https://www.sendo.vn/noi-go-cho-be-0-2-tuoi-87x45x25cm-noi-go-cho-be-super-market-26216936.html,Nôi gỗ cho bé 0-2 tuổi 87x45x25cm - nôi gỗ cho bé - Super Market ,1460000,Dominate The Market
17154487,https://www.sendo.vn/combo-may-dua-vong-em-be-vinanoi-a100-suc-dua-100kg-sieu-em-va-xe-tap-di-cho-be-17154487.html,COMBO Máy đưa võng em bé VINANOI - A100 sức đưa 100kg siêu êm và Xe tập đi cho bé,1000000,MeBeOnline
21770926,https://www.sendo.vn/day-curoa-noi-dien-thanh-hung-2-day-21770926.html,Dây curoa Nôi điện Thành Hưng 2 dây,25000,VongxepMantubung
21770467,https://www.sendo.vn/day-coloa-noi-dien-cho-be-21770467.html,Dây coloa nôi điện cho bé,23000,VongxepMantubung
21615407,https://www.sendo.vn/ghe-rung-cho-be-yeu-21615407.html,Ghế rung cho bé yêu,649000,Tít Tít Sing
24577941,https://www.sendo.vn/vong-noi-dai-vy-24577941.html,võng nôi đại vỹ,999000,CÁI GÌ CŨNG CÓ 01
20407470,https://www.sendo.vn/may-dua-vong-autoru-eco-85kg-20407470.html,MÁY ĐƯA VÕNG AUTORU Eco 85KG,550000,Nguyenky79
24577984,https://www.sendo.vn/vong-noi-dai-vy-24577984.html,võng nôi đại vỹ,999000,CÁI GÌ CŨNG CÓ 02
20687589,https://www.sendo.vn/giuong-luoi-cho-be-yeu-kem-qua-tang-20687589.html,GIƯỜNG LƯỚI CHO BÉ YÊU KÈM QUÀ TẶNG ,169000,GiaDụngThăngLong
21563607,https://www.sendo.vn/sieu-re-chieu-coi-cho-be-nam-noi-loai-dep-buon-si-21563607.html,Siêu Rẻ Chiếu Cói Cho Bé Nằm Nôi Loại Đẹp Buôn Sỉ,65100,LeeShop92
20393493,https://www.sendo.vn/ghe-rung-phat-nhac-cho-be-ghe-rung-phat-nhac-cho-be-20393493.html,Ghế rung phát nhạc cho bé - Ghế rung phát nhạc cho bé,429000,TongKhoGiaDụngMiềnBắc
20104856,https://www.sendo.vn/1-thanh-chan-giuong-baby-gift-m8-20104856.html,1 Thanh chắn giường baby gift m8 ,339000,GiaDụngThăngLong
28082379,https://www.sendo.vn/noi-dien-ru-be-f1-28082379.html,NÔI ĐIỆN RU BÉ F1,1450000,V BABY
29377812,https://www.sendo.vn/it-smart-giuong-nam-cho-be-sozzy-cao-su-non-cao-cap-chong-lat-chong-trao-29377812.html,"It Smart - Giường nằm cho bé Sozzy cao su non cao cấp chống lật, chống trào",185000,Tiệm Đồ Gia Dụng 168
22999913,https://www.sendo.vn/de-m-na-m-cao-ca-p-da-chu-c-nang-coza-baby-bed-lite-mau-be-22999913.html,Đệm Nằm Cao Cấp Đa Chức Năng Coza Baby Bed – Lite Màu Be,2299000,Mom Baby Care
22999285,https://www.sendo.vn/de-m-na-m-cao-ca-p-da-chu-c-nang-coza-baby-bed-lite-mau-hong-22999285.html,Đệm Nằm Cao Cấp Đa Chức Năng Coza Baby Bed – Lite Màu Hồng,2299000,Mom Baby Care
29363152,https://www.sendo.vn/it-smart-giuong-ngu-kiem-ghe-sofa-cho-be-0-3-tuoi-baby-bed-sofa-5in1-29363152.html,It Smart -  Giường ngủ kiêm ghế Sofa cho bé 0-3 tuổi Baby Bed Sofa 5in1,920000,Tiệm Đồ Gia Dụng 168
29376101,https://www.sendo.vn/it-smart-noi-dua-tu-dong-cho-be-co-nhac-boss-baby-29376101.html,It Smart - Nôi đưa tự động cho bé có nhạc Boss Baby,1490000,Tiệm Đồ Gia Dụng 168
28859172,https://www.sendo.vn/noi-ngu-cho-be-rung-tu-dong-babykey-5-che-do-rung-hen-gio-remote-phat-nhac-tren-dien-thoai-bang-bluetooth-xam-28859172.html,"Nôi ngủ cho bé Rung Tự Động BaByKey 5 Chế Độ Rung, Hẹn Giờ, Remote, Phát Nhạc Trên Điện Thoại bằng Bluetooth (Xám)",2290000,13th October
29762641,https://www.sendo.vn/thanh-chan-giuong-umoo-bao-ve-be-chong-nga-chong-em-be-bo-ra-ngoai-me-yen-tam-ngu-say-29762641.html,"Thanh Chắn giường Umoo, bảo vệ bé chống ngã, chống em bé bò ra ngoài, mẹ yên tâm ngủ say",350000,Zimba Baby Shop
29842908,https://www.sendo.vn/nhong-chun-cao-cap-29842908.html,Nhộng chũn cao cấp,199000,KELLY BABY SHOP
29824092,https://www.sendo.vn/nhong-chun-cho-be-29824092.html,NHỘNG CHŨN CHO BÉ,199000,KELLY BABY SHOP
28524930,https://www.sendo.vn/noi-ru-ngu-tu-dong-mau-moi-2020-28524930.html,Nôi ru Ngủ Tự động mẫu mới 2020,1680000,SuSu Kids kube
28838244,https://www.sendo.vn/day-cu-roa-noi-dien-dai-vi-loai-1-tang-bo-2-chiec-28838244.html,DÂY CU ROA  NÔI ĐIỆN ĐẠI Vĩ Loại 1 TẦNG- BỘ 2 CHIẾC,40000,SHOP MINH KHÔI BABY
30146150,https://www.sendo.vn/cui-quay-bong-cho-be-30146150.html,CŨI QUÂY BÓNG CHO BÉ,390000,GIA DỤNG TỔNG HỢP VIAN
17130279,https://www.sendo.vn/cui-quay-cho-be-kem-100-bong-17130279.html,CŨI QUÂY CHO BÉ kèm 100 bóng,490000,GIA DỤNG TỔNG HỢP VIAN
17901896,https://www.sendo.vn/cui-quay-bong-luoi-danh-cho-tre-17901896.html,CŨI QUÂY BÓNG LƯỚI DÀNH CHO TRẺ,420000,GIA DỤNG TỔNG HỢP VIAN
17858983,https://www.sendo.vn/noi-rung-tu-dong-17858983.html,NÔI RUNG TỰ ĐỘNG,899000,GIA DỤNG TỔNG HỢP VIAN
13078413,https://www.sendo.vn/cui-quay-cho-be-kem-100-bong-13078413.html,CŨI QUÂY CHO BÉ kèm 100 bóng,520000,GIA DỤNG TỔNG HỢP VIAN
12756658,https://www.sendo.vn/cui-quay-bong-khung-inox-12756658.html,Cũi quây bóng khung inoX,480000,GIA DỤNG TỔNG HỢP VIAN
28890327,https://www.sendo.vn/quay-cui-kiem-nha-bong-khung-inox-hang-cao-cap-dung-cho-be-yeu-28890327.html, Quây cũi kiêm nhà bóng khung inox - Hàng cao cấp dùng cho bé yêu,299000,SHOP MINH KHÔI BABY
21770514,https://www.sendo.vn/noi-dien-vong-xep-2-trong-1-dai-vi-tang-kem-vong-man-chong-muoi-cho-be-21770514.html,Nôi điện Võng xếp 2 Trong 1 Đại Vĩ Tặng kèm võng màn chống muỗi cho bé,855000,VongxepMantubung
29610834,https://www.sendo.vn/noi-cho-be-da-nang-hugme-8in1-full-tinh-nang-gap-gon-tang-kem-3-phu-kien-va-do-choi-cho-be-29610834.html,"Nôi cho bé đa năng Hugme 8IN1, full tính năng, gấp gọn, tặng kèm 3 phụ kiện và đồ chơi cho bé",2099000,Zimba Baby Shop
21563672,https://www.sendo.vn/chan-he-danh-cho-be-sieu-xinh-buon-si-21563672.html,Chăn hè dành cho bé siêu xinh Buôn sỉ,240000,LeeShop92
11952153,https://www.sendo.vn/giuong-luoi-cho-be-11952153.html,Giường Lưới Cho Bé,350000,chuyên đồ gia dụng hương
11846907,https://www.sendo.vn/quay-bong-lam-cui-luoi-kem-100-bong-11846907.html,Quây Bóng  Làm Cũi Lưới Kèm 100 bóng,530000,chuyên đồ gia dụng hương
30192832,https://www.sendo.vn/noi-dat-vong-chong-cong-lung-size-85x55-chieu-lot-noi-30192832.html,Nôi đặt võng chóng còng lưng size 85x55 + chiếu lót nôi,170000,SHOP BÁN NÔI TRE NGỌC YẾN
23598499,https://www.sendo.vn/ghe-rung-ghe-nhun-cho-be-23598499.html,GHẾ RUNG GHẾ NHÚN CHO BÉ ,630000,SHOP MẸ VÀ BÉ 89
29589917,https://www.sendo.vn/chieu-lot-noi-cho-be-nam-vong-29589917.html,Chiếu lót nôi cho bé nằm võng,60000,NÔI MÂY TRE ĐAN CHO BÉ
28400824,https://www.sendo.vn/giuong-nem-ngu-em-ai-cho-be-28400824.html,Giường Nệm Ngủ Êm Ái Cho Bé,859000,Phụ kiện HnL
9462942,https://www.sendo.vn/chieu-dieu-hoa-cho-be-9462942.html,Chiếu điều hòa cho bé,120000,Hoa Tư Dẫn
9540238,https://www.sendo.vn/goi-cao-su-non-cho-be-9540238.html,Gối cao su non cho bé,85000,Hoa Tư Dẫn
10739533,https://www.sendo.vn/ghe-rung-nhun-cho-be-10739533.html,Ghế rung nhún cho bé,150000,Bepviet16122017
19176112,https://www.sendo.vn/vong-noi-dien-2-tang-co-tang-bo-vong-cho-be-yeu-19176112.html,VÕNG NÔI ĐIỆN 2 TẦNG CÓ TẶNG BỘ VÕNG CHO BÉ YÊU,960000,ĐỒ CHƠI CHO BÉ
17201509,https://www.sendo.vn/giuong-cui-noi-4-in1-thong-minh-cho-tre-so-sinh-alfor-baby-17201509.html,"Giường cũi, nôi 4 in1 thông minh cho trẻ sơ sinh  Alfor Baby",5890000,dautram_ngoctuyet
10056844,https://www.sendo.vn/noi-dua-tre-em-joie-sansa-in-the-rain-10056844.html,Nôi đưa trẻ em Joie Sansa In the Rain,5300000,MTP Store
23295781,https://www.sendo.vn/quay-bong-khung-inox-cho-be-23295781.html,QUÂY BÓNG KHUNG INOX CHO BÉ ,350000,chuyên đồ gia dụng hương
10071953,https://www.sendo.vn/nem-cho-be-nem-cao-cap-cho-be-10071953.html,Nệm cho bé - Nệm cao cấp cho bé,349000,CHÂU THUẬN PHÁT
17025436,https://www.sendo.vn/cui-quay-cho-be-17025436.html,CŨI QUÂY CHO BÉ ,420000,chuyên đồ gia dụng hương
16954185,https://www.sendo.vn/tham-be-nam-choi-an-toan-16954185.html,THẢM BÉ NẰM CHƠI AN TOÀN,350000,thanhtinh774
17028775,https://www.sendo.vn/adaptor-cao-cap-prota-dung-cho-may-dua-vong-17028775.html,Adaptor cao cấp  Prota dùng cho máy đưa võng,195000,Taphoagannha
17073560,https://www.sendo.vn/cui-quay-cho-be-17073560.html,CŨI QUÂY CHO BÉ,480000,GiadungDinhVinh
25145271,https://www.sendo.vn/noi-vong-dai-vi-2trong1-vua-lam-vong-lai-chuyen-lam-noi-25145271.html,Nôi Võng Đại Vĩ _2TRONG1 VỪA LÀM VÕNG LẠI CHUYỂN LÀM NÔI,659000,Shop duy thuong86
12823652,https://www.sendo.vn/giuong-luoi-cho-be-12823652.html,giường lưới cho bé,340000,GiadungDinhVinh
11759565,https://www.sendo.vn/giuong-xep-gon-cho-be-home-and-garden-11759565.html,Giường xếp gọn cho bé - Home and Garden,1679000,Home and Garden
11231222,https://www.sendo.vn/ghe-tap-ngoi-nhoi-bong-cho-be-11231222.html,GHẾ TẬP NGỒI NHỒI BÔNG CHO BÉ,165000,MHKhanhNgan
11755127,https://www.sendo.vn/thiet-bi-mam-non-toan-quoc-cc-si-le-giuong-mn-ma-1xst-11755127.html,"THIẾT BỊ MẦM NON TOÀN QUỐC. CC sỉ, lẻ giường MN. Mã 1XST",220000,Thietbimamnontoanquoc
11604398,https://www.sendo.vn/cui-quay-cho-be-kem-100-bong-11604398.html,CŨI QUÂY CHO BÉ kèm 100 bóng,520000,giadunganan
11213589,https://www.sendo.vn/1-thanh-chan-giuong-1m6-cho-be-11213589.html,1 THANH CHẮN GIƯỜNG 1M6 CHO BÉ,325000,shopdogiadung1207
13994874,https://www.sendo.vn/giuong-luoi-cho-be-13994874.html,GIƯỜNG LƯỚI CHO BÉ,340000,giadunganan
28409655,https://www.sendo.vn/mieng-dan-thanh-chan-giuong-dan-tuong-treo-do-vat-dung-28409655.html,"Miếng dán thanh chắn giường, dán tường treo đồ vật dụng",15000,baby68
11213619,https://www.sendo.vn/1-thanh-cha-n-giuo-ng-2m-cao-ca-p-11213619.html,1 THANH CHẮN GIƯỜNG 2M CAO CẤP,325000,shopdogiadung1207
8945182,https://www.sendo.vn/ghe-goi-dau-cho-be-8945182.html,ghế gội đầu cho bé,155000,susutmilk
10440764,https://www.sendo.vn/quay-cui-nhua-3d-loai-20-mieng-cho-be-kem-tham-va-bong-10440764.html,QUÂY CŨI NHỰA 3D LOẠI 20 MIẾNG CHO BÉ KÈM THẢM VÀ BÓNG,2200000,Cái Gì Chẳng Có 1
19092592,https://www.sendo.vn/chieu-tre-soi-tam-cho-be-chieu-tre-em-chieu-dai-noi-kt-1m1-x-60cm-19092592.html,Chiếu tre sợi tăm cho bé - chiếu trẻ em - chiếu dải nôi kt 1m1 x 60cm,179000,CỰC RẺ 86
9514574,https://www.sendo.vn/giuong-nam-cho-be-sozzy-cao-su-non-cao-cap-chong-lat-chong-trao-9514574.html,"Giường nằm cho bé Sozzy cao su non cao cấp chống lật, chống trào",185000,Home and Garden
12266560,https://www.sendo.vn/quay-bong-cho-be-vai-du-khung-thep-inox-hang-dep-tang-200-bong-12266560.html,QUÂY BÓNG CHO BÉ VẢI DÙ KHUNG THÉP INOX HÀNG ĐẸP TẶNG 200 BÓNG,460000,Cái Gì Chẳng Có 1
16298567,https://www.sendo.vn/1thanh-chan-giuong-2m-cho-be-16298567.html, 1THANH CHẮN GIƯỜNG 2M CHO BÉ,319000,GIADUNGGIAGOC1
12479924,https://www.sendo.vn/noi-tu-dong-cao-cap-mastela-dieu-khien-tu-xa-co-nhac-sg237-xanh-12479924.html,"Nôi tự động cao cấp Mastela điều khiển từ xa, có nhạc SG237 - Xanh",2499000,Nam Thành baby
20087981,https://www.sendo.vn/cui-quay-cho-be-20087981.html,Cũi Quây cho bé,480000,Dogiadung99
24679549,https://www.sendo.vn/thanh-chan-giuong-baby-smiles-cao-cap-mau-ghi-2020-24679549.html,THANH CHẮN GIƯỜNG BABY SMILES CAO CẤP MÀU GHI 2020,400000,Baby and dear
21186066,https://www.sendo.vn/cui-quay-cho-be-21186066.html,CŨI QUÂY CHO BÉ,350000,Dogiadung99
18020076,https://www.sendo.vn/cui-quay-cho-be-18020076.html,cũi quây cho bé ,350000,Dogiadung99
13372601,https://www.sendo.vn/giuong-luoi-cho-be-13372601.html,giường lưới cho bé,340000,Dogiadung99
12488550,https://www.sendo.vn/noi-giuong-mini-chiu-luc-xep-gon-cao-cap-cho-be-2019-12488550.html,Nôi giường mini chịu lực xếp gọn cao cấp cho bé 2019,1680000,Shop P T L
22457683,https://www.sendo.vn/cui-quay-cho-be-22457683.html,cũi quây cho bé,480000,Dogiadung99
23658957,https://www.sendo.vn/chieu-tre-soi-tam-2-mat-sieu-mat-cho-be-tang-kem-01-nut-bit-o-dien-bao-ve-an-toan-cho-be-yeu-23658957.html,Chiếu tre sợi tăm 2 mặt siêu mát cho bé - Tặng kèm 01 nút bịt ổ điện bảo vệ an toàn cho bé yêu,185000,Shop Mẹ Mía
22899797,https://www.sendo.vn/giuong-mam-non-cho-be-22899797.html,Giường mầm non cho bé ,600000,dochoithongminhvietnam01
23184027,https://www.sendo.vn/noi-dien-dai-vi-2-trong-1-23184027.html,NÔI ĐIỆN ĐẠI VĨ 2 TRONG 1,645000,minh son dieu anh
28117077,https://www.sendo.vn/vong-noi-2in-1thanh-hung-vua-la-vong-xep-vua-la-noi-dien-28117077.html,võng nôi 2in 1thành hưng vừa là võng xếp vừa là nôi điện,619000,Nghĩa Phượng Shop
29510210,https://www.sendo.vn/noi-may-chong-may-cho-be-tu-1-12-thang-29510210.html,Nôi mây chõng mây cho bé từ 1-12 tháng ,535000,Nghĩa Phượng Shop
26144594,https://www.sendo.vn/noi-dien-tu-dua-khanh-ngoc-cho-be-hang-cao-cap-tang-man-va-vong-26144594.html,NÔI ĐIỆN TỰ ĐƯA KHÁNH NGỌC CHO BÉ HÀNG CAO CẤP TẶNG MÀN VÀ VÕNG,679000,Shop Con Cưngg
21757852,https://www.sendo.vn/noi-go-di-dong-cho-be-tang-man-chup-chong-muoi-21757852.html,nôi gỗ di động cho bé tặng màn chụp chống muỗi,999000,Võng Xếp Màn Khung
18059754,https://www.sendo.vn/nha-bong-cho-be-kem-dem-va-200-bong-18059754.html,Nhà bóng cho bé kèm đệm và 200 bóng,1890000,Big Mall
