product_id,product_url,name,price,shop_name
28833185,https://www.sendo.vn/it-smart-giuong-ngu-kiem-ghe-sofa-cho-be-0-3-tuoi-baby-bed-sofa-5in1-28833185.html,It Smart  Giường ngủ kiêm ghế Sofa cho bé 0-3 tuổi Baby Bed Sofa 5in1,920000,IT Smart
29379830,https://www.sendo.vn/giuong-luoi-cho-be-29379830.html,Giường lưới cho bé,295000,E U SHOP
30158428,https://www.sendo.vn/noi-tre-nam-vong-size-11x70-cho-be-0-32-thang-tang-vong-dau-tam-30158428.html,Nôi tre nằm võng size 1.1x70 cho bé 0-32 tháng ( tặng vòng dâu tằm),250000,Noitrenamvong
29842730,https://www.sendo.vn/nhong-chun-cho-be-29842730.html,Nhộng chũn cho bé,199000,KELLY BABY SHOP
29751766,https://www.sendo.vn/bo-quay-cui-cho-be-14-tam-1m6x1m6-tang-bong-va-tham-an-toan-cho-be-29751766.html,Bộ quây cũi cho bé 14 tấm 1m6x1m6 tặng bóng và thảm an toàn cho bé,1350000,Máy công cụ tổng hợp
28890432,https://www.sendo.vn/quay-cui-quay-bong-vai-du-khung-thep-inox-hang-loai-1-28890432.html,Quây cũi quây bóng vải dù- Khung thép inox- Hàng Loại 1,395000,SHOP MINH KHÔI BABY
28895059,https://www.sendo.vn/noi-may-chong-may-cho-be-tu-o-den-12-thang-sp-09-28895059.html,Nôi mây chõng mây cho bé từ o đến 12 tháng (sp 09),499000,Nghĩa Phượng Shop
30817180,https://www.sendo.vn/man-chong-muoi-cho-be-nam-vong-30817180.html,Màn chóng muỗi cho bé nằm võng,160000,SHOP NÔI TRE  ĐẠI NAM
30832255,https://www.sendo.vn/cuc-nguon-may-dua-vong-30832255.html,cục nguồn máy đưa võng,189000,SÀI TIẾN
30816558,https://www.sendo.vn/boc-noi-size-lon-30816558.html,Bọc nôi size lớn,200000,SHOP NÔI TRE  ĐẠI NAM
30816485,https://www.sendo.vn/boc-noi-size-nho-va-trung-30816485.html,bọc  nôi size nhỏ và trung,130000,SHOP NÔI TRE  ĐẠI NAM
30816411,https://www.sendo.vn/chieu-lot-noi-30816411.html,Chiếu lót nôi,60000,SHOP NÔI TRE  ĐẠI NAM
30738964,https://www.sendo.vn/thanh-chan-giuong-cao-cap-7-cap-do-dieu-chinh-do-cao-30738964.html,Thanh chắn giường cao cấp 7 cấp độ điều chỉnh độ cao,289000,Nguyenty16
30728872,https://www.sendo.vn/noi-tre-cho-be-size-90x60-chieu-lot-tang-kem-vong-dau-tam-30728872.html,NÔI TRE CHO BÉ SIZE 90X60 + CHIẾU LÓT (TẶNG KÈM VÒNG DÂU TẰM),200000,SHOP  BÁN NÔI TRE  YẾN NGỌC
30815436,https://www.sendo.vn/noi-tre-nam-vong-cho-be-size-85x55-tang-kem-vong-dau-tam-30815436.html,Nôi tre nằm võng cho bé size 85x55 ( tặng kèm vòng dâu tằm),110000,SHOP NÔI TRE  ĐẠI NAM
30815388,https://www.sendo.vn/cuc-nguon-may-dua-vong-30815388.html,cục nguồn máy đưa võng,189000,CÔNG TÔN THẮNG
30806380,https://www.sendo.vn/bo-khung-kep-35-bai-hat-khong-loi-chay-bang-pin-30806380.html,BỘ KHUNG KẸP 35 BÀI HÁT KHÔNG LỜI CHẠY BẰNG PIN,220000,Nanatuti 0963371612
29792103,https://www.sendo.vn/cui-quay-khung-inox-kiem-nha-bong-chac-chan-an-toan-cho-be-cu-i-cho-be-tren-6-tha-ng-tuo-i-do-choi-cho-be-tren-6-tha-ng-tuo-i-tang-kem-bong-da-sac-mauhot-29792103.html,Cũi quây khung Inox kiêm nhà bóng chắc chắn an toàn cho bé - Cũi cho bé trên 6 THÁNG tuổi -Đồ chơi cho bé trên 6 tháng tuổi-TẶNG KÈM BÓNG ĐA SẮC MÀU[HOT],339000,MapDit Shop
30816101,https://www.sendo.vn/noi-tre-dat-vong-chong-gu-lung-cho-be-size-90x60-chieu-lot-noi-30816101.html,Nôi tre đặt võng chóng gù lưng cho bé size 90x60 + chiếu lót nôi,200000,SHOP NÔI TRE  ĐẠI NAM
30813024,https://www.sendo.vn/bo-buom-chuyen-dong-khung-chu-thap-30813024.html,BỘ BƯỚM CHUYỂN ĐỘNG - KHUNG CHỮ THẬP,65000,Nanatuti 0963371612
29563780,https://www.sendo.vn/quay-bong-luc-giac-cho-be-tang-kem-10-bong-29563780.html,QUÂY BÓNG LỤC GIÁC CHO BÉ TẶNG KÈM 10 BÓNG ,269000,GiaDụngBaMiền
29622085,https://www.sendo.vn/noi-may-chong-may-cho-be-tu-0-9-thang-tuoi-29622085.html,Nôi mây chõng mây cho bé từ 0-9 tháng tuổi ,529000,Nghĩa Phượng Shop
29603511,https://www.sendo.vn/noi-tre-size-90x60-chieu-lot-boc-noi-man-chup-29603511.html,Nôi tre size 90x60 + chiếu lót + bọc nôi + màn chụp,485000,NÔI MÂY TRE ĐAN CHO BÉ
29458364,https://www.sendo.vn/cu-rung-noi-dien-thanh-hung-tang-2-day-curoa-du-phong-co-anh-that-29458364.html,Củ Rung Nôi Điện Thành Hưng   Tặng 2 Dây Curoa Dự Phòng  Có Ảnh Thật,250000,màn chụp tự bung
29583477,https://www.sendo.vn/day-cuaroa-noi-dien-long-hung-ban-day-dan-29583477.html,Dây cuaroa nôi điện Long Hưng  (bản dày dặn),28000,hoa giay
30856238,https://www.sendo.vn/cuc-nguon-may-dua-vong-30856238.html,cục nguồn máy đưa võng,189000,ANGELABABY
28137996,https://www.sendo.vn/combo-2-day-curoa-noi-long-hung-ban-day-dan-28137996.html,Combo 2 dây curoa nôi Long Hưng- bản dày dặn,54000,hoa giay
28957662,https://www.sendo.vn/chieu-lot-noi-cho-be-28957662.html,Chiếu Lót Nôi cho Bé,60000,Nôi Tre Nằm Võng
29596370,https://www.sendo.vn/noi-ngu-chung-giuong-cho-be-29596370.html,Nôi ngủ chung giường cho bé,525000,Tổng kho đồ sơ sinh
29261082,https://www.sendo.vn/noi-dien-vong-xep-tu-dong-thanh-hung-2-trong-1-tang-man-chong-muoi-29261082.html,Nôi Điện Võng xếp tự động Thành Hưng 2 trong 1 tặng - màn chống muỗi,1500000,TranKhanhLyTklys
30812229,https://www.sendo.vn/combo-treo-noi-tron-khung-j-30812229.html,COMBO TREO NÔI TRÒN - KHUNG J,175000,Nanatuti 0963371612
18060079,https://www.sendo.vn/nha-do-choi-cho-be-18060079.html,nhà đồ chơi cho bé,1990000,Big Mall
6547335,https://www.sendo.vn/noi-rung-chi-be-6547335.html,nôi rung chi be,490000,shop-phuongbeo
9816319,https://www.sendo.vn/giuong-luoi-cao-cap-tre-em-9816319.html,Giường lưới cao cấp trẻ em,189000,duchangshop
30037063,https://www.sendo.vn/noi-tre-dat-vong-size-90x60-xuc-xac-trong-tang-kem-vong-dau-tam-30037063.html,Nôi tre đặt võng size 90x60 + xúc xắc trống tặng kèm vòng dâu tằm,160000,SHOP BÁN NÔI TRE NGỌC YẾN
8958364,https://www.sendo.vn/tham-dan-fissher-price-8958364.html,Thảm đàn Fissher Price,845000,bonghongxanh
17154614,https://www.sendo.vn/combo-noi-vong-tu-dong-cho-be-2-trong-1-vinanoi-nv25-va-bo-lau-nha-360-17154614.html,COMBO Nôi Võng tự động cho bé 2 trong 1 VINANOI - NV25 Và Bộ lau nhà 360,1600000,MeBeOnline
29943564,https://www.sendo.vn/quay-cui-bong-khung-inox-29943564.html,QUÂY CŨI BÓNG KHUNG INOX ,249000,Siêu thị xe trẻ em
28335877,https://www.sendo.vn/ghe-nam-danh-cho-tre-em-co-khung-bang-sat-boc-dem-chinh-hang-mastela-28335877.html,Ghế nằm dành cho trẻ em có khung bằng sắt bọc đệm CHÍNH HÃNG Mastela,939000,BabyKingdom
28343715,https://www.sendo.vn/noi-tu-dong-cao-cap-danh-cho-be-sg239-hieu-mastela-mau-xanh-28343715.html,Nôi tự động cao cấp dành cho bé SG239 hiệu Mastela màu xanh,2399000,BabyKingdom
19205766,https://www.sendo.vn/giuong-luoi-cho-be-19205766.html,Giường lưới cho bé,249000,Kho hàng gia dụng uy tín
10320745,https://www.sendo.vn/may-dua-vong-tu-dong-yukushi-10320745.html,MÁY ĐƯA VÕNG TỰ ĐỘNG YUKUSHI,310000,ShopLG
28346753,https://www.sendo.vn/quay-bong-kiem-cui-cho-be-28346753.html,Quây bóng kiêm cũi cho bé,259000,shopmebon208
9098863,https://www.sendo.vn/chieu-lua-cao-cap-kem-theo-goi-cho-be-9098863.html,Chiếu Lụa Cao Cấp Kèm Theo Gối Cho Bé,150000,Shop Mua Sắm Online Giá Rẻ
9125812,https://www.sendo.vn/1-thanh-chan-giuong-2m-9125812.html,1 Thanh chắn giường 2m,500000,shophaianhcomputer
5346347,https://www.sendo.vn/vong-tu-dong-cao-cap-autoru-aubh01-5346347.html,Võng tự động cao cấp Autoru AUBH01,195000,baby68
5979171,https://www.sendo.vn/giuong-luoi-autoru-cao-cap-khung-inox-5979171.html,Giường lưới Autoru cao cấp khung inox,260000,baby68
8920278,https://www.sendo.vn/vong-noi-dien-k2-m369-8920278.html,VÕNG NÔI ĐIỆN K2 M369,745000,giadinhcungmuavn
17324248,https://www.sendo.vn/combo-may-dua-vong-em-be-vinanoi-vn365-suc-dua-70kg-sieu-em-va-xe-tap-di-cho-be-17324248.html,COMBO Máy đưa võng em bé VINANOI - Vn365 sức đưa 70kg siêu êm và Xe tập đi cho bé,945000,MeBeOnline
8920198,https://www.sendo.vn/vong-noi-dien-m369-vnd-8920198.html,Võng nôi điện M369-VNĐ,725000,giadinhcungmuavn
7444964,https://www.sendo.vn/giuong-tang-3-trong-1-o-to-gt13-7444964.html,Giường tầng 3 trong 1 ô tô GT13,13013000,baby68
25652704,https://www.sendo.vn/bo-chieu-goi-dieu-hoa-cho-be-25652704.html,Bộ chiếu gối điều hòa cho bé,99000,Ngoc Phat Store
22993051,https://www.sendo.vn/tham-nam-cho-be-co-nhac-va-do-choi-22993051.html,Thảm nằm cho bé có nhạc và đồ chơi ,318000,hunggiadung
23410265,https://www.sendo.vn/noi-tu-dong-cao-cap-danh-cho-be-sg239-hieu-mastela-mau-xanh-23410265.html,Nôi tự động cao cấp dành cho bé SG239 hiệu Mastela màu xanh,2279000,BabyKingdom
12445104,https://www.sendo.vn/cui-tre-em-2-tang-viet-nam-co-dai-80-x-120-cm-12445104.html,Cũi trẻ em 2 tầng Việt Nam cỡ đại 80 x 120 cm,1240000,Babimart Hà Nội
25018728,https://www.sendo.vn/noi-tu-dong-cao-cap-mastela-sg239-mau-xanh-25018728.html,Nôi tự động cao cấp Mastela SG239 - Màu xanh,2060000,Chăm sóc bé sơ sinh
12445096,https://www.sendo.vn/giuong-cui-giuong-cui-tre-em-2-tang-viet-nam-co-dai-80-x-120-cm-12445096.html,Giường cũi - giường cũi trẻ em 2 tầng Việt Nam cỡ đại 80 x 120 cm,1240000,Babimart Hà Nội
10182481,https://www.sendo.vn/giuong-cui-2-tang-joie-commuter-change-snooze-travel-cot-linen-10182481.html,Giường cũi 2 tầng Joie Commuter Change Snooze Travel Cot Linen,3300000,Diệp Anh Japan
12212865,https://www.sendo.vn/quay-cui-nhua-3d-loai-12-mieng-cho-be-kem-tham-va-bong-hang-cao-cap-12212865.html,QUÂY CŨI NHỰA 3D LOẠI 12 MIẾNG CHO BÉ KÈM THẢM VÀ BÓNG HÀNG CAO CẤP,1650000,Cái Gì Chẳng Có 68
5438926,https://www.sendo.vn/noi-xach-tay-autoru-aucc01-5438926.html,Nôi xách tay Autoru AUCC01,790000,baby68
10186919,https://www.sendo.vn/quay-cui-goc-tron-size-l-10186919.html,QUÂY CŨI GÓC TRÒN SIZE L,2800000,shop thaothy16
10358564,https://www.sendo.vn/quay-cui-soc-cao-cap-tam-le-nho-63cm-x-40cm-du-mau-10358564.html,Quây cũi sọc cao cấp - tấm lẻ nhỏ 63cm x 40cm - đủ màu,150000,Đô Phin shop
11672659,https://www.sendo.vn/cui-quay-bong-khung-inox-chac-chan-an-toan-cho-be-tang-kem-bong-11672659.html,Cũi quây bóng khung inox chắc chắn an toàn cho bé + Tặng kèm bóng,530000,chuyên đồ gia dụng hương
10919986,https://www.sendo.vn/chieu-co-theu-hinh-size-60x100cm-10919986.html,Chiếu cỏ thêu hình size 60x100cm,70000,hai hip's house
12212918,https://www.sendo.vn/quay-cui-nhua-3d-loai-14-mieng-cho-be-kem-tham-va-bong-hang-cao-cap-12212918.html,QUÂY CŨI NHỰA 3D LOẠI 14 MIẾNG CHO BÉ KÈM THẢM VÀ BÓNG HÀNG CAO CẤP,1750000,Cái Gì Chẳng Có 68
11384724,https://www.sendo.vn/giuong-noi-phat-nhac-abn-11384724.html,Giường nôi phát nhac ABN,545000,shop Tiện tích giá rẻ
11308128,https://www.sendo.vn/cui-quay-cho-be-kem-100-qua-bong-11308128.html,CŨI QUÂY CHO BÉ kèm 100 quả bóng,520000,ĐỒ GIA DỤNG VIAN
11354746,https://www.sendo.vn/cui-quay-cho-be-kem-100-bong-11354746.html,CŨI QUÂY CHO BÉ kèm 100 bóng,520000,giadunganan
10915537,https://www.sendo.vn/nem-cotton-kim-home-size-lon-75x130cm-cho-tre-em-10915537.html,Nệm cotton kim home size lớn 75x130cm cho trẻ em,170000,Babies Vn
11231076,https://www.sendo.vn/ghe-tap-ngoi-nhoi-bong-cho-be-11231076.html,GHẾ TẬP NGỒI NHỒI BÔNG CHO BÉ,165000,MHKhanhNgan
13948864,https://www.sendo.vn/quay-cui-nhua-pe-cao-cap-play-happy-12-mieng-ghep-12x155m-13948864.html,Quây cũi nhựa PE cao cấp Play&Happy 12 miếng ghép 1.2x1.55m,2380000,HanRui Shop
14137575,https://www.sendo.vn/bo-quay-va-ga-vuong-mien-ghi-goldcat-14137575.html,Bộ quây và ga Vương miện ghi GoldCat,500000,Goldcat shop
13940738,https://www.sendo.vn/man-nhac-cho-be-yeu-13940738.html,Màn nhạc cho bé yêu,230000,giadunganan
16060653,https://www.sendo.vn/day-curoa-cho-noi-dien-2-tang-1-bo-2-day-16060653.html,Dây Curoa Cho Nôi Điện 2 tầng - 1 Bộ 2 dây,35000,Siêu Thị 24h Online
16851297,https://www.sendo.vn/noi-tu-dong-cao-cap-dieu-khien-tu-xa-co-nhac-mastela-sg237-mau-hong-hoa-tiet-16851297.html,Nôi tự động cao cấp điều khiển từ xa có nhạc Mastela SG237 MÀU HỒNG HOẠ TIẾT,2499000,Gấu Babi Shop
14040961,https://www.sendo.vn/cui-quay-bong-cho-be-14040961.html,cũi quây bóng cho bé,450000,Shop Tiện Ích Gia Vinh
13466931,https://www.sendo.vn/cui-quay-cho-be-13466931.html,cũi quây cho bé,480000,GiadungDinhVinh
12231885,https://www.sendo.vn/noi-cui-du-zaracos-jenni-5046-pink-12231885.html,NÔI CŨI DÙ ZARACOS JENNI 5046 - PINK,2150000,Chăm sóc bé sơ sinh
12231790,https://www.sendo.vn/combo-2-thanh-chan-giuong-m8x2m-12231790.html,combo 2 thanh chắn giường m8x2m,650000,ShopDuongMinh
12553300,https://www.sendo.vn/thanh-chan-giuong-2018-mau-truot-len-xuong-chan-det-thanh-m8-12553300.html,thanh chắn giường 2018 mẫu trượt lên xuống chân dẹt thanh m8,460000,ShopDuongMinh
11527409,https://www.sendo.vn/ghe-rung-cho-be-11527409.html,Ghế rung cho bé,515000,Yến Trang babyshop
11915346,https://www.sendo.vn/quay-cui-nhua-3d-loai-22-mieng-cho-be-tang-tham-va-bong-hang-cao-cap-11915346.html,QUÂY CŨI NHỰA 3D LOẠI 22 MIẾNG CHO BÉ TẶNG THẢM VÀ BÓNG HÀNG CAO CẤP,2250000,Cái Gì Chẳng Có 1
11591495,https://www.sendo.vn/chan-long-cuu-hinh-thu-sieu-mem-min-cho-be-gai-11591495.html,Chăn lông cừu hình thú siêu mềm mịn cho bé gái,85000,Bebi 123
11915416,https://www.sendo.vn/quay-cui-nhua-3d-loai-24-mieng-cho-be-tang-tham-va-bong-hang-cao-cap-11915416.html,QUÂY CŨI NHỰA 3D LOẠI 24 MIẾNG CHO BÉ TẶNG THẢM VÀ BÓNG HÀNG CAO CẤP,2450000,Cái Gì Chẳng Có 1
13646102,https://www.sendo.vn/quay-bong-khung-sat-cho-be-13646102.html,quây bóng khung sắt cho bé,350000,Shop Tiện Ích Gia Vinh
12319758,https://www.sendo.vn/qua-tang-0-dong-chieu-truc-dat-vong-cho-be-60-x-120cm-tang-1-goi-giay-an-gau-truc-12319758.html,[QUÀ TẶNG 0 ĐỒNG ] chiếu trúc đặt võng cho bé 60 x 120cm TẶNG 1 GÓI GIÁY ĂN GẤU TRÚC,230000,Chiếu trúc Việt Nam
12904194,https://www.sendo.vn/ghe-rung-fisher-comfort-curve-bouncer-cfb88-12904194.html,Ghế rung Fisher Comfort Curve Bouncer CFB88,685000,Mun House
13646094,https://www.sendo.vn/quay-bong-khung-sat-cho-be-kem-100-bong-13646094.html,quây bóng khung sắt cho bé kèm 100 bóng,450000,Shop Tiện Ích Gia Vinh
13849548,https://www.sendo.vn/noi-cui-dua-tu-dong-xep-gon-cho-be-full-box-nhu-hinh-13849548.html,Nôi cũi đưa tự động xếp gọn cho bé  Full Box như hình,1480000,Shop P T L
13206631,https://www.sendo.vn/1-thanh-chan-giuong-2m-cao-82cm-cua-aachamann-13206631.html,1 Thanh chăn giường 2m cao 82cm của Aachamann,449000,SHOPTRUCTUYEN
12163495,https://www.sendo.vn/chieu-co-cho-be-co-nho-40x60cm-12163495.html,Chiếu cỏ cho bé cỡ nhỏ 40x60cm,25000,bikidsvn2 Cơ sở 19 Xa La
13206523,https://www.sendo.vn/1-thanh-chan-giuong-cho-be-2m-13206523.html,1 Thanh chắn giường cho bé 2m,399000,SHOPTRUCTUYEN
13525625,https://www.sendo.vn/giuong-luoi-tre-em-13525625.html,giường lưới trẻ em,340000,GiadungDinhVinh
10505981,https://www.sendo.vn/quay-cui-nhua-3d-loai-12-mieng-cho-be-hang-xuat-chau-au-10505981.html,QUÂY CŨI NHỰA 3D LOẠI 12 MIẾNG CHO BÉ  HÀNG XUẤT CHÂU ÂU,1650000,Cái Gì Chẳng Có 68
13078358,https://www.sendo.vn/cui-quay-cho-be-13078358.html,CŨI QUÂY ChO BÉ,450000,giadunganan
10852844,https://www.sendo.vn/dem-ngu-dung-tu-the-jjovce-xanh-ngoc-10852844.html,Đệm ngủ đúng tư thế JJOVCE - Xanh Ngọc,200000,iKids
8773300,https://www.sendo.vn/chieu-noi-cho-be-8773300.html,chiếu nôi cho bé,210000,Chiếu trúc Việt Nam
10701298,https://www.sendo.vn/ghe-nhun-phat-nhac-cho-tre-10701298.html,Ghế Nhún Phát Nhạc Cho Trẻ,530000,sevenmart
8990878,https://www.sendo.vn/vong-noi-dien-k3-m1504-8990878.html,VÕNG NÔI ĐIỆN K3 M1504,795000,Ty shopping
9015543,https://www.sendo.vn/ghe-rung-do-choi-cho-be-9015543.html,Ghế rung đồ chơi cho bé,200000,bonghongxanh
9689298,https://www.sendo.vn/thanh-chan-giuong-acchman-mot-m-tam-9689298.html,Thanh chắn giường Acchman một m tám,390000,Ngocphat212
9837803,https://www.sendo.vn/tam-lot-chong-tham-cho-be-9837803.html,Tấm lót chống thấm cho bé,55000,ĐỒ SƠ SINH CHỈ TỪ 3K
11715382,https://www.sendo.vn/cui-quay-cho-be-kem-100-bong-11715382.html,CŨI QUÂY CHO BÉ kèm 100 bóng,520000,giadunganan
11784466,https://www.sendo.vn/thanh-chan-giuong-1m6-mau-kem-cao-90cm-chan-dep-nut-bam-11784466.html,Thanh chắn giường 1m6 màu kem cao 90cm chân dẹp- nút bấm,299000,Nguyenty16
10885548,https://www.sendo.vn/chieu-cao-su-cao-cap-cho-be-hinh-ngau-nhien-10885548.html,Chiếu cao su cao cấp cho bé hình ngẫu nhiên,152150,nguyenquy2903
12111643,https://www.sendo.vn/thanh-chan-giuong-mau-moi-truot-len-xuong-2018-12111643.html,thanh chắn giường mẫu mới trượt lên xuống 2018,460000,shop sóc thỏ
11854732,https://www.sendo.vn/giuong-luoi-cho-be-11854732.html,GIƯỜNG LƯỚI CHO BÉ,340000,chuyên đồ gia dụng hương
10896054,https://www.sendo.vn/ghe-dung-ghe-nhun-cho-be-10896054.html,Ghế Dung Ghế Nhún Cho Bé,370000,GiadungDinhVinh
11783603,https://www.sendo.vn/thanh-chan-giuong-2m-mau-kem-cao-90cm-cua-aachamann-11783603.html,Thanh chăn giường 2m màu kem cao 90cm của Aachamann,299000,Nguyenty16
12069734,https://www.sendo.vn/quay-cui-nhua-3d-loai-22-mieng-cho-be-hang-cao-cap-tang-tham-va-bong-12069734.html,QUÂY CŨI NHỰA 3D LOẠI 22 MIẾNG CHO BÉ HÀNG CAO CẤP TẶNG THẢM VÀ BÓNG,2350000,THÍCH GÌ CŨNG CÓ
12756652,https://www.sendo.vn/cui-quay-cho-be-kem-100-bong-12756652.html,CŨI QUÂY CHO BÉ kèm 100 bóng,520000,GIA DỤNG TỔNG HỢP VIAN
12070213,https://www.sendo.vn/quay-cui-nhua-3d-loai-20-mieng-cho-be-tang-tham-va-bong-hang-cao-cap-12070213.html,QUÂY CŨI NHỰA 3D LOẠI 20 MIẾNG CHO BÉ TẶNG THẢM VÀ BÓNG HÀNG CAO CẤP,2050000,THÍCH GÌ CŨNG CÓ
12080937,https://www.sendo.vn/quay-cui-nhua-3d-loai-20-mieng-cho-be-tang-tham-va-bong-hang-cao-cap-12080937.html,QUÂY CŨI NHỰA 3D LOẠI 20 MIẾNG CHO BÉ TẶNG THẢM VÀ BÓNG HÀNG CAO CẤP,2150000,Cái Gì Chẳng Có
12086990,https://www.sendo.vn/quay-cui-nhua-3d-loai-14-mieng-cho-be-tang-tham-va-bong-hang-cao-cap-12086990.html,QUÂY CŨI NHỰA 3D LOẠI 14 MIẾNG CHO BÉ TẶNG THẢM VÀ BÓNG HÀNG CAO CẤP,1750000,Cái Gì Chẳng Có 1
12754979,https://www.sendo.vn/cui-quay-bong-cho-be-12754979.html,cũi quây bóng cho bé,530000,chuyên đồ gia dụng hương
12169640,https://www.sendo.vn/may-dua-vong-s-baby-80kg-12169640.html,Máy đưa võng S-Baby 80KG,590000,Nhật Trường Store
11908158,https://www.sendo.vn/quay-cui-nhua-3d-loai-24-mieng-cho-be-hang-cao-cap-tang-tham-va-bong-11908158.html,QUÂY CŨI NHỰA 3D LOẠI 24 MIẾNG CHO BÉ HÀNG CAO CẤP TẶNG THẢM VÀ BÓNG,2650000,Cái Gì Chẳng Có
12706286,https://www.sendo.vn/cui-quay-cho-be-12706286.html,CŨI QUÂY ChO BÉ,450000,ĐỒ GIA DỤNG VIAN
11570531,https://www.sendo.vn/cui-quay-cho-be-kem-100-bong-11570531.html,CŨI QUÂY CHO BÉ kèm 100 bóng,520000,giadunganan
12670734,https://www.sendo.vn/quay-bong-khung-sat-cho-be-12670734.html,quây bóng khung sắt cho bé,480000,GiadungDinhVinh
11689193,https://www.sendo.vn/giuong-luoi-cho-be-01674776662-11689193.html,GIƯỜNG LƯỚI CHO BÉ 01674776662,299000,GIAN HÀNG GIA DỤNG TIỆN ÍCH
13466397,https://www.sendo.vn/cui-quay-cho-be-13466397.html,cũi quây cho bé,480000,Dogiadung99
13436170,https://www.sendo.vn/noi-tre-hun-khoi-chu-nhat-s4-95x60cm-13436170.html,Nôi tre hun khói chữ nhật S4 95x60cm,110000,Babies Vn
10619141,https://www.sendo.vn/u-ken-cho-so-sinh-hieu-swaddleme-10619141.html,Ủ kén cho sơ sinh hiệu SwaddleMe,99000,mevabesosinh
10123733,https://www.sendo.vn/ke-chu-a-ngo-nghinh-cho-be-tap-choi-10123733.html,Kệ chữ A ngộ nghĩnh cho bé tập chơi,149000,duchangshop
13419557,https://www.sendo.vn/vong-noi-dien-k3-nhua-cho-lon-13419557.html,VÕNG NÔI ĐIỆN K3 NHỰA CHỢ LỚN,1100000,Xe Đạp Hưng Thịnh
13487908,https://www.sendo.vn/giuong-luoi-tre-em-13487908.html,giường lưới trẻ em,340000,GiadungDinhVinh
16335951,https://www.sendo.vn/chieu-dieu-hoa-kem-goi-16335951.html,chiếu điều hòa kèm gối,89000,quan 2015
10189045,https://www.sendo.vn/cui-quay-cho-be-10189045.html,CŨI QUÂY CHO BÉ,480000,giadunganan
9962710,https://www.sendo.vn/nem-nam-cho-be-nem-jjocve-nem-cho-be-9962710.html,Nệm nằm cho bé- nệm jjocve-nệm cho bé,499000,ĐẠI ĐẠI CÁT
9538700,https://www.sendo.vn/vong-luoi-cao-cap-sieu-ben-2-lop-9538700.html,Võng lưới cao cấp siêu bền 2 lớp,240000,Siêu thị hàng việt
10935531,https://www.sendo.vn/noi-1-tang-2-sao-autoru-da-nang-10935531.html,NÔI 1 TẦNG 2 SAO AUTORU ĐÀ NẴNG,1500000,ONG VANG
10450188,https://www.sendo.vn/quay-cui-nhua-3d-loai-20-mieng-cho-be-kem-tham-va-bong-10450188.html,QUÂY CŨI NHỰA 3D LOẠI 20 MIẾNG CHO BÉ KÈM THẢM VÀ BÓNG,2200000,Cái Gì Chẳng Có 68
11239319,https://www.sendo.vn/quay-bong-cui-luoi-kem-100-bong-11239319.html,Quây Bóng Cũi Lưới Kèm 100 Bóng,399000,tongkhogiadungso1
11953125,https://www.sendo.vn/quay-bong-cui-luoi-kem-150-bong-11953125.html,Quây Bóng Cũi Lưới Kèm 150 Bóng,530000,chuyên đồ gia dụng hương
12069360,https://www.sendo.vn/quay-cui-nhua-3d-loai-12-mieng-cho-be-hang-cao-cap-tang-tham-va-bong-12069360.html,QUÂY CŨI NHỰA 3D LOẠI 12 MIẾNG CHO BÉ HÀNG CAO CẤP TẶNG THẢM VÀ BÓNG,1650000,THÍCH GÌ CŨNG CÓ
14036586,https://www.sendo.vn/giuong-luoi-tre-em-14036586.html,giường lưới trẻ em,340000,chuyên đồ gia dụng hương
14063897,https://www.sendo.vn/cui-3d-playpen-cho-be-14063897.html,Cũi 3d Playpen cho bé,905000,Cui 3d
12578142,https://www.sendo.vn/cui-quay-cho-be-12578142.html,cũi quây cho bé,410000,GiadungDinhVinh
13350247,https://www.sendo.vn/1-thanh-chan-giuong-mau-moi-truot-len-xuong-2018-1m6-13350247.html,1 thanh chắn giường mẫu mới trượt lên xuống 2018 1M6,319000,GIADUNGLINHDAM
12612308,https://www.sendo.vn/cui-quay-cho-be-12612308.html,cũi quây cho bé,410000,GiadungDinhVinh
12559066,https://www.sendo.vn/noi-em-be-noi-rung-bap-benh-5-trong-1-co-man-mau-hong-mastela-12559066.html,"Nôi em bé, Nôi rung, bập bênh 5 trong 1 CÓ MÀN màu hồng Mastela",1499000,SHOP BÉ CHƠI
13255622,https://www.sendo.vn/cui-quay-cho-be-kem-100-bong-13255622.html,cũi quây cho bé kèm 100 bóng,510000,chuyên đồ gia dụng hương
12544396,https://www.sendo.vn/noi-em-be-tu-dong-gia-re-vinanoi-n20-12544396.html,Nôi em bé tự động giá rẻ VINANOI - N20,990000,MeBeOnline
12886015,https://www.sendo.vn/quay-cui-go-thong-3d-loai-4-mieng-cho-be-hang-viet-nam-12886015.html,QUÂY CŨI GỖ THÔNG 3D LOẠI 4 MIẾNG CHO BÉ HÀNG VIỆT NAM,1650000,THÍCH GÌ CŨNG CÓ
11040764,https://www.sendo.vn/noi-tre-hun-khoi-oval-85x55cm-11040764.html,nôi tre hun khói oval 85x55cm,130000,hai hip's house
16267415,https://www.sendo.vn/ke-vet-chu-a-16267415.html,kệ vẹt chữ a,139000,huykhoi171017
11091238,https://www.sendo.vn/ghe-rung-ghe-nhun-cho-be-11091238.html,GHẾ RUNG - GHẾ NHÚN CHO BÉ,190000,Gia dụng Minh Khánh
12662410,https://www.sendo.vn/noi-rung-kiem-ghe-bap-benh-5-trong-1-mastela-tim-12662410.html,Nôi rung kiêm ghế bập bênh 5 trong 1 Mastela - Tím,1697000,Nam Thành baby
10189374,https://www.sendo.vn/freeship-giuong-chong-nong-thoang-mat-02-10189374.html,FREESHIP giường chống nóng thoáng mát 02,199000,trucvyshop
16128896,https://www.sendo.vn/cui-quay-cho-be-kem-100-bong-16128896.html,CŨI QUÂY CHO BÉ kèm 100 bóng,499000,giadunganan
16850480,https://www.sendo.vn/noi-tu-dong-cao-cap-dieu-khien-tu-xa-mastela-sg239-hinh-soc-16850480.html,Nôi tự động cao cấp điều khiển từ xa Mastela SG239 HÌNH SỌC,2399000,Gấu Babi Shop
14135061,https://www.sendo.vn/bo-quay-va-ga-cho-xanh-goldcat-14135061.html,Bộ quây và ga Chó xanh GoldCat,500000,Goldcat shop
16104905,https://www.sendo.vn/cui-quay-cho-be-16104905.html,CŨI QUÂY CHO BÉ,450000,giadunganan
16240251,https://www.sendo.vn/quay-bong-cho-be-16240251.html,QUÂY BÓNG CHO BÉ ,420000,GiadungDinhVinh
24369041,https://www.sendo.vn/cui-cho-be-cui-cho-be-cao-cap-24369041.html,Cũi cho bé - cũi cho bé cao câp,2059000,HONA HOME
24514534,https://www.sendo.vn/thanh-chan-giuong-cho-be-1m5-1m8-2m-24514534.html,"Thanh chắn giường cho bé 1m5, 1m8, 2m",410000,Siêu Thị 24h Online
24106539,https://www.sendo.vn/goi-chong-trao-nguoc-babystar-tang-goi-chong-lom-va-2-mieng-lot-chong-tham-cotton-24106539.html,Gối chống trào ngược Babystar- tặng gối chống lõm và 2 miếng lót chống thấm cotton,369000,shop Muns
24221428,https://www.sendo.vn/noi-cho-be-noi-cho-be-24221428.html,Nôi cho bé-Nôi cho bé,1320000,CLICK BUY SHOP
22944706,https://www.sendo.vn/bo-quay-cui-chan-ga-goi-dem-man-22944706.html,Bộ quây cũi. chăn. ga. gối. đệm. màn,1470000,LôiLôi90
23708415,https://www.sendo.vn/noi-ga-p-ngu-chung-giuo-ng-ibaby-co-nhac-du-ngu-cho-be-23708415.html,Nôi Gấp Ngủ Chung Giường iBaBy Có Nhạc Du Ngủ Cho Bé,575000,MANGO KIDS _ Shop Mẹ Và Bé
24817248,https://www.sendo.vn/noi-dien-ket-noi-bluetooth-noi-cho-be-24817248.html,Nôi điện kết nối bluetooth - Nôi cho bé,1759000,HONA BEAT
24817210,https://www.sendo.vn/noi-dien-cho-be-noi-dien-kem-dieu-khien-24817210.html,Nôi điện cho bé - Nôi điện kèm điều khiển,1659000,HONA BEAT
