product_id,product_url,name,price,shop_name
12119426,https://www.sendo.vn/noi-dien-vong-xep-tu-dong-thanh-hung-2-trong-1-co-vong-man-chong-muoi-12119426.html,Nôi điện Võng xếp tự động Thành Hưng 2 Trong 1- Có võng màn chống muỗi,680000,Siêu Thị 24h Online
13047194,https://www.sendo.vn/cui-quay-cho-be-vui-choi-13047194.html,Cũi quây cho bé vui chơi,269000,Tạp hóa toàn quốc
20347469,https://www.sendo.vn/chieu-coi-cho-be-20347469.html,CHIẾU CÓI CHO BÉ,25000,SIEUTHI_ME_VA_BE
22843739,https://www.sendo.vn/dem-ngu-thong-minh-chong-giat-minh-22843739.html,Đệm Ngủ Thông Minh chống giật mình,199000,hangsosinh 46115
11909573,https://www.sendo.vn/vong-noi-cho-be-loai-khong-dien-tang-man-chong-muoi-tam-lot-lung-11909573.html,"Võng Nôi cho bé loại không điện - Tặng màn chống muỗi, tấm lót lưng",630000,Siêu Thị 24h Online
11768463,https://www.sendo.vn/giuong-luoi-khung-inox-cho-be-size-90x60cm-11768463.html,Giường lưới khung inox cho bé size 90x60cm,195000,minhchau2018
28240065,https://www.sendo.vn/quay-bong-khung-inox-tang-kem-100-bong-28240065.html,QUÂY BÓNG KHUNG INOX-tặng kèm 100 bóng,310000,shopmebon208
19709559,https://www.sendo.vn/1-thanh-chan-giuong-2m-chinh-cao-7-nac-khong-kenh-dem-1-thanh-19709559.html,1 THANH CHẮN GIƯỜNG 2M CHỈNH CAO 7 NẤC KHÔNG KÊNH ĐỆM - 1 thanh,339000,GIA DỤNG ĐĂNG MINH
16313070,https://www.sendo.vn/vong-noi-cho-be-dai-vi-khong-dien-tang-man-chong-muoi-tam-lot-lung-16313070.html,"Võng Nôi Cho Bé Đại Vĩ Không Điện - Tặng Màn Chống Muỗi, Tấm Lót Lưng",599000,shopluandung
23253063,https://www.sendo.vn/vong-noi-cho-be-khanh-ngoc-khong-dien-tang-man-chong-muoi-tam-lot-lung-23253063.html,"Võng Nôi Cho Bé Khánh Ngọc Không Điện - Tặng Màn Chống Muỗi, Tấm Lót Lưng",628000,shopluandung
29849734,https://www.sendo.vn/quay-bong-khung-inox-tang-kem-100-bong-29849734.html,QUÂY BÓNG KHUNG INOX-tặng kèm 100 bóng,315000,shopmebon208
20423440,https://www.sendo.vn/chieu-nhua-thay-bim-so-sinh-loai-to-20423440.html,Chiếu nhựa thay bỉm sơ sinh loại to,18000,shopchuyensosinh
23527155,https://www.sendo.vn/noi-dien-2-tang-kiem-vong-2in1-co-man-chong-muoi-23527155.html,NÔI ĐIỆN 2 TẦNG KIÊM VÕNG 2IN1 CÓ MÀN CHỐNG MUỖI,1150000,Siêu Thị 24h Online
30192832,https://www.sendo.vn/noi-dat-vong-chong-cong-lung-size-85x55-chieu-lot-noi-30192832.html,Nôi đặt võng chóng còng lưng size 85x55 + chiếu lót nôi,170000,SHOP BÁN NÔI TRE NGỌC YẾN
29042097,https://www.sendo.vn/noi-dien-tu-dong-29042097.html,NÔI ĐIỆN TỰ ĐỘNG,915000,GIA DỤNG TỔNG HỢP VIAN
18922917,https://www.sendo.vn/noi-vong-cho-be-2-trong-1-loai-khong-dien-co-man-chong-muoi-18922917.html,Nôi Võng cho bé 2 Trong 1 loại Không điện - Có màn chống muỗi,620000,Siêu Thị 24h Online
24698171,https://www.sendo.vn/tham-xop-hai-mat-maboshi-hang-viet-nam-cao-cap-cho-be-vua-hoc-vua-choi-24698171.html,THẢM XỐP HAI MẶT MABOSHI HÀNG VIỆT NAM CAO CẤP - CHO BÉ VỪA HỌC VỪA CHƠI,125000,Babykids
24487229,https://www.sendo.vn/xe-day-5-banh-kieu-moi-24487229.html,XE ĐẨY 5 BÁNH KIỂU MỚI,380000,shopsieure911
24094279,https://www.sendo.vn/giuong-luoi-th01-cho-cac-be-hoc-mam-non-24094279.html,Giường lưới TH01 cho các bé học mầm non 💕💕💕💕,229000,ThoanKim
25455649,https://www.sendo.vn/bong-vai-luyen-chan-cho-be-me-ken-25455649.html,Bóng vải luyện chân cho bé - Mẹ Ken,150000,Bột Bình Tinh Nguyên Chất
26144700,https://www.sendo.vn/noi-dien-vong-xep-2-tang-co-dai-2-trong-1-co-man-chong-muoi-tang-vong-26144700.html,Nôi điện Võng xếp 2 tầng cỡ đại 2 Trong 1 Có màn chống muỗi tặng võng,960000,Shop Con Cưngg
24577984,https://www.sendo.vn/vong-noi-dai-vy-24577984.html,võng nôi đại vỹ,999000,CÁI GÌ CŨNG CÓ 02
26144565,https://www.sendo.vn/day-curoa-noi-dien-dai-vi-loai-1-tang-1-bo-gom-2-day-26144565.html,Dây Curoa Nôi điện Đại Vĩ loại 1 tầng 1 bộ gồm 2 dây,40000,Shop Con Cưngg
24577941,https://www.sendo.vn/vong-noi-dai-vy-24577941.html,võng nôi đại vỹ,999000,CÁI GÌ CŨNG CÓ 01
25269480,https://www.sendo.vn/quan-chun-cao-cap-giup-be-ngu-ngon-cotton-co-gian-4-chieu-vai-giong-cocoon-25269480.html,QUẤN CHŨN CAO CẤP GIÚP BÉ NGỦ NGON - COTTON CO GIÃN 4 CHIỀU - VẢI GIỐNG COCOON,170000,Túi Ngủ Thiện Tâm
26146754,https://www.sendo.vn/vong-noi-cho-be-dai-vi-khong-dien-tang-man-chong-muoi-tam-lot-lung-26146754.html,Võng Nôi Cho Bé Đại Vĩ Không Điện - Tặng Màn Chống Muỗi Tấm Lót Lưng,650000,Babykids
23757926,https://www.sendo.vn/noi-dien-dai-vi-2-trong-1-vua-la-noi-dien-vua-la-vong-xep-hang-vn-chat-luong-cao-23757926.html,NÔI ĐIỆN ĐẠI VĨ 2 TRONG 1   VỪA LÀ NÔI ĐIỆN VỪA LÀ VÕNG XẾP - HÀNG VN CHẤT LƯỢNG CAO,650000,Shop Con Cưngg
23230373,https://www.sendo.vn/dau-goi-dalin-cho-be-125ml-giup-toc-be-mem-hon-23230373.html,Dầu gội Dalin cho bé 125ml giúp tóc bé mềm hơn,39000,SHOPHANGCHINHHANG
12796087,https://www.sendo.vn/noi-dien-2-in-1-cho-be-tang-vong-man-chong-muoi-12796087.html,Nôi điện 2 in 1 cho bé - Tặng võng màn chống muỗi,720000,Siêu Thị 24h Online
25145271,https://www.sendo.vn/noi-vong-dai-vi-2trong1-vua-lam-vong-lai-chuyen-lam-noi-25145271.html,Nôi Võng Đại Vĩ _2TRONG1 VỪA LÀM VÕNG LẠI CHUYỂN LÀM NÔI,659000,Shop duy thuong86
12537109,https://www.sendo.vn/noi-dien-vong-xep-2in1-khanh-ngoc-tang-kem-vong-man-chong-muoi-12537109.html,"Nôi điện võng xếp 2in1 Khánh Ngọc - Tặng kèm võng, màn chống muỗi",720000,Siêu Thị 24h Online
16431575,https://www.sendo.vn/cu-sac-cua-noi-dien-16431575.html,Củ sạc của nôi điện,170000,shopluandung
11809044,https://www.sendo.vn/noi-may-chong-may-cho-be-0-12-thang-tuoi-chat-hoac-goi-cho-shop-truoc-khi-dat-hang-11809044.html,Nôi mây Chõng mây cho bé 0-12 tháng tuổi - Chat hoặc gọi cho shop trước khi đặt hàng,499000,Siêu Thị 24h Online
26626188,https://www.sendo.vn/cui-quay-bang-go-tu-nhien-cho-be-loai-5-mieng-hang-viet-nam-26626188.html,CŨI QUÂY BẰNG GỖ TỰ NHIÊN CHO BÉ LOẠI 5 MIẾNG HÀNG VIỆT NAM,2150000,Cái Gì Chẳng Có 1
20393493,https://www.sendo.vn/ghe-rung-phat-nhac-cho-be-ghe-rung-phat-nhac-cho-be-20393493.html,Ghế rung phát nhạc cho bé - Ghế rung phát nhạc cho bé,429000,TongKhoGiaDụngMiềnBắc
22350098,https://www.sendo.vn/cu-rung-sac-noi-dien-cho-be-2-in-1-may-dua-noi-thanh-hung-22350098.html,"Củ rung, sạc nôi điện cho bé 2 in 1 - máy đưa nôi thành hưng",350000,Màn Khung Võng Xếp
22127452,https://www.sendo.vn/giuong-luoi-cho-be-yeu-kem-qua-tang-22127452.html,GIƯỜNG LƯỚI CHO BÉ YÊU KÈM QUÀ TẶNG,175000,tongkholinhdam
19328056,https://www.sendo.vn/cui-giuong-go-soi-goldcat-mua-cui-tang-man-ho-tro-phi-ship-19328056.html,"Cũi giường gỗ Sồi GoldCat - MUA CŨI TẶNG MÀN, HỖ TRỢ PHÍ SHIP",2050000,Goldcat shop
19352566,https://www.sendo.vn/treo-cui-hinh-dong-vat-co-nhac-winfun-19352566.html,Treo cũi hình động vật có nhạc Winfun,359000,TILO MART OFFICIAL STORE
19293511,https://www.sendo.vn/noi-tu-dong-autoru-eco22-19293511.html,Nôi tự động Autoru ECO22,1390000,YoYoShop99
18705270,https://www.sendo.vn/quay-bong-nhua-2m-gom-10-canh-nho-2-canh-lon-50-banh-1-tham-18705270.html,quay bóng nhựa 2m gồm 10 cánh nhỏ 2 cánh lớn 50 banh 1 thảm,1800000,Gia dụng SIÊU RẺ Bà Rịa
21985231,https://www.sendo.vn/noi-dien-vong-xep-tu-dong-thanh-hung-2-trong-1-tang-man-chong-muoi-vong-21985231.html,Nôi Điện Võng Xếp Tự Động Thành Hưng 2 Trong 1 Tặng Màn Chống Muỗi + Võng,880000,Màn Khung Võng Xếp
21999595,https://www.sendo.vn/treo-noi-mau-sac-kich-thich-thi-giac-21999595.html,Treo nôi màu sắc kích thích thị giác,120000,LIF MOD
22668658,https://www.sendo.vn/quay-cui-kiem-nha-bong-tang-kem-bong-22668658.html,Quây cũi kiêm nhà bóng tặng kèm bóng,290000,Gia dụng tiện ích đồ chơi TE
22826331,https://www.sendo.vn/giuong-hai-tang-bb013-nhieu-mau-kem-hoc-nam-tren-1m2-duoi-1m2-22826331.html,Giường hai tầng BB013 nhiều màu kèm hộc nằm trên 1m2 dưới 1m2,5300000,baby68
22828410,https://www.sendo.vn/binh-ve-sinh-lam-sach-mui-cho-be-300-ml-22828410.html,Bình vệ sinh làm sạch mũi cho bé 300 ml,144500,Bigstore24h
21914778,https://www.sendo.vn/day-curoa-noi-dien-thanh-hung-2-day-21914778.html,Dây curoa Nôi điện Thành Hưng 2 dây,25000,Võng Xếp Nôi Điện
22811133,https://www.sendo.vn/harushop168-giuong-noi-xep-gon-cho-be-travel-home-22811133.html,HaruShop168 - Giường nôi xếp gọn cho bé Travel Home,1689000,HaruShop168
22715684,https://www.sendo.vn/bo-goi-chan-vo-do-cho-be-goi-chan-goi-22715684.html,BỘ GỐI CHẶN VỎ ĐỖ CHO BÉ - GỐI - CHẶN GỐI,86000,đồ sơ sinh gia rẻ
22779073,https://www.sendo.vn/noi-dien-cho-be-2in1-thanh-hung-dai-vi-22779073.html,Nôi điện cho bé 2in1 Thành Hưng Đại Vĩ,680000,Siêu Thị 24h Online
22375443,https://www.sendo.vn/mau-treo-noi-den-trang-hinh-may-kich-thich-thi-giac-22375443.html,Mẫu treo nôi đen trắng hình mây kích thích thị giác,109000,Thiết bị vệ sinh LIFMOD
23241195,https://www.sendo.vn/bo-cap-nguon-cua-noi-dien-nguyen-sac-23241195.html,Bộ cấp nguồn của nôi điện - Nguyên sạc,159000,Siêu Thị 24h Online
23215830,https://www.sendo.vn/cui-quay-bong-cho-be-23215830.html,CŨI QUÂY BÓNG CHO BÉ,390000,SHOP HÀNG TỔNG HỢP
23003805,https://www.sendo.vn/noi-go-tre-em-phong-cach-nhat-ban-tu-0-2-tuoi-87x45x25cm-ad-23003805.html,Nôi gỗ trẻ em phong cách Nhật Bản từ 0-2 tuổi 87x45x25cm - AD,1460000,AudiSport Shop
23250327,https://www.sendo.vn/dem-chong-trao-nguoc-cho-tre-so-sinh-coolfoam-japan-xanh-smartshop1688-23250327.html,Đệm chống trào ngược cho trẻ sơ sinh CoolFoam Japan xanh- SmartShop1688,895000,SmartShop1688
23002101,https://www.sendo.vn/quay-cui-nhua-pe-cao-cap-tortoise-and-hare-playpen-109x147cm-ad-23002101.html,Quây cũi nhựa PE cao cấp Tortoise and Hare PLAYPEN 109x147cm - AD,2390000,AudiSport Shop
23306889,https://www.sendo.vn/bo-man-khung-treo-cui-23306889.html,BỘ MÀN KHUNG treo cũi,189000,shop Muns
23015974,https://www.sendo.vn/quay-cui-4-tam-cat-theo-kich-thuoc-khach-hang-dat-23015974.html,Quây cũi 4 tấm cắt theo kích thước khách hàng đặt,380000,Goldcat shop
23212506,https://www.sendo.vn/may-nghe-tieng-on-trang-white-noise-may-tao-tieng-ru-cho-be-ngu-ngon-23212506.html,Máy nghe tiếng ồn trắng white noise - Máy tạo tiếng ru cho bé ngủ ngon,185000,Túi Ngủ Thiện Tâm
21770514,https://www.sendo.vn/noi-dien-vong-xep-2-trong-1-dai-vi-tang-kem-vong-man-chong-muoi-cho-be-21770514.html,Nôi điện Võng xếp 2 Trong 1 Đại Vĩ Tặng kèm võng màn chống muỗi cho bé,855000,VongxepMantubung
21578399,https://www.sendo.vn/noi-dien-cho-be-2in1-dai-vi-21578399.html,Nôi điện cho bé 2in1 đại vĩ ,870000,Võng Xếp Nôi Điện
19511720,https://www.sendo.vn/chieu-lua-dieu-hoa-cho-be-60-x-120-cm-19511720.html,Chiếu Lụa Điều Hòa Cho Bé 60 x 120 cm,65000,shopkidshp
19448259,https://www.sendo.vn/lot-chong-tham-hangtrang-do-chieu-cao-cho-be-19448259.html,Lót chống thấm HằngTrang đo chiều cao cho bé,26500,Cubon Shop
22976313,https://www.sendo.vn/dem-ngu-dung-tu-the-baby-22976313.html,ĐỆM NGỦ ĐÚNG TƯ THẾ BABY,210000,Gia Dụng Gia Đình Việt
23754899,https://www.sendo.vn/treo-noi-kich-thich-thi-giac-hinh-cuu-den-trang-23754899.html,Treo nôi kích thích thị giác hình cừu đen trắng,109000,Thiết bị vệ sinh LIFMOD
19208619,https://www.sendo.vn/giuong-luoi-cho-be-19208619.html,Giường lưới cho bé,249000,Kho hàng gia dụng uy tín
20423569,https://www.sendo.vn/cui-quay-cho-be-20423569.html,Cũi quây cho bé,430000,chuyên đồ gia dụng hương
20687579,https://www.sendo.vn/giuong-luoi-cho-be-yeu-kem-qua-tang-20687579.html,GIƯỜNG LƯỚI CHO BÉ YÊU KÈM QUÀ TẶNG ,169000,GiaDụngBaMiền
19447534,https://www.sendo.vn/goi-cao-su-non-cho-be-19447534.html,Gối cao su non cho bé,36000,Cubon Shop
20687561,https://www.sendo.vn/giuong-luoi-cho-be-20687561.html,GIƯỜNG LƯỚI CHO BÉ,169000,GiaDụngBaMiền
16099543,https://www.sendo.vn/quay-bong-khung-sat-cho-be-16099543.html,quây bóng khung sắt cho bé,480000,Dogiadung99
16840488,https://www.sendo.vn/combo-vong-xep-inox-cao-cap-va-may-dua-tu-dong-vinanoi-16840488.html,Combo Võng xếp inox cao cấp và Máy Đưa tự động VINANOI,1299000,Chăm sóc bé sơ sinh
16002292,https://www.sendo.vn/cui-quay-cho-be-16002292.html,CŨI QUÂY CHO BÉ ,480000,GiadungDinhVinh
16413377,https://www.sendo.vn/cui-cho-be-16413377.html,CŨI CHO BÉ ,480000,giadunganan
17325533,https://www.sendo.vn/cui-quay-bong-kem-100-bong-17325533.html,cũi quây bóng kèm 100 bóng,510000,Dogiadung99
12130322,https://www.sendo.vn/cui-quay-khung-inox-kiem-nha-bong-an-toan-cho-be-12130322.html,Cũi quây khung inox kiêm nhà bóng an toàn cho bé,339150,nguyenquy2903
12093851,https://www.sendo.vn/thanh-chan-giuong-babyqiner-mau-moi-2018-truot-len-xuong-12093851.html,thanh chắn giường babyqiner mẫu mới 2018 trượt lên xuống,460000,shop sóc thỏ
12138016,https://www.sendo.vn/thanh-chan-giuong-baby-gift-m8-12138016.html,thanh chắn giường baby gift m8,315000,ShopDuongMinh
21770467,https://www.sendo.vn/day-coloa-noi-dien-cho-be-21770467.html,Dây coloa nôi điện cho bé,23000,VongxepMantubung
22328699,https://www.sendo.vn/treo-noi-cui-xe-day-tho-mama-gau-papa-co-nhac-22328699.html,"TREO NÔI, CŨI, XE ĐẨY THỎ MAMA GẤU PAPA CÓ NHẠC",79000,Babies Vn
12131485,https://www.sendo.vn/cui-quay-bong-cho-be-12131485.html,Cũi Quây Bóng Cho Bé,480000,GiadungDinhVinh
21511356,https://www.sendo.vn/noi-cho-be-21511356.html,Nôi cho bé,1350000,Cactus
12088791,https://www.sendo.vn/quay-cui-nhua-3d-loai-20-mieng-cho-be-tang-tham-va-bong-hang-cao-cap-12088791.html,QUÂY CŨI NHỰA 3D LOẠI 20 MIẾNG CHO BÉ TẶNG THẢM VÀ BÓNG HÀNG CAO CẤP,2050000,Cái Gì Chẳng Có 1
16820236,https://www.sendo.vn/quay-bong-cho-be-16820236.html,quây bóng cho bé,480000,Shop Tiện Ích Gia Vinh
17734361,https://www.sendo.vn/chieu-lua-dieu-hoa-kem-goi-cho-be-60x120cm-17734361.html,Chiếu Lụa Điều Hòa Kém Gối Cho Bé 60x120cm,125000,Zin Baby
11670287,https://www.sendo.vn/noi-may-chong-may-cho-be-11670287.html,Nôi mây -Chõng mây cho bé,530000,shopluandung
12111660,https://www.sendo.vn/thanh-chan-giuong-mau-moi-truot-len-xuong-2018-12111660.html,thanh chắn giường mẫu mới trượt lên xuống 2018,440000,shop sóc thỏ
11745669,https://www.sendo.vn/dem-dinh-hinh-cho-be-life-technogoly-11745669.html,Đệm định hình cho bé - LIFE Technogoly,315000,SmartShop1688
7692903,https://www.sendo.vn/bo-suu-tap-mau-giuong-sat-cao-cap-sang-trong-tinh-te-7692903.html,"Bộ sưu tập mẫu giường sắt  cao cấp sang trọng, tinh tế",2500000,sắt nghệ thuật
25367451,https://www.sendo.vn/quay-cui-kiem-nha-bong-khung-inox-tang-kem-bong-da-sac-2021-25367451.html,Quây Cũi Kiêm Nhà Bóng Khung Inox Tặng Kèm Bóng Đa Sắc 2021,290000,Siêu Thị 24h Online
25053022,https://www.sendo.vn/mung-ngu-cho-tre-em-25053022.html,Mùng ngủ cho trẻ em,370000,đồ lót chất
24631294,https://www.sendo.vn/boc-noi-24631294.html,Bọc Nôi,120000,Mây tre đan Minh Tâm
25037340,https://www.sendo.vn/goi-chong-trao-nguoc-babystar-25037340.html,GỐI CHỐNG TRÀO NGƯỢC BABYSTAR,359000,shop Muns
20687589,https://www.sendo.vn/giuong-luoi-cho-be-yeu-kem-qua-tang-20687589.html,GIƯỜNG LƯỚI CHO BÉ YÊU KÈM QUÀ TẶNG ,169000,GiaDụngThăngLong
24697994,https://www.sendo.vn/tham-nam-choi-cho-be-co-nhac-24697994.html,Thảm nằm chơi cho bé có nhạc,250000,Tổng kho đồ sơ sinh
11680552,https://www.sendo.vn/set-nem-goi-cho-be-11680552.html,set nệm gối cho bé,180000,Sơ sinh trọn gói
16153546,https://www.sendo.vn/cui-quay-cho-be-16153546.html,CŨI QUÂY CHO BÉ ,420000,Shop Tiện Ích Gia Vinh
12136576,https://www.sendo.vn/noi-tre-oval-size-90x60cm-12136576.html,nôi tre oval size 90x60cm,160000,abcbabies
12133962,https://www.sendo.vn/noi-tre-oval-size-85x55cm-12133962.html,nôi tre oval size 85x55cm,130000,abcbabies
24679549,https://www.sendo.vn/thanh-chan-giuong-baby-smiles-cao-cap-mau-ghi-2020-24679549.html,THANH CHẮN GIƯỜNG BABY SMILES CAO CẤP MÀU GHI 2020,400000,Baby and dear
24634206,https://www.sendo.vn/tu-nhua-da-sac-5-ngan-keo-thuong-hieu-viet-nhat-tu-do-cho-be-24634206.html,Tủ Nhựa Đa Sắc 5 Ngăn Kéo Thương Hiệu Việt Nhật- Tủ đồ cho Bé,500000,Babykids
24303542,https://www.sendo.vn/bo-treo-noi-bang-vai-ni-cat-san-khach-ve-may-hoac-shop-may-hoan-chinh-24303542.html,Bộ treo nôi bằng vải nỉ cắt sẵn khách về may hoặc shop may hoàn chỉnh,150000,Tiem Vai Thao Khang
24219475,https://www.sendo.vn/noi-chup-tre-em-24219475.html,NÔI CHỤP TRẺ EM ,199000,CHĂN GA GỐI ĐỆM XUẤT NHẬP KHẨU
24053987,https://www.sendo.vn/noi-dien-vong-xep-2-trong-1-thanh-hung-tang-kem-vong-man-chong-muoi-cho-be-24053987.html,Nôi Điện Võng Xếp 2 Trong 1 Thành Hưng Tặng Kèm Võng + Màn Chống Muỗi Cho Bé,729000,Đồ Gia Dụng VN
23686719,https://www.sendo.vn/combo-cui-2-tang-kem-dem-va-quay-cui-cho-be-23686719.html,Combo Cũi 2 tầng kèm đệm và quây cũi cho bé,2968000,HONA BEAT
23658957,https://www.sendo.vn/chieu-tre-soi-tam-2-mat-sieu-mat-cho-be-tang-kem-01-nut-bit-o-dien-bao-ve-an-toan-cho-be-yeu-23658957.html,Chiếu tre sợi tăm 2 mặt siêu mát cho bé - Tặng kèm 01 nút bịt ổ điện bảo vệ an toàn cho bé yêu,185000,Shop Mẹ Mía
22999383,https://www.sendo.vn/de-m-na-m-cao-ca-p-da-chu-c-nang-coza-baby-bed-lite-mau-xanh-bien-22999383.html,Đệm Nằm Cao Cấp Đa Chức Năng Coza Baby Bed – Lite Màu Xanh Biển,2299000,Mom Baby Care
23754888,https://www.sendo.vn/mau-treo-noi-mau-sac-hinh-may-cho-be-23754888.html,Mẫu treo nôi màu sắc hình mây cho bé,49000,Thiết bị vệ sinh LIFMOD
28137669,https://www.sendo.vn/day-curoa-noi-hoang-thanh-2-day-28137669.html,Dây curoa nôi Hoàng Thành (2 dây),29000,hoa giay
26236515,https://www.sendo.vn/giuong-luoi-dieu-hoa-rainbow-1mx60cm-26236515.html,Giường lưới điều hoà Rainbow 1mx60cm,250000,Giường lưới Vuông Tròn 8
26146741,https://www.sendo.vn/vong-noi-cho-be-khanh-ngoc-tang-man-chong-muoi-tam-lot-lung-26146741.html,"Võng Nôi Cho Bé Khánh Ngọc  - Tặng Màn Chống Muỗi, Tấm Lót Lưng",690000,Babykids
26252968,https://www.sendo.vn/noi-dua-tu-dong-2-tang-autoru-eco-25-26252968.html,Nôi đưa tự động 2 tầng Autoru-Eco 25,1890000,baby68
28761523,https://www.sendo.vn/noi-tre-dat-vong-size-12mx70-tang-vong-dau-tam-28761523.html,Nôi tre đặt võng Size 1.2mx70 ( tặng vòng dâu tằm),300000,Nôi Tre Đặt Võng 36
28137809,https://www.sendo.vn/day-curoa-cho-noi-cui-2-day-28137809.html,Dây curoa cho nôi cũi 2 dây,56000,hoa giay
28852515,https://www.sendo.vn/noi-rung-2-tang-quang-hung-qh02-28852515.html,Nôi rung 2 tầng Quang Hưng QH02,1150000,siêu thị TELO
28163513,https://www.sendo.vn/goi-chong-trao-nguoc-cho-be-hang-dep-28163513.html,GỐI CHỐNG TRÀO NGƯỢC CHO BÉ - HÀNG ĐẸP,146000,ShopMeBe
28105841,https://www.sendo.vn/cui-3d-6-canh-me-vi-be-28105841.html,Cũi 3d 6 cánh - Mẹ Vì Bé,1260000,Cty Mẹ Vì Bé
29849285,https://www.sendo.vn/ghe-hoi-cho-be-tap-ngoi-cho-be-29849285.html,Ghế hơi cho bé tập ngồi cho bé,189000,gia dung bao chau2 plaza
30246643,https://www.sendo.vn/noi-vong-cho-be-30246643.html,NÔI VÕNG CHO BÉ,969000,HÀNGTIỆNÍCH
28145360,https://www.sendo.vn/noi-tre-va-phu-kien-noi-tre-28145360.html,Nôi tre và phụ kiện nôi tre,65000,thảo dược tây nguyên
28117077,https://www.sendo.vn/vong-noi-2in-1thanh-hung-vua-la-vong-xep-vua-la-noi-dien-28117077.html,võng nôi 2in 1thành hưng vừa là võng xếp vừa là nôi điện,619000,Nghĩa Phượng Shop
21800706,https://www.sendo.vn/day-curoa-noi-dien-thanh-hung-2-day-21800706.html,Dây curoa Nôi điện Thành Hưng 2 dây,28000,Màn Khung Võng Xếp
20393379,https://www.sendo.vn/ghe-rung-phat-nhac-cho-be-ghe-rung-phat-nhac-cho-be-20393379.html,Ghế rung phát nhạc cho bé - Ghế rung phát nhạc cho bé,429000,GIA DỤNG ĐĂNG MINH
23658787,https://www.sendo.vn/chieu-nam-thoang-mat-cho-be-bang-tre-soi-tam-tang-kem-01-nut-bit-o-dien-bao-ve-an-toan-cho-be-yeu-23658787.html,Chiếu nằm thoáng mát cho bé bằng tre sợi tăm - Tặng kèm 01 nút bịt ổ điện bảo vệ an toàn cho bé yêu,139000,Shop Mẹ Mía
20370787,https://www.sendo.vn/cui-quay-cho-be-20370787.html,CŨI QUÂY CHO BÉ,480000,HÀNG TIỆN ÍCH 02
26146757,https://www.sendo.vn/vong-noi-cho-be-thanh-hung-tang-man-chong-muoi-tam-lot-lung-26146757.html,"Võng Nôi Cho Bé Thành Hưng  - Tặng Màn Chống Muỗi, Tấm Lót Lưng",649000,Babykids
28732926,https://www.sendo.vn/quay-cui-nhua-nguyen-sinh-bpa-free-28732926.html,QUÂY CŨI NHỰA NGUYÊN SINH BPA FREE,1440000,talt1590
28460222,https://www.sendo.vn/bo-nguon-adapter-may-dua-vong-tu-dong-fujishi-va017-adapter-28460222.html,Bộ nguồn adapter Máy đưa võng tự động Fujishi VA017 - adapter,199000,TIỆN ÍCH VIỆT 24H
28409655,https://www.sendo.vn/mieng-dan-thanh-chan-giuong-dan-tuong-treo-do-vat-dung-28409655.html,"Miếng dán thanh chắn giường, dán tường treo đồ vật dụng",15000,baby68
28426703,https://www.sendo.vn/quay-cui-nhua-nguyen-sinh-an-toan-cho-be-08-1m2-28426703.html,QUÂY CŨI NHỰA NGUYÊN SINH AN TOÀN CHO BÉ 0.8-1M2,1100000,Khoailang Shop
20037059,https://www.sendo.vn/man-coc-cui-tre-em-mc01-20037059.html,"Màn, cọc cũi trẻ em MC01",250000,Babimart Hà Nội
20770913,https://www.sendo.vn/quay-bong-cho-be-20770913.html,Quây bóng cho bé,350000,GiadungDinhVinh
19892434,https://www.sendo.vn/noi-vong-tu-dong-cho-be-hai-trong-mot-vinanoi-nv25-19892434.html,Nôi võng tự động cho bé hai trong một Vinanoi - NV25,1149000,"Engineering Services Co., Ltd"
28543686,https://www.sendo.vn/hang-chinh-hang-muslin-tree-mau-moi-chieu-lua-lam-mat-chieu-dieu-hoa-kem-goi-chieu-cho-be-28543686.html,"[Hàng chính hãng Muslin Tree- mẫu mới ] Chiếu lụa làm mát, chiếu điều hoà kèm gối, chiếu cho bé",189000,Baby Art & Craft
28830858,https://www.sendo.vn/noi-ngu-cho-be-rung-tu-dong-babykey-5-che-do-rung-hen-gio-remote-phat-nhac-tren-dien-thoai-bang-bluetooth-xam-28830858.html,"Nôi ngủ cho bé Rung Tự Động BaByKey 5 Chế Độ Rung, Hẹn Giờ, Remote, Phát Nhạc Trên Điện Thoại bằng Bluetooth (Xám)",2290000,SmartShop1688
28830020,https://www.sendo.vn/noi-cho-be-28830020.html,Nôi cho bé,1550000,DITA SHOP
28079404,https://www.sendo.vn/ghe-nhun-co-gau-cho-be-28079404.html,Ghế nhún có gấu cho bé,219000,Gia Dụng Thanh Huyền
28519854,https://www.sendo.vn/giuong-luoi-cho-be-28519854.html,giường lưới cho bé,350000,SIÊU THỊ GIA ĐÌNH 1
29080573,https://www.sendo.vn/noi-tre-dat-vong-chong-cong-lung-cho-beda-ho-ramkt-29080573.html,Nôi tre đặt võng chống còng lưng cho bé(đã hơ rằm)kt:,300000,nôi tre đặt võng cho bé
19000567,https://www.sendo.vn/noi-dien-vong-xep-2-trong-1-dai-vi-tang-2-day-curoa-vong-man-chong-muoi-19000567.html,Nôi điện Võng xếp 2 Trong 1 Đại Vĩ -Tặng 2 dây Curoa + võng +  màn chống muỗi,680000,Siêu Thị 24h Online
19833740,https://www.sendo.vn/noi-tre-cho-be-60x90-19833740.html,Nôi tre cho bé 60x90,30000,Quần chục
20370756,https://www.sendo.vn/cui-quay-cho-be-20370756.html,CŨI QUÂY CHO BÉ,480000,GIA DỤNG TỔNG HỢP VIAN
26235648,https://www.sendo.vn/giuong-luoi-dieu-hoa-rainbow-1m1x60cm-26235648.html,Giường lưới điều hoà Rainbow 1m1x60cm,280000,Giường lưới Vuông Tròn 8
19819716,https://www.sendo.vn/vong-tu-dong-cho-be-vinanoi-vtd25-luoi-mau-xanh-la-19819716.html,Võng tự động cho bé VINANOI VTD25 lưới màu xanh lá,990000,VINANOI
21796359,https://www.sendo.vn/cui-quay-bong-luc-giac-21796359.html,Cũi quây bóng lục giác,350000,Shop Tiện Ích Gia Vinh
28570855,https://www.sendo.vn/quay-bong-luc-giac-28570855.html,QUÂY BÓNG LỤC GIÁC ,350000,GiadungDinhVinh
28118039,https://www.sendo.vn/ke-thay-ta-03-tang-tu-nhien-me-vi-be-28118039.html,Kệ thay tã 03 tầng tự nhiên - Mẹ Vì Bé,1150000,Cty Mẹ Vì Bé
17256823,https://www.sendo.vn/cui-quay-cho-be-17256823.html,CŨI QUÂY CHO BÉ ,420000,giadunganan
19018582,https://www.sendo.vn/vo-ng-noi-die-n-tu-do-ng-3-trong-1-cho-be-19018582.html,Võng nôi điện tự động 3 trong 1 cho bé,2370000,Mẹ và bé ĐH
16035156,https://www.sendo.vn/ghe-rung-cao-cap-cho-be-co-bao-hiem-do-choi-mai-che-dieu-chinh-nam-ngoi-16035156.html,"Ghế Rung Cao Cấp Cho Bé - Có Bảo Hiểm, Đồ Chơi, Mái Che, Điều Chỉnh Nằm Ngồi",370000,Siêu Thị 24h Online
28517646,https://www.sendo.vn/ghe-rung-nhun-cao-cap-28517646.html,ghế rung nhún cao cấp,630000,SHOP MẸ VÀ BÉ 89
16104907,https://www.sendo.vn/quay-cui-quay-bong-16104907.html,Quây cũi quây bóng,450000,giadunganan
19092592,https://www.sendo.vn/chieu-tre-soi-tam-cho-be-chieu-tre-em-chieu-dai-noi-kt-1m1-x-60cm-19092592.html,Chiếu tre sợi tăm cho bé - chiếu trẻ em - chiếu dải nôi kt 1m1 x 60cm,179000,CỰC RẺ 86
11912260,https://www.sendo.vn/hop-phat-nhac-len-day-cot-treo-noi-cui-cho-be-11912260.html,Hộp phát nhạc lên dây cót treo Nôi Cũi Cho Bé,69000,Bebi 123
