product_id,product_url,name,price,shop_name
12131459,https://www.sendo.vn/cui-quay-cho-be-12131459.html,Cũi Quây Cho Bé,480000,GiadungDinhVinh
12403885,https://www.sendo.vn/noi-dua-joie-sansa-2in1-in-the-rain-12403885.html,Nôi đưa Joie Sansa 2in1 In The Rain,5300000,sieu thi hang nhat
12417674,https://www.sendo.vn/quay-bong-dong-thoi-lam-cui-luoi-cho-be-12417674.html,Quây bóng đồng thời làm cũi lưới cho bé,480000,GiadungDinhVinh
11650353,https://www.sendo.vn/giuong-ngu-cho-be-xep-gon-11650353.html,Giường ngủ cho bé xếp gọn,1679000,IT Smart
11618868,https://www.sendo.vn/thiet-bi-mam-non-toan-quoc-giuong-mam-non-chat-luong-cao-ma-xstb-11618868.html,THIẾT BỊ MẦM NON TOÀN QUỐC- Giường mầm non chất lượng cao. Mã XSTB,220000,Thietbimamnontoanquoc
11598246,https://www.sendo.vn/giuong-luoi-cho-be-01674776662-11598246.html,GIƯỜNG LƯỚI CHO BÉ 01674776662,299000,Gia Dụng Ngọc Lan
11257352,https://www.sendo.vn/chan-luoi-xuat-nga-11257352.html,CHĂN LƯỚI XUẤT NGA,150000,shopQuynhchi
7169276,https://www.sendo.vn/giuong-tre-em-doremon-1m4-7169276.html,Giường trẻ em Doremon 1m4,4085000,baby68
23199661,https://www.sendo.vn/cui-3d-4-canh-cho-be-quickflex-23199661.html,Cũi 3D 4 cánh cho bé Quickflex,920000,Babymart
7169025,https://www.sendo.vn/giuong-hello-kitty-1m4-7169025.html,Giường Hello kitty 1m4,4000000,baby68
28137996,https://www.sendo.vn/combo-2-day-curoa-noi-long-hung-ban-day-dan-28137996.html,Combo 2 dây curoa nôi Long Hưng- bản dày dặn,54000,hoa giay
23757137,https://www.sendo.vn/noi-cho-be-thao-roi-de-dang-23757137.html,Nôi cho bé-tháo rời dễ dàng,369000,shop Muns
13424546,https://www.sendo.vn/bo-10-mieng-tham-lot-san-tron-30x30cm-13424546.html,Bộ 10 miếng thảm lót sàn trơn 30x30cm,89000,September Cosmetics
29081746,https://www.sendo.vn/noi-tre-dat-vong-cho-beda-ho-dam-ki-29081746.html,Nôi tre đặt võng cho bé.(đã hơ dằm kĩ),250000,nôi tre đặt võng cho bé
11079021,https://www.sendo.vn/bo-10-mieng-tham-lot-san-mau-hinh-hoc-so-loai-lon-30x30x1cm-11079021.html,Bộ 10 miếng thảm lót sàn mẫu hình học số loại lớn 30x30x1cm,89000,September Cosmetics
18979525,https://www.sendo.vn/chieu-cao-su-chong-tham-cho-be-size-60x90-18979525.html,Chiếu cao su chống thấm Cho Bé size 60x90,200000,THIÊN ĐƯỜNG MẸ VÀ BÉ
13571766,https://www.sendo.vn/bo-noi-tre-chu-nhat-s4-95x60cm-kem-nem-lot-cara-tron-vietkids-dat-vong-xep-cho-be-13571766.html,Bộ nôi tre chữ nhật S4  95x60cm kèm nệm lót cara trơn Vietkids đặt võng xếp cho bé,210000,Babies Vn
17951622,https://www.sendo.vn/dem-ngu-chong-giat-minh-cho-be-17951622.html,ĐỆM NGỦ CHỐNG GIẬT MÌNH CHO BÉ,265000,DOTINO VIETNAM
10007763,https://www.sendo.vn/noi-cui-inox-vai-du-nha-bong-tang-10-bong-cho-be-gia-goc-10007763.html,Nôi Cũi Inox Vải Dù Nhà Bóng Tặng 10 bóng cho bé giá gốc,585000,shoppigvpp
10986359,https://www.sendo.vn/chieu-dat-noi-cho-tre-10986359.html,chiếu đặt nôi cho trẻ,310000,ChieuTrucVietNam
11078757,https://www.sendo.vn/bo-10-mieng-tham-lot-san-mau-trai-cay-loai-lon-30x30x1cm-11078757.html,Bộ 10 miếng thảm lót sàn mẫu trái cây loại lớn 30x30x1cm,89000,September Cosmetics
13469589,https://www.sendo.vn/hop-may-noi-tu-dong-autoru-13469589.html,Hộp máy nôi tự động Autoru,360000,Babymart
17988490,https://www.sendo.vn/giuong-luoi-mua-he-cho-be-120x55x10cm-17988490.html,Giường lưới mùa hè cho bé 120x55x10cm,1679000,XuHa Baby
19972696,https://www.sendo.vn/noi-dien-tu-dong-4-trong-1-go-thong-mau-trang-cho-be-19972696.html,Nôi điện tự động 4 trong 1 gỗ thông màu trắng cho bé,5350000,thietbidonoithat
29995082,https://www.sendo.vn/giuong-luoi-cho-be-29995082.html,GIƯỜNG LƯỚI CHO BÉ,290000,HÀNG TIỆN ÍCH 01
17772439,https://www.sendo.vn/cui-quay-cho-be-17772439.html,CŨI QUÂY CHO BÉ,420000,HÀNG TIỆN ÍCH 02
19122186,https://www.sendo.vn/noi-cui-vai-du-zaracos-jenni-5046-mau-hong-19122186.html,Nôi cũi vải dù Zaracos Jenni 5046 màu hồng,2250000,azobabyvn
17474589,https://www.sendo.vn/cui-quay-cho-be-kem-100-qua-bong-17474589.html,CŨI QUÂY CHO BÉ kèm 100 quả bóng,450000,HÀNG TIỆN ÍCH 01
25063216,https://www.sendo.vn/giuong-cui-noi-cho-be-25063216.html,"Giường cũi, nôi cho bé",2109000,ĐỒ CHƠI VÀ GẤU BÔNG SỈ LẺ
28262792,https://www.sendo.vn/noi-em-be-tu-dong-vinanoi-vnn301-go-thong-cao-cap-vua-lam-noi-vua-lam-vong-mau-tu-nhien-28262792.html,Nôi Em Bé Tự Động Vinanoi-VNN301 Gỗ Thông Cao Cấp Vừa Làm Nôi Vừa Làm Võng Màu Tự Nhiên,4250000,VINANOI
19766063,https://www.sendo.vn/noi-vong-tu-dong-cho-be-2-trong-1-vinanoi-nv25h-long-noi-mau-hong-19766063.html,Nôi Võng tự động cho bé 2 trong 1 VINANOI - NV25H lồng nôi màu hồng,1300000,VINANOI
19818228,https://www.sendo.vn/combo-may-dua-vong-em-be-vinanoi-vn365-suc-dua-30kg-sieu-em-va-goi-ke-chuyen-19818228.html,COMBO Máy đưa võng em bé VINANOI - VN365 sức đưa 30kg siêu êm và gối kể chuyện,695000,VINANOI
19784392,https://www.sendo.vn/combo-may-dua-vong-em-be-vinanoi-a100-suc-dua-100kg-sieu-em-va-goi-ke-chuyen-cho-be-19784392.html,COMBO Máy đưa võng em bé VINANOI - A100 sức đưa 100kg siêu êm và Gối kể chuyện cho bé,750000,VINANOI
16620534,https://www.sendo.vn/chieu-lua-dieu-hoa-cho-be-gia-dung-gia-re-amina-16620534.html,Chiều Lụa Điều Hòa Cho Bé - Gia Dụng Giá Rẻ Amina,119000,Đại Siêu Thị Amina
7339332,https://www.sendo.vn/giuong-doremon-1m2-gd06-1-7339332.html,Giường Doremon 1m2 GD06-1,3800000,baby68
12642965,https://www.sendo.vn/noi-rung-cao-cap-carter-sboo-cho-be-12642965.html,Nôi rung cao cấp Carter Sboo cho bé,945000,Mun House
7866360,https://www.sendo.vn/ghe-rung-cho-be-7866360.html,Ghế rung cho bé,280000,shop gia dụng rẻ
8634637,https://www.sendo.vn/ga-chong-tham-cotton-cao-cap-thoang-lung-cho-be-1m8-8634637.html,Ga chống thấm cotton cao cấp thoáng lưng cho bé 1m8,290000,Ga Chống Thấm Cotton Cho Bé
13456419,https://www.sendo.vn/bo-30-mieng-tham-xop-lot-san-30x30-trai-cay-dong-vat-phuong-tien-giao-thong-so-13456419.html,"Bộ 30 miếng thảm xốp lót sàn 30x30 - trái cây, động vật, phương tiện giao thông, số",289000,September Cosmetics
12662437,https://www.sendo.vn/noi-rung-kiem-ghe-bap-benh-5-trong-1-mastela-xam-vien-xanh-12662437.html,Nôi rung kiêm ghế bập bênh 5 trong 1 Mastela - Xám viền xanh,1697000,Nam Thành baby
12712797,https://www.sendo.vn/giuong-luoi-cho-be-12712797.html,giường lưới cho bé,340000,GiadungDinhVinh
13272253,https://www.sendo.vn/combo-cui-giuong-go-que-goldcat-kich-thuoc-85x130-mua-combo-nhan-qua-hap-han-ho-tro-phi-ship-13272253.html,"Combo cũi giường gỗ Quế GoldCat - Kích thước 85x130 - MUA COMBO NHẬN QUÀ HẤP HẪN, HỖ TRỢ PHÍ SHIP",3870000,Goldcat shop
9588008,https://www.sendo.vn/quay-cui-nhua-3d-loai-14-mieng-cho-be-kem-tham-va-bong-9588008.html,QUÂY CŨI NHỰA  3D LOẠI 14 MIẾNG CHO BÉ KÈM THẢM VÀ BÓNG,1850000,Cái Gì Chẳng Có 1
9591284,https://www.sendo.vn/chieu-dat-noi-cho-tre-tang-01-khan-tam-giac-9591284.html,chiếu đặt nôi cho trẻ Tặng 01 khăn tam giác,210000,Chiếu trúc Việt Nam
8829749,https://www.sendo.vn/chieu-cao-su-hoi-cao-cap-8829749.html,Chiếu cao su hơi cao cấp,195000,bonbonbaby
10077664,https://www.sendo.vn/ghe-rung-phat-nhac-ghe-rung-phat-nhac-10077664.html,Ghế Rung Phát Nhạc - Ghế Rung Phát Nhạc,530000,Việt Mart
19766853,https://www.sendo.vn/vong-xep-tu-dong-nguoi-lon-vinanoi-vn365n-kvt-khung-thep-luoi-dai-mau-xanh-la-19766853.html,Võng xếp tự động người lớn VINANOI VN365N-KVT khung thép lưới đại màu xanh lá,1270000,VINANOI
7087706,https://www.sendo.vn/giuong-tang-doremon-gt03-7087706.html,Giường tầng Doremon GT03,9097000,baby68
10506197,https://www.sendo.vn/quay-cui-nhua-16-mieng-cho-be-kem-tham-va-bong-hang-xuat-chau-au-10506197.html,QUÂY CŨI NHỰA 16 MIẾNG CHO BÉ KÈM THẢM VÀ BÓNG HÀNG XUẤT CHÂU ÂU,2050000,Cái Gì Chẳng Có 68
10439975,https://www.sendo.vn/quay-cui-nhua-3d-loai-18-mieng-cho-be-kem-tham-va-bong-10439975.html,QUÂY CŨI NHỰA 3D LOẠI 18 MIẾNG CHO BÉ KÈM THẢM VÀ BÓNG,1950000,Cái Gì Chẳng Có 1
10958462,https://www.sendo.vn/man-noi-di-dong-chong-muoi-cho-be-10958462.html,màn nôi di động chống muỗi cho bé,180000,susutmilk
10199113,https://www.sendo.vn/ghe-rung-mastela-chinh-hang-6906-mau-xanh-10199113.html,Ghế rung Mastela chính hãng 6906 màu xanh,960000,Diệp Anh Japan
12013183,https://www.sendo.vn/giuong-luoi-tre-em-12013183.html,GIƯỜNG LƯỚI TRẺ EM,340000,GiadungDinhVinh
11079683,https://www.sendo.vn/bo-4-mieng-tham-lot-san-cho-be-loai-dai-60-60-1cm-dien-tich-san-1-2-m2-11079683.html,"Bộ 4 miếng thảm lót sàn cho bé loại đại 60*60*1cm diện tích sàn 1,2 m2",169000,September Cosmetics
11759544,https://www.sendo.vn/noi-xep-gon-cho-be-home-and-garden-11759544.html,Nôi xếp gọn cho bé - Home and Garden,1679000,Home and Garden
11823827,https://www.sendo.vn/noi-vai-cotton-cho-be-tu-0-den-24-thang-11823827.html,Nôi vải cotton cho bé từ 0 đến 24 tháng,635000,huamai
16620455,https://www.sendo.vn/chieu-lua-cho-be-gia-dung-gia-re-amina-16620455.html,Chiếu Lụa Cho Bé - Gia Dụng Giá Rẻ Amina,99000,Đại Siêu Thị Amina
11786888,https://www.sendo.vn/noi-cui-du-zaracos-jenni-5046-blue-11786888.html,NÔI CŨI DÙ ZARACOS JENNI 5046 - BLUE,2600000,đồ dùng cho bé zaracos coozy
10701249,https://www.sendo.vn/ghe-rung-phat-nhac-cho-be-10701249.html,Ghế rung phát nhạc cho bé,530000,sevenmart
16968252,https://www.sendo.vn/chieu-coi-cho-be-16968252.html,chiếu cói cho bé,30000,sơ sinh Quân Hợp
16959894,https://www.sendo.vn/noi-tu-dong-cao-cap-mastela-sg239-mau-ghi-soc-16959894.html,Nôi Tự Động Cao Cấp Mastela SG239 - mẫu GHI SỌC,2399000,Vnkids Fashion
16955140,https://www.sendo.vn/xich-du-kiem-noi-rung-mastela-2-trong-1-mastela-sg301-16955140.html,Xich đu kiêm Nôi rung Mastela 2 trong 1 Mastela SG301,3699000,Vnkids Fashion
9845625,https://www.sendo.vn/nem-nuoc-cao-su-cho-be-9845625.html,Nệm nước cao su cho bé,180000,Hoa Tư Dẫn
30072767,https://www.sendo.vn/ghe-rung-ghe-nhun-danh-cho-be-tu-so-sinh-den-18kg-co-phat-nhac-kich-thich-su-phat-trien-nao-bo-cua-tre-mau-xanh-30072767.html,"Ghế rung, Ghế nhún dành cho Bé từ sơ sinh đến 18kg, có phát nhạc kích thích sự phát triển não bộ của trẻ - Màu xanh",399000,Shop Mẹ Mía
18668016,https://www.sendo.vn/quay-cui-nhua-loai-14-mieng-cho-be-tang-tham-va-bong-hang-cao-cap-18668016.html,QUÂY CŨI NHỰA LOẠI 14 MIẾNG CHO BÉ  TẶNG THẢM VÀ BÓNG HÀNG CAO CẤP,1900000,Cái Gì Chẳng Có
11907887,https://www.sendo.vn/quay-cui-nhua-3d-loai-20-mieng-cho-be-hang-cao-cap-tangtham-va-bong-11907887.html,QUÂY CŨI NHỰA 3D LOẠI 20 MIẾNG CHO BÉ HÀNG CAO CẤP TẶNGTHẢM VÀ BÓNG,2250000,Cái Gì Chẳng Có
11907978,https://www.sendo.vn/quay-cui-nhua-3d-loai-22-mieng-cho-be-hang-cao-cap-tang-tham-va-bong-11907978.html,QUÂY CŨI NHỰA 3D LOẠI 22 MIẾNG CHO BÉ HÀNG CAO CẤP TẶNG THẢM VÀ BÓNG,2500000,Cái Gì Chẳng Có
30074797,https://www.sendo.vn/cui-quay-cho-be-30074797.html,CŨI QUÂY CHO BÉ,359000,giadunganan
12080912,https://www.sendo.vn/quay-cui-nhua-3d-loai-18-mieng-cho-be-tang-tham-va-bong-hang-cao-cap-12080912.html,QUÂY CŨI NHỰA 3D LOẠI 18 MIẾNG CHO BÉ TẶNG THẢM VÀ BÓNG HÀNG CAO CẤP,2050000,Cái Gì Chẳng Có
12080777,https://www.sendo.vn/quay-cui-nhua-3d-loai-12-mieng-cho-be-tang-tham-va-bong-hang-cao-cap-12080777.html,QUÂY CŨI NHỰA 3D LOẠI 12 MIẾNG CHO BÉ TẶNG THẢM VÀ BÓNG HÀNG CAO CẤP,1800000,Cái Gì Chẳng Có
4739960,https://www.sendo.vn/cui-go-da-nang-goldcat-4739960.html,Cũi gỗ đa năng GOLDCAT,2600000,Cái Gì Chẳng Có
10283336,https://www.sendo.vn/quay-cui-nhua-3d-loai-16-mieng-cho-be-tang-tham-va-bong-hang-cao-cap-10283336.html,QUÂY CŨI NHỰA 3D LOẠI 16 MIẾNG CHO BÉ TẶNG THẢM VÀ BÓNG HÀNG CAO CẤP,1950000,Cái Gì Chẳng Có
9414596,https://www.sendo.vn/chieu-coi-nhat-nam-60-90cm-9414596.html,CHIẾU CÓI NHẬT NAM 60*90cm,95000,Thoi_trang_tre_em_HIENNGO
10521944,https://www.sendo.vn/meo-tim-phat-nhac-10521944.html,Mèo tím phát nhạc,75000,ChiOngNau
27851380,https://www.sendo.vn/mau-moi-giuong-cui-em-be-tien-nghi-cho-be-loai-1-2m-co-2-tang-da-chuc-nang-cobabies-27851380.html,"MẪU MỚI Giường cũi em bé tiện nghi cho bé loại 1,2m có 2 tầng đa chức năng Cobabies",2499000,dautram_ngoctuyet
14207789,https://www.sendo.vn/giuong-hoi-gia-re-14207789.html,Giường hơi giá rẻ,1709000,bestway vn
11606678,https://www.sendo.vn/noi-ngu-chung-giuong-summer-cua-my-chinh-hang-11606678.html,Nôi ngủ chung giường Summer của Mỹ Chính hãng,1789000,Enbay24h.com
11003158,https://www.sendo.vn/dem-ngu-dung-tu-the-cosydream-babymoov-chinh-hang-tu-phap-mau-xanh-11003158.html,Đệm ngủ đúng tư thế Cosydream Babymoov Chính hãng từ Pháp màu Xanh,1290000,Enbay24h.com
10313272,https://www.sendo.vn/cui-quay-cho-be-10313272.html,CŨI QUÂY CHO BÉ,460000,giadunganan
11088366,https://www.sendo.vn/cui-quay-cho-be-11088366.html,CŨI QUÂY CHO BÉ ,350000,giadunganan
12255157,https://www.sendo.vn/cui-quay-cho-be-12255157.html,CŨI QUÂY CHO BÉ,450000,giadunganan
12848689,https://www.sendo.vn/cui-quay-cho-be-12848689.html,CŨI QUÂY CHO BÉ,480000,giadunganan
11401616,https://www.sendo.vn/cui-quay-cho-be-kem-100-bong-11401616.html,CŨI QUÂY CHO BÉ kèm 100 bóng,520000,giadunganan
11277105,https://www.sendo.vn/cui-quay-cho-be-kem-100-bong-11277105.html,CŨI QUÂY CHO BÉ kèm 100 bóng,520000,giadunganan
12870772,https://www.sendo.vn/cui-quay-cho-be-kem-100-bong-12870772.html,CŨI QUÂY CHO BÉ kèm 100 bóng,520000,giadunganan
20108665,https://www.sendo.vn/vong-noi-tu-dong-4-trong-1-20108665.html,VÕNG NÔI TỰ ĐỘNG 4 TRONG 1,2970000,Mẹ và bé ĐH
22455779,https://www.sendo.vn/cui-quay-cho-be-22455779.html,cũi quây cho bé,450000,giadunganan
19092514,https://www.sendo.vn/chieu-tre-em-bamboo-chieu-tre-may-tre-em-hang-vn-cao-cap-60cm-x-1m1-19092514.html,chiếu trẻ em bamboo - chiếu TRE mây trẻ em hàng VN CAO CẤP 60cm x 1m1,179000,CỰC RẺ 86
22772703,https://www.sendo.vn/giuong-noi-xep-gon-cho-be-travel-home-best-seller-tony-22772703.html,Giường nôi xếp gọn cho bé Travel Home - Best Seller Tony,1679000,Shop P T L
16288701,https://www.sendo.vn/may-dua-vong-tu-dong-domo-16288701.html,Máy đưa võng tự động DOMO,399000,SHOP MINH SAN
23488412,https://www.sendo.vn/cui-quay-cho-be-23488412.html,CŨI QUÂY CHO BÉ,350000,ĐỒ GIA DỤNG VIAN
12870620,https://www.sendo.vn/cui-quay-cho-be-kem-100-bong-12870620.html,CŨI QUÂY CHO BÉ kèm 100 bóng,520000,ĐỒ GIA DỤNG VIAN
11604385,https://www.sendo.vn/cui-quay-cho-be-kem-100-bong-11604385.html,CŨI QUÂY CHO BÉ kèm 100 bóng,520000,ĐỒ GIA DỤNG VIAN
11670078,https://www.sendo.vn/cui-quay-cho-be-kem-100-bong-11670078.html,CŨI QUÂY CHO BÉ kèm 100 bóng,520000,ĐỒ GIA DỤNG VIAN
17990517,https://www.sendo.vn/cui-quay-cho-be-17990517.html,CŨI QUÂY CHO BÉ,420000,ĐỒ GIA DỤNG VIAN
11449711,https://www.sendo.vn/cui-quay-cho-be-kem-100-bong-11449711.html,CŨI QUÂY CHO BÉ kèm 100 bóng,520000,ĐỒ GIA DỤNG VIAN
17890825,https://www.sendo.vn/cui-quay-cho-be-17890825.html,CŨI QUÂY CHO BÉ,420000,ĐỒ GIA DỤNG VIAN
11028843,https://www.sendo.vn/giuong-noi-phat-nhac-abn-11028843.html,Giường nôi phát nhac ABN,299000,trucvyshop
10220917,https://www.sendo.vn/cui-quay-cho-be-10220917.html,CŨI QUÂY CHO BÉ,450000,ĐỒ GIA DỤNG VIAN
10116503,https://www.sendo.vn/cui-quay-cho-be-10116503.html,CŨI QUÂY CHO BÉ,480000,ĐỒ GIA DỤNG VIAN
11570565,https://www.sendo.vn/cui-quay-cho-be-kem-100-qua-bong-11570565.html,CŨI QUÂY CHO BÉ kèm 100 quả bóng,550000,ĐỒ GIA DỤNG VIAN
11354793,https://www.sendo.vn/cui-quay-cho-be-kem-100-qua-bong-11354793.html,CŨI QUÂY CHO BÉ kèm 100 quả bóng,520000,ĐỒ GIA DỤNG VIAN
13078320,https://www.sendo.vn/cui-quay-kem-bong-13078320.html,CŨI QUÂY KÈM BÓNG,490000,ĐỒ GIA DỤNG VIAN
12111000,https://www.sendo.vn/cui-quay-cho-be-kem-100-bong-12111000.html,CŨI QUÂY CHO BÉ kèm 100 bóng,520000,ĐỒ GIA DỤNG VIAN
29751766,https://www.sendo.vn/bo-quay-cui-cho-be-14-tam-1m6x1m6-tang-bong-va-tham-an-toan-cho-be-29751766.html,Bộ quây cũi cho bé 14 tấm 1m6x1m6 tặng bóng và thảm an toàn cho bé,1350000,Máy công cụ tổng hợp
17999670,https://www.sendo.vn/may-dua-vong-tu-dong-co-radio-fm-va-may-nghe-nhac-usb-cao-cap-kem-17999670.html,Máy đưa võng tự động có radio FM và máy nghe nhạc USB cao cấp kèm,745000,tuyettuyetshop
18846878,https://www.sendo.vn/noi-dien-dai-vi-2-trong-1-vua-la-noi-dien-vua-la-vong-xep-hang-vn-chat-luong-cao-18846878.html,NÔI ĐIỆN ĐẠI VĨ 2 TRONG 1  VỪA LÀ NÔI ĐIỆN VỪA LÀ VÕNG XẾP - HÀNG VN CHẤT LƯỢNG CAO  ,640000,Shop Mẹ Bé Nhímm
19976916,https://www.sendo.vn/bo-quay-cui-4-tam-nhieu-mau-sac-cho-be-goldcat-san-pham-khong-bao-gom-cui-19976916.html,Bộ quây cũi 4 tấm nhiều màu sắc cho bé GoldCat - SẢN PHẨM KHÔNG BAO GỒM CŨI,500000,Goldcat shop
20025678,https://www.sendo.vn/noi-go-di-dong-cho-be-20025678.html,NÔI GỖ DI ĐỘNG CHO BÉ,1250000,ĐỒ CHƠI CHO BÉ
9500207,https://www.sendo.vn/giuong-chong-nong-thoang-mat-9500207.html,giường chống nóng thoáng mát,189000,trucvyshop
23077944,https://www.sendo.vn/treo-noi-chay-pin-35-bai-dieu-chinh-am-luong-va-chon-bai-23077944.html,Treo nôi chạy pin 35 bài điều chỉnh âm lượng và chọn bài ,185000,Thiết bị vệ sinh LIFMOD
11570523,https://www.sendo.vn/cui-quay-cho-be-kem-100-bong-11570523.html,CŨI QUÂY CHO BÉ kèm 100 bóng,520000,ĐỒ GIA DỤNG VIAN
20076062,https://www.sendo.vn/dem-dinh-hinh-cho-be-20076062.html,đệm định hình cho bé,220000,Thuongnguyen dogiadung
9573602,https://www.sendo.vn/may-dua-vong-ts-an-thai-son-cao-cap-cho-be-yeu-giac-ngu-ngon-9573602.html,Máy Đưa Võng TS An Thái Sơn Cao Cấp Cho Bé Yêu Giấc Ngủ Ngon,550000,Siêu thị hàng việt
23769894,https://www.sendo.vn/quan-chun-hang-cao-cap-chat-cotton-thun-co-gian-4-chieu-an-toan-cho-be-23769894.html,QUẤN CHŨN HÀNG CAO CẤP - CHẤT COTTON THUN CO GIÃN 4 CHIỀU AN TOÀN CHO BÉ,230000,Túi Ngủ Thiện Tâm
10077688,https://www.sendo.vn/ghe-nhun-cho-be-ghe-nhun-cho-be-10077688.html,GHẾ NHÚN CHO BÉ - GHẾ NHÚN CHO BÉ,530000,Việt Mart
18743697,https://www.sendo.vn/noi-dien-tu-dong-2-in-1-khanh-ngoc-tang-man-chong-muoi-va-vong-18743697.html,Nôi điện tự động 2 in 1 Khánh Ngọc - Tặng màn chống muỗi và  võng,900000,BabyChip
20104722,https://www.sendo.vn/1-thanh-chan-giuong-cho-be-2m-20104722.html,1  Thanh chắn giường cho bé 2m ,339000,GiaDụngThăngLong
21835034,https://www.sendo.vn/de-m-na-m-cao-ca-p-da-chu-c-nang-coza-baby-bed-lite-mau-be-21835034.html,Đệm Nằm Cao Cấp Đa Chức Năng Coza Baby Bed – Lite Màu Be,2300000,MomMomCare
12100981,https://www.sendo.vn/may-dua-vong-the-he-moi-vinanoi-a100-12100981.html,Máy đưa võng thế hệ mới VINANOI A100,399000,HAMATUS
20946751,https://www.sendo.vn/quay-cui-kiem-nha-bong-khung-inox-tang-kem-bong-da-sac-20946751.html,Quây Cũi Kiêm Nhà Bóng Khung Inox Tặng Kèm Bóng Đa Sắc,400000,BabyChip
26677644,https://www.sendo.vn/noi-tre-dat-vong-size-100-chong-cong-lung-tai-ha-noi-26677644.html,nôi tre đặt võng size 100 chống còng lưng tại Hà Nội,203000,B2B
22245632,https://www.sendo.vn/thanh-chan-giuong-tphcm-thanh-chan-giuong-umoo-chinh-hang-22245632.html,thanh chắn giường tphcm - thanh chắn giường Umoo chính hãng,389000,Dososinh_SocNau
23392757,https://www.sendo.vn/giuong-luoi-tam-kem-goi-cho-be-giam-cuc-khung-23392757.html,Giường lưới tắm kèm gối cho bé giảm cực khủng,130000,shop rẻ 9k
28111803,https://www.sendo.vn/giuong-ngu-cho-be-28111803.html,giường ngủ cho bé,370000,SIÊU THỊ GIA ĐÌNH 2
28770390,https://www.sendo.vn/giuong-luoi-cho-be-28770390.html,giường lưới cho bé,350000,SIÊU THỊ GIA ĐÌNH 2
25556252,https://www.sendo.vn/cuc-nguon-may-dua-vong-25556252.html,Cục nguồn máy đưa võng,159000,Cơ khí 304
22844094,https://www.sendo.vn/hot-set-2-khan-soi-tre-muslim-aden-anais-2-lop-da-nang-tang-1-mu-goi-dau-chan-tai-cho-be-re-22844094.html,HOT Set 2 Khăn sợi tre Muslim Aden Anais 2 lớp đa năng Tặng 1 Mũ gội đầu chắn tai cho bé RE,245050,THANH THANH 01
24874403,https://www.sendo.vn/noi-dai-vi-co-tang-vong-man-cho-be-k0-co-dien-24874403.html,NÔI  ĐẠI VĨ CÓ TẶNG VÕNG MÀN CHO BÉ K0 CÓ ĐIỆN,160000,Thế Giới Tuổi Thơ
23643299,https://www.sendo.vn/bo-man-chup-tu-bung-co-nhac-tang-kem-1-goi-1-dem-dong-mau-1-bo-phat-nhac-23643299.html,Bộ màn chụp Tự bung có nhạc  Tặng kèm 1 gối  1 đệm đồng màu  1 bộ phát nhạc,300000,Tổng Kho Sơ Sinh Giá Sỉ
27591250,https://www.sendo.vn/mo-ta-noi-ngu-chung-giuong-dewel-0-12m-27591250.html,Mô tả Nôi ngủ chung giường Dewel (0-12M),520000,Tổng kho đồ sơ sinh
23643664,https://www.sendo.vn/quay-cui-kiem-nha-bong-khung-inox-tang-kem-bong-da-sac-cho-be-vui-choi-23643664.html,Quây Cũi Kiêm Nhà Bóng Khung Inox - Tặng Kèm Bóng Đa Sắc Cho Bé Vui Chơi,150000,Tổng Kho Sơ Sinh Giá Sỉ
28063835,https://www.sendo.vn/giuong-ngu-xinh-xan-cho-be-28063835.html,Giường ngủ xinh xắn cho bé,350000,HANGTIENICH04
28814553,https://www.sendo.vn/giuong-cui-di-dong-cho-be-28814553.html,giường cũi di động cho bé,890000,SuSu Kids kube
29059853,https://www.sendo.vn/chieu-coi-cho-be-29059853.html,chiếu cói cho bé,23000,dotuyetyuki
29792103,https://www.sendo.vn/cui-quay-khung-inox-kiem-nha-bong-chac-chan-an-toan-cho-be-cu-i-cho-be-tren-6-tha-ng-tuo-i-do-choi-cho-be-tren-6-tha-ng-tuo-i-tang-kem-bong-da-sac-mauhot-29792103.html,Cũi quây khung Inox kiêm nhà bóng chắc chắn an toàn cho bé - Cũi cho bé trên 6 THÁNG tuổi -Đồ chơi cho bé trên 6 tháng tuổi-TẶNG KÈM BÓNG ĐA SẮC MÀU[HOT],339000,MapDit Shop
29363732,https://www.sendo.vn/noi-rung-tu-dong-29363732.html,NÔI RUNG TỰ ĐỘNG,1520000,DITA SHOP
7169001,https://www.sendo.vn/giuong-hello-kitty-1m2-7169001.html,Giường Hello kitty 1m2,3800000,baby68
7166837,https://www.sendo.vn/giuong-o-to-so-9-mau-vang-gd01-y-7166837.html,Giường ô tô số 9 màu vàng GD01-Y,3800000,baby68
10486554,https://www.sendo.vn/noi-vong-dien-tu-dong-cho-be-k3-10486554.html,NÔI VÕNG ĐIỆN TỰ ĐỘNG CHO BÉ K3,850000,dodungconghe
25646094,https://www.sendo.vn/noi-dien-nhap-khau-806-25646094.html, Nôi điện nhập khẩu 806,1690000,baby68
10283497,https://www.sendo.vn/quay-cui-nhua-3d-cho-be-loai-12-mieng-co-bong-ro-10283497.html,QUÂY CŨI NHỰA 3D CHO BÉ LOẠI 12 MIẾNG CÓ BÓNG RỔ,1500000,Cái Gì Chẳng Có 1
28482728,https://www.sendo.vn/giuong-nem-ngu-em-ai-cho-be-home-and-garden-28482728.html,Giường Nệm Ngủ Êm Ái Cho Bé- Home and Garden,849000,Home and Garden
25287344,https://www.sendo.vn/chieu-luc-binh-2-lop-chong-tham-cho-be-25287344.html,Chiếu lục bình 2 lớp chống thấm cho bé,125000,baby68
25166041,https://www.sendo.vn/noi-da-nang-seebaby-p2-25166041.html,Nôi đa năng Seebaby P2,1250000,baby68
25125620,https://www.sendo.vn/bo-may-dua-vong-dua-noi-tu-dong-em-be-fujishi-va017-hang-viet-nam-25125620.html,Bộ Máy Đưa Võng đưa nôi Tự Động em bé Fujishi VA017 hàng Việt Nam,359000,Shop Mounts
25226630,https://www.sendo.vn/5-cay-keo-nen-lam-do-hand-made-25226630.html,5 cây Keo nến làm đồ hand made,10000,Thiết bị vệ sinh LIFMOD
5571993,https://www.sendo.vn/chieu-lua-dieu-hoa-cao-cap-kem-goi-cho-be-5571993.html,Chiếu lụa điều hòa cao cấp kèm gối cho bé,99000,Giadungcucre
23393019,https://www.sendo.vn/bet-thu-nho-bon-cau-co-bac-thang-len-xuong-giam-cuc-khung-23393019.html,BỆT THU NHỎ BỒN CẦU CÓ BẬC THANG LÊN XUỐNG giảm cực khủng,417000,shop rẻ 9k
6129951,https://www.sendo.vn/noi-dien-tre-em-mot-tang-6129951.html,Nôi điện trẻ em một tầng,1072000,All-in-one
6404260,https://www.sendo.vn/bo-chieu-goi-dieu-hoa-cho-be-60x100cm-6404260.html,"Bộ chiếu, gối điều hòa cho bé 60x100cm",125000,besinhdoi
5631936,https://www.sendo.vn/giuong-tang-bb-225-cau-thang-treo-nhieu-mau-5631936.html,Giường tầng BB 225  cầu thang treo nhiều màu,3500000,baby68
5251764,https://www.sendo.vn/quay-cui-nhua-3d-loai-12-mieng-cho-be-tang-tham-va-bong-5251764.html,QUÂY CŨI NHỰA  3D LOẠI 12 MIẾNG CHO BÉ TẶNG THẢM VÀ BÓNG,1650000,Cái Gì Chẳng Có 1
5312046,https://www.sendo.vn/giuong-cui-xk-70x105-5312046.html,Giường cũi XK 70x105,1450000,baby68
5310859,https://www.sendo.vn/giuong-cui-bt01-mau-tu-nhien-5310859.html,Giường cũi BT01 màu tự nhiên,1450000,baby68
5368952,https://www.sendo.vn/thanh-chan-giuong-munchkin-mk47044-5368952.html,Thanh chặn giường Munchkin MK47044,1999000,baby68
5312024,https://www.sendo.vn/giuong-cui-xk-70x95-x90cm-5312024.html,Giường cũi XK 70x95 x90cm,1350000,baby68
28833185,https://www.sendo.vn/it-smart-giuong-ngu-kiem-ghe-sofa-cho-be-0-3-tuoi-baby-bed-sofa-5in1-28833185.html,It Smart  Giường ngủ kiêm ghế Sofa cho bé 0-3 tuổi Baby Bed Sofa 5in1,920000,IT Smart
28834783,https://www.sendo.vn/chieu-lua-cho-be-28834783.html,Chiếu lụa cho bé,105000,an toan uy tin
